video_id,title,publishedAt,channelId,channelTitle,categoryId,trending_date,tags,view_count,likes,dislikes,comment_count,thumbnail_link,comments_disabled,ratings_disabled,description
"RsEZmictANA","taylor swift - willow (official music video)","2020-12-11T05:00:10Z","UCANLZYMidaCbLQFWXBC95Jg","TaylorSwiftVEVO","10","20.12.12","taylor swift|taylor|swift|willow|willow taylor swift|taylor swift willow|willow official video|willow music video|willow evermore|evermore|taylor swift evermore|willow lyrics|taylor swift willow lyrics|taylor willow|willow taylor|evermore taylor swift|ever more|taylor swift new album|taylor swift new music|ever more taylor swift|taylor swift ever more","9174013","781075","8477","52813","https://i.ytimg.com/vi/RsEZmictANA/default.jpg","False","False","Official music video by Taylor Swift performing “willow” – off her evermore album. Listen here: https://taylor.lnk.to/evermorealbum►Subscribe to Taylor Swift on YouTube: https://ts.lnk.to/subscribe  ►Exclusive Merch: http://taylorswift.lnk.to/store►Follow Taylor Swift online:Instagram: http://instagram.com/taylorswift  Facebook: http://facebook.com/taylorswift  Tumblr: http://taylorswift.tumblr.com  Twitter: http://twitter.com/taylorswift13  Snapchat: http://snapchat.com/add/taylorswiftWebsite: http://www.taylorswift.com  ►Follow Taylor Nation OnlineInstagram: http://instagram.com/taylornation  Tumblr: http://taylornation.tumblr.com  Twitter: http://twitter.com/taylornation13 starringtaylor swifttaeok leeindiana cheairssamuel silveryoe apolinariomaria wadajazz smithgracie stewartjake landgrebenolan padillamark villaverrobert greenmason cutlersienna lyonsdirected bytaylor swiftdirector of photographyrodrigo prieto ASC, AMCproducerjil hardineditorchancler haynesproduction designersethan tobmanregina fernandezstylistsjoseph cassellsunshine madsenfirst adjoe “oz” osborneco-first adev salomonvisual effectsingenuity studiosgrant miller david lebensfeldjumanah shaheen executive producerrebecca skinnerco-producerkathy palmergaffermanny tapiakey grip“pie” alexander griffithsstoryboardsvincent lucidothe songwritten by taylor swift and aaron dessnerproduced by aaron dessnerrecorded by jonathan low and aaron dessnermixed by jonathan loworchestration by bryce dessnermastered by greg calbi and steve fallonedrum machine programming, percussion, keyboards, synthesizers, piano and electric, bass andacoustic guitars by aaron dessnersynthesizers and drum machine programming by james mcalisterpercussion and drum machine programming by bryan devendorfviolin by yuki numata resnickelectric guitar by josh kaufmancello by clarice jensenglockenspiel by jason treutingflute by alex soppfrench horn by cj camerierikeyboard and synthesizers by thomas bartlettintro musicmodular synth by benjamin lanzA special thank you to our on set medics, COVID-19 compliance personnel and the crew for operating under the strictest guidelines including wearing PPE, practicing thorough sanitization and respecting social distancing during the video shoot.#taylorswift #willow #evermore"
"Xa0Swz3X1cQ","Wilbur Soot - Your New Boyfriend (OFFICIAL VIDEO)","2020-12-11T18:00:10Z","UC1n_PfsVqxllCcnMPlxBIjw","Wilbur Soot","10","20.12.12","wilbur soot|live|wilbur live|wilbur plays","1559380","371104","1627","54061","https://i.ytimg.com/vi/Xa0Swz3X1cQ/default.jpg","False","False","Spotify: [COMING SOON]Follow me:https://twitter.com/WilburSoot                    https://www.instagram.com/wilbursoot/E-Girl: https://twitter.com/chiffonhahaMerch: https://bit.ly/WilburSootMerchEdited: me and https://www.instagram.com/elodie.gif/Music used:Guitar, Vocals, Drums, Piano by Wilbur SootBacking Vocals: ChevyBass by Dmitry LisenkoTrumpets by Isaac BeerProduced by Wilbur Soot"
"YiX9VKmDOBg","PAY ATTENTION TO ME ITS IMPORTANT","2020-12-11T19:00:16Z","UCGwu0nbY2wSkW8N-cghnLpA","Jaiden Animations","1","20.12.12","jaiden|animations|jaidenanimation|jaidenanimations","1876980","269725","1380","18588","https://i.ytimg.com/vi/YiX9VKmDOBg/default.jpg","False","False","BE THERE LETS RAISE A LOT OF MONEY#Thankmas: https://youtu.be/YfJ_ptCTLms"
"1GKDatspLKY","Nba Youngboy - Green Dot","2020-12-10T23:26:56Z","UClW4jraMKz6Qj69lJf-tODA","YoungBoy Never Broke Again","10","20.12.12","[none]","1947520","166324","2118","19710","https://i.ytimg.com/vi/1GKDatspLKY/default.jpg","False","False",""
"zWz6v-UAs8Q","The Game Awards 2020 Official Stream (4K) - Video Game's Biggest Night Live!","2020-12-11T03:19:06Z","UCqDS7KWjAPKv-7ZSlro9OiQ","thegameawards","20","20.12.12","game awards|the game awards|gameplay|world premiere|video game awards|xbox|playstation|nintendo|tga|geoff keighley|videogame|announcement|trailer|first look|official|reveal|surprise","4159977","115403","12662","6928","https://i.ytimg.com/vi/zWz6v-UAs8Q/default.jpg","False","False","Tune in live on Thursday, December 10 at 3:30 PM PT / 6:30 PM ET / 12:30a CET.VOTE NOW: http://www.thegameawards.com/nomineesVideo game's biggest night is LIVE on YouTube in 4K, presented by Gillette. With appearances by Keanu Reeves, Christopher Nolan, Gal Gadot, Tom Holland, Brie Larson, Reggie Fils-Aime, The Muppets, Stephen A. Smith, Nolan North, Troy Baker and more!Plus performances by Eddie Vedder, and the London Philharmonic conducted by Lorne Balfe.Stream the show on live Thursday, December 10 in 4K on YouTube.Subscribe to Watch The Game Awards Live:  http://bit.ly/tga18subFollow The Game Awards on Twitter: http://www.twitter.com/thegameawardsFollow The Game Awards on Instagram:http://www.instagram.com/thegameawardsFollow Geoff Keighley on Twitter:http://www.twitter.com/geoffkeighleyJoin the conversation about the risks of vaping at thetruth.com: https://bit.ly/37utjU0#thegameawards #gameawards #gameoftheyear"
"G4JuopziR3Q","Exclusive Clip | Loki | Disney+","2020-12-11T00:46:34Z","UCvC4D8onUfXzvjTOM-dBfEA","Marvel Entertainment","24","20.12.12","marvel|comics|loki|trailer|teaser|disney+|official","6084962","352811","3228","17636","https://i.ytimg.com/vi/G4JuopziR3Q/default.jpg","False","False","“Glorious.”Loki, an Original Series from Marvel Studios, is coming May 2021 to #DisneyPlus.► Subscribe to Marvel: http://bit.ly/WeO3YJFollow Marvel on Twitter: ‪https://twitter.com/marvelLike Marvel on Facebook: ‪https://www.facebook.com/marvelWatch Marvel on Twitch: https://www.twitch.tv/marvelReward your Marvel fandom by joining Marvel Insider!Earn points, then redeem for awesome rewards.Terms and conditions apply. Learn more at https://www.marvel.com/insider?Osocial=YT&CID=MarvelInsiderFor even more news, stay tuned to:Tumblr: ‪http://marvelentertainment.tumblr.com/Instagram: https://www.instagram.com/marvelPinterest: ‪http://pinterest.com/marvelofficialReddit: http://reddit.com/u/marvel-official"
"VibGLc41UvQ","Daddy Yankee & Marc Anthony - De Vuelta Pa' La Vuelta (Video Oficial)","2020-12-11T00:00:07Z","UC9TO_oo4c_LrOiKNaY6aysA","Daddy Yankee","10","20.12.12","daddy yankee en vivo|con calma|dura|shaky shaky|reggaeton 2019|reggaeton hits|lo mejor de daddy yankee|con calma remix|con calma challenge|daddy yankee en gira|concalmadegira|adictiva|dy adictiva|anuel adictiva|dy en vivo|daddy yankee en vivo|como te llamas baby|hola me llamo katy|daddy yankee gasolina|daddy y yankee|con calma worldwide|desde que te vi supe que eras pa mi","5513582","463673","7018","20675","https://i.ytimg.com/vi/VibGLc41UvQ/default.jpg","False","False","Daddy Yankee & Marc AnthonyDe Vuelta Pa' La Vuelta (Video Oficial)Suscríbete al canal: https://goo.gl/yypZyaMás vídeos de DY: Don Don: https://youtu.be/bZMPz5lzb2UCon Calma: https://youtu.be/DiItGE3eAyQQue Tire Pa' 'Lante: https://youtu.be/fAgvmh1jaCESigue a DY:Facebook-http://goo.gl/QYZ53a | Twitter-http://goo.gl/AzaR8o Instagram-http://goo.gl/a6F7gz | www.daddyyankee.comLetra:DY00:00 - 00:30Antes de que digas nada ya tus ojos me confirman todoEs verdad lo que me dicen y para negarlo ya es muy tardeMe cuidaba de personas como tú pero al final ni modoSoy humano y tengo mucho más defectos de los que tú sabes  MARC00:30 - 00:41 De mi te burlaste y se que lo hiciste con gusto pa’ eso eres experta apuntas y nunca te tiembla el pulso  DY00:41 - 00:50Cuando hagas tu maleta no olvides llevar tu orgullo Lo vas a necesitar pa’ cuando quieras regresar  MARC00:51 - 1:21Ya no eres bienvenida aquí Si tu amor fue una mentira vete y se felizNo te preocupes por mi que voy a estar mejor sin ti anda ve y dile a la gente que yo te jodí pa’ que no quedes mal aquíY está claro que perdiste cuando me perdiste Y yo perdí cuando te conocí DY Coro:1:21 - 1:41De vuelta pa’ la vueltaVoy a amarrar a toa’ las que anden sueltaDe vuelta pa’ la vueltaMe voy a levantar hasta las que anden muerta De vuelta pa’ la vueltaTrampa trampita está descubiertaDe vuelta pa’ la vueltaTú tenías la llave pero te rompí la puerta  DY1:42 - 2:12Cúlpame de tus dolores el papel de víctima siempre tiene defensoresAl que miente lo adoran al que dice la verdad lo ahorcan Felicidades te ganaste un Oscar Dios que mi camino alumbre de tus costumbres  pa’ ti todos los días son 31 de octubre siempre con la máscara puesta  si se te cae una tienes otra de repuestaojo que no ven corazón de qué!Si aunque no te vi tus mentiras yo me las sePensé que eras perfecta ahora puedo reconocer que tu único defecto fue nacer  MARC Coro:2:12  - 2:21Ya no eres bienvenida aquí Si tu amor fue una mentira vete y sé felizNo te preocupes por mi  DY2:21 - 2:31que voy a estar mejor sin ti anda y ve dile a la gente que yo te jodíPa’ que no quedes mal aquí MARC2:32 - 2:40Está claro que perdiste cuando me perdiste Y yo perdí cuando te conocí DY Coro:2:40 - 3:03De vuelta pa’ la vuelta MARCNo eres bienvenida bienvenida aquí  DY Coro:De vuelta pa’ la vueltaSigue en tu viaje y vete por ahíDe vuelta pa’ la vuelta MARCAnda y dile a la gente que yo te jodí  DY Coro:De vuelta pa’ la vueltaPero no- pero no- pero no- pero no- pero nopero no- pero no- pero no- pero no- pero no pero no- pero no- pero yo no fui el que aquí perdí  Ataca Yankee Qué! Que!Fuego! Yankee Dile Marc  Esto es pa’ la historia De aquí pal’ mundo come on!  Ataca Sergio! Ya no eres bienvenida aquíSalte del medio están pasando los King King KingYa no eres bienvenida aquíBesa el anillo el pinky ring ring ringYa no eres bienvenida aquíBarrio Obrero City pa’ toa’ las nenas pretty Ya no eres bienvenida aquíNos dicen los Clemente porque tenemos SWING! #DaddyYankee #DVPLV #MarcAnthony"
"n9HJrXgqbx8","Fredo Bang - Big Steppa Feat. Sada Baby (Official Video)","2020-12-11T17:00:11Z","UC8FHFLWe9KkG0eoxPMIgcpg","Fredo Bang","10","20.12.12","fredo bang|sada baby|rap|hiphop|south|baton rouge|Louisiana|viral|detroit|nba youngboy|akademiks|shaderoom|no jumper|saycheese|raptv|vladtv|most hated|in the name of gee|mulatto|kevin gates|new orleans|viral videos","208690","20283","366","1861","https://i.ytimg.com/vi/n9HJrXgqbx8/default.jpg","False","False","Stream/Download: http://fredobang.lnk.to/BigSteppaShop: https://www.fredobangshop.com/Text “Fredo Bang” to 31996 for Exclusive Updates 🦍Follow Fredo Bang: Instagram: https://instagram.com/fredobangFacebook: https://www.facebook.com/fredobangbiz/  Twitter: https://twitter.com/fredobang #FredoBang #BigSteppa"
"wMpqCRF7TKg","Taylor Swift - champagne problems (Official Lyric Video)","2020-12-11T05:00:30Z","UCANLZYMidaCbLQFWXBC95Jg","TaylorSwiftVEVO","10","20.12.12","taylor swift|swift|taylor|champagne problems|taylor swift champagne problems|champagne problems taylor swift|willow video|willow lyrics|taylor swift lyrics|evermore|taylor swift evermore|evermore taylor swift|evermore album|taylor swift album|ever more|taylor swift evermore album|taylor swift new music|evermore lyrics|ever more lyrics|evermore album lyrics|ever more album lyrics","1840723","150770","1132","7211","https://i.ytimg.com/vi/wMpqCRF7TKg/default.jpg","False","False","Official lyric video by Taylor Swift performing “champagne problems” – off her evermore album. Listen to the album here: https://taylor.lnk.to/evermorealbum ►Subscribe to Taylor Swift on YouTube: https://ts.lnk.to/subscribe   ►Exclusive Merch: http://taylorswift.lnk.to/store ►Follow Taylor Swift online:Instagram: http://instagram.com/taylorswift   Facebook: http://facebook.com/taylorswift    Tumblr: http://taylorswift.tumblr.com   Twitter: http://twitter.com/taylorswift13   Snapchat: http://snapchat.com/add/taylorswift Website: http://www.taylorswift.com   ►Follow Taylor Nation OnlineInstagram: http://instagram.com/taylornation   Tumblr: http://taylornation.tumblr.com   Twitter: http://twitter.com/taylornation13#TaylorSwift #champagneproblems #evermoreMusic video by Taylor Swift performing champagne problems (Lyric Video). © 2020 Taylor Swifthttp://vevo.ly/CUmEer"
"EXLgZZE072g","Taylor Swift - evermore (Official Lyric Video) ft. Bon Iver","2020-12-11T05:00:02Z","UCANLZYMidaCbLQFWXBC95Jg","TaylorSwiftVEVO","10","20.12.12","taylor swift|swift|taylor|bon iver|taylor swift bon iver|bon iver taylor swift|willow video|willow lyrics|taylor swift lyrics|evermore|taylor swift evermore|evermore taylor swift|evermore album|taylor swift album|ever more|taylor swift evermore album|taylor swift new music|evermore lyrics|ever more lyrics|evermore album lyrics|ever more album lyrics|bon iver evermore|bon iver ever more|bone iver","1823471","159722","1024","6909","https://i.ytimg.com/vi/EXLgZZE072g/default.jpg","False","False","Official lyric video by Taylor Swift ft. Bon Iver performing “evermore” – off her evermore album. Listen to the album here: https://taylor.lnk.to/evermorealbum ►Subscribe to Taylor Swift on YouTube: https://ts.lnk.to/subscribe   ►Exclusive Merch: http://taylorswift.lnk.to/store ►Follow Taylor Swift online:Instagram: http://instagram.com/taylorswift   Facebook: http://facebook.com/taylorswift    Tumblr: http://taylorswift.tumblr.com   Twitter: http://twitter.com/taylorswift13   Snapchat: http://snapchat.com/add/taylorswift Website: http://www.taylorswift.com   ►Follow Taylor Nation OnlineInstagram: http://instagram.com/taylornation   Tumblr: http://taylornation.tumblr.com   Twitter: http://twitter.com/taylornation13#TaylorSwift #evermoreMusic video by Taylor Swift performing evermore (Lyric Video). © 2020 Taylor Swifthttp://vevo.ly/f7vbCh"
"Z3nmVmEqo-w","DJ K.i.D & DDG - Tony Montana (Official Music Video)","2020-12-11T05:00:14Z","UCKqqDlf6lfo3ChRA4-gzusQ","DDG","10","20.12.12","ddg|ddg music|tony montana|dj kid|ddg tony|ddg tony montana|riding round|riding around","550449","77775","775","12557","https://i.ytimg.com/vi/Z3nmVmEqo-w/default.jpg","False","False","Stream Tony Montana Now on All Platforms!Follow DDG:Twitter: https://twitter.com/PontiacMadeDDGInstagram: https://instagram.com/PontiacMadeDDGSnapchat: @PontiacMadeDDGFollow DJ K.i.D: Twitter: https://twitter.com/iamdjkidInstagram: https://instagram.com/iamdjkidSnapchat: @DjkidnwShot by:  @Reel Goats"
"0OfSyl9gkWM","Kid Cudi, Skepta, Pop Smoke - Show Out (Official Visualizer)","2020-12-11T05:00:00Z","UCsiY9eX1oL0a-_yWoYtkbQA","KidCudiVEVO","10","20.12.12","Kid cudi|cudi|man on the moon|man on the moon 3|MOTMIII|MOTM3|show out|pop smoke|skepta|BBK|boy better know|woo","592020","44612","314","2930","https://i.ytimg.com/vi/0OfSyl9gkWM/default.jpg","False","False","Official audio for Kid Cudi “Show Out” with Pop Smoke and Skepta from the album Man On The Moon III: The Chosen. Available now: https://kidcudi.lnk.to/MOTM3Video by: Ryan Frank @toonboi►Subscribe to Kid Cudi on YouTube: https://KidCudi.lnk.to/subscribeID►Exclusive merch: https://shop.kidcudi.com►Follow Kid Cudi:https://twitter.com/kidcudihttps://instagram.com/kidcudihttps://facebook.com/kidcudihttps://snapchat.com/add/kidcudihttps://www.kidcudi.com#KidCudi #MOTMIIIMusic video by Kid Cudi, Skepta, Pop Smoke performing Show Out (Audio). © 2020 Republic Records, a division of UMG Recordings, Inc.http://vevo.ly/6cbilC"
"JPxcE1dMqL8","Super Smash Bros. Ultimate – The One-Winged Angel! - Nintendo Switch","2020-12-11T00:11:46Z","UCwVVpHQ2Cs9iGJfpdFngePQ","Super Smash Bros.","20","20.12.12","Game|VideoGame|ゲーム|ビデオゲーム|Video Game (Industry)|任天堂|ニンテンドー|Nintendo|sv_nintendo|Switch|大乱闘|スマッシュブラザーズ|スマブラ|smashbros|SSBU|桜井|政博|sakurai|masahiro|セフィロス|Sephiroth|FFVII|FF7|FF|ファイナルファンタジー|FINAL FANTASY|スクウェア・エニックス|スクエニ|SQUARE ENIX","1022213","65880","2807","0","https://i.ytimg.com/vi/JPxcE1dMqL8/default.jpg","True","False","https://www.smashbros.com/"
"OFMUvKu-bZs","Call of Duty®: Black Ops Cold War & Warzone™ - Season One Trailer","2020-12-11T01:04:46Z","UC9YydG57epLqxA9cTzZXSeQ","Call of Duty","20","20.12.12","call of duty|cod|activision|season 1|s1|season one|black ops|cold war|treyarch|gamers|gaming|gamer|video game|video games|gameplay|multiplayer","1109687","64768","1736","6044","https://i.ytimg.com/vi/OFMUvKu-bZs/default.jpg","False","False","Prepare for payback.Welcome to #BlackOpsColdWar Season One. Available on all platforms December 16."
"OnZn-ci3ImM","Lakeyah - Female Goat ft City Girls (Official Video)","2020-12-11T17:00:08Z","UCkdG7hkvCrQn3Aqfv__yRoQ","Lakeyah","10","20.12.12","city girls|lakeyah|lakeya|quality control|female goat","268129","19762","124","1190","https://i.ytimg.com/vi/OnZn-ci3ImM/default.jpg","False","False","Official Video for Female Goat ft. City Girls by LakeyahListen/Download: http://lakeyah.lnk.to/timesupFollow LakeyahInstagram: https://www.instagram.com/itslakeyah/FaceBook: https://www.facebook.com/LakeyahDanaeefpTwitter: https://twitter.com/LaKeyahDanaeee"
"UdfSrJvqY_E","AirPods Max Unboxing & Impressions: $550?!","2020-12-10T14:00:39Z","UCBJycsmduvYEL83R_U4JriQ","Marques Brownlee","28","20.12.12","AirPods Max|AirPods Max unboxing|unboxing|review|preview|features|sound|sound quality|price|MKBHD|AirPods headphones|noise cancelling|AirPods Max case|smart case","7461288","299641","8641","38870","https://i.ytimg.com/vi/UdfSrJvqY_E/default.jpg","False","False","AirPods Max: Apple just dropped a surprise set of $549 ultra premium noise cancelling headphones. This is everything you need to know!MKBHD Merch: http://shop.MKBHD.comTech I'm using right now: https://www.amazon.com/shop/MKBHDIntro Track: http://youtube.com/20sylPlaylist of MKBHD Intro music: https://goo.gl/B3AWV5Headphones provided by Apple for review.~http://twitter.com/MKBHDhttp://instagram.com/MKBHDhttp://facebook.com/MKBHD"
"jkBfGvb7NzM","Exclusive First Look | The Falcon and the Winter Soldier | Disney+","2020-12-11T00:43:57Z","UCvC4D8onUfXzvjTOM-dBfEA","Marvel Entertainment","24","20.12.12","marvel|comics|falcon and the winter soldier|first look|teaser|trailer|official|disney+|mcu","4337792","249959","2696","7624","https://i.ytimg.com/vi/jkBfGvb7NzM/default.jpg","False","False","“The legacy of that shield is complicated.”Marvel Studios’ The Falcon and the Winter Soldier, an Original Series, starts streaming Mar. 19 on #DisneyPlus.► Subscribe to Marvel: http://bit.ly/WeO3YJFollow Marvel on Twitter: ‪https://twitter.com/marvelLike Marvel on Facebook: ‪https://www.facebook.com/marvelWatch Marvel on Twitch: https://www.twitch.tv/marvelReward your Marvel fandom by joining Marvel Insider!Earn points, then redeem for awesome rewards.Terms and conditions apply. Learn more at https://www.marvel.com/insider?Osocial=YT&CID=MarvelInsiderFor even more news, stay tuned to:Tumblr: ‪http://marvelentertainment.tumblr.com/Instagram: https://www.instagram.com/marvelPinterest: ‪http://pinterest.com/marvelofficialReddit: http://reddit.com/u/marvel-official"
"YB9DIxdB198","Sizzle | The Bad Batch | Disney+","2020-12-10T23:20:21Z","UCZGYJFUizSax-yElQaFDp5Q","Star Wars","24","20.12.12","star wars|bad batch|disney+|disney plus","941422","65539","421","5509","https://i.ytimg.com/vi/YB9DIxdB198/default.jpg","False","False","A sneak peek at Star Wars: The Bad Batch, an all-new animated Original Series from Lucasfilm Animation, coming soon to Disney+."
"jD1jvB3M45I","Funk Flex x @King Von - Lurkin (Official Video)","2020-12-11T03:02:08Z","UCXNRIMKkkYxYrfSVuII6PQA","DJ FUNK FLEX","10","20.12.12","Funk Flex|King Von|Lurkin|Funk Flex Sessions|Funk Flex Album|Sessions|Official Music Video|funkmaster flex|lurken|dj funk flex|dj funk master flex|kingvon|king von flex|king von flex freestyle","583545","35644","354","2818","https://i.ytimg.com/vi/jD1jvB3M45I/default.jpg","False","False","RIP DAYVON DAQUAN BENNETTChoose your platform: https://create.ffm.to/lurkin7 months ago I hit Von in the DM, we facetime'd and sent him the track. We didn't have a deep relationship.... He shared that freestyle on the spot wasn't his thing but he mentioned that his pen game was mean! He sent me 6 bars... we listened.. tweaked it and he finished the song in about 4 weeks. He let me know he was coming to New York for his album so i asked to shoot the vid! His publicist said he has/likes Hellcat Redeye's! When i met him he made it known he was gonna hit the drivers seat! 2 days later he passed. I have an interview i recorded that day but I'm not going to release it... no need. After Von passed we couldn’t find the session/vocals/track. Thanks so much to Dj Ted Smooth for working his magic on getting me the vocals to mix. Rest well Von... THANK U FOR THE OPPORTUNITY!From the desk ofFunk Flex (Newest member of the lypo club)THANK YOU TO HIS FAMILY, HIS MANAGEMENT, EMPIRE RECORDS / GHAZY, Thank You for allowing us to put Together a College Fund for the Kids.Stream On All PlatformsDirected By: @Juganot, Produced by Funk Flex & BMCBeats, Strings By: Grant GardnerLabel: InFlexWeTrust Films & Records: Tat Wza, Sabrina B., Joe Jaxson, Emma, Nova, HR, AZ, Wil, Mike G., Clare, Seife, Pamela, Juganot Media, Quinn Films, No Cap Films, BasilA&R’s: Hunter, Jayden, Dante, Alex Special Thanks To: Maria, Orlando, Shaft, Gabby, Joie IE, Carl Chery, Ebro Darden, Tuma Basa LitDigitalDJs; DJ Bobby Trends, Kool DJ Red Alert, Dj Chuck Chillout, Dj Spazo, Dj HR Partners: Create Music Group, Crowd Control Digital, Eric & Fred from Collab, Bob Celestin, Eric S. Marder, Pio, TT Torrez Jewelry: Taj Diamonds Coat: Canadian Goose Kicks: Supreme Air Force Barber: Fade to Famous Auto: Dodge Challenger Hell Cat Red Eye Location: Manhattan NYCBooking Information: LitdigitalDJs@Gmail.com, 718-400-6301Up And Coming Next Single: Funk Flex / Fivio Foreign Socials:IG: @FunkFlex, FB: @FunkFlex, TW: @FunkFlexDownload The LitDigitalDJs APPAPP Store - Google Play"
"gSW-pARyP-M","Sizzle Reel | Andor | Disney+","2020-12-10T23:16:27Z","UCZGYJFUizSax-yElQaFDp5Q","Star Wars","24","20.12.12","star wars|andor|disney+|disney plus","845972","40827","503","2052","https://i.ytimg.com/vi/gSW-pARyP-M/default.jpg","False","False","“Everything I did, I did for the Rebellion.” Andor, an Original Series set in the Star Wars universe, is streaming in 2022 on Disney+."
"Lg-Ctg6k_Ao","The Next Mass Effect - Official Teaser Trailer","2020-12-11T02:43:34Z","UC-AAk4vhWHPzR-cV4o5tLRg","Mass Effect","20","20.12.12","Mass Effect|mass effect trailer|mass effect teaser|mass effect 5|mass effect 5 trailer|mass effect 5 teaser|The Game Awards 2020|game awards 2020|game awards 2020 trailers|new mass effect trailer|new mass effect|mass effect game awards 2020|mass effect game awards|BioWare|sci-fi|RPG","1008821","56862","1397","9498","https://i.ytimg.com/vi/Lg-Ctg6k_Ao/default.jpg","False","False","Get a sneak peek at the next chapter of the Mass Effect universe. A veteran team at BioWare is in the early stages of what is on the horizon for the Mass Effect franchise, and we are excited to show you where we’ll be heading next!"
"GyWYDugtwa4","Beautiful Trip","2020-12-10T10:04:30Z","UCo2-dPLJcpbZK84FIt0vD-w","Kid Cudi - Topic","10","20.12.12","Kid Cudi|キッドカディ|キッド・カディ|Man On The Moon III: The Chosen|Beautiful Trip","344358","5868","73","285","https://i.ytimg.com/vi/GyWYDugtwa4/default.jpg","False","False","Provided to YouTube by Universal Music GroupBeautiful Trip · Kid CudiMan On The Moon III: The Chosen℗ 2020 Republic Records, a division of UMG Recordings, Inc.Released on: 2020-12-11Producer, Associated  Performer, Vocalist: Kid CudiProducer: Emile HaynieProducer, Executive  Producer: Dot Da GeniusProducer: Plain PatProducer: FINNEASStudio  Personnel, Mixer: Manny MaroquinStudio  Personnel, Engineer: William J. SullivanStudio  Personnel, Mastering  Engineer: Joe LaPortaA &  R: Ken Duro IfillComposer  Lyricist: Scott MescudiComposer  Lyricist: Emile HaynieComposer  Lyricist: Oladipo OmishoreComposer  Lyricist: Patrick ReynoldsComposer  Lyricist: Finneas O'ConnellAuto-generated by YouTube."
"kpnwRg268FQ","HELLUVA BOSS - Loo Loo Land // S1: Episode 2","2020-12-09T21:00:23Z","UCzfyYtgvkx5mLy8nlLlayYg","Vivziepop","1","20.12.12","Helluva Boss|Helluva Boss cartoon|Helluva Boss animation|Helluva Boss season 1|Helluva Boss official|Helluva Boss Official episode|Helluva Boss Loona|Helluva Boss Blitz|Helluva Boss Moxxie|Helluva Boss Millie|Helluva Boss Blitzo|helluva boss season one episode one|helluva boss vivziepop|helluva boss new|helluva boss new episode|Helluva boss murder family|helluva boss episode 2|helluva boss season 1 episode 2|helluva boss season 1 part 2|helluva boss part 2","5644715","770471","3101","87324","https://i.ytimg.com/vi/kpnwRg268FQ/default.jpg","False","False","EPISODE 2 IS ACTUALLY HERE!When Stolas hires I.M.P as bodyguards on a trip to Loo Loo Land, things sure do happen.HELLUVA BOSS MERCH AVAILABLE ► https://sharkrobot.com/vivziepopWARNING: for clown!HELLUVA BOSS MERCH AVAILABLE ► https://sharkrobot.com/vivziepopEPISODE 1: https://www.youtube.com/watch?v=el_PChGfJN8Or Support us on Patreon!http://www.patreon.com/VivienneMedrano#helluvaboss"
