video_id,title,publishedAt,channelId,channelTitle,categoryId,trending_date,tags,view_count,likes,dislikes,comment_count,thumbnail_link,comments_disabled,ratings_disabled,description
"4g_Be4VoXpg","Flight - Sum (Official Music Video)","2020-12-09T00:15:10Z","UC_k0qgMNIW2VmTQKjFsbXDw","FlightReacts","10","20.12.12","Reactions|Family|vlog|life|NBA|sports|Friends|fashion|friendly|nice","302434","46458","681","4880","https://i.ytimg.com/vi/4g_Be4VoXpg/default.jpg","False","False","Stream Spotifyhttps://open.spotify.com/track/3cGkrg53Z9tNRi8Ik1fir6?si=qihQk_COQ1G-3P0CeqWTiwSoundcloudhttps://soundcloud.com/user-593517877/flight-sumDownload Apple ITunes Music https://music.apple.com/us/album/sum/1518788148?i=1518788149#Sum #ShakeSumMerchhttps://www.flightreacts.us/Daily Livestreamhttps://www.twitch.tv/flight23whiteFollow my  instagram https://www.instagram.com/Flight23White_FOLLOW ME ON TWITTERhttps://twitter.com/Flight23White"
"XAUiShT6wHQ","Big Scarr - Big Boy Diamonds Freestyle (Extended) [Official Video]","2020-12-07T17:00:11Z","UC9mqQoDko9Si0jFc0tFpP7Q","Big Scarr","10","20.12.12","[none]","584153","25116","235","1245","https://i.ytimg.com/vi/XAUiShT6wHQ/default.jpg","False","False","Big Scarr - Big Boy Diamonds Freestyle (Extended)Directed by Jordan SpencerGet into Big Scarr 💰Instagram: https://bigscarr.lnk.to/InstagramFacebook: https://bigscarr.lnk.to/FacebookTwitter: https://bigscarr.lnk.to/TwitterYoutube: https://bigscarr.lnk.to/Youtube#BigBoyDiamondsFreestyle #BigScarr #TheNew1017"
"-92HQA0GcI8","Inside the Lab That Invented the COVID-19 Vaccine","2020-12-08T15:30:40Z","UCH4BNI0-FOK2dMXoFtViWHw","It's Okay To Be Smart","27","20.12.12","science|joe hanson|it's okay to be smart|covid|vaccine|coronavirus vaccine|coronavirus|corona|covid 19 vaccine|virus|covid 19|pbs|its okay to be smart|its ok to be smart|it's ok to be smart|pbs digital studios|covid-19|coronavirus update|biology|coronavirus pandemic|vaccines|covid vaccine","435381","24230","683","3173","https://i.ytimg.com/vi/-92HQA0GcI8/default.jpg","False","False","We’re on PATREON! Join the community ►► https://www.patreon.com/itsokaytobesmartSUBSCRIBE so you don’t miss a video! ►► http://bit.ly/iotbs_sub↓↓↓ More info and sources below ↓↓↓Here we are, just a year after the first news of the coronavirus we now call SARS-CoV-2 and the global pandemic known as COVID-19… and scientists have already developed more than one safe & effective vaccine. How did they do that so quickly? I visited the lab whose work directly led to these first COVID vaccines, so you can learn how basic research connects to life-saving medicine. This is how to make a COVID-19 vaccine.References: Wrapp, D. et al. Cryo-EM structure of the 2019-nCoV spike in the prefusion conformation. Science 367, 1260–1263 (2020) doi: 10.1126/science.abb2507Watanabe, Y., Allen, J. D., Wrapp, D., McLellan, J. S. & Crispin, M. Site-specific glycan analysis of the SARS-CoV-2 spike. Science eabb9983 (2020) doi:10.1126/science.abb9983.-----------Special thanks to our Brain Trust Patrons:AlecZero Amory SilvaAmy SowadaBaerbel WinklerBenjamin TeinbyBob RossetBrent M.Denzel HolmesDiego LombeidaDustinEric MeerGeorge gladdingKaren HaskellMarcus TuepkerOliver and Arden BradshawPeter EhrnstromRobert YoungRon KakarSalih ArslanVincbisZenimalJoin us on Patreon! https://patreon.com/itsokaytobesmartTwitter http://www.twitter.com/DrJoeHansonhttp://www.twitter.com/okaytobesmart Instagram http://www.instagram.com/DrJoeHanson http://www.instagram.com/okaytobesmart Merchhttps://store.dftba.com/collections/its-okay-to-be-smartFacebookhttps://www.facebook.com/itsokaytobesmartpbs/"
"aBTH6D0UL-Q","Shawn Mendes, Camila Cabello - The Christmas Song","2020-12-08T02:00:01Z","UC4-TgOSMJHn-LtY4zCzbQhw","ShawnMendesVEVO","10","20.12.12","Shawn|Mendes|Camila|Cabello|The|Christmas|Song|LP4-5|PS/|Island|Holiday","5397368","460314","5587","14694","https://i.ytimg.com/vi/aBTH6D0UL-Q/default.jpg","False","False","“Wonder” the album out nowListen now: https://Wonder.lnk.to/Albumhttps://www.feedingamerica.org/ways-to-giveFor every ten million streams of “The Christmas Song” by Shawn and Camila, during the period commencing December 5, 2020 and ending on December 31, 2020, $10,000 USD will be donated to Feeding America through The Shawn Mendes Foundation, a project of the Social Impact Fund, a registered 501(c)(3) organization, subject to a minimum donation of $100,000 USD.Follow Shawn MendesInstagram | https://www.instagram.com/shawnmendes/Twitter | https://twitter.com/ShawnMendesFacebook | https://www.facebook.com/ShawnMendesO...Snap | https://www.snapchat.com/add/shawnmen...TikTok | https://www.tiktok.com/@shawnmendesWebsite | http://www.shawnmendesofficial.com/Follow Camila CabelloInstagram | https://www.instagram.com/camila_cabelloTwitter | https://twitter.com/camila_cabelloFacebook | https://www.facebook.com/camilacabelloWebsite | https://www.camilacabello.comMusic video by Shawn Mendes, Camila Cabello performing The Christmas Song. © 2020 Island Records, a division of UMG Recordings, Inc."
"g4k1qp7MiJ4","Earl Dibbles Jr - Diesel (Official Music Video)","2020-12-08T01:00:10Z","UCYhfnFOdWfHv_OtE9KZA_JQ","Granger Smith","10","20.12.12","Earl Dibbles Jr|Granger Smith|Diesel|diesel lyric|cummins|powerstroke|duramax|whistlin diesel|kentucky ballistics|demolition ranch|lunkerstv|mudding|truck stuck in mud|monster max|monster max drives in the ocean|monster max totalled|monster truck|trucks mudding|dont tread on me|country boy song|flame thrower|big truck|monster jam|monster truck in ocean|what happened to monster max|jacked up truck|offroad|trucks|lifted|monstermax|whistling|music video","748082","48026","1013","3804","https://i.ytimg.com/vi/g4k1qp7MiJ4/default.jpg","False","False","Special thanks: @WhistlinDiesel, @Kentucky Ballistics, @FarFromStock, @Mrs.Whistlindiesel, @FREED DIESEL, @Risky Business with Butch and Bull //Download my new album here! ▶ https://grangersmith.lnk.to/countrythingsShop YEE YEE APPAREL™️ here ▶ http://YeeYeeApparel.com Subscribe here ▶ http://smarturl.it/gschannelsubscribeSubscribe to my family channel here ▶ http://youtube.com/thesmithstvGRANGER SMITH:TOUR: http://GrangerSmith.com/tour INSTAGRAM: https://instagram.com/GrangerSmith FACEBOOK: https://facebook.com/GrangerSmith TWITTER: https://twitter.com/GrangerSmith WEBSITE: http://GrangerSmith.com EARL DIBBLES JR:TOUR: http://EarlDibblesJr.com/tour INSTAGRAM: https://instagram.com/EarlDibblesJrFACEBOOK: https://facebook.com/EarlDibblesJrTWITTER: https://twitter.com/EarlDibblesJr WEBSITE: http://EarlDibblesJr.comINSTAGRAMS:@WHISTLINDIESEL@MRS.WHISTLINDIESEL@FARFROMSTOCK@ELECTRIC_BLUE_79@FREED_DIESELLYRICS:Detroit Cummins powerstrokin duramax.Turbo whirlin burnin coal up a hot stackPretty Prius from the city aint got thatSo why drive that? Huh. Shoot.It’s for the backwoods tractor pullin country folkYou can’t miss em hear their whistle when they blowin smokeHaulin everything from hay bales to bass boatsIt aint no joke, nope.Yeah we love smokin that dieselIt screams out freedom like a big bald eagleLike a rooster on a June bug beetleCountry boys are led foot lethalHallelujah chrome stack’s like a steepleAll my Yee Yee peopleLove smokin that dieselYou can pour it on some pine on a Saturday nightCrack a cold one, get it going with a match strikeCountry girls look pretty in the firelightMan that’s what I like, you know that’s right.Yeah we love smokin that dieselIt screams out freedom like a big bald eagleLike a rooster on a June bug beetleCountry boys are leadfoot lethalHallelujah chrome stack’s like a steepleAll my Yee Yee peopleLove smokin that dieselTalking farmer tan, Skoal can, Bandit and the SnowmanMaking them tree huggers chokeLoaded up rifle rackBlack Barbwire tatThat everybody knows goesIt goes all the way around of courseYEE YEEYeah we love smokin that dieselIt screams out freedom like a big bald eagleLike a rooster on a June bug beetleCountry boys are leadfoot lethalHallelujah chrome stack’s like a steepleAll my Yee Yee peopleLove smokin that dieselYah we love smoking that dieselYes we do.YEE YEE.Directed & shot by: Paul De La Cerda @framesbypaulProduction Company: Encima MediaFPV Drone: Jonathan Lucan @JlucanEditors: Jonathan Lucan & Paul De La CerdaSet Assist: Jun Cleveland, Brian Kimble."
"H1QWCg9A-p4","Cowboys vs. Ravens Week 13 Highlights | NFL 2020","2020-12-09T04:14:31Z","UCDVYQ4Zhbm3S2dlz7P1GBDg","NFL","17","20.12.12","NFL|Football|offense|defense|American Football|highlight|highlights|game|sport|play|plays|season|2020|touchdown|td|game highlights|week 13|best plays|top plays|cowboys|dallas|dal|ravens|baltimore|bal|cowboys ravensgame highlights|cowboys highlights|ravens highlights|cowboys td|ravens td|DAL vs. BAL|Cowboys Ravens","1688079","16550","705","3077","https://i.ytimg.com/vi/H1QWCg9A-p4/default.jpg","False","False","The Dallas Cowboys take on the Baltimore Ravens during Week 13 of the 2020 NFL season.Subscribe to NFL: http://j.mp/1L0bVBuCheck out our other channels:Para más contenido de la NFL en Español, suscríbete a https://www.youtube.com/nflenespanolNFL Fantasy Football https://www.youtube.com/nflfantasyfootballNFL Vault http://www.youtube.com/nflvaultNFL Network http://www.youtube.com/nflnetworkNFL Films http://www.youtube.com/nflfilmsNFL Rush http://www.youtube.com/nflrushNFL Play Football https://www.youtube.com/playfootballNFL Podcasts https://www.youtube.com/nflpodcasts#NFL #Cowboys #Ravens"
"nIk8YnCGckw","$549 AirPods Max Impressions: Has Apple Lost Their Minds?","2020-12-08T22:08:04Z","UCDlQwv99CovKafGvxyaiNDA","Jonathan Morrison","28","20.12.12","AirPods|AirPods max|AirPods Pro|AirPods Pro max|AirPods max review|AirPods max unboxing|AirPods max hands on|apple|AirPods Pro vs AirPods max|AirPods max headphones|AirPods vs Sony|Apple vs Sony|tld|Jonathan Morrison","315724","11616","552","2378","https://i.ytimg.com/vi/nIk8YnCGckw/default.jpg","False","False","AirPods Max Impressions! $549. Has Apple lost their minds? Or will these be great? Subscribe for my AirPods Max hands on review! Apple M1 music review impressions! https://youtu.be/VB78wqZHclEwe made a song out of the MagSafe sound :o https://youtu.be/mugdii5TJpIShot on iPhone 12 Pro - HDR Dolby Vision Footage + channel! https://youtu.be/zAS8AOoiWug14 inch MacBook Pro? https://youtu.be/1VV8e3BOOzcGiving the iPhone 11 to strangers  - https://www.youtube.com/watch?v=AbuDm0C4vt0&t=7sFollow me (if ya want) - http://www.twitter.com/tldtodayhttp://www.instagram.com/tldtoday"
"bqiSv8uEsKc","The Try Guys Try 9 Things They've Never Done Before - Part 2 | Allure","2020-12-08T17:00:06Z","UCb0tMboxhHE8Jx6-nhJmRPw","Allure","24","20.12.12","the try guys|try nine|nine things|never done before|try 9 things|9 things|try nine things|the try guys try|the try guys allure|the try guys lipstick|the try guys kylie|the try guys nine things|ned the try guys|zach the try guys|try guys friends|try guy|eugene try guys|keith try guys|try guys 2020|celebs try|celebs never done before|the four try guys|try anything celebs|try stuff|the try guys art|the try guys date|mandalorian helmet|allure","154955","6683","71","222","https://i.ytimg.com/vi/bqiSv8uEsKc/default.jpg","False","False","Keith, Ned, Zach, and Eugene of The Try Guys linked up to dazzle us once more with a second installment of Try 9. The infamous Try Guys try nine things they've never done before, from making a Mandalorian helmet with puppy pee pads to carving their faces on a butternut squash. Who will walk away a Try warrior and who will carry their squash carving away in shame?The Try Guys documentary Behind The Try will premiere on 12/18. Get tickets for the virtual premiere: https://tryguys.veeps.com/stream/events/5999949829fcStill haven’t subscribed to Allure on YouTube? ►► http://bit.ly/AllureYouTubeSubABOUT ALLUREThe best daily makeup tips, skin-care advice, hair tutorials, product reviews, and videos from beauty experts. The Try Guys Try 9 Things They've Never Done Before - Part 2 | Allure"
"D0VAQ2BhObA","Basaksehir WALK OFF the field in protest against racism during Champions League tie against Paris","2020-12-08T20:36:42Z","UC0jPwNs4B7yJySNewHan5hQ","Optus Sport","17","20.12.12","how to watch|where can I watch|optus sport|australia|highlights|premier|league|goal|review|premier league highlights|goals|champions league highlights|europa league highlights|soccer|football|premier league|epl|ucl|uel|uefa|psg|Istanbul Basaksehir|psg racism|webo|demba ba racism|suspended|walk off|paris|coaching staff","668197","13088","562","4702","https://i.ytimg.com/vi/D0VAQ2BhObA/default.jpg","False","False","There was unbelievable scenes in Paris, with Istanbul Basaksehir walking off the pitch in protest against an apparent racist comment made by a UEFA official..The world's best football.All in one place.Get free access to Optus Sport on eligible Optus plans or purchase for $14.99/mth. Data charges may apply.Join Optus Sporthttps://sport.optus.com.au/signup==========================For the latest updates, follow us on:►TWITTER: http://twitter.com/optussport►FACEBOOK: http://facebook.com/optussport ►INSTAGRAM: http://instagram.com/optussport Optus Sport is the home of the Premier League, UEFA Champions League, UEFA Europa League, FA Women's Super League and Euro 2020.#OptusSport"
"eykh4PSQZcc","Call of Duty®: Black Ops Cold War & Warzone™ - Season One Cinematic","2020-12-07T19:14:11Z","UC9YydG57epLqxA9cTzZXSeQ","Call of Duty","20","20.12.12","call of duty|cod|activision|cw|cold war|mp|s1|season 1|warzone|br|battle royale","1186761","55151","1531","4645","https://i.ytimg.com/vi/eykh4PSQZcc/default.jpg","False","False","Time to settle the score. A trap has been set. A CIA safehouse has been hit. And an old enemy returns to get his revenge.After storming an experimental Nova 6 production site on Rebirth Island, Russell Adler has made a powerful enemy in Vikhor Stitch Kuzmin, the ex-KGB leader of the Nova 6 program. And Stitch is looking to settle the score.Now, Adler and his CIA strike team find themselves trapped, and surrounded by enough Nova 6 nerve gas to throw the world off its axis.Season One arrives to Call of Duty: Black Ops Cold War on December 16."
"the81FQoAUI","What The Coronavirus Vaccine Does To Your Body","2020-12-08T14:34:16Z","UCC552Sd-3nyi_tk2BudLUzA","AsapSCIENCE","27","20.12.12","asapscience|asap science|asapscience youtube|asap science youtube|asap|science|fun science|coronavirus|coronavirus vaccine|COVID19|COVID19 Vaccine|Pfizer vaccine|mRNA vaccine|how coronavirus vaccine works|what coronavirus vaccine is approved|what COVID19 vaccines do|is covid19 vaccine safe|vaccine safe","379072","21963","1333","5570","https://i.ytimg.com/vi/the81FQoAUI/default.jpg","False","False","With the first person receiving a COVID19 vaccine from Pfizer in the UK - what does it even do to your body? And are mRNA vaccines safe?Watch our Vaccine Podcast: https://youtu.be/22XsYKospsAWatch this BRILLIANT live stream on vaccines with Dr. Alex Dainis: https://youtu.be/YP62jFlj41YJoin our mailing list: https://bit.ly/34fWU27There’s a lot of excitement right now around the record-speed vaccines for COVID19, some of which are already starting distribution in parts of the world. But given that these are mRNA vaccines - a relatively new technology that has not been widely used before - we wanted to explain how they work, and what happens in your body from the moment the needle touches your skin. Written by Gregory Brown and Mitchell MoffitEditing by Luka ŠarlijaFOLLOW US!AsapSCIENCETikTok: @AsapSCIENCE Instagram: https://instagram.com/asapscienceFacebook: https://facebook.com/asapscienceTwitter: https://twitter.com/asapscienceSome Extra Resources:https://www.cdc.gov/coronavirus/2019-ncov/vaccines/different-vaccines/mrna.htmlhttps://www.nature.com/articles/nrd.2017.243https://www.nature.com/articles/s41541-020-0159-8https://www.nature.com/articles/d41573-020-00119-8https://www.frontiersin.org/articles/10.3389/fimmu.2019.00594/fullhttps://www.phgfoundation.org/briefing/rna-vaccineshttps://youtu.be/YP62jFlj41Y"
"-xQKDW5pITg","Trippie Redd - Too Fly","2020-12-08T05:00:01Z","UCEtPQSQ2BkBct_n8DIeacFQ","TrippieReddVEVO","10","20.12.12","Trippie|Redd|Too|Fly|1400|Entertainment/TenThousand|Projects|Hip|Hop","623487","50677","768","3880","https://i.ytimg.com/vi/-xQKDW5pITg/default.jpg","False","False","Official Music Video for Too Fly”  by Trippie Redd Listen/Download: https://trippieredd.lnk.to/pegasusOfficial Merch: shop.trippieredd.comSpotify: https://trippieredd.lnk.to/pegasus/spApple Music: https://trippieredd.lnk.to/pegasus/apAmazon Music: https://trippieredd.lnk.to/pegasus/amDeezer: https://trippieredd.lnk.to/pegasus/deFollow Trippie ReddInstagram: https://instagram.com/trippiereddFacebook: http://www.facebook.com/trippiereddTwitter: http://www.twitter.com/trippiereddTIkTok: https://www.tiktok.com/@trippieatplay"
"qIUb3bjh42Y","Pringles Update: Last Week Tonight with John Oliver (Web Exclusive)","2020-12-07T04:00:05Z","UC3XTzVzaHQEd30rQbuvCtTQ","LastWeekTonight","24","20.12.12","[none]","4381946","184766","3836","9089","https://i.ytimg.com/vi/qIUb3bjh42Y/default.jpg","False","False","With the help of viewers at home, John tries to get to the bottom of an important mystery.Connect with Last Week Tonight online... Subscribe to the Last Week Tonight YouTube channel for more almost news as it almost happens: www.youtube.com/lastweektonight Find Last Week Tonight on Facebook like your mom would: www.facebook.com/lastweektonight Follow us on Twitter for news about jokes and jokes about news: www.twitter.com/lastweektonight Visit our official site for all that other stuff at once: www.hbo.com/lastweektonight"
"4pUfu96WXHw","UFC 256 Embedded: Vlog Series - Episode 3","2020-12-09T19:32:54Z","UCvgfXK4nTYKudb0rFR6noLA","UFC - Ultimate Fighting Championship","17","20.12.12","ufc|ultimate|fighting|championship|champion|champ|embedded|episode|series|mma|ultimate fighting championship|UFC Apex|Apex|Las Vegas|Deiveson|Figueiredo|Brandon|Moreno|Ferguson|tony|oliveira|flyweight","483753","9408","209","1607","https://i.ytimg.com/vi/4pUfu96WXHw/default.jpg","False","False","Presented by Hyperice, Junior Dos Santos arrives on a late-night flight. Champion Deiveson Figueiredo hits the sauna; opponent Brandon Moreno sings through training and PT. Jacare Souza starts his quarantine. Tony Ferguson checks in with his not-coach. Visit https://hyperice.com/Subscribe to get all the latest UFC content: http://bit.ly/2uJRzRRExperience UFC live with UFC FIGHT PASS, the digital subscription service of the UFC. Visit https://ufcfightpass.com/To order UFC Pay-Per-Views on ESPN+, visit https://bit.ly/2vNIBE8 (U.S. only)To order UFC Pay-Per-Views, visit http://welcome.ufcfightpass.com/#PPV (Non U.S.)Connect with UFC online and on Social:Website: http://www.ufc.comTwitter: http://www.twitter.com/ufcFacebook: http://www.facebook.com/ufcInstagram: http://www.instagram.com/ufcSnapchat: UFCPeriscope: http://Periscope.tv/ufcConnect with UFC FIGHT PASS on Social:Twitter: http://www.twitter.com/ufcfightpassFacebook: http://www.facebook.com/ufcfightpassInstagram: http://www.instagram.com/ufcfightpass#UFC256"
"2unhM-tWKQA","Secret Formula","2020-12-06T18:00:00Z","UC91V6D3nkhP89wUb9f_h17g","MeatCanyon","1","20.12.12","meatcanyon|spongebob|meatcanyon spongebob|meatcanyon cartoon|secret formula|meatcanyon secret formula","6194825","332656","13513","50586","https://i.ytimg.com/vi/2unhM-tWKQA/default.jpg","False","False","thanks for watching the toon! if you wanna support the channel consider signing up for a monthly sticker on my patreon!https://www.patreon.com/meatcanyonAnimators MeatcanyonFantishow: https://www.youtube.com/user/FANTASHOW100Primate Punk: https://www.youtube.com/user/PrimatePunkBackgrounds:Davecavedraws: https://www.instagram.com/davecavedraws/?hl=enVFXMolly Wright: https://www.youtube.com/c/wollymightMusic Composer:Samuel Long: https://open.spotify.com/artist/1o4eqJumHhKcJrpybBK20R?si=I8xtb8hBTxmamyd8jt9mZAPAudio Engineer:Justin Greger: https://twitter.com/imadeasongMeatcanyon Twitter: https://twitter.com/meatcanyon?ref_src=twsrc%5Egoogle%7Ctwcamp%5Eserp%7Ctwgr%5EauthorMeatcanyon Instagram: https://www.instagram.com/meatcanyon/?hl=en"
"9wwi5wfNFQo","Spiderman Helps Santa (Parkour In Real Life)","2020-12-08T14:00:02Z","UChCBHudFoBnsF0O1flPXqiQ","Nick Pro","24","20.12.12","spiderman parkour|spider-man parkour|spiderman santa|santa spiderman|spiderman in real life|spider-man in real life|spider-man|santa claus|spiderman|spider man real life|spiderman real life|spiderman vs|in real life|parkour|real life|nick pro|superheroes in real life","1028305","18100","1080","1004","https://i.ytimg.com/vi/9wwi5wfNFQo/default.jpg","False","False","Spiderman Helps Santa (Parkour In Real Life) | Nick Pro#Spiderman #Parkour #SpidermanInRealLife👨🏻‍🎤Subscribe👨🏻‍🎤 : https://bit.ly/SubNickPro🔔 Never miss a video, turn on Notifications! 🔔🎬 Watch More 🎬: https://www.youtube.com/playlist?list=PL9A7496ADDBBA0F75Most Filming by: Inceptive Studios https://www.youtube.com/channel/UCDd7VYaPMqCPqKNrtVLGBAQ👕 Nick Pro & Parkour MERCH 👕: https://bit.ly/NickProMerch📷 INSTAGRAM 📷: https://bit.ly/NickProInsta✉️ WEBSITE ✉️: https://bit.ly/NickProWEB"
"8-PZoB-wRt8","RB Leipzig vs. Manchester United: Extended Highlights | UCL on CBS Sports","2020-12-08T22:22:31Z","UCET00YnetHT7tOpu12v8jxg","Champions League on CBS Sports","17","20.12.12","RB Leipzig|Manchester United|RB Leipzig vs. Manchester United","705948","7307","237","2213","https://i.ytimg.com/vi/8-PZoB-wRt8/default.jpg","False","False","Extended Highlights Presented By HeinekenRB Leipzig was able to fend off Manchester United on Matchday 6 and secured a monumental 3-2 win. Both sides were still vying for a spot in the knockout stage and RB Leipzig made their presence known jumping out to a three goal lead but Manchester United staged a late comeback that with a Bruno Fernandes goal in the 80’ and a Paul Pogba goal in the 82’ but it was too little too late and Leipzig got the win.  Leipzig wasted no time scoring in this match as Angelino opened things up in the 2’. From there, they doubled their lead in the 13’ with a Haidara goal, they held onto that 2-0 lead going into half. In the 69’ Leipzig tacked on a much needed third goal when Kluivert found the back of the net. Man. United got one back when Bruno Fernandes powered it home from the penalty spot in the 80’ to cut the Leipzig lead to 3-1. Then just two minutes later Paul Pogba, who had come on as a substitute, gave Manchester United life when he headed one home to cut the lead to one. That would be all the English side could muster, unable to find the back of the net in the match’s final minutes and with Leipzig holding on for the win, Manchester United will not advance to the UEFA Champions League knockout stage.  Stream every UEFA Champions League match live on CBS All Access:http://bit.ly/ucloncbssports #UEFA #RBLeipzig #ManchesterUnited #ManU #Leipzig #ManUnited #UCL #ChampionsLeague #Matchday6"
"QlryDJqWalI","[Q&A and updates only] SN8 prelaunch stream, new stream coming for launch!","2020-12-08T18:41:21Z","UC6uKrU_WqJ1R2HMTY3LIx5Q","Everyday Astronaut","28","20.12.12","SpaceX|Starship|SpaceX Starship|SN-8|Starship SN-8|SpaceX Starship SN-8|Elon Musk|Elon Musk SpaceX|SpaceX Rocket Launch|Starship Launch|Starship Rocket|Starship Rocket Launch|Boca Chica|Texas Rocket Launch|Starship LIVE|Starship engine|Raptor engine|SN8 flight|SN8 launch|SN-8 Launch live|12.5km hop|12 km hop|high altitude flight starship|Starship first flight|Starship belly flop|Starship explosion|starship explosion explosion live","584406","13493","218","265","https://i.ytimg.com/vi/QlryDJqWalI/default.jpg","False","False","00:00 - Mostly nothing but yapping and pretty views30:00 - Mostly nothing but yapping and pretty views1:00:00 - 00:00 - Mostly nothing but yapping and pretty views[Went live to give you up to date info, will start a fresh feed for the launch attempt]SpaceX will be attempting a 12.5-kilometer hop with their Starship SN8 prototype vehicle. SN8 will lift off under the power of its three Raptor engines and fly to an altitude of approximately 12.5 km (~41,000 ft). At that altitude, using its body flaps, SN8 will flip to a horizontal position and descend belly-first.Just prior to landing, using a combination of its engines and body flaps, SN8 will flip around again to attempt a soft propulsive landing. Need to know more information? Check out our Prelaunch Preview - https://everydayastronaut.com/starship-sn8-12-5-kilometer-hop/-------------------Want to support what I do? Consider becoming a Patreon supporter for access to exclusive livestreams, our discord channel and subreddit! - http://patreon.com/everydayastronautOr become a YouTube member for some bonus perks as well! - https://www.youtube.com/channel/UC6uKrU_WqJ1R2HMTY3LIx5Q/joinThe best place for all your space merch needs!https://everydayastronaut.com/shop/All music is original! Check out my album Maximum Aerodynamic Pressure anywhere you listen to music (Spotify, iTunes, Google Play, Amazon, etc) or click here for easy links - http://everydayastronaut.com/musicI'm the cohost of an awesome podcast where we talk all about current technologies and how they shape our future! http://ourludicrousfuture.com or here on YouTube https://www.youtube.com/ourludicrousfuture"
