video_id,title,publishedAt,channelId,channelTitle,categoryId,trending_date,tags,view_count,likes,dislikes,comment_count,thumbnail_link,comments_disabled,ratings_disabled,description
"cVBgTNQ_ajM","BTS Talks About GRAMMY Nomination, Quarantine Hobbies, and More With Dumbfoundead | Amazon Music","2020-12-10T16:02:23Z","UCPqftlDSXpl3V4u044KT88w","Amazon Music","10","20.12.12","Amazon|Amazon Music|Amazon Echo|Alexa Play|Amazon Music Unlimited|Prime Music|Alexa|Amazon Alexa|Amazon Music HD|Streaming Music HD|Ask Alexa|Music|Streaming Music|Streaming|Streaming Platform|Music App|HD Music|4K Music|bts|bts army|dumbfoundead|Bangtan Boys|RM|Jin|Suga|J-Hope|Jimin|Jungkook|boy band|korean|k pop|k pop boy band|k pop band|k pop music|rap|asian rapper|quarentine|grammys|grammy nominee","712609","91363","240","3493","https://i.ytimg.com/vi/cVBgTNQ_ajM/default.jpg","False","False","BTS sat down with Dumbfoundead to talk about their recent GRAMMY nomination, new quarantine hobbies, and a new Christmas version of their hit song Dynamite. Listen to BE: https://amzn.to/373DeRrDownload: https://www.amazon.com/BE-BTS/dp/B08NPHXFHDCD: https://www.amazon.com/BE-Deluxe-BTS/dp/B08JJNCVRX#AmazonMusic #BTS #DumbfoundeadSUBSCRIBE NOW: http://bit.ly/AZMusicYTAbout Amazon Music:Amazon Music reimagines music listening by enabling customers to unlock millions of songs and thousands of curated playlists and stations with their voice. Amazon Music provides unlimited access to new releases and classic hits across iOS and Android mobile devices, Fire tablets and the Fire TV Stick Basic Edition, PC, Mac, Echo, and more. With Amazon Music, Prime members have access to ad-free listening of more than two million songs at no additional cost to their membership. Now available in HD, listeners have access to over 60 million songs in High Definition. Engaging with music has never been more natural, simple, and fun. For more information, visit amazonmusic.com or download the Amazon Music app.Connect with Amazon Music: Visit Amazon Music WEBSITE: https://amzn.to/amazonmusicLike Amazon Music on FACEBOOK: http://bit.ly/AmazonMusicFBFollow Amazon Music on TWITTER: http://bit.ly/AmazonMusicTWFollow Amazon Music on INSTAGRAM: http://bit.ly/AmazonMusicIGBTS Talks About GRAMMY Nomination, Quarantine Hobbies, and More With Dumbfoundead | Amazon Musichttps://www.youtube.com/amazonmusic"
"3DN4-LZFZtc","Riverdale | Season 5 Trailer | The CW","2020-12-09T18:00:11Z","UCJyEY_Iwtg8-FLP3Gg5pL0Q","Riverdale","24","20.12.12","riverdale|cw|lili reinhart|bughead|riverdale cast|cast sprouse|cole sprouse|varchie|archie|ronnie|beronica|cole|interview|camila mendes|kj apa lili reinhart|jughead|kj apa|veronica and archie|madelaine petsch|fashion|riverdale fan theories|cw show|cw tv|teen drama|mystery|bingeable tv|netflix|katy keene|NY Times Quotes Extended|Season Trailer","1425697","95764","1875","7536","https://i.ytimg.com/vi/3DN4-LZFZtc/default.jpg","False","False","Season 5 premieres Wednesday, January 20! Stream next day free only on The CW.SUBSCRIBE: https://go.cwtv.com/RVRYTSubscribeConnect with RIVERDALE:Stream FREE EPISODES: go.cwtv.com/genRVRytFollow RIVERDALE on INSTAGRAM: instagram.com/thecwriverdaleFollow RIVERDALE on TWITTER: twitter.com/CW_RiverdaleLike RIVERDALE on FACEBOOK: facebook.com/CWRiverdale#Riverdale About RIVERDALE:The Official YouTube Channel for The CW’s Riverdale – Based on the characters from the Archie Comics, Riverdale is a bold and subversive take on the wholesome town of Riverdale and some of its teen residents, including Archie, Betty, Veronica and Jughead as they discover the darkness and dangers that bubble underneath their town’s wholesome facade. About The CW:Official YouTube Channel for The CW Network featuring the hit series Riverdale, as well as All American, Batwoman, Black Lightning, The Flash, DC’s Stargirl, Supergirl, DC’s Legends of Tomorrow, Supernatural, Nancy Drew, Charmed, Dynasty, In the Dark, Legacies, Penn & Teller: Fool Us, Masters of Illusion, and Roswell, New Mexico.Connect with The CW Online:Visit The CW WEBSITE: http://on.cwtv.com/homeLike The CW on FACEBOOK: http://www.facebook.com/thecwFollow The CW on TWITTER: http://twitter.com/thecwFollow The CW on INSTAGRAM: http://instagram.com/thecwRiverdale | Season 5 Trailer | The CWhttp://www.youtube.com/user/Riverdale"
"k2ejcEddQt8","Simple off grid cabin (Part 2).........that anyone can build & afford","2020-12-09T20:38:04Z","UCo698VL13Dip93yh0f4Rc5Q","Bushradical","26","20.12.12","Tiny cabin|tiny house|small cabin|off grid cabin|cabin|shed|shack|off grid","501237","20268","169","1744","https://i.ytimg.com/vi/k2ejcEddQt8/default.jpg","False","False","(PART 2).... of building a simple off grid cabin anyone can build and afford. My wife Brooke and I finish up the siding, put of the roof, finish paint & trim, Install windows and doors and a woodstove!  Dave Whipple                   Here is the link to PART ONE of this video series. https://www.youtube.com/watch?v=bOOXmfkXpkM"
"RCtMVgOFcqA","Joyner Lucas - Like A River ft. Elijah James (Official Video) Evolution","2020-12-09T19:01:27Z","UCUebubwSuTHfHjWJI4gCS9A","Joyner Lucas","10","20.12.12","joyner lucas|like a river|elijah james|joyner lucas snitch|new joyner lucas|joyner lucas 2020|2020|2021|snitch joyner lucas reaction|joyner lucas evolution|joyner lucas type beat|joyner lucas reaction|joyner lucas snitch reaction|joyner lucas fall slowly|fall slowly joyner lucas|adhd|rap|hip hop|eminem reaction|joyner lucas str8 like dat|joyner lucas evolution reaction|reaction|snitch reaction joyner lucas|joyner lucas zim zimma|zim zimma|ashanti|tiktok","415409","43087","208","3165","https://i.ytimg.com/vi/RCtMVgOFcqA/default.jpg","False","False","Stream Joyner Lucas now: https://orcd.co/joynerlucasevolutionEvolution Merch: https://bit.ly/2EJbZ30Written and Managed on Tully: http://onelink.to/8rdzhv"
"rokGy0huYEA","Google — Year in Search 2020","2020-12-09T07:59:45Z","UCK8sQmJBp8GCxrOtXWBpyEA","Google","28","20.12.12","google|google year in search|zeitgeist|year in review|2020|2020 highlights|2020 recap|best of 2020|google year in search 2020|year in search|year in search 2020|why|biggest moments on 2020|end of year recap","17661116","120776","12021","9183","https://i.ytimg.com/vi/rokGy0huYEA/default.jpg","False","False","In times of uncertainty, people seek understanding and meaning. This year, the world searched “why” more than ever. This film features the questions we asked this year, with words and narration by Kofi Lost. Explore more trends from the year at https://google.com/yearinsearch#YearInSearch Mira este video en español: https://www.youtube.com/watch?v=d5ZzM-4mF8wAudio described version here: https://www.youtube.com/watch?v=2oVrUv-w3Oo C R E D I T S:Google Brand StudioWords/Narration: Kofi LostEditor: Scott Butzer - Cabin Editing CompanySound Design: John Bolen - Formosa Group VFX/Color/Finish: Shape + LightOriginal Music: Peter CottonTale - “Together” Featured Artists: Chicago Children’s Choir, Cynthia Erivo, and The Matt Jones (Re-Collective Orchestra)SELECT FOOTAGE COURTESY OF:@RMG NewsGetty Images / NBC News ArchivesTom Fuller, Tom Wilkinson, and the University of OxfordSeán DoranPhoto by Stephanie MazeFootage from the “World Surf Weekly” provided through the courtesy of the World Surf LeagueMeged Gozani, HaaretzThe Real Neal’sBreonna Taylor Mural by Future History NowBreonna Taylor Mural photo courtesy of Maurice TaylorAcademy Awards® ClipCopyright © Academy of Motion Pictures Arts and SciencesWNBA/NBA footage courtesy of the National Basketball Association Jimmy Fallon footage courtesy of NBC UniversalEstate of Breonna TaylorTrayvon Martin FoundationThe estate of George FloydMamba & Mambacita Sports Foundation Photo copyright courtesy of NBC ArchivesFootage copyright courtesy of Alyza EnriquezRichner Communications, Inc /Long Island HeraldStory to SpectacleNandi BushellEddie VanHalen music video footage courtesy of Rhino Records,  a Warner Music Group companyCanal OFFXOS DigitalMural Credit -Dom WhitehurstPhoto courtesy of Nate PalmerPhotography by PABLO MARTINEZ MONSIVAIS/APCommencement speech courtesy of Howard UniversityMural Artist Nikkolas SmithFootage courtesy US Tennis AssociationJaVale McGee, https://www.youtube.com/javalemcgeeSubscribe to our Channel: https://www.youtube.com/googleTweet with us on Twitter: https://twitter.com/googleFollow us on Instagram: https://www.instagram.com/googleJoin us on Facebook: https://www.facebook.com/Google"
"32I0Qso4sDg","[HOONIGAN] Gymkhana 2020: Travis Pastrana Takeover; Ultimate Hometown Shred in an 862hp Subaru STI","2020-12-08T14:00:00Z","UCXlfi8sf6cKGQ8sOd0-yRuw","Hoonigan","2","20.12.12","Hoonigan|Gymkhana|Gymkhana 11|Gymkhana eleven|Gymkhana 2020|Gymkhana Annapolis|Gymkhana Maryland|Travis Pastrana|Travis Pastrana Gymkhana|Ken Block Gymkhana|Annapolis Jump|Annapolis car jump|Travis Pastrana Motocross|Subaru|Subaru Gymkhana|Subaru WRX STI|Subaru Rally|Subaru Motorsports|Pastranaland|Pit Viper|Kirby Chambliss|Stunt plane|Ego Alley","6898505","319104","3075","18581","https://i.ytimg.com/vi/32I0Qso4sDg/default.jpg","False","False","More than a decade-long rivalry between friends and rally drivers Travis Pastrana and Ken Block has culminated in a passing of the torch. Travis Pastrana is trying his hand at his own Gymkhana film, shot and edited by the same crew that makes all the Gymkhana films: Hoonigan Media Machine.  Who’s the real winner here? You! Gymkhana 2020 is brought to you by: Subaru USAWeb: https://www.subaru.com/IG: https://www.instagram.com/subaru_usa/FB: https://www.facebook.com/subaruofamerica/ Subaru MotorsportsWeb: https://www.subaru.com/motorsportsIG: https://www.instagram.com/subarumotorsportsusa/FB: https://www.facebook.com/subarumotorsportsusa/ Yokohama TireWeb: https://www.yokohamatire.comIG: https://www.instagram.com/yokohamatire/FB: https://www.facebook.com/yokohamatire OmazeWeb: https://www.omaze.com/*** Enter for your chance to win the custom built Subaru STI in this video: https://bit.ly/You-Custom-Subaru *** Pit ViperWeb: https://www.pitvipersunglasses.comIG: https://www.instagram.com/pit_viper/?hl=enFB: https://www.facebook.com/pitviperlifestyle/ Black Rifle Coffee CompanyWeb: https://www.blackriflecoffee.comIG: https://www.instagram.com/blackriflecoffee/?hl=enFB: https://www.facebook.com/blackriflecoffeeco/  Steel-it CoatingsWeb: https://www.steel-it.comIG: https://www.instagram.com/steelitcoatings/?hl=enFB: https://www.facebook.com/STEELITCOATINGS/  Method Race WheelsWeb: https://www.methodracewheels.comIG: https://www.instagram.com/methodracewheels/?hl=enFB: https://www.facebook.com/MethodRaceWheels/ Big props to Connor Stitt on his double backflip in this video... at only 9 years old!? Give him a follow: https://www.instagram.com/connor.stitt/For press inquiries, please contact Ron Zarasron@hoonigan.com We’ve got channels for all your car content needs. Subscribe, nerds. The Hoonigans: https://www.youtube.com/user/TheHoonigans?sub_confirmation=1 Project Cars: https://www.youtube.com/c/HooniganProjectCars??sub_confirmation=1 Daily Transmission: http://www.youtube.com/c/HooniganDailyTransmission?sub_confirmation=1 Ken Block: https://www.youtube.com/KenBlockHHIC?sub_confirmation=1 AutoFocus: https://www.youtube.com/channel/UCuGuOqcXsgzL3YrguODoGXw?sub_confirmation=1 Bonus: https://www.youtube.com/channel/UCFhUumuHyYL-mAXSeZVbqMg?sub_confirmation=1 Stay fresh with the latest apparel: https://www.hoonigan.com/thenewnew Facebook: https://www.facebook.com/TheHoonigans/ Instagram: https://www.instagram.com/thehoonigans/ Follow Our Crew:@brianscotto@hertlife@vin_tra@dangerdan3@mister_zachary@jchase7452@nadsynads@larry_chen_foto@suppymk4@amezcua_fs1@roncar And don’t forget to turn on notifications so you don’t miss out on our latest uploads!https://www.hoonigan.com/"
"TreSUQsRnCo","Red vs Blue Introduce New Blood Gulch Fortnite Creative Map","2020-12-11T03:01:05Z","UClG8odDC8TS6Zpqk9CGVQiQ","Fortnite","20","20.12.12","Fortnite|Epic Games|PC|PS4|Xbox One|Battle Royale|Unreal Tournament|Unreal Engine|Fortnite Battle Royale|Fortnite Creative","1625729","120708","3142","8225","https://i.ytimg.com/vi/TreSUQsRnCo/default.jpg","False","False","Master Chief has arrived in the Fortnite Item Shop and to celebrate you can drop in to the new Blood Gulch Creative Map in Fortnite Creative https://www.epicgames.com/fn/5394-2533-7196#FortniteCreative"
"Su9ABA6RcV8","girl in red - two queens in a king sized bed (official video)","2020-12-10T18:00:10Z","UCwlHDQ83jgF1crd6XXzSmIA","girl in red","24","20.12.12","girl in red|world in red|do you listen to girl in red|we fell in love in october|girl in red girls|midnight love|girl in red rue|two queens in a king sized bed|gay christmas song|gay christmas|lgbtq songs|lgbt songs|girl in red interview|girl in red lyrics|girl in red live|christmas song","292740","98513","218","5678","https://i.ytimg.com/vi/Su9ABA6RcV8/default.jpg","False","False","the official video for two queens in a king sized bedU CAN LISTEN HERE : https://girlinred.ffm.to/tqiaksb.oydmy insta: https://gir.lnk.to/InstagramYD twitter : https://gir.lnk.to/TwitterYD loml tik tok! : https://gir.lnk.to/tiktokYD facebook: https://gir.lnk.to/facebookYDmailer: https://girlinred.ffm.to/signup.oydwww.worldinred.comCredits:Director: Niels WindfeldtProducer: Aleksander AurdalDOP: Andreas JohannessenFocus puller: Vi Duc TruongGaffer: Tobias Olsen JohnsgårdBest boy: Lars AnderssenGrip/crane: Bob Aas Carho *Octocopter Film*Grip/crane assistant: Simen Moe MæhlumTech ass: Espen RudiProps: Nina Von Gegerfelt NielsenProd.ass: Petter ArntsenProd.ass: Sander WickstrømCatering: Ine AatangenProduction: PARENTCast: Thale Log SkageMarie UlvenPost.prod:Editor - Henrik PedersenGrade - Joakim RissvedsVFX/Online - Sindre HammersbøenFilm Scan - Focus Film // Nina BoririTV mix - Andreas W. MartinsenEquipment: Storyline StudiosBTS: ParentGlenn C. PettersenTHE LYRICS!!!! two queens in a king sized bedthere's no mistletoe above our headsbut i’ll kiss you anywayon christmas dayyea i’ll kiss you anyway on christmas day i don’t have a lot to givebut i would give you everythingall my time is yours to spend let me wrap you in with my skin  two queens in a king sized bedlike angels in the snowmy only wish is one more year and then i want them allyour freckled cheeksour tangled feetthe closer the better it getsso let's stay right here until forever disappears #worldinred #twoqueensinakingsizedbed #girlinred"
"kxeIrVJdUs8","I missed this • AIR FRYIN' WITH LIZA","2020-12-09T19:00:15Z","UCxSz6JVYmzVhtkraHWZC7HQ","Liza Koshy","23","20.12.12","liza|lizza|lizzza|lizzzavine|lizzzak|lizzzako|koshy|lizakoshy|wednesdays","797286","98091","755","6090","https://i.ytimg.com/vi/kxeIrVJdUs8/default.jpg","False","False","I cooked an entire holiday meal... WITH AIR. I don't mean to be humble, but I'm a MASTER. I am Avatar, the Last Airfryer. Pardon me as I blow your minds... and my food. Healthy Holidays to you all, and to you all... a little gift below:••••••••••••••••••••••••••••••••••••••••­­­•••••••••••SURPRISE! This is what you get for being nosy in the description... A GIFT TO YOU: 20% OFF EVERYTHING in my new beauty and skincare line when you use code HOLIDAZE.... PLUS, enjoy free shipping. PLUS, get a free gift (Give 'Em Lip (& Cheek) Tint) on all orders $40+! Get it all here: https://www.cestmoi.com/pages/liza-koshy-x-cest-moi••••••••••••••••••••••••••••••••••••••••­­­•••••••••••What the hell? She has a beauty line now? Watch this for context: https://www.youtube.com/watch?v=JlazW6xJMEM••••••••••••••••••••••••••••••••••••••••­­­•••••••••••Why yes, she does upload. Proof:Early 2020: https://www.youtube.com/watch?v=B4h0_7fUZIUAffected by 2020: https://www.youtube.com/watch?v=9cCXsCaxXSw&t=292s ••••••••••••••••••••••••••••••••••••••••­­­•••••••••••Stay inside and get your food air fried.Healthy Holidays my dears! Love always,Liza"
"j-pKKM6CXr0","Why did I build Monoliths all around the World?","2020-12-08T23:07:07Z","UCJLZe_NoiG0hT7QCX_9vmqw","I did a thing","24","20.12.12","[none]","2820740","191437","8790","17086","https://i.ytimg.com/vi/j-pKKM6CXr0/default.jpg","False","False","Go watch their Netflix show!  https://www.netflix.com/auntydonnasbigolhouseoffunMonolith Location: https://www.google.com/maps/place/Doongalla+Picnic+Ground/@-37.8459467,145.3447355,469m/data=!3m1!1e3!4m5!3m4!1s0x0:0xda3df305fa212bb8!8m2!3d-37.8454896!4d145.3454013Patreon: https://www.patreon.com/user?u=13180179Twitter: https://twitter.com/ididathing1Discord: https://discord.gg/mppfmHW"
"ETnepJ1zgKQ","It Finally Happened | OT 20","2020-12-07T23:00:40Z","UCRijo3ddMTht_IHyNSNXpNQ","Dude Perfect","17","20.12.12","dude perfect|dude perfect stereotypes|dude perfect water bottle flip|bottle flip|water bottle flip|dude perfect bottle flip|dude perfect basketball|dp|dude perfect world record|edition|nerf|trick shots|trick shot|family|ping pong|bowling|clean|family friendly|bubble wrap|soccer|football|spinner|spinners|fidget spinners|dude|overtime|over|time|20|small|games|big|prizes|cool|not cool|wheel|unfortunate|plus|dp+|behind|the|scenes|cat|own a cat|chair|chair drop","8611726","394824","8415","33737","https://i.ytimg.com/vi/ETnepJ1zgKQ/default.jpg","False","False","The Wheel Unfortunate spin you’ve all been waiting for. Today's OT kicks off with a brand new segment, followed by all your faves! Thanks to Dr Pepper for sponsoring this video! Click HERE to learn more about the Tuition Giveaway! https://bit.ly/DrPepperDP Be sure to subscribe so you don't miss our 4 back-to-back OT's in December!► Thanks for subscribing! - http://bit.ly/SubDudePerfect► Subscribe to our Behind The Scenes channel! - https://bit.ly/DPplusSubscribeThanks for watching #Overtime20Intro: 0:00Small Games Big Prizes: 1:02Cool Not Cool: 7:44Dude Perfect Plus Sneak Peak: 15:24Wheel Unfortunate: 17:52Shout out to @WorkshopHustle (Instagram) for creating the unbelievable DP chair. We are terribly sorry for what happened when we put it through the Get Crafty judging criteria...but that doesn't take away from the incredible craftsmanship!Special thanks to Little Elm Animal Shelter!NEXT LEVEL STUFF -------------------------------------------🎒 NEW Merch - http://bit.ly/DPStore🎮 Play our FREE iPhone game! - http://smarturl.it/DudePerfect2📱 Text us - (469) 205-7005🔔 Hit the bell next to Subscribe so you don't miss a video!👨🏻‍💻 Watch our newest vids! - http://bit.ly/NewDPVids📕 Read our Book - Go Big - http://amzn.to/OYdZ2sFollow our Instagrams so we can be best friends -------------------------------------------🏆 http://Instagram.com/DudePerfect🧔🏻 http://Instagram.com/TylerNToney👱🏻‍♂️ http://Instagram.com/Cody_Jones_🙋🏻‍♂️ http://Instagram.com/CobyCotton👨‍🦰 http://Instagram.com/GarrettHilbert⛹🏻‍♂️ http://Instagram.com/CoryCotton-------------------------------------------Bonus points if you're still reading this! Comment: Yay for Tiger Lilly!!Click here to learn more about Dude Perfect:http://bit.ly/AboutDudePerfectAs always...Go Big and God Bless!- Your friends at Dude PerfectBusiness or Media, please contact us at: Dude@DudePerfect.com------------5 Best Friends and a Panda.If you like Sports + Comedy, come join the Dude Perfect team!Best known for trick shots, stereotypes, battles, bottle flips, ping pong shots and all-around competitive fun, Dude Perfect prides ourselves in making the absolute best family-friendly entertainment possible! Welcome to the crew! Pound it 👊🏻 Noggin 🙇🏻‍♂️ - Dude Perfect"
"KzarvReKTlg","Vory - Ain't It Funny ft. Meek Mill","2020-12-09T17:00:53Z","UCwDYAUE2Le9HYZJIGJ9xK4A","VORYVEVO","10","20.12.12","Vory|Ain't|Funny|UMG|Recordings|Inc|Hip|Hop","588064","10935","806","831","https://i.ytimg.com/vi/KzarvReKTlg/default.jpg","False","False","#Dreamchasers artist #Vory debuts the official music video to Ain't It Funny ft #MeekMill Stream VORY everywhere here: https://dreamchasers.lnk.to/VORYFollow VORY on Instagram here: https://www.instagram.com/voryMusic video by Vory performing Ain't It Funny. © 2020 UMG Recordings, Inc.http://vevo.ly/cihxDsMusic video by Vory performing Ain't It Funny. © 2020 UMG Recordings, Inc.http://vevo.ly/cihxDs"
"YsyHUkUuwo8","How a Chinese Barbecue Master Has Been Roasting Whole Pigs for 30 Years — Smoke Point","2020-12-09T15:00:10Z","UCRzPUBhXUZHclB7B5bURFXw","Eater","26","20.12.12","chinese barbecue pork|Chinese barbecue|Chinese bbq|chinese bbq pork|Whole roasted pig|Chinese whole roasted pig|roasted pig|Chinese food|Chinese cuisine|Chinese chef|Char siu|sweet and sour pork|char siu pork|char siu recipe|sweet and sour pork recipe|how to roast a whole pig|Chinese-style roasted pig|Philippino roast pig|East Court and Mike's BBQ|Best Chinese food in Toronto|eater|eater.com|food|restaurant|dining|dish|foodie|chef|food show|barbecue|bbq","1183329","19585","475","1400","https://i.ytimg.com/vi/YsyHUkUuwo8/default.jpg","False","False","Toronto’s East Court BBQ owner Jack Tsoi has been perfecting the complex process of Chinese-style whole roasted pig for 30 years. From butchering to boiling to roasting to salting to roasting again, he makes some of the crispiest, juiciest barbecued pig in the area.  Credits:Director/Producer: Daniel Geneen Camera: Andrew Budziak, Ryan MorganEditor: Daniel Geneen Executive Producer: Stephen PelletteriDevelopment Producer: McGraw WolfmanCoordinating Producer: Stefania OrrùAudience Engagement: Daniel Geneen, Terri Ciccone ----------------------------------------------------------------------------------------------------------For more episodes of 'Smoke Point,' click here: https://trib.al/EKbAUmrEater is the go-to resource for food and restaurant obsessives with hundreds of episodes and new series, featuring exclusive access to dining around the world, rich culture, immersive experiences, and authoritative experts. Binge it, watch it, crave it. Subscribe to our YouTube Channel now! http://goo.gl/hGwtF0"
"UnA7tepsc7s","Cyberpunk 2077 — Official Launch Trailer — V","2020-12-08T17:01:00Z","UC4zyoIAzmdsgpDZQfO1-lSA","Cyberpunk 2077","20","20.12.12","Cyberpunk|Cyberpunk 2077|CP|CP77|CP2077|2077|gameplay|official|trailer|video game|game|RPG|Night City|FPP|cd projekt|cd projekt red|CDPR|cd project|cd project red|Xbox|Xbox One|PlayStation|PlayStation 4|PS4|PS5|PlayStation 5|PC|Stadia","11145450","382990","6300","34761","https://i.ytimg.com/vi/UnA7tepsc7s/default.jpg","False","False","Would you rather live in peace as Mr. Nobody... or go down for all times in a blaze of glory?December 10th.#Cyberpunk2077 Cyberpunk 2077, an open-world, action-adventure story from CD PROJEKT RED, is coming to Xbox One, PlayStation 4, PC, and Google Stadia on December 10th, 2020. The game will also be playable on Xbox Series X and PlayStation 5 consoles when available.Pre-order now: https://www.cyberpunk.net/pre-orderAbout the game:Cyberpunk 2077 is an open-world, action-adventure story set in Night City, a megalopolis obsessed with power, glamour and body modification. You play as V, a mercenary outlaw going after a one-of-a-kind implant that is the key to immortality. You can customize your character’s cyberware, skillset and playstyle, and explore a vast city where the choices you make shape the story and the world around you.Learn more:https://www.cyberpunk.net https://www.twitter.com/CyberpunkGamehttps://www.facebook.com/CyberpunkGame https://www.instagram.com/CyberpunkGamehttps://www.discord.gg/CyberpunkGamehttps://www.CyberpunkGame.tumblr.comMusic:P.T. Adamczyk feat. Olga Jankowska – Never Fade Away (SAMURAI Cover)"
