video_id,title,publishedAt,channelId,channelTitle,categoryId,trending_date,tags,view_count,likes,dislikes,comment_count,thumbnail_link,comments_disabled,ratings_disabled,description
"WTXF6ZSU7iw","Hulk (2003) Pitch Meeting","2020-12-06T20:15:00Z","UC2iUwfYi_1FCGGqhOUNx-iA","Screen Rant","24","20.10.12","Hulk|2003|pitch meeting|marvel|eric bana|ang lee|jennifer connely|the incredible hulk|bruce banner|betty ross|general ross|marvel cinematic universe|marvel comics|superhero|nick nolte|hulk smash|hulk transformation|hulk dogs|sam elliot|josh lucas|stan lee|lou ferrigno|plot holes|super easy barely an inconvenience|ryan george|screen rant|screenrant","603516","38219","335","2231","https://i.ytimg.com/vi/WTXF6ZSU7iw/default.jpg","False","False","Step inside the pitch meeting that led to 2003’s Hulk movie!Subscribe for more Pitch Meetings: http://goo.gl/ho3Hg6In the early 2000’s, years before the Marvel Cinematic Universe came into existence, superhero movies were starting to pick up steam. Spider-Man starring Tobey Maguire was a massive success, and so it made sense to start tackling some other Marvel properties. However, studios didn’t exactly know what to do with comic book movies just yet. Thus was born Ang Lee’s slow-burn, slow-paced Hulk movie in 2003 with the weirdest editing transitions known to man.Ang Lee’s hulk definitely raises some questions. Like why does it take so long to see the Hulk? Why is a movie about a giant green monster that smashes things so slow-paced? What’s up with Hulk fighting dogs? Why is everybody surviving these catastrophic attacks from the Hulk? And seriously, what’s with this editing?To answer all these questions and more, step inside the Pitch Meeting that led to Hulk! It’ll be super easy, barely an inconvenience.Check Out These Other Amazing Videos:The Incredible Hulk (Edward Norton) Pitch Meetinghttps://www.youtube.com/watch?v=DTDoqTEHykQGame of Thrones Season 8 Pitch Meetinghttps://www.youtube.com/watch?v=jAhKOV3nImQOur Social Media:https://twitter.com/screenranthttps://www.facebook.com/ScreenRantOur Websitehttp://screenrant.com/"
"otOGmTQ4rBI","When Walmart cancels your PS5 order","2020-12-06T01:58:36Z","UCrA2bqOHwjX1DxgP9CaVJzw","Lenarr Young","23","20.10.12","Lenarr|Lenarr Young|lennarr|lenarryoung|lenar|lanar|lanarr|young|skit|skits|comedy|creator|funny","828643","98026","845","6471","https://i.ytimg.com/vi/otOGmTQ4rBI/default.jpg","False","False","Follow me on:Twitter: https://twitter.com/lenarr_?lang=enInstagram: https://www.instagram.com/lenarr___/?hl=en"
"n-yoOQ6axsw","I Made a Game Inside a Game...","2020-12-06T13:43:30Z","UCORkUj9eaM2aDJM1VYyDDTA","Sam Hogan","28","20.10.12","recursion|game inside a game|game in a game|unity|game development|gamedev|unity game dev|indie dev|learning unity|unity3d|c# game engine|online game development|creating a game app|learning game development|software developer|video game development software|unity developer|game development software|unity game development|render texture","446336","35481","161","3871","https://i.ytimg.com/vi/n-yoOQ6axsw/default.jpg","False","False","(inside a game)Download: https://samhogan.itch.io/game-inside-a-gameTwitter: https://twitter.com/SamHGamesInstagram: https://www.instagram.com/samhgames/Discord: https://discord.gg/Gy7pW69This game was inspired by this one: https://youtu.be/n-yoOQ6axswFor some reason I decided to develop a game about recursion. The initial idea was to have the player itself be a smaller copy of the level that can navigate inside itself. So you could do things to the level to give yourself certain abilities or do things to yourself to modify the level. There weren't many amazing directions to take this, so I thought of something else:What if the level contained a smaller copy of itself, and the player character can navigate between the different recursive instances. The idea is cool I guess, but programming it turned out to be quite the challenge - ultimately involving the use of a render texture and quickly swapping out the controlled player copy.The final 2D golf based game is full of some mind-bending mechanics involving scaling the player, changing gravity, and duplicating yourself. --- MUSIC ---→ Sidearm by INTL.CMD - https://soundcloud.com/intlcmd→ Pookatori and Friends by Kevin MacLeod (incompetech.com)→ Crazy by Antti Luode"
"jX4MsaZ92d0","Walmart Holiday Drone Light Show","2020-12-06T00:57:59Z","UC701pqb1-HJPS4RMjSmK4Yg","Walmart","24","20.10.12","[none]","696765","7382","704","774","https://i.ytimg.com/vi/jX4MsaZ92d0/default.jpg","False","False","Don’t miss the chance to watch your favorite holiday songs coming to life through the magic of drones. Live on YouTube, Saturday, Dec. 5, at 7:40 PM EST. #WalmartDroneShowSave Money. Live Better.Subscribe to Walmart on YouTube: http://bit.ly/1tVy1CI  Like Walmart on Facebook: http://on.fb.me/1qS59V6 Follow Walmart on Pinterest: http://bit.ly/1vR6XBY Follow Walmart on Twitter: http://bit.ly/1pMbNfy Follow Walmart on Instagram: http://bit.ly/1FMiiJX"
"A3CVHvCqouE","SIDEMEN FIND OUT THEIR FOOTBALL STATS","2020-12-05T20:00:05Z","UCh5mLn90vUaB1PbRRx_AiaA","MoreSidemen","22","20.10.12","sidemen|moresidemen|miniminter|ksi|zerkaa|behzinga|tbjzl|vikkstar|wroetoshaw","4055108","208835","1551","8124","https://i.ytimg.com/vi/A3CVHvCqouE/default.jpg","False","False","https://a.did.as/6001HMV6dThank you Adidas  for sponsoring this video!• Sidemen: http://www.youtube.com/Sidemen• Sidemen Clothing: http://www.sidemenclothing.com• Sidemen Twitter: https://twitter.com/Sidemen---------------------------------------------------------------------Sidemen:• Miniminter: http://www.youtube.com/Miniminter• Zerkaa: http://www.youtube.com/Zerkaa• Behzinga: http://www.youtube.com/Behzinga• Vikkstar123: http://www.youtube.com/Vikkstar123• TBJZL: http://www.youtube.com/TBJZL• Wroetoshaw: http://www.youtube.com/Wroetoshaw• KSI: http://www.youtube.com/KSIedited by https://twitter.com/chipfat_"
"vMLk_T0PPbk","Black Eyed Peas, Shakira - GIRL LIKE ME (Official Music Video)","2020-12-04T15:00:09Z","UCrwmu-gceGOmtZeuTsn7DlQ","BlackEyedPeasVEVO","10","20.10.12","will.i.am|apl.de.ap|Taboo|black eyed peas|fergie|boom boom pow|imma be|i gotta feeling|let's get it started|ritmo|mamacita|ozuna|j. rey soul|epic|epic records|new black eyed peas music|mamasita|feel the beat|maluma|bep|translation|girl like me|tonta love|celebrate|todo bueno|duro hard|mabuti|i woke up|get loose now|action|news today|vida loca|no manana|new bep|bep album|j balvin|j rey soul|shakira|nicky","38272343","1106081","62283","71386","https://i.ytimg.com/vi/vMLk_T0PPbk/default.jpg","False","False","Translation available at: https://Black-Eyed-Peas.lnk.to/TranslationGIRL LIKE ME Official Audio: https://youtu.be/rGhvqK9eLBgFollow Black Eyed Peas onlineFacebook: https://www.facebook.com/blackeyedpeasTwitter: https://twitter.com/bep Instagram: https://www.instagram.com/bepMore Videos: https://www.youtube.com/playlist?list=PLgZwaNdNnwLpNLAN8Kh2DoWsD1ViSlNDNFollow Shakira onlineInstagram: http://www.instagram.com/shakira Facebook: http://www.facebook.com/shakira Twitter: http://www.twitter.com/shakira Tik Tok: https://www.tiktok.com/@shakira(C) 2020 BEP Music, LLC, under exclusive license to Epic Records, a division of Sony Music Entertainment#BlackEyedPeas #Shakira #GIRLLIKEME"
"GzWffFXpI1w","Official Trailer - I Survived Hardcore Minecraft For 2000 Days And This Is What Happened","2020-12-05T16:30:02Z","UC9FkeEFIGd9FXRfxpTltXYA","Luke TheNotable","20","20.10.12","luke thenotable|luke|the|notable|minecraft|hardcore minecraft|I Survived Hardcore Minecraft For 1000 Days And This Is What Happened|1000 days|1000 days hardcore|and this is what happened|hardcore minecraft survival|hardcore mode minecraft|hardcore minecraft 1000 days|100 days|100|1000|100 drops|100 games|i survived 100 days minecraft|400 days|300 days|new minecraft|hardcore mode|minecraft survival|100 days minecraft|minecraft hardcore|100 days hardcore","1664705","98856","1684","12016","https://i.ytimg.com/vi/GzWffFXpI1w/default.jpg","False","False","Welcome to the official trailer for 2000 Days! I know you have all waited a long time to watch this video and it's coming very soon! Make sure to show up on premiere day to watch 2000 Days with me LIVE for the first time! 2000 Days Premieres live on Youtube @ 12PM CST on 12/19/2020If you have any questions please comment below and I will make a FAQ section here!BACKGROUND MUSIC C418 - MinecraftFollow me on Twitter!! - https://twitter.com/LukeTheNotable"
"HgzXgP8RlbQ","Making The McDonald's McRib At Home | But Better","2020-12-06T16:00:03Z","UChBEbMKI1eCcejTtmI32UEw","Joshua Weissman","26","20.10.12","mcrib|homemade mcrib|mcdonalds|homemade mcdonalds|mcrib recipe|secret recipe mcrib|rib sandwich|homemade hoagie bread|hoagie bread recipe|easy bread recipe|oven rib recipe|rib recipe|bbq ribs|barbecue ribs recipe|barbecue sauce recip|bbq sauce recipe|joshua weissman|youtube recipes|youtube cooking series|sat bawl pro|how to make the mcrib|boneless rib sandwich|sesame hoagie recipe|mcdonalds mcrib|mcrib is back|mcrib sandwich|homemade|at home","1166588","57161","937","4407","https://i.ytimg.com/vi/HgzXgP8RlbQ/default.jpg","False","False","They say it can't be done. A homemade McRib, which is essentially just a rib sandwich isn't just doable... we can make everything from scratch and make it much much better.New Merch (In time for the Holidays): https://bit.ly/WeissmanMerchFOLLOW ME:Instagram: https://www.instagram.com/joshuaweissmanTik Tok: https://www.tiktok.com/@flakeysaltTwitter: https://twitter.com/therealweissmanFacebook: https://www.facebook.com/thejoshuaweissmanSubreddit: https://www.reddit.com/r/JoshuaWeissman/---------------------------------------------------------------Ingredients you'll need:Hoagie Bread-1.5 cups (350ml) warm water2.5 teaspoons (7g) instant yeast1 tablespoon (14g) sugar3.5 cups (525g) all purpose flour2 teaspoons (7g) fine sea salt3 tablespoons (42g) unsalted butter, softened1 egg whitesplash of milk1/4 cup (38g) Sesame seedsRibs:1 rack baby back or spare ribs 1 tablespoon kosher salt2 tablespoons brown sugar2 teaspoons garlic powder2 teaspoons mustard powder2 teaspoons smoked paprika 2 teaspoons white pepper BBQ sauce: 1 cup 220g dark brown sugar1 cup 276gp ketchup3 tablespoons (58g) molasses 1/4 cup sherry vinegar1 tablespoon 12g garlic powder1 tablespoon 7g smoked paprika 1.5  teaspoons cayenne1 tablespoon Worcestershire sauce1 tablespoon kosher salt1 teaspoons fresh ground black pepper Assembly:Unsalted butter, for toastingBbq sauceDill pickles, slicedsweet onion, thinly sliced"
"ieTnO1Dvt-I","Lil Baby - On Me","2020-12-04T05:00:23Z","UCM1gEqLPsgej7ZKzu9w8v7A","LilBabyVEVO","10","20.10.12","Lil|Baby|Quality|Control|Music/Motown|Records|Hip|Hop|Lil Baby|On Me|Lil Baby On Me|Errbody|Lil Baby Errbody|My Turn|The Bigger Picture|4PF|Rylo Rodriguez|42 Dugg|GIFH","9643369","233502","7433","14890","https://i.ytimg.com/vi/ieTnO1Dvt-I/default.jpg","False","False","Stream/Download Lil Baby's On Me here: https://QualityControl.lnk.to/OnMeFollow Lil Baby Everywhere:Instagram: https://www.instagram.com/lilbaby_1/TikTok: https://www.tiktok.com/@lilbaby Twitter: https://twitter.com/lilbaby4PFOn Me Lyrics:[Verse 1]Fill the bando up with bandsGive the lil bro them a jobYou can come get rich with usYou gone eat or you gone starveKeep a certified hittas and I pay him not to robHop out 2020 Cullinan and I’m riding in a starKnow some people hate that I’m on top I bulletproof the carAll the members made three bands our pack live like they cracking cardsJoe know for a fact I keep it real he still ain’t take the chargeWhy she talkin’ crazy bout me like I don't do more than my partI can’t play with my creation give the world to my lil boyI been saving more than I been spending that’s what I be onI’m a human I’m not perfect I know sometimes I be wrong[Hook]I’m like come and put that pussy on me Dont be running from meIf I like it I spend money on itGet whatever from mePut six figures in your business I do real shitI drop cash at the dealershipThey’ll mail you a pink slipShe make sure she keep her nails did and her wig fixedWent to jail and that one held me down shea real bitchHundred rounds in this double drum It’s a kill tent Marco been in prison for a while but he still flexin’[Verse 2]I told bro and them to park the car but they still wreckI don't think nobody around still but I still checkI don’t gota hundred million I can’t chill yetBut don’t get it misconstrued yeah I get real checksbaby fucking like a pornstar we have real sexHave nobody in our business we take real jetsSay she like when I perform so I fuck her with my chains onAnd she handle her part so I let her play the main roleAin’t have to get rich for this partner stay with the same folksAnd I cant beef with none of you niggas not in the same boatNever gone get caught up about it know how the game go10 chain bussin’ look like rainbows[Hook]I’m like come and put that pussy on me Don’t be running from meIf I like it I spend money on itGet whatever from mePut six figures in your business I do real shitI drop cash at the dealershipThey’ll mail you a pink slipShe make sure she keep her nails did and her wig fixedWent to jail and that one held me down she a real bitchHundred rounds in this double drum It’s a kill tent Marco been in prison for a while but he still flexin’I’m like come and put that pussy on me Don't be running from meIf I like it I spend money on itGet whatever from meMusic video by Lil Baby performing On Me. Quality Control Music/Motown Records; © 2020 Quality Control Music, LLC, under exclusive license to UMG Recordings, Inc.http://vevo.ly/r6pEMA"
"2nVctLmtqJ4","WE FAILED OUR INSPECTION | BUILDING OUR OWN HOUSE","2020-12-07T14:00:00Z","UCwh2SF7McSUf1GVFVk0nP8w","Trent & Allie","22","20.10.12","van life|vanlife|trent and allie|eamon and bec|trent and allie van|homesteading|red poppy ranch|tiny home|tiny house|off grid|wild wonderful off grid|tiny house tour|do it yourself|diy|life uncontained|building|building a house|framing|framing a house|cabin build|building our own home|snow in the mountains|building our own house|cabin in the mountains|building in the snow|alpen|alpen windows|inspection|we failed our inspection|building inspection","315432","32509","408","1967","https://i.ytimg.com/vi/2nVctLmtqJ4/default.jpg","False","False","Check out SimpliSafe’s holiday sale by visiting https://simplisafe.com/trentandallie. Get 40% off their award-winning home security that keeps your home safe around the clock, plus a free HD camera! It’s really reliable, easy to use, and there are no contracts.It's been a long time since we've had an inspector visit our house and we thought we were doing everything right. Well turns out we were about to get a big surprise from the inspector, we failed our inspection. watch to find out more and we hope you have a few laughs along the way too. Become a Patron ~ http://bit.ly/TApatreon BUY OUR COOKBOOK HERE ~ http://bit.ly/2kAdua6PayPal ~ trentandallie@gmail.comUse code trentandallie at https://www.RENOGY.com for 10% offThis Video's Music ~ http://bit.ly/EpisoundBuy Our Van Layout & Diagrams~ http://bit.ly/VanLayout All Our Adventure Gear Comes From ~ http://bit.ly/2TjFoq8Our Mailing Address:Trent & Allie6300 N Sagewood DrSte H - 632Park City, UT 84098~~~ VAN LIFE NECESSITIES ~~~Espresso machine ~ https://amzn.to/2YD4RuxOur blanket ~ https://amzn.to/2LhaRBEBlendtec ~ https://amzn.to/2J1PrrKPaper Towel Dispenser ~ https://amzn.to/2kAduU0Water Filtration System ~ https://amzn.to/2L8pGGKNature's head Composting Toilet~ https://amzn.to/2N8wVTw~~~ Camera Gear ~~~Drone ~ https://amzn.to/2CKzntgVlogging Camera ~ https://amzn.to/2FsG3NjMain Lens ~ https://amzn.to/2HKw49nMicrophone ~ https://amzn.to/2uwU5Z1Joby ~ https://amzn.to/2HUzy8uTripod ~ https://amzn.to/2FHVe6kGopro ~ https://amzn.to/2rVE1SSBack up Camera ~ https://amzn.to/2HJGCptCamera Backpack ~ https://amzn.to/37AFZHu~~~ Solar & Electrical ~~~Charge Controller ~ https://amzn.to/2JJWmKRSolar Cables ~ https://amzn.to/2Jf2ZTSInverter ~https://amzn.to/2shzs2aBatteries ~ https://amzn.to/2IXVtgPCable entry ~ https://amzn.to/2L5npfrSolar Panel Brackets ~ https://amzn.to/2sjVUrxSolar Panels ~ https://amzn.to/2xyr6ZlDC Fuse Panel ~ https://amzn.to/2IVxNtEMain DC Panel Breaker ~ https://amzn.to/2L1g6oQL.E.D. Lights ~ https://amzn.to/2IWpptSBattery Cables ~ https://amzn.to/2xqc07RUSB Dual Charger ~ https://amzn.to/2IWnYHOVoltage Sensing Relay ~ https://amzn.to/2H1idXsThermostat ~ https://amzn.to/2xkT1LY~~~ Plumbing &  Water ~~~Water Heater ~ https://amzn.to/2kA3fPCWater Heater Door ~ https://amzn.to/2JeJ2g8Water Heater Sealant ~ https://amzn.to/2LHvsAn Kitchen Faucet ~ https://amzn.to/2JeGtKVSoap Dispenser ~ https://amzn.to/2IY6X3OSink ~ https://amzn.to/2kx2KWfWater Pump ~ https://amzn.to/2kCRkABWater Pump Strainer ~ https://amzn.to/2kxoj96Accumulator Tank ~ https://amzn.to/2L6m7kiShower Faucet ~ https://amzn.to/2suoCW7Shower Pan ~ https://amzn.to/2JhFvNSFresh Water Tank ~ https://amzn.to/2IWgy7qGrey Water Tank ~ https://bit.ly/2Yxb771Fresh Water Fill Door ~ https://amzn.to/2xqdL4XWaterless P-trap ~ https://amzn.to/2IXDS4uGrey Tank Grommet ~ https://amzn.to/2xolC2TGrey Tank Valve ~ https://amzn.to/2LGtfVFWater Filtration System ~ https://amzn.to/2Jf73U8Shower Drain ~ https://amzn.to/2IXSgy5~~~ Accessories & Misc. ~~~Fridge ~ https://bit.ly/35pQmwfAir Compressor ~ https://amzn.to/2LgtfKQAir bag Kit ~ https://amzn.to/2JueOG2Bike Rack ~ https://amzn.to/39GRDSWCell Booster ~ https://amzn.to/2JqpIwkShelf by bed ~ https://amzn.to/2sxndxGTrailer Hitch ~ https://amzn.to/2FKyYchTelescoping Ladder ~ https://amzn.to/2ITkARYMountain Bike Fork Mount ~ https://amzn.to/2LGphfCBathroom Shelves ~ https://amzn.to/2smEk5qBack Door Organizer ~ https://amzn.to/2Jfk7c1Propane Detector ~ https://amzn.to/2JhMnLaCarbon Monoxide Detector ~ https://amzn.to/2L222eXButcher Block Glaze ~ https://amzn.to/2ya5SRLFire Extinguisher ~ https://amzn.to/2H0hCoYFolding Hooks ~ https://amzn.to/2IUenVTTable Drawer Slides ~ https://amzn.to/2H2h3LcMemory Foam Mattress ~ https://amzn.to/2Jh31dURoof Fan ~ https://amzn.to/2xoisfxPropane Tank ~ https://amzn.to/2Jciw6TPropane Tank Insulation ~ https://amzn.to/2JfeJpjPropane Regulator ~ https://amzn.to/2xqyx4FPropane Furnace ~ https://amzn.to/2Jgka7zFINISHING THE ROOF AND INSTALLING WINDOWS | BUILDING OUR OWN HOUSE #trentandallie #building #cabin trent and allie"
"tEbos1zc3Z0","Tottenham 2-0 Arsenal | I’ve Had Enough, ARTETA OUT! (Troopz)","2020-12-06T21:21:42Z","UCBTy8j2cPy6zw68godcE7MQ","AFTV","17","20.10.12","afc|aftv|arsenal|arsenal fan tv|fan cams|arsenal tv|arsenal fan cams|football|gooners|ozil|premier league|robbie lyle|troopz|dt|aftvmedia|david luiz|xhaka|martinelli|mesut ozil|arteta|mikel arteta|aftv news|Pierre-Emerick Aubameyang|Aubameyang|Nicolas Pepe|All Gunz Blazing|transfer daily|gabriel|willian|thomas partey|aftv troopz|expressions|TOTARS|spurs vs arsenal|spurs arsenal|tottenham arsenal|spurs arsenal live|spurs arsenal stream|arsenal tottenham","770769","26628","1714","5628","https://i.ytimg.com/vi/tEbos1zc3Z0/default.jpg","False","False","Tottenham 2-0 Arsenal | I’ve Had Enough, ARTETA OUT! (Troopz)Join Profit Accumulator, the UK’s largest matched betting community, FREE TODAY and you could earn up to £45. 120,000 users are not wrong. https://bit.ly/2SCMlRh UK only and 18+. Please gamble responsibly. #AD 👉 Check out the new AFTV web-app today: AFTV.mobi - http://aftv.mobi/☑️Try the full AFTV VIP experience: AFTV.mobi (http://aftv.mobi/) FREE for 2 weeks, with exclusive new shows, all our YouTube content ad-free, an in-game Opta match centre, team selectors, daily polls, world-class news articles, as well as brilliant competitions including; opportunities to appear on AFTV and much more. *Just £2.99/month after the free trial period*😷  AFTV have put in place all the measures suggested by our government, in order to keep our people, and our country, safer during Covid-19.  https://aftv.co.uk/home/aftv-covid-19-policy/🎥 SUBSCRIBE NOW: https://bit.ly/3dXN9Zl📸 FOLLOW US ON INSTAGRAM: https://bit.ly/3dX0kcT📲 FOLLOW US ON TWITTER: https://bit.ly/3f0Wvou👤 LIKE US ON FACEBOOK: https://bit.ly/2VJaHuK📱 FOLLOW US ON TIKTOK: https://bit.ly/2BEux3h🤖 JOIN US ON REDDIT: https://bit.ly/2VN1tNU⚽️ JOIN US ON FLICK: https://bit.ly/2Zna3Vk📺 WATCH US ON TWITCH: https://bit.ly/3ivXYVR🛍 VISIT THE AFTV STORE: http://www.aftvstore.com🖥 VISIT OUR WEBSITE: https://www.aftv.co.uk🙋 Do you have a suggestion for content that you would like to see us do, here on AFTV?➡️ Fill out this quick suggestion form and we might use your idea: https://bit.ly/3iork8JAFTV is the largest football fan network in the world! With a bias towards Arsenal Football Club, we are the place where the fan’s uncensored opinion can be heard before, during and after the whistle blows. Join in the banter and follow us for football previews, watch alongs, fan cams, podcasts and more. This is where the world watches, and the voice of the fan is heard!⚠️ DISCLAIMER: Football is a vibrant game and fans are passionate. Colourful language is sometimes used, and controversial opinions expressed. Content is often streamed live, and we are not always able to edit or censor material in advance. VIEWER DISCRETION IS ADVISED. The thoughts, views and opinions expressed are those of the contributors and do not necessarily purport to be or reflect those of AFTV.#TOTARS #AFTV #Arsenal #Football"
"W2WRE5pxZ7A","Lil Wayne - Something Different (Official Music Video)","2020-12-04T22:42:43Z","UCO9zJy7HWrIS3ojB4Lr7Yqw","Lil Wayne","10","20.10.12","lil wayne|lil wayne 2020|weezy|weezy wednesday|wayne carter|young money|hiphop|tha carter|ymcmb|hollyweezy|birdman|dwayne carter|wayne|hot boys|cash money|tunechi|lil tunechi|carter|no ceilings|no ceilings 3|something different|lil wayne something different|something different lil wayne|something different music video|lil wayne no ceilings 3","3137265","141519","5545","10713","https://i.ytimg.com/vi/W2WRE5pxZ7A/default.jpg","False","False","Official music video for Something Different by Lil Wayne, from No Ceilings 3 (A Side). Worldstar premier!Listen to the full No Ceilings 3 mixtape: https://www.youtube.com/playlist?list=PLXcRV4ZzG8t1RClxCRZI3zpyhaKS84eczAvailable everywhere now: https://www.noceilings3.com/ @DatPiff @WORLDSTARHIPHOP Click to subscribe to Lil Wayne's YouTube channel for exclusive footage! http://bit.ly/WayneYTSubWatch Lil Wayne's Exclusive Series and Footage:Funeral: https://bit.ly/FuneralWayneDedication 6 Reloaded: https://bit.ly/Dedication6ReloadedWeezy Wednesdays: http://bit.ly/WeezyWedsLil Wayne Exclusive Tracks: http://bit.ly/WayneExclusivesLil Wayne Official Music Videos: http://bit.ly/WayneVideosLil Wayne on Twitter: http://www.twitter.com/LilTunechiLil Wayne on Facebook: http://www.facebook.com/LilWayneLil Wayne on Instagram: https://www.instagram.com/liltunechiYoung Money on Facebook: http://www.facebook.com/youngmoneyent#LilWayne"
"xpv8PRcesfI","[2020 MAMA] BTS_ON","2020-12-06T16:10:38Z","UCbD8EppRX3ZwJSou-TVo90A","Mnet K-POP","24","20.10.12","방탄소년단|BTS|ON|온|2020MAMA|2020마마|MAMA|마마|Mnet|엠넷|Mnet ASIAN MUSIC AWARDS","5968812","684561","8153","27252","https://i.ytimg.com/vi/xpv8PRcesfI/default.jpg","False","False","ON&ONON by BTS in 2020 MAMA#2020MAMA #MAMA #MnetAsianMusicAwards"
