video_id,title,publishedAt,channelId,channelTitle,categoryId,trending_date,tags,view_count,likes,dislikes,comment_count,thumbnail_link,comments_disabled,ratings_disabled,description
"QlryDJqWalI","[Q&A and updates only] SN8 prelaunch stream, new stream coming for launch!","2020-12-08T18:41:21Z","UC6uKrU_WqJ1R2HMTY3LIx5Q","Everyday Astronaut","28","20.10.12","SpaceX|Starship|SpaceX Starship|SN-8|Starship SN-8|SpaceX Starship SN-8|Elon Musk|Elon Musk SpaceX|SpaceX Rocket Launch|Starship Launch|Starship Rocket|Starship Rocket Launch|Boca Chica|Texas Rocket Launch|Starship LIVE|Starship engine|Raptor engine|SN8 flight|SN8 launch|SN-8 Launch live|12.5km hop|12 km hop|high altitude flight starship|Starship first flight|Starship belly flop|Starship explosion|starship explosion explosion live","574717","13489","212","260","https://i.ytimg.com/vi/QlryDJqWalI/default.jpg","False","False","00:00 - Mostly nothing but yapping and pretty views30:00 - Mostly nothing but yapping and pretty views1:00:00 - 00:00 - Mostly nothing but yapping and pretty views[Went live to give you up to date info, will start a fresh feed for the launch attempt]SpaceX will be attempting a 12.5-kilometer hop with their Starship SN8 prototype vehicle. SN8 will lift off under the power of its three Raptor engines and fly to an altitude of approximately 12.5 km (~41,000 ft). At that altitude, using its body flaps, SN8 will flip to a horizontal position and descend belly-first.Just prior to landing, using a combination of its engines and body flaps, SN8 will flip around again to attempt a soft propulsive landing. Need to know more information? Check out our Prelaunch Preview - https://everydayastronaut.com/starship-sn8-12-5-kilometer-hop/-------------------Want to support what I do? Consider becoming a Patreon supporter for access to exclusive livestreams, our discord channel and subreddit! - http://patreon.com/everydayastronautOr become a YouTube member for some bonus perks as well! - https://www.youtube.com/channel/UC6uKrU_WqJ1R2HMTY3LIx5Q/joinThe best place for all your space merch needs!https://everydayastronaut.com/shop/All music is original! Check out my album Maximum Aerodynamic Pressure anywhere you listen to music (Spotify, iTunes, Google Play, Amazon, etc) or click here for easy links - http://everydayastronaut.com/musicI'm the cohost of an awesome podcast where we talk all about current technologies and how they shape our future! http://ourludicrousfuture.com or here on YouTube https://www.youtube.com/ourludicrousfuture"
"2unhM-tWKQA","Secret Formula","2020-12-06T18:00:00Z","UC91V6D3nkhP89wUb9f_h17g","MeatCanyon","1","20.10.12","meatcanyon|spongebob|meatcanyon spongebob|meatcanyon cartoon|secret formula|meatcanyon secret formula","5825966","316345","12730","48292","https://i.ytimg.com/vi/2unhM-tWKQA/default.jpg","False","False","thanks for watching the toon! if you wanna support the channel consider signing up for a monthly sticker on my patreon!https://www.patreon.com/meatcanyonAnimators MeatcanyonFantishow: https://www.youtube.com/user/FANTASHOW100Primate Punk: https://www.youtube.com/user/PrimatePunkBackgrounds:Davecavedraws: https://www.instagram.com/davecavedraws/?hl=enVFXMolly Wright: https://www.youtube.com/c/wollymightMusic Composer:Samuel Long: https://open.spotify.com/artist/1o4eqJumHhKcJrpybBK20R?si=I8xtb8hBTxmamyd8jt9mZAPAudio Engineer:Justin Greger: https://twitter.com/imadeasongMeatcanyon Twitter: https://twitter.com/meatcanyon?ref_src=twsrc%5Egoogle%7Ctwcamp%5Eserp%7Ctwgr%5EauthorMeatcanyon Instagram: https://www.instagram.com/meatcanyon/?hl=en"
"I-VHMHIELNQ","FRESH'S $1,000,000 OFFICE TOUR! (hosted by lazarbeam)","2020-12-07T14:28:48Z","UChnm6XBN1Izz82EPzpmL1Pw","FreshFresh","22","20.10.12","fresh|lazarbeam|lazar|mrfreshasian|setup|music|freshfresh|Harley Fresh","861715","72291","1174","9286","https://i.ytimg.com/vi/I-VHMHIELNQ/default.jpg","False","False","10 MASSIVE NEXT GEN CONSOLE GIVEAWAY: https://bit.ly/freshnextgenHope you guys enjoyed the office tour! Leave a comment with what you wanna see on this channel, I'm wanting to expand and do a lot more!YesFollow me @Twitch: https://www.twitch.tv/freshTwitter: https://www.twitter.com/mrfreshasianInstagram: https://www.instagram.com/mrfreshasian/Discord: https://discord.gg/yes"
"fA6GwORbw5g","GOLDBRIDGE! RB Leipzig 3-2 Manchester United Match Reaction","2020-12-08T22:49:25Z","UCMmVPVb0BwSIOWVeDwlPocQ","The United Stand","24","20.10.12","Manchester United|Man United|Man Utd|Manchester United TV|The United Stand|United Stand|Manchester United News|MUFC|Man Utd News|United|Manchester United 2020|Manchester United Latest News|Manchester United Transfer News|Man Utd Transfer News|Transfer|Solskjaer|Ole Gunnar Solskjaer|Solskjaer news|MU live streaming|mu live|Man Utd live stream|live|RB Leipzig|RB Leipzig vs Man Utd|RB Leipzig Manchester United|RB Leipzig vs Manchester United","426611","13663","611","1374","https://i.ytimg.com/vi/fA6GwORbw5g/default.jpg","False","False","RB Leipzig 3-2 Manchester United! Mark Goldbridge reacts to a big result for Solskjaer's United. Get the latest Man Utd News on The United Stand.🔔 Player Ratings Vote here  https://www.theunitedstand.com/articles/match-ratings/fan-player-ratings-rb-leipzig-vs-manchester-unitedLIVE FAN REACTION SHOW: https://www.youtube.com/watch?v=tDpC1eMI1k8&feature=youtu.be&ab_channel=TheUnitedStand🚨VISIT OUR WEBSITE 🚨For all the latest United news and TUS content:https://www.theunitedstand.com⏲️The United Stand Content TIMELINE is the best way to find all our latest content quickly! https://www.theunitedstand.com/timeline📰 LATEST WRITTEN NEWS https://www.theunitedstand.com/articles/latest-news📸 FOLLOW OUR INSTAGRAMhttps://www.instagram.com/theunitedstandtv/✅ The United Stand MEMBERSHIP https://buff.ly/2I2Of9R📧Contact The United Stand = soccerboxtv@gmail.com📧WRITER SUBMISSIONS = unitedstandwebsite@gmail.comAddressing: Jamie or NoraSee the FULL United Stand Kit Range CLICK HERE https://buff.ly/2Krpw1zEXCLUSIVE NEW PODCAST ITUNES https://buff.ly/2ZUhv84Spotify https://buff.ly/34dwEo6Google Podcast https://buff.ly/2ZHlNDnCastBox https://buff.ly/2UuiU3RRadio Public https://buff.ly/34jWkzAThe United Stand is Manchester United's biggest independent fan channel. Made for Manchester United fans by Manchester United fans, the United Stand provides you with the latest Manchester United transfer news, highlights, goal reviews and much more. So if MUFC means the world to you, get involved and subscribe to The United Stand http://bit.ly/1CmczHm#Goldbridge #ManchesterUnited #MUFC"
"-92HQA0GcI8","Inside the Lab That Invented the COVID-19 Vaccine","2020-12-08T15:30:40Z","UCH4BNI0-FOK2dMXoFtViWHw","It's Okay To Be Smart","27","20.10.12","science|joe hanson|it's okay to be smart|covid|vaccine|coronavirus vaccine|coronavirus|corona|covid 19 vaccine|virus|covid 19|pbs|its okay to be smart|its ok to be smart|it's ok to be smart|pbs digital studios|covid-19|coronavirus update|biology|coronavirus pandemic|vaccines|covid vaccine","244492","16753","436","2281","https://i.ytimg.com/vi/-92HQA0GcI8/default.jpg","False","False","We’re on PATREON! Join the community ►► https://www.patreon.com/itsokaytobesmartSUBSCRIBE so you don’t miss a video! ►► http://bit.ly/iotbs_sub↓↓↓ More info and sources below ↓↓↓Here we are, just a year after the first news of the coronavirus we now call SARS-CoV-2 and the global pandemic known as COVID-19… and scientists have already developed more than one safe & effective vaccine. How did they do that so quickly? I visited the lab whose work directly led to these first COVID vaccines, so you can learn how basic research connects to life-saving medicine. This is how to make a COVID-19 vaccine.References: Wrapp, D. et al. Cryo-EM structure of the 2019-nCoV spike in the prefusion conformation. Science 367, 1260–1263 (2020) doi: 10.1126/science.abb2507Watanabe, Y., Allen, J. D., Wrapp, D., McLellan, J. S. & Crispin, M. Site-specific glycan analysis of the SARS-CoV-2 spike. Science eabb9983 (2020) doi:10.1126/science.abb9983.-----------Special thanks to our Brain Trust Patrons:AlecZero Amory SilvaAmy SowadaBaerbel WinklerBenjamin TeinbyBob RossetBrent M.Denzel HolmesDiego LombeidaDustinEric MeerGeorge gladdingKaren HaskellMarcus TuepkerOliver and Arden BradshawPeter EhrnstromRobert YoungRon KakarSalih ArslanVincbisZenimalJoin us on Patreon! https://patreon.com/itsokaytobesmartTwitter http://www.twitter.com/DrJoeHansonhttp://www.twitter.com/okaytobesmart Instagram http://www.instagram.com/DrJoeHanson http://www.instagram.com/okaytobesmart Merchhttps://store.dftba.com/collections/its-okay-to-be-smartFacebookhttps://www.facebook.com/itsokaytobesmartpbs/"
"WWDRbwe1ys8","19-Year-Old TikToker Realizes She Lost Her Sense of Taste","2020-12-07T23:29:04Z","UC9k-yiEpRHMNVOnOi_aQK8w","Inside Edition","25","20.10.12","Coronavirus|tiktok|Inside Edition|Inside_Edition|IE Coronavirus|TikTok|tiktok covid|tiktoker loses sense of smell|coronavirus tiktok|coronavirus symptoms|covid-19|tiktoker loses sense of taste|lose taste covid-19|starbucks","997423","41951","822","3203","https://i.ytimg.com/vi/WWDRbwe1ys8/default.jpg","False","False","A teen who thought she was just filming a bit for TikTok ended up recording the exact moment she discovered she had a tell-tale COVID-19 symptom. Maryn Short, 19, was sampling what was supposed to be a sweet drink when she discovered she couldn’t taste a thing. In that moment, Short tells Inside Edition, she realized an awful truth. Short quickly went to get tested, and it came back positive for COVID-19. She is now quarantined at home in Louisiana, and documenting her struggle on TikTok."
"6WL2pFxJIjE","Stephen A. goes OFF on Kyrie Irving | First Take","2020-12-08T16:09:17Z","UCiWLfSweyRNmLpgEHekhoAg","ESPN","17","20.10.12","first take|nba|espn|kyrie irving|stephen a. smith|lebron james|lebron|kyrie|first take today|kyrie irving kevin durant|kyrie irving lebron james|kyrie irving nets|lebron james kyrie irving|kyrie lebron|lebron kyrie|brooklyn nets|espn first take kyrie irving|first take kyrie irving|kyrie irving first take|kevin durant|kyrie irving brooklyn nets|irving|kyrie nets|nba on espn|nets|kyrie espn|cleveland cavaliers|kyrie irving espn|nba news|basketball","1132513","28310","1836","5088","https://i.ytimg.com/vi/6WL2pFxJIjE/default.jpg","False","False","Stephen A. Smith reacts to Brooklyn Nets star Kyrie Irving’s decision to release a statement instead of engaging with the media.#FirstTake #NBA✔️ Subscribe to ESPN+https://plus.espn.com/✔️ Get the ESPN App: http://www.espn.com/espn/apps/espn✔️ Subscribe to ESPN on YouTube: http://es.pn/SUBSCRIBEtoYOUTUBE✔️ Subscribe to NBA on ESPN on YouTube: http://bit.ly/SUBSCRIBEtoNBAonESPN✔️ Watch ESPN on YouTube TV: http://es.pn/YouTubeTVESPN on Social Media:► Follow on Twitter: http://www.twitter.com/espn► Like on Facebook: http://www.facebook.com/espn► Follow on Instagram: http://www.instagram.com/espnVisit ESPN on YouTube to get up-to-the-minute sports news coverage, scores, highlights and commentary for NFL, NHL, MLB, NBA, College Football, NCAA Basketball, soccer and more. More on ESPN.com: https://www.espn.com"
"-xQKDW5pITg","Trippie Redd - Too Fly","2020-12-08T05:00:01Z","UCEtPQSQ2BkBct_n8DIeacFQ","TrippieReddVEVO","10","20.10.12","Trippie|Redd|Too|Fly|1400|Entertainment/TenThousand|Projects|Hip|Hop","431336","44212","656","3579","https://i.ytimg.com/vi/-xQKDW5pITg/default.jpg","False","False","Official Music Video for Too Fly”  by Trippie Redd Listen/Download: https://trippieredd.lnk.to/pegasusOfficial Merch: shop.trippieredd.comSpotify: https://trippieredd.lnk.to/pegasus/spApple Music: https://trippieredd.lnk.to/pegasus/apAmazon Music: https://trippieredd.lnk.to/pegasus/amDeezer: https://trippieredd.lnk.to/pegasus/deFollow Trippie ReddInstagram: https://instagram.com/trippiereddFacebook: http://www.facebook.com/trippiereddTwitter: http://www.twitter.com/trippiereddTIkTok: https://www.tiktok.com/@trippieatplay"
"1OJ7aW3Df5U","Stu - SNL","2020-12-06T07:25:45Z","UCqFzWxSCi39LnW1JKFR3efg","Saturday Night Live","24","20.10.12","snl|saturday night live|season 46|snl 46|snl host|Jason bateman|Jason bateman snl|Pete Davidson|Kate mckinnon|Kyle mooney|Chloe fineman|Bowen yang|letters to santa|snl letters to santa|Saturday night live letters to santa|stan Eminem|dido|Christmas gift|playstation 5|ps5|Eminem|north pole|elton john|s46|s46e7|episode 7|live|new york|comedy|sketch|funny|hilarious|late night|host|music|guest|laugh|impersonation|actor|musician","4640258","151704","2368","7588","https://i.ytimg.com/vi/1OJ7aW3Df5U/default.jpg","False","False","Santa Claus (Jason Bateman) receives a series of Christmas letters from an insistent man (Pete Davidson).Saturday Night Live.  Stream now on Peacock: https://bit.ly/3j1IRUkSubscribe to SNL: https://goo.gl/tUsXwMStream Current Full Episodes: http://www.nbc.com/saturday-night-live WATCH PAST SNL SEASONSGoogle Play - http://bit.ly/SNLGooglePlayiTunes - http://bit.ly/SNLiTunes SNL ON SOCIALSNL Instagram: http://instagram.com/nbcsnlSNL Facebook: https://www.facebook.com/snlSNL Twitter: https://twitter.com/nbcsnlSNL Tumblr: http://nbcsnl.tumblr.com/SNL Pinterest: http://www.pinterest.com/nbcsnl/ GET MORE NBCLike NBC: http://Facebook.com/NBCFollow NBC: http://Twitter.com/NBCNBC Tumblr: http://NBCtv.tumblr.com/YouTube: http://www.youtube.com/nbcNBC Instagram: http://instagram.com/nbc #SNL #JasonBateman #MorganWallen #SNL46"
"the81FQoAUI","What The Coronavirus Vaccine Does To Your Body","2020-12-08T14:34:16Z","UCC552Sd-3nyi_tk2BudLUzA","AsapSCIENCE","27","20.10.12","asapscience|asap science|asapscience youtube|asap science youtube|asap|science|fun science|coronavirus|coronavirus vaccine|COVID19|COVID19 Vaccine|Pfizer vaccine|mRNA vaccine|how coronavirus vaccine works|what coronavirus vaccine is approved|what COVID19 vaccines do|is covid19 vaccine safe|vaccine safe","281347","17494","1044","4138","https://i.ytimg.com/vi/the81FQoAUI/default.jpg","False","False","With the first person receiving a COVID19 vaccine from Pfizer in the UK - what does it even do to your body? And are mRNA vaccines safe?Watch our Vaccine Podcast: https://youtu.be/22XsYKospsAWatch this BRILLIANT live stream on vaccines with Dr. Alex Dainis: https://youtu.be/YP62jFlj41YJoin our mailing list: https://bit.ly/34fWU27There’s a lot of excitement right now around the record-speed vaccines for COVID19, some of which are already starting distribution in parts of the world. But given that these are mRNA vaccines - a relatively new technology that has not been widely used before - we wanted to explain how they work, and what happens in your body from the moment the needle touches your skin. Written by Gregory Brown and Mitchell MoffitEditing by Luka ŠarlijaFOLLOW US!AsapSCIENCETikTok: @AsapSCIENCE Instagram: https://instagram.com/asapscienceFacebook: https://facebook.com/asapscienceTwitter: https://twitter.com/asapscienceSome Extra Resources:https://www.cdc.gov/coronavirus/2019-ncov/vaccines/different-vaccines/mrna.htmlhttps://www.nature.com/articles/nrd.2017.243https://www.nature.com/articles/s41541-020-0159-8https://www.nature.com/articles/d41573-020-00119-8https://www.frontiersin.org/articles/10.3389/fimmu.2019.00594/fullhttps://www.phgfoundation.org/briefing/rna-vaccineshttps://youtu.be/YP62jFlj41Y"
"9wwi5wfNFQo","Spiderman Helps Santa (Parkour In Real Life)","2020-12-08T14:00:02Z","UChCBHudFoBnsF0O1flPXqiQ","Nick Pro","24","20.10.12","spiderman parkour|spider-man parkour|spiderman santa|santa spiderman|spiderman in real life|spider-man in real life|spider-man|santa claus|spiderman|spider man real life|spiderman real life|spiderman vs|in real life|parkour|real life|nick pro|superheroes in real life","683808","13880","759","858","https://i.ytimg.com/vi/9wwi5wfNFQo/default.jpg","False","False","Spiderman Helps Santa (Parkour In Real Life) | Nick Pro#Spiderman #Parkour #SpidermanInRealLife👨🏻‍🎤Subscribe👨🏻‍🎤 : https://bit.ly/SubNickPro🔔 Never miss a video, turn on Notifications! 🔔🎬 Watch More 🎬: https://www.youtube.com/playlist?list=PL9A7496ADDBBA0F75Most Filming by: Inceptive Studios https://www.youtube.com/channel/UCDd7VYaPMqCPqKNrtVLGBAQ👕 Nick Pro & Parkour MERCH 👕: https://bit.ly/NickProMerch📷 INSTAGRAM 📷: https://bit.ly/NickProInsta✉️ WEBSITE ✉️: https://bit.ly/NickProWEB"
"9qQ8FiP1GFM","Available Now! Clash Of Clans December Update 2020","2020-12-07T10:51:37Z","UCD1Em4q90ZUK2R5HKesszJg","Clash of Clans","20","20.10.12","clash of clans|COC|Clash of Clans Gameplay|Clash of Clans Strategy|Clash of Clans Animation|Clash of Clans Commercial|Clash of Clans Attacks|Clash of Clans Town Hall|Hog Rider|PEKKA|Clan Wars|season challenges|clan war leagues|clash on|clan game","5457747","111293","2965","4716","https://i.ytimg.com/vi/9qQ8FiP1GFM/default.jpg","False","False","2020 is no year for an ordinary Clashmas - the Logmas Update is here! • Roll through enemy villages with the Log Launcher, a brand-new Siege Machine!• Introducing Super Wizard and Ice Hound, the latest additions to the Super Troop line-up!• Update also contains a new, must-see Spell, fresh Town Hall 13 content, neat quality of life changes and much more!Follow us on our Socials!Twitter ► https://twitter.com/ClashofClans/Instagram ►https://www.instagram.com/clashofclans Facebook ►https://www.facebook.com/ClashofClans Attack. Defend. Strategize. Download for free for mobile devices. http://supr.cl/ThisArmyFrom rage-­filled Barbarians with glorious mustaches to pyromaniac wizards, raise your own army and lead your clan to victory! Build your village to fend off raiders, battle against millions of players worldwide, and forge a powerful clan with others to destroy enemy clans.PLEASE NOTE! Clash of Clans is free to download and play, however some game items can also be purchased for real money Also, under our Terms of Service and Privacy Policy, you must be at least 13 years of age to play or download Clash of Clans.A network connection is also required.FEATURES- Build your village into an unbeatable fortress - Raise your own army of Barbarians, Archers, Hog Riders, Wizards, Dragons and other mighty fighters- Battle with players worldwide and take their Trophies- Join together with other players to form the ultimate Clan- Fight against rival Clans in epic Clan Wars - Build 18 unique units with multiple levels of upgrades- Discover your favorite attacking army from countless combinations of troops, spells, Heroes and Clan reinforcements - Defend your village with a multitude of Cannons, Towers, Mortars, Bombs, Traps and Walls- Fight against the Goblin King in a campaign through the realmChief, are you having problems? Visit http://supercell.helpshift.com/a/clas...Privacy Policy:http://www.supercell.net/privacy-policy/Terms of Service:http://www.supercell.net/terms-of-ser...Parent’s Guide:http://www.supercell.net/parents#clashofclans #logmas #newupdate"
"8NYiO_0xLcE","Apple announces New AirPods MAX!","2020-12-08T14:32:56Z","UCa962e5dqRMO1nUldwaaRMw","Tailosive Tech","28","20.10.12","Tailosive|Tech|Technology|Science|Modern Day|Apple|AirPods|AirPods Pro|AirPods Max|Over ear headphones|headphones wireless headphones","155395","4957","201","1937","https://i.ytimg.com/vi/8NYiO_0xLcE/default.jpg","False","False","● Podcast:  https://www.youtube.com/tailosivepodcasts● Merch:  https://teespring.com/stores/tailosive-merchandise● Twitch: https://www.twitch.tv/tailosivetech● Discord: https://discordapp.com/invite/tailosive● Twitter:  https://twitter.com/tailosivetech● Instagram:  https://instagram.com/tailosivetechIntro/Outro and Channel Art: https://twitter.com/BeatsDJMusic by: https://twitter.com/RandyVazquez"
"qFX3-wd1a-k","How EVERY throw away villain acts when the MC needs to be power scaled.","2020-12-07T05:27:40Z","UCI1XS_GkLGDOgf8YLaaXNRA","CalebCity","23","20.10.12","[none]","1904614","208637","1278","14331","https://i.ytimg.com/vi/qFX3-wd1a-k/default.jpg","False","False","Oh he looks weakMusicOddwin - 19"
"GrSHhCjnsEQ","This is uncomfortable for me to talk about, but we should talk.","2020-12-07T17:08:27Z","UCm3OUO3lGimpxtg6bS72f_g","Defranco Does","22","20.10.12","Defranco|Philip Defranco|Philip Defranco opens up|Philip Defranco show|pds","273108","42978","469","3907","https://i.ytimg.com/vi/GrSHhCjnsEQ/default.jpg","False","False","I didn't start the video with a mission but it ended up going to a vulnerable place for me. Also I'm not going to be perfect in explaining this but I needed to get this off my chest so I and maybe you feel a little less lonely with something you're struggling with."
"TSbsI3-PdC8","Shaqir O'Neal Day In The Life | Inside Shaq's INSANE Atlanta Mansion!! The O'Neals are COMEDY!","2020-12-07T20:24:58Z","UC_zgOsTPdML6tol9hLYh4fQ","Ballislife","17","20.10.12","shaqir o'neal|shaqir|o'neal|day in the life|ballislife|high school|basketball|highlights|shaq|shaquille o'neal|shaquille","393511","12982","146","886","https://i.ytimg.com/vi/TSbsI3-PdC8/default.jpg","False","False","We got to spend a day with Shaqir O'Neal at his insane Atlanta mansion where we also got a few surprises from Shaq himself! Hope you guys enjoy this one as much as we enjoyed our time with the O'Neal boys!-------------------------------------------------------------------------------------------------If You Love Our Content, You’ll Love Our Brand, Shop With us:-------------------------------------------------------------------------------------------------Shop: http://bit.ly/2jxxecU---------------------------------------------------------------------------Follow Us On Social!---------------------------------INSTAGRAM: http://bit.ly/2jZYaAjTwitter: http://bit.ly/2jWBBdEFacebook: http://bit.ly/2kTRHW5--------------------------------------------------Check Out Our Other Channels:--------------------------------------------------Main Channel: http://bit.ly/2jZTNWdBIL 2.0: http://bit.ly/2kiyjlYEastCoast Highlights: http://bit.ly/2ktrhNfWestCoast Highlights: http://bit.ly/2kiwPYDMidWest Highlights: http://bit.ly/2jWClPYThe South Highlights: http://bit.ly/2jWVQrp-------------------------------------------------------------------------------------------------"
"du-DxOGIM7Y","HEADING TO THE HOSPITAL TO GIVE BIRTH TO TREU ‼️💕 ( VLOGMAS DAY 6❤️🎄)","2020-12-08T04:35:21Z","UCPCa-gpPNnJj0QhxY5nSYEg","Senia Marie","22","20.10.12","[none]","126419","11350","88","671","https://i.ytimg.com/vi/du-DxOGIM7Y/default.jpg","False","False","HAY BABIES! SO WE'RE EXCITED TO SAY THAT WE ARE CURRENTLY IN THE HOSPITAL GETTING READY FOR OUR BUNDLE OF JOY ! I DON'T WANT TO SAY MUCH BUT THE NEXT TIME YOU GUYS SEE US SHE'LL BE HERE 💕💕‼️"
"qIUb3bjh42Y","Pringles Update: Last Week Tonight with John Oliver (Web Exclusive)","2020-12-07T04:00:05Z","UC3XTzVzaHQEd30rQbuvCtTQ","LastWeekTonight","24","20.10.12","[none]","4131052","178762","3558","8829","https://i.ytimg.com/vi/qIUb3bjh42Y/default.jpg","False","False","With the help of viewers at home, John tries to get to the bottom of an important mystery.Connect with Last Week Tonight online... Subscribe to the Last Week Tonight YouTube channel for more almost news as it almost happens: www.youtube.com/lastweektonight Find Last Week Tonight on Facebook like your mom would: www.facebook.com/lastweektonight Follow us on Twitter for news about jokes and jokes about news: www.twitter.com/lastweektonight Visit our official site for all that other stuff at once: www.hbo.com/lastweektonight"
"xGo_2-XtA6I","Your Broken Hero - A Letter To Ashley [Official Music Video]","2020-12-07T18:00:09Z","UCAz1x4ydc-WPcoKPfnjsHnQ","Matt Cutshall","23","20.10.12","[none]","399891","42119","340","5174","https://i.ytimg.com/vi/xGo_2-XtA6I/default.jpg","False","False","Follow me on Instagram! https://instagram.com/mattcutshallEmo's Not Dead merch available here https://emosnotdead.com/Directed by: Aaron Johnson & Matt Cutshall Produced By Catcher Creativehttps://www.catchercreative.com/Follow the emo castChris Carrabba https://instagram.com/dashboardconfessionalKyra Green https://instagram.com/kyra212greenKatie Blackburn https://instagram.com/_katieblackburnJanelle Gray https://instagram.com/janelleallisa#EmosNotDead"
"JvexZz-HJkA","THE TRILOGY CONTINUES","2020-12-07T17:01:24Z","UCoNPsL8j28yfKRu6e7YUhPA","Kid Cudi","24","20.10.12","kid cudi|scott mescudi|man on the moon|man on the moon 3|man on the moon iii|kid cudi the chosen|the chosen|cudi|cudder|moon man|WZRD","298897","29357","124","2317","https://i.ytimg.com/vi/JvexZz-HJkA/default.jpg","False","False","THE TRILOGY CONTINUES...Pre-Order here: https://kidcudi.lnk.to/MOTM3Kid Cudi's Artist Spotlight Story will be available 12/11 on YouTube Music.►Subscribe to Kid Cudi on YouTube: https://KidCudi.lnk.to/subscribeID►Exclusive merch: https://shop.kidcudi.com►Follow Kid Cudi:https://twitter.com/kidcudihttps://instagram.com/kidcudihttps://facebook.com/kidcudihttps://snapchat.com/add/kidcudihttps://www.kidcudi.com#kidcudi #MOTMIII"
"vbrYmSsgPTw","Gwen Stefani - Let Me Reintroduce Myself (Official Lyric Video)","2020-12-07T17:00:48Z","UCX6mObpqyrtKMdxvCV9YkGg","Gwen Stefani","10","20.10.12","[none]","340376","15627","757","1814","https://i.ytimg.com/vi/vbrYmSsgPTw/default.jpg","False","False","Listen now to Let Me Reintroduce Myself: https://smarturl.it/ReintroduceGwenFollow Gwen:Instagram: https://www.instagram.com/gwenstefaniTwitter: https://twitter.com/gwenstefaniFacebook: https://www.facebook.com/gwenstefani#GwenStefani #LetMeReintroduceMyself"
