video_id,title,publishedAt,channelId,channelTitle,categoryId,trending_date,tags,view_count,likes,dislikes,comment_count,thumbnail_link,comments_disabled,ratings_disabled,description
"mp3V9tuPf_0","2020 YouTube Streamy Awards","2020-12-13T02:00:11Z","UCRJujaKIoPjmPXB8UmL7dvQ","Streamy Awards","1","20.14.12","2020 YouTube Streamy Awards|Streamys|Streamy Awards|2020 Streamys|10th Annual|Creator of the Year|Show of the Year|Breakout Creator|Gamer|Creator Honors|Trixie and Katya|Doja Cat|Say So|Lewis Capaldi|Before You Go|Tones and I|Dance Monkey|Lilly Singh|Marques Brownlee|Patrick Starrr|2020 YouTube|YouTube Rewind|YouTube Rewind 2020|Rewind 2020|Streamy|2020 Awards Shows|Online Awards|Awards|Creators|YouTube|YouTube Streamy Awards|YouTube Originals","2341530","63807","13444","19891","https://i.ytimg.com/vi/mp3V9tuPf_0/default.jpg","False","False","Join hosts Trixie and Katya for the 2020 YouTube Streamy Awards as we honor the best of our creator community. Watch it free December 12 with ads on YouTube or sign up for YouTube Premium to watch exclusive Q&As with Streamys creators that you won't find anywhere else. Learn more at https://support.google.com/youtube/answer/6358146 Check out YouTube Premium at: https://www.youtube.com/premium/originals See if Premium is available in your country at https://support.google.com/youtube/answer/6307365Featuring personal creator-to-creator tributes from Juanpa Zurita, Kyle Exum, Lilly Singh, Liza Koshy, Marques Brownlee, NikkieTutorials, and Patrick Starrr, exciting musical performances from Doja Cat, Lewis Capaldi, and Tones and I, and of course, revealing the 2020 Streamys Creator of the Year. With appearances from Bretman Rock, Brittany Broski, Camila Loures, Casey Neistat, Charli D'Amelio, David Dobrik, Dixie D'Amelio, Dream, James Charles, LaurDIY, MrBeast, Mark Rober, MatPat and Stephanie Patrick from The Game Theorists, Rebecca Zamolo, Shalom Blac, Tabitha Brown, and ZHC. #streamysSubscribe so you don’t miss out: https://www.youtube.com/streamys?sub_confirmation=1*The views and opinions expressed in this program are those of the participants and do not necessarily reflect the official policy or position of any YouTube/Google entity."
"g6ClKQ7VWsQ","Luring My Friends To Their Death in Proximity Chat Among Us | CORPSE 666IQ IMPOSTER PLAYS","2020-12-12T22:05:23Z","UCFNTq9XKHDNy_1-2lL0kqCg","Corpse Husband","24","20.14.12","Among Us|CORPSE Among Us|among us corpse|funny among us|best among us|among us funny moments|among us gameplay|among us imposter|among us IQ|among us best|jacksepticeye among us|disguised toast among us|sykkuno among us|valkyrae among us|james charles among us|proximity chat among us|bretman|bretman among us|corpse imposter|corpse choke me|lilypichu among us","2585173","233175","1743","12553","https://i.ytimg.com/vi/g6ClKQ7VWsQ/default.jpg","False","False","Proximity chat allows you to talk in game, but only when other players are nearbyTWITTER: https://twitter.com/Corpse_HusbandINSTAGRAM: https://www.instagram.com/Corpse_Husband/Thumbnail by: https://twitter.com/chryseuswitchEdited by: https://twitter.com/Otriggad"
"HafMOd7uBRg","LaMelo Ball NBA Debut Highlights vs Raptors | December 12, 2020 NBA Preseason","2020-12-13T02:19:37Z","UCqQo7ewe87aYAe7ub5UqXMw","House of Highlights","17","20.14.12","lamelo ball|nba|lamelo nba highlights|lamelo ball nba debut|lamelo ball nba debut highlights|hornets vs raptors 2020|nba preseason|nba highlights|basketball|long full game highlights|nba full game highlights|charlotte hornets|toronto raptors|hornets vs raptors|hornets vs raptors preseason","564562","7883","340","1487","https://i.ytimg.com/vi/HafMOd7uBRg/default.jpg","False","False","Toronto Raptors vs Charlotte Hornets - Full Game Highlights | December 12, 2020 | 2020 NBA Preseason📌 SHOP OUR NBA MERCH COLLAB: https://hoh.world📌 Follow our Instagram: https://www.instagram.com/houseofhighlights/📌 Follow our TikTok: https://www.tiktok.com/@houseofhighlights📌 Follow our Facebook: https://www.facebook.com/houseofhighlights1📌 Follow our Twitter: https://twitter.com/HoHighlights📌 SUBSCRIBE, LIKE & COMMENT for MORE!------------------▶️ WATCH HOH Originals: https://www.youtube.com/playlist?list=PL_HppZy-GwSzf1Ot-A4MIJTfqF9mm0WBT▶️ WATCH TTW Podcasts: https://www.youtube.com/playlist?list=PL_HppZy-GwSwGkOvnE3gUxvlIBEl3Yo-5▶️ WATCH Instagram Moments: https://www.youtube.com/playlist?list=PL_HppZy-GwSz3ngOnW-KrExOScABfYfTi▶️ WATCH 2019-20 Players Highlights: https://www.youtube.com/playlist?list=PL_HppZy-GwSzO5avP_DTAgtHuVFSsSrRr▶️ WATCH 2019-20 Full Game Highlights: https://www.youtube.com/playlist?list=PL_HppZy-GwSzraIU44yYfSb3PW7Q8V6mh▶️ WATCH 2019-20 Best of NBA: https://www.youtube.com/playlist?list=PL_HppZy-GwSznNzog1_eJt7Y-Z4Uci_22#HouseofHighlights #NBA"
"QCO0tXeFFEo","HIGHLIGHTS | Anthony Joshua vs. Kubrat Pulev","2020-12-13T00:34:56Z","UCurvRE5fGcdUgCYWgh-BDsg","DAZN Boxing","17","20.14.12","dazn|boxing|highlights|full fight|ko|knockout|ryan garcia|top 10|canelo|anthony joshua|ggg|haney|joshua pulev|heavyweight|free stream|sky sports","551194","10579","541","2571","https://i.ytimg.com/vi/QCO0tXeFFEo/default.jpg","False","False","December 12, 2020 -- Anthony Joshua vs. Kubrat Pulev, from the SSE Arena, Wembley in London, United Kingdom.Subscribe to our YouTube channel 👉  http://bit.ly/DAZNBoxingYouTubeDownload the DAZN app now 👉  http://bit.ly/DAZN_YTFollow DAZN Boxing On Social Media 👇Twitter: https://www.twitter.com/DAZNBoxingInstagram: https://www.instagram.com/DAZNBoxingFacebook: https://www.facebook.com/DAZN"
"ljarqkLfqDQ","Dream SMP But I Troll Skeppy","2020-12-12T23:00:11Z","UCFAiFyGs6oDiF1Nf-rRJpZA","Technoblade","20","20.14.12","Minecraft|Technoblade|Technothepig|Skeppy|Dream SMP|DreamSMP|Technoblade Dream SMP|Skeppy Dream SMP","2094826","256762","1300","11775","https://i.ytimg.com/vi/ljarqkLfqDQ/default.jpg","False","False","[this was not live-streamed, this is video original. now you gotta give me ad revenue to get IMPORTANT LORE HAHAHAHAHAA]SKEPPY: https://www.youtube.com/channel/UCzMjRlKVO9XIqH_crIFpi6wAWESAMDUDE (BUILT THE MAZE): https://www.twitch.tv/awesamdude--------------------------------become a CHANNEL MEMBER here: https://www.youtube.com/channel/UCFAiFyGs6oDiF1Nf-rRJpZA/joinother YT channel (go subscribe): https://www.youtube.com/channel/UCV--8wtuyGo3vMtIdeq4j3wfollow me on twitter too: https://twitter.com/Technothepigmusic:State of Play by Christoffer Moe Ditlevsen Blue Monkey by OTEhttps://www.epidemicsound.com/referral/m3rfi7/"
"ZhbJNqib1Kw","RAPTORS at HORNETS | FULL GAME HIGHLIGHTS | December 12, 2020","2020-12-13T02:32:07Z","UCWJ2lWNubArHWmf3FIHbfcQ","NBA","17","20.14.12","NBA|G League|Basketball|game-0012000006|Pass|Assist|Dunk|Jump Shot|Steal|Rebound|Offense|Defense|Three|Three-Pointer|Triple|Mid-Range|Jumper|Highlight|Highlights|NBA Preseason|Preseason|Full Game Highlights|Full Game Recap|Hornets|Charlotte Hornets|Charlotte|Toronto|Toronto Raptors|Raptors","2128379","20973","662","3391","https://i.ytimg.com/vi/ZhbJNqib1Kw/default.jpg","False","False","RAPTORS at HORNETS | FULL GAME HIGHLIGHTS | December 12, 2020The Toronto Raptors closed the game on a 20-8 run to defeat the Charlotte Hornets, 111-100, and earn their first win of the #NBAPreseason. Matt Thomas scored a game-high 16 PTS (4 3PM)  for the Raptors off the bench, and OG Anunoby netted 11 PTS and 5 REB. No. 3 pick LaMelo Ball dazzled in his Hornets preseason debut, tallying 10 REB and 4 AST. Miles Bridges led the Hornets in scoring with 12 PTS and Gordon Hayward scored 11 PTS in his Charlotte preseason debut.Next Game:Toronto Raptors at Charlotte Hornets – Dec. 14 at 7pm/et on NBA League PassSubscribe to the NBA: https://on.nba.com/2JX5gSN Full Game Highlights Playlist: https://on.nba.com/2rjGMgeFor news, stories, highlights and more, go to our official website at https://nba_webonly.app.link/nbasiteGet NBA LEAGUE PASS: https://nba.app.link/nbaleaguepass5"
"76XXN4-WOCE","Game Theory: FNAF, The New Breed","2020-12-12T20:05:15Z","UCo_IB5145EVNcf8hw1Kku7w","The Game Theorists","20","20.14.12","fnaf|five nights at freddy's|fnaf fan game|fnaf fan games|five nights at candy's|the joy of creation|jolly|five nights at freddys|fnaf security breach|five nights at freddys security breach|security breach|fnaf security breach trailer|five nights at freddys security breach trailer|fnaf trailer|new fnaf game|fnaf theory|fnaf ar|fnaf help wanted|fnaf vr|fnaf sister location|sister location|fnaf animation|game theorists|game theory|matpat|disney","1878520","168242","1827","15345","https://i.ytimg.com/vi/76XXN4-WOCE/default.jpg","False","False","Get our NEW Holiday & Official FNAF Merch! ► https://bit.ly/2UkxCv0  Don't forget to Subscribe to Food Theory! ► https://bit.ly/2CdCooV  The original Five Nights at Freddy's spawned many sequels and sister games. Over the years I've played them all and through that stumbled upon the phenomena that is FNAF fan games. Games so loved by FNAF fans that those games have ALSO created their own universes - some linked to the original game and some all their own. These games have gotten so big that it's a wonder they haven't been struck down by the copyright powers that be - and there is a VERY specific reason they haven't. You see, Scott Cawthon has learned one thing that most game companies never have and likely never will - community.Find the original game here ► Five Nights at Freddy's -  http://www.scottgames.com/  Find out more about the fan games here ►Five Nights at Candy's 4 - https://gamejolt.com/@Emilmacko/gamesPopgoes Evergreen - https://gamejolt.com/p/popgoes-evergreen-n5mssuvyOne Night at Flumpty's - https://gamejolt.com/games/onaf/124881The Joy of Creation - https://gamejolt.com/games/tjocsm/139218FNaF Plus - https://twitter.com/FNAFPLUSNeed Royalty Free Music for your Content? Try Epidemic Sound. Get A 30 Day Free Trial! ► http://share.epidemicsound.com/MatPat#FNAF #FiveNightsAtFreddys #FNAFFanGame #FNAFSecurityBreach #FNAFTrailer #SecurityBreach #SecurityBreachTrailer #NewFNAF #FNAFTheory #MatPat #GameTheory #JoyofCreationMore THEORIES: FNAF, The FINAL Timeline ►► https://bit.ly/2MlHYFeFNAF, The Monster We MISSED! ►► https://youtu.be/_ygN8HLCaJgFNAF This Theory Changes Everything ► https://bit.ly/2JUQUn6FNAF, You Were Meant To Lose ► https://youtu.be/7bn8hM9k0b0FNAF 6, No More Secrets ► https://bit.ly/2LVCq4u   Credits:Writers: Matthew Patrick and JustinEditors: Tyler Mascola, Pedro Freitas, Alex Sedge Sedgwick, and Dan Cybert SeibertAssistant Editor: AlyssaBeCrazySound Editor: Yosi Berman"
"EJAsuu0bkRg","Daddy Yankee - 2K20 Live Parte 2","2020-12-13T01:00:26Z","UC9TO_oo4c_LrOiKNaY6aysA","Daddy Yankee","10","20.14.12","daddy yankee en vivo|con calma|dura|reggaeton hits|lo mejor de daddy yankee|con calma remix|con calma challenge|daddy yankee en gira|concalmadegira|adictiva|dy adictiva|anuel adictiva|dy en vivo|como te llamas baby|daddy yankee gasolina|daddy y yankee|con calma worldwide|desde que te vi supe que eras pa mi|dy2k20|daddy yankee livestream|daddy yankee 2k20|daddy yankee live|daddy yankee concert|daddy yankee live performance|dy2k20 live","2210343","127178","1661","6363","https://i.ytimg.com/vi/EJAsuu0bkRg/default.jpg","False","False","Un año después de su mayor éxito, el legendario artista urbano e ícono global, Daddy Yankee, arranca la temporada navideña brindándole una nueva experiencias a sus fanáticos alrededor del mundo con el lanzamiento de “DY2K20”, una versión digital de sus inolvidables 12 conciertos todo vendido, “Con Calma Pal’ Choli”.  “DY2K20”, que es la última serie de conciertos antes de la pandemia, estará disponible en YouTube y todas las plataformas de música digitales con imágenes nunca antes vistas. Este especial se lanza en tres partes, la primera estará disponible este viernes, 4 de diciembre, mientras que la segunda y tercera parte estarán disponibles el 12 y 19 de diciembre, respectivamente. “Este año ha sido difícil para todos nosotros y qué mejor forma de comenzar la temporada navideña, sino es recordando y celebrando el aniversario de uno de mis mayores logros como artista y espero que los llene a todos de mucha alegría”, expresó Daddy Yankee. En diciembre 2019, “Con Calma Pal’ Choli” se convirtió en la única serie de conciertos en romper récords por ser la más taquillera jamás realizada en Puerto Rico, con más de 170,000 boletos vendidos en un mes. Producido por el promotor de conciertos puertorriqueño Rafael Pina, el espectáculo brindó una experiencia única a todos sus fanáticos en Puerto Rico utilizando la más alta tecnología y llevándolos a través de un viaje musical interpretando los mayores éxitos de sus casi 30 años de carrera. Yankee también contó con la participación de invitados especiales durante cada uno de los espectáculos, incluyendo a artistas tales como Luis Fonsi, Wisin & Yandel y Nicky Jam, entre otros.Se alentará a los espectadores [o fanáticos] a donar lo que puedan a Feeding America a través de la plataforma de YouTube. Feeding America, la organización nacional más grande que lucha contra el hambre, estima que 50 millones de personas en Estados Unidos podrían sufrir una crisis alimentaria como resultado de la pandemia este año. Daddy Yankee apoya a la organización y es miembro de su Consejo de Entretenimiento.Escucha 2K20 en tu plataforma digital favorita: https://ingroov.es/2k20-pt-1Suscríbete al canal: Subscribe to the channel: https://goo.gl/yypZyaMás vídeos de DY:De Vuelta Pa La Vuelta: https://www.youtube.com/watch?v=VibGLc41UvQDon Don: https://youtu.be/bZMPz5lzb2UCon Calma: https://youtu.be/DiItGE3eAyQQue Tire Pa' 'Lante: https://youtu.be/fAgvmh1jaCEFollow DY:Facebook-http://goo.gl/QYZ53a | Twitter-http://goo.gl/AzaR8o Instagram-http://goo.gl/a6F7gz | www.daddyyankee.com#DaddyYankee #DY2K20"
"shbDX0u0SYI","Spookley And The Christmas Kittens Is A Confusing Trainwreck","2020-12-12T18:00:09Z","UCSUf5_EPEfl4zlBKZHkZdmw","Danny Gonzalez","23","20.14.12","danny gonzalez|funny|commentary|comedy|react|reaction|reacting|awful|humor","1036810","95169","613","8346","https://i.ytimg.com/vi/shbDX0u0SYI/default.jpg","False","False","Thanks to ExpressVPN for sponsoring this video. Go to https://expressvpn.com/dannygonzalez and find out how you can get 3 months free.Support MeMERCH ► http://dannygonzalez.storeFollow MeINSTAGRAM ► https://www.instagram.com/dannygonzalez/TWITTER ► https://twitter.com/dannygonzalezSECOND CHANNEL ► https://www.youtube.com/c/2Danny2FuriousSPOTIFY ► https://open.spotify.com/artist/6pDkmNhHCLh7YEb3sXceOs?si=8ZpMgF41SoufOS1UZ4vbkgWHY DO I CALL MY FANS GREG?Greg is the strongest family on the internet, we're the fastest growing channel on Youtube, and we make fire content. So, instead of making up some pun using my name and calling my fans that, I decided to use a different name entirely. A name so strong, haters tremble when it is spoken. WE ARE GREG. AND WE ARE TAKING OVER THE INTERNET. And all you have to do to join is hit subscribe and turn on notifications. #dannygonzalez"
"br2l_vzmuDY","CLIPPERS at LAKERS | FULL GAME HIGHLIGHTS | December 11, 2020","2020-12-12T05:35:24Z","UCWJ2lWNubArHWmf3FIHbfcQ","NBA","17","20.14.12","NBA|G League|Basketball|game-0012000004|Clippers|LA Clippers|Los Angeles|Battle Of Los Angeles|Lakers|LA Lakers|Los Angeles Lakers|Pass|Assist|Dunk|Jump Shot|Steal|Rebound|Highlight|Highlights|Full Game Highlights|Full Game Recap","3844297","31916","2592","5535","https://i.ytimg.com/vi/br2l_vzmuDY/default.jpg","False","False","CLIPPERS at LAKERS | FULL GAME HIGHLIGHTS | December 11, 2020Montrezl Harrell and Talen Horton-Tucker starred for the defending champion Los Angeles Lakers as they defeated the LA Clippers, 87-81, in their #NBAPreseason opener. Harrell (13 PTS, 12 REB, 2 STL) recorded a double-double in his Lakers debut, while Horton-Tucker led all scorers with a game-high 19 PTS to go along with 9 REB and 4 AST. Kyle Kuzma added 18 PTS and 5 AST in the Lakers' victory. Paul George scored a team-high 10 PTS for the Clippers, and Luke Kennard and Serge Ibaka added 7 PTS and 6 PTS, respectively, in their first game as Clippers.Next Game:LA Clippers at Los Angeles Lakers – Dec. 13 at 8:30pm/et on ESPNThe 2020-21 NBA Season Starts Christmas Week with Games Beginning Tuesday, December 22. #KiaTipOff20Subscribe to the NBA: https://on.nba.com/2JX5gSN Full Game Highlights Playlist: https://on.nba.com/2rjGMgeFor news, stories, highlights and more, go to our official website at https://nba_webonly.app.link/nbasiteGet NBA LEAGUE PASS: https://nba.app.link/nbaleaguepass5"
"QMpZTzqNHNo","Dream Wins Gaming | 2020 YouTube Streamy Awards","2020-12-13T02:52:20Z","UCRJujaKIoPjmPXB8UmL7dvQ","Streamy Awards","24","20.14.12","Dream|Gaming|LaurDIY|2020 YouTube Streamy Awards|Streamys|Streamy Awards|2020 Streamys|10th Annual|2020 YouTube|YouTube Rewind|YouTube Rewind 2020|Rewind 2020|Streamy|2020 Awards Shows|Online Awards|Awards Shows|Awards|YouTube Creators|Creators|YouTube|Creator Community|YouTube Streamy Awards|YouTube Premiere|YouTube Originals|YTO","377803","38112","807","3442","https://i.ytimg.com/vi/QMpZTzqNHNo/default.jpg","False","False","Dream wins the Gaming award, presented by LaurDIY.#streamys #dream #laurdiyThe Streamy Awards honors excellence in online video and the creators behind it. Marking its 10th anniversary in 2020, the annual event is the foremost recognition by which online creators and their work is lauded.Stay Connected @streamysYouTube https://www.youtube.com/streamysTwitter https://twitter.com/streamysInstagram https://www.instagram.com/streamysFacebook https://www.facebook.com/streamysSnapchat https://www.snapchat.com/add/streamysWebsite: https://www.streamys.org"
"Xa0Swz3X1cQ","Wilbur Soot - Your New Boyfriend (OFFICIAL VIDEO)","2020-12-11T18:00:10Z","UC1n_PfsVqxllCcnMPlxBIjw","Wilbur Soot","10","20.14.12","wilbur soot|live|wilbur live|wilbur plays","6621377","619437","7765","80937","https://i.ytimg.com/vi/Xa0Swz3X1cQ/default.jpg","False","False","Spotify: https://open.spotify.com/track/4vLBnQtece15fFhqWxZvJP?si=qthZHi4pRHSwGsUMLQjWtwFollow me:https://twitter.com/WilburSoot                    https://www.instagram.com/wilbursoot/E-Girl: https://twitter.com/chiffonhahaMerch: https://bit.ly/WilburSootMerchEdited: me and https://www.instagram.com/elodie.gif/Music used:Guitar, Vocals, Drums, Piano by Wilbur SootBacking Vocals: ChevyBass by Dmitry LisenkoTrumpets by Isaac BeerProduced by Wilbur Soot"
"xxn8bUcjukU","The Try Guys Bake Brownies Without A Recipe","2020-12-12T16:00:14Z","UCpi8TJfiA4lKGkaXs__YdBA","The Try Guys","23","20.14.12","try guys|keith|ned|zach|eugene|habersberger|fulmer|kornfeld|yang|buzzfeedvideo|buzzfeed|ariel|ned & ariel|comedy|education|funny|try|learn|fail|experiment|test|tryceratops|without a recipe|cooking|challenge|cooking challenge|chef|chef show|amazing cooking|how to cook|cake|baking cakes|best|worst|winner|loser|brownies|brownie recipe|best brownie|how to make brownies|baking brownies|how to bake brownies|baking|baking show|the great british bake off|food show","2062377","124738","1117","9383","https://i.ytimg.com/vi/xxn8bUcjukU/default.jpg","False","False","Let's bake! Enjoy another chaos and joy filled episode of Without A Recipe! Who's special brownies do you think will be the biggest hit with the judges? Get tickets to the Virtual World Premiere of Behind The Try today on https://tryguys.com/movie Are you a business looking to work with The Try Guys? Reach out to us at 2ndtrybusiness@gmail.com for all business inquiries! 🎧THE TRYPOD 🎧: watch our new podcast at https://youtube.com/trypod or listen at https://tryguys.com/podcast📘THE HIDDEN POWER OF F*CKING UP 📘: check out our new book at https://tryguys.com/bookGet your official Try Guys color hoodies and phone cases at https://tryguys.com/collections/color-line 💙❤️💚💜Support us! http://www.patreon.com/tryguys. Join our Patreon to get videos a day early, plus, live streams, chatrooms, BTS footage, exclusive merchandise, and more!SUBSCRIBE TO AND FOLLOW THE TRY GUYS http://www.youtube.com/c/tryguyshttp://www.facebook.com/tryguys  http://www.twitter.com/tryguyshttps://www.instagram.com/tryguysFOLLOW THE GUYShttp://www.Instagram.com/keithhabshttp://www.Instagram.com/nedfulmerhttp://www.Instagram.com/korndiddyhttp://www.instagram.com/eugeneleeyang http://www.twitter.com/keithhabshttp://www.twitter.com/nedfulmer http://www.twitter.com/korndiddyhttp://www.twitter.com/eugeneleeyang THE TRY GUYSThe #TryGuys is the flagship channel of 2ND TRY, LLC. Tune in twice a week for shows from Keith, Ned, Zach and Eugene, the creators and stars of The Try Guys.FEATURINGRosanna Pansino -- Baker & YouTuberCheck out all of her amazing cooking content online!Website: http://www.RosannaPansino.comYouTube: @RosannaPansino https://www.youtube.com/user/RosannaPansinoInstagram: @rosannapansino http://instagram.com/rosannapansinoTwitter: @rosannapansino  http://twitter.com/rosannapansinoKwesi JamesIG, Twitter: @kwesi_jamesJen Yee - Baker at KonbiIG: @jen.yeeeIG for Konbi: @konbihttps://www.konbila.com/EDITED BYYB Chang @xoyboxMUSICLicensed from AudioNetworkSFXLicensed from AudioblocksVIDEOLicensed from VideoblocksOfficial Try Guys Photos By Mandee Johnson Photography | @mandeephotoEXTERNAL CREWDirected by Rachel Ann ColeProduced by Rachel Ann Cole Produced by Nick RufcaAssociate Producer: Alexandria HerringAssistant Production Coordinator: Sam JohnsonAssistant Production Coordinator: Jonathan KirkDirector of Photography: Phil JacksonCamera Operator: Mike Maliwang Camera Operator: Tanisha MorenoCamera Operator: Delaney Teichler1st AC: Iliana Ipes 1st AC: Natalie AbrahamDIT/Assistant: Editor Will WitwerGaffer: Tim DavisKey Grip: Donato BragagnoloSound Mixer: Kevin BazellBoom Op: Peter BeerBoom Op: David ConanProduction Designer: Susannah HoneyShopper: Megan BrasfieldFood Stylist: Niki FordArt PA: Emily ZiskoArt PA: Alex MerkleProduction Assistant: Edgar Castillo Still Photographer: JD RenesEditor: YB ChangEditor: Rob SidelIllustrator: Jack Sjogren2nd Try, LLC STAFFExecutive Producer - Keith HabersbergerExecutive Producer - Ned FulmerExecutive Producer - Zach KornfeldExecutive Producer - Eugene Lee YangProducer - Rachel Ann ColeProducer - Nick RufcaAssociate Producer - Alexandria HerringEditor - Devlin McCluskeyEditor - YB ChangEditor - Elliot DickerhoofAssistant Editor - Will WitwerPodcast Producer - Miles BonsignoreCamera Operator/Assistant Production Coordinator - Jonathan KirkSound Operator Assistant Production Coordinator - Sam JohnsonContent Strategist - Kaylin BurkeSpecial Thanks To! Thanks to all of our Gold Level Patrons! AJ S., Amy Fleming, Ana Camba, Cat Hicks, Elisa Proust, Emma Godfrey, Erica Rao, Jared Aarons, Kelsey Bock, Kourtney Wong, Loretta Wen, Matthew Tadros, Miha, Paulus, Sarah Waxman, Traci Lew, Wendy Tran, Lily"
"Huh2A8x8IxQ","Best Armored Vehicle Wins $10,000","2020-12-12T22:03:22Z","UCau_n8AK1uk3Ys5bEnRAoqg","JustDustin","23","20.14.12","MTG|MTG Arena|MTG Cards|Magic Arena|Magic The Gathering|Magic The Gathering Arena|Magic The Gathering Online|Magic The Gathering Cards","878360","34793","690","2000","https://i.ytimg.com/vi/Huh2A8x8IxQ/default.jpg","False","False","Play MTG Arena for free at http://magic.wizards.com/mtgarenaThanks to Magic: The Gathering for sponsoring a portion of this video.click this link or stay curious forever... https://www.youtube.com/watch?v=69C-jCy6QwA&t=32s----------------------------------------------------------------follow me ;)• Facebook - https://www.facebook.com/justdustinn/• Twitter - https://twitter.com/justdustin•  Instagram - https://www.instagram.com/justdustin•  TikTok - https://www.tiktok.com/@justdustin--------------------------------------------------------------------Become a Join Member To Get Special Perks and Badges:https://www.youtube.com/channel/UCau_n8AK1uk3Ys5bEnRAoqg/join"
"PKFA_iJd0kE","NUGGETS at WARRIORS | FULL GAME HIGHLIGHTS | December 12, 2020","2020-12-13T04:13:41Z","UCWJ2lWNubArHWmf3FIHbfcQ","NBA","17","20.14.12","NBA|G League|Basketball|game-0012000011|Pass|Assist|Dunk|Jump Shot|Steal|Rebound|Offense|Defense|Three|Three-Pointer|Triple|Mid-Range|Jumper|Highlight|Highlights|NBA Preseason|Preseason|Full Game Highlights|Full Game Recap|Warriors|Nuggets","2349549","28290","774","3252","https://i.ytimg.com/vi/PKFA_iJd0kE/default.jpg","False","False","NUGGETS at WARRIORS | FULL GAME HIGHLIGHTS | December 12, 2020The Golden State Warriors defeated the Denver Nuggets, 107-105 behind 10 PTS from Stephen Curry and a team-high 13 PTS from Kent Bazemore in his return to Golden State. In his Warriors #NBAPreseason debut, Kelly Oubre Jr. (10 PTS) was one of six Warriors players to finish the game in double-digits. Nikola Jokic recorded a dominant double-double for the Nuggets, tallying 26 PTS and 10 REB with 5 AST. Rookie Zeke Nnaji scored 7 PTS in his Nuggets preseason debut, and Gary Harris added 11 PTS for Denver. Next Games:Sacramento Kings at Golden State Warriors – Dec. 15 at 10pm/et on TNTPortland Trail Blazers at Denver Nuggets – Dec. 16 at 9pm/et on NBA League PassSubscribe to the NBA: https://on.nba.com/2JX5gSN Full Game Highlights Playlist: https://on.nba.com/2rjGMgeFor news, stories, highlights and more, go to our official website at https://nba_webonly.app.link/nbasiteGet NBA LEAGUE PASS: https://nba.app.link/nbaleaguepass5"
