video_id,title,publishedAt,channelId,channelTitle,categoryId,trending_date,tags,view_count,likes,dislikes,comment_count,thumbnail_link,comments_disabled,ratings_disabled,description
"rHHbTm3Npfk","A Recipe for Seduction | Premieres December 13th | Presented by Kentucky Fried Chicken | Lifetime","2020-12-07T14:08:38Z","UCpYF_3dMxbTukeCG2GsgPbA","Lifetime","24","20.14.12","lifetime|lifetime shows|lifetime tv|lifetime channel|mylifetime|dance moms|lifetime dance moms|lifetime full episodes|lifetime movies|lifetime original movies|lifetime movie|watch lifetime movies|Wonderful Lifetime|holiday movies on Lifetime|movies on Lifetime|lifetime shows 2020|lifetime tv movies|lifetime channel full movies|A Recipe for Seduction|Kentucky Fried Chicken|handsome chef|Harland Sanders|series of events|Seduction|Fried Chicken|Recipe","1616686","14028","1737","3689","https://i.ytimg.com/vi/rHHbTm3Npfk/default.jpg","False","False","Premieres Sunday, December 13th at 12pm ET on Lifetime! Presented by KFC and Lifetime. As the holidays draw near, a young heiress contends with the affections of a suitor handpicked by her mother. When the handsome chef, Harland Sanders, arrives with his secret fried chicken recipe and a dream, he sets in motion a series of events that unravels the mother’s devious plans. Will our plucky heiress escape to her wintry happily ever after with Harland at her side, or will she cave to the demands of family and duty? #LifetimeMovies #ARecipeforSeductionWatch Lifetime Movies anytime with the Lifetime Movie Club app:https://mylt.tv/LifetimeMovieClubFind out more about this and other Lifetime movies on our site:https://mylt.tv/LifetimeMovies                                                                                                                                                         Check out exclusive Lifetime content:Website - https://mylt.tv/myLifetimeFacebook - https://mylt.tv/facebookTwitter - https://mylt.tv/twitterLifetime® is a premier female-focused entertainment destination dedicated to providing viewers with a diverse selection of critically acclaimed and award-winning original movies, scripted dramas, and unscripted programming. A favorite and trusted network for women, we are continually building on our heritage by attracting top Hollywood talent and producing shows that are modern, sexy, exciting, daring, and provocative. Visit us at myLifetime.com for more info."
"KZ6yUrYYEBM","Washington Football Team vs. Steelers Week 13 Highlights | NFL 2020","2020-12-08T01:43:28Z","UCDVYQ4Zhbm3S2dlz7P1GBDg","NFL","17","20.14.12","NFL|Football|offense|defense|American Football|highlight|highlights|game|sport|play|plays|season|2020|touchdown|td|game highlights|week 13|best plays|top plays|washington football team|washington|was|steelers|pittsburgh|pit|washington steelers game highlights|washington highlights|steelers highlights|washington td|steelers td","2745995","34337","1427","9859","https://i.ytimg.com/vi/KZ6yUrYYEBM/default.jpg","False","False","The Washington Football Team takes on the Pittsburgh Steelers during Week 13 of the 2020 NFL season.Subscribe to NFL: http://j.mp/1L0bVBuCheck out our other channels:Para más contenido de la NFL en Español, suscríbete a https://www.youtube.com/nflenespanolNFL Fantasy Football https://www.youtube.com/nflfantasyfootballNFL Vault http://www.youtube.com/nflvaultNFL Network http://www.youtube.com/nflnetworkNFL Films http://www.youtube.com/nflfilmsNFL Rush http://www.youtube.com/nflrushNFL Play Football https://www.youtube.com/playfootballNFL Podcasts https://www.youtube.com/nflpodcasts#NFL #WashingtonFootballTeam #Steelers"
"aBTH6D0UL-Q","Shawn Mendes, Camila Cabello - The Christmas Song","2020-12-08T02:00:01Z","UC4-TgOSMJHn-LtY4zCzbQhw","ShawnMendesVEVO","10","20.14.12","Shawn|Mendes|Camila|Cabello|The|Christmas|Song|LP4-5|PS/|Island|Holiday","6090108","482725","6077","15181","https://i.ytimg.com/vi/aBTH6D0UL-Q/default.jpg","False","False","“Wonder” the album out nowListen now: https://Wonder.lnk.to/Albumhttps://www.feedingamerica.org/ways-to-giveFor every ten million streams of “The Christmas Song” by Shawn and Camila, during the period commencing December 5, 2020 and ending on December 31, 2020, $10,000 USD will be donated to Feeding America through The Shawn Mendes Foundation, a project of the Social Impact Fund, a registered 501(c)(3) organization, subject to a minimum donation of $100,000 USD.Follow Shawn MendesInstagram | https://www.instagram.com/shawnmendes/Twitter | https://twitter.com/ShawnMendesFacebook | https://www.facebook.com/ShawnMendesO...Snap | https://www.snapchat.com/add/shawnmen...TikTok | https://www.tiktok.com/@shawnmendesWebsite | http://www.shawnmendesofficial.com/Follow Camila CabelloInstagram | https://www.instagram.com/camila_cabelloTwitter | https://twitter.com/camila_cabelloFacebook | https://www.facebook.com/camilacabelloWebsite | https://www.camilacabello.comMusic video by Shawn Mendes, Camila Cabello performing The Christmas Song. © 2020 Island Records, a division of UMG Recordings, Inc."
"the81FQoAUI","What The Coronavirus Vaccine Does To Your Body","2020-12-08T14:34:16Z","UCC552Sd-3nyi_tk2BudLUzA","AsapSCIENCE","27","20.14.12","asapscience|asap science|asapscience youtube|asap science youtube|asap|science|fun science|coronavirus|coronavirus vaccine|COVID19|COVID19 Vaccine|Pfizer vaccine|mRNA vaccine|how coronavirus vaccine works|what coronavirus vaccine is approved|what COVID19 vaccines do|is covid19 vaccine safe|vaccine safe","459169","24647","1616","6409","https://i.ytimg.com/vi/the81FQoAUI/default.jpg","False","False","With the first person receiving a COVID19 vaccine from Pfizer in the UK - what does it even do to your body? And are mRNA vaccines safe?Watch our Vaccine Podcast: https://youtu.be/22XsYKospsAWatch this BRILLIANT live stream on vaccines with Dr. Alex Dainis: https://youtu.be/YP62jFlj41YJoin our mailing list: https://bit.ly/34fWU27There’s a lot of excitement right now around the record-speed vaccines for COVID19, some of which are already starting distribution in parts of the world. But given that these are mRNA vaccines - a relatively new technology that has not been widely used before - we wanted to explain how they work, and what happens in your body from the moment the needle touches your skin. Written by Gregory Brown and Mitchell MoffitEditing by Luka ŠarlijaFOLLOW US!AsapSCIENCETikTok: @AsapSCIENCE Instagram: https://instagram.com/asapscienceFacebook: https://facebook.com/asapscienceTwitter: https://twitter.com/asapscienceSome Extra Resources:https://www.cdc.gov/coronavirus/2019-ncov/vaccines/different-vaccines/mrna.htmlhttps://www.nature.com/articles/nrd.2017.243https://www.nature.com/articles/s41541-020-0159-8https://www.nature.com/articles/d41573-020-00119-8https://www.frontiersin.org/articles/10.3389/fimmu.2019.00594/fullhttps://www.phgfoundation.org/briefing/rna-vaccineshttps://youtu.be/YP62jFlj41Y"
"WWDRbwe1ys8","19-Year-Old TikToker Realizes She Lost Her Sense of Taste","2020-12-07T23:29:04Z","UC9k-yiEpRHMNVOnOi_aQK8w","Inside Edition","25","20.14.12","Coronavirus|tiktok|Inside Edition|Inside_Edition|IE Coronavirus|TikTok|tiktok covid|tiktoker loses sense of smell|coronavirus tiktok|coronavirus symptoms|covid-19|tiktoker loses sense of taste|lose taste covid-19|starbucks","1729558","62870","1254","4527","https://i.ytimg.com/vi/WWDRbwe1ys8/default.jpg","False","False","A teen who thought she was just filming a bit for TikTok ended up recording the exact moment she discovered she had a tell-tale COVID-19 symptom. Maryn Short, 19, was sampling what was supposed to be a sweet drink when she discovered she couldn’t taste a thing. In that moment, Short tells Inside Edition, she realized an awful truth. Short quickly went to get tested, and it came back positive for COVID-19. She is now quarantined at home in Louisiana, and documenting her struggle on TikTok."
"4g_Be4VoXpg","Flight - Sum (Official Music Video)","2020-12-09T00:15:10Z","UC_k0qgMNIW2VmTQKjFsbXDw","FlightReacts","10","20.14.12","Reactions|Family|vlog|life|NBA|sports|Friends|fashion|friendly|nice","328402","48503","718","5004","https://i.ytimg.com/vi/4g_Be4VoXpg/default.jpg","False","False","Stream Spotifyhttps://open.spotify.com/track/3cGkrg53Z9tNRi8Ik1fir6?si=qihQk_COQ1G-3P0CeqWTiwSoundcloudhttps://soundcloud.com/user-593517877/flight-sumDownload Apple ITunes Music https://music.apple.com/us/album/sum/1518788148?i=1518788149#Sum #ShakeSumMerchhttps://www.flightreacts.us/Daily Livestreamhttps://www.twitch.tv/flight23whiteFollow my  instagram https://www.instagram.com/Flight23White_FOLLOW ME ON TWITTERhttps://twitter.com/Flight23White"
"-xQKDW5pITg","Trippie Redd - Too Fly","2020-12-08T05:00:01Z","UCEtPQSQ2BkBct_n8DIeacFQ","TrippieReddVEVO","10","20.14.12","Trippie|Redd|Too|Fly|1400|Entertainment/TenThousand|Projects|Hip|Hop","785678","55064","855","4075","https://i.ytimg.com/vi/-xQKDW5pITg/default.jpg","False","False","Official Music Video for Too Fly”  by Trippie Redd Listen/Download: https://trippieredd.lnk.to/pegasusOfficial Merch: shop.trippieredd.comSpotify: https://trippieredd.lnk.to/pegasus/spApple Music: https://trippieredd.lnk.to/pegasus/apAmazon Music: https://trippieredd.lnk.to/pegasus/amDeezer: https://trippieredd.lnk.to/pegasus/deFollow Trippie ReddInstagram: https://instagram.com/trippiereddFacebook: http://www.facebook.com/trippiereddTwitter: http://www.twitter.com/trippiereddTIkTok: https://www.tiktok.com/@trippieatplay"
"l46E7Q3UKqI","Cyberpunk 2077 Review","2020-12-07T17:00:30Z","UCKy1dAqELo0zrOtPkf0eTMw","IGN","20","20.14.12","PC|IGN|Review|CD Projekt|Cyberpunk 2077|CD Projekt Red|ign review|ign game reviews|cyberpunk review|cyberpunk ign review|cyberpunk|cyberpunk pc review|ign reviews|top videos|cyberpunk 2077 review|cyberpunk 2077 gameplay|cyberpunk 2077 reaction|cyberpunk 2077 ps5|cyberpunk gameplay|cyberpunk 2077 trailer|cyberpunk 2077 new gameplay|cyberpunk 2077 ps4|ign|cyberpunk trailer|cyberpunk review ign|cyberpunk 2077 ign review|cyberpunk 2077 ign","4448604","114901","8379","15716","https://i.ytimg.com/vi/l46E7Q3UKqI/default.jpg","False","False","Cyberpunk 2077 reviewed by Tom Marks on PC, also available on PlayStation 4, Xbox One, and Google Stadia.Developer CD Projekt Red's first game after The Witcher 3: Wild Hunt is an RPG that throws you into the beautiful open-world map of Night City and offers a staggering amount of flexibility in how you choose to take it from there.Cyberpunk 2077 is an open-world, action-adventure story set in Night City, a megalopolis obsessed with power, glamour and body modification. You play as V, a mercenary outlaw going after a one-of-a-kind implant that is the key to immortality. You can customize your character’s cyberware, skillset and playstyle, and explore a vast city where the choices you make shape the story and the world around you. (Featuring Keanu Reeves as Johnny Silverhand)#ign"
"H1QWCg9A-p4","Cowboys vs. Ravens Week 13 Highlights | NFL 2020","2020-12-09T04:14:31Z","UCDVYQ4Zhbm3S2dlz7P1GBDg","NFL","17","20.14.12","NFL|Football|offense|defense|American Football|highlight|highlights|game|sport|play|plays|season|2020|touchdown|td|game highlights|week 13|best plays|top plays|cowboys|dallas|dal|ravens|baltimore|bal|cowboys ravensgame highlights|cowboys highlights|ravens highlights|cowboys td|ravens td|DAL vs. BAL|Cowboys Ravens","1746739","16967","728","3129","https://i.ytimg.com/vi/H1QWCg9A-p4/default.jpg","False","False","The Dallas Cowboys take on the Baltimore Ravens during Week 13 of the 2020 NFL season.Subscribe to NFL: http://j.mp/1L0bVBuCheck out our other channels:Para más contenido de la NFL en Español, suscríbete a https://www.youtube.com/nflenespanolNFL Fantasy Football https://www.youtube.com/nflfantasyfootballNFL Vault http://www.youtube.com/nflvaultNFL Network http://www.youtube.com/nflnetworkNFL Films http://www.youtube.com/nflfilmsNFL Rush http://www.youtube.com/nflrushNFL Play Football https://www.youtube.com/playfootballNFL Podcasts https://www.youtube.com/nflpodcasts#NFL #Cowboys #Ravens"
"bqiSv8uEsKc","The Try Guys Try 9 Things They've Never Done Before - Part 2 | Allure","2020-12-08T17:00:06Z","UCb0tMboxhHE8Jx6-nhJmRPw","Allure","24","20.14.12","the try guys|try nine|nine things|never done before|try 9 things|9 things|try nine things|the try guys try|the try guys allure|the try guys lipstick|the try guys kylie|the try guys nine things|ned the try guys|zach the try guys|try guys friends|try guy|eugene try guys|keith try guys|try guys 2020|celebs try|celebs never done before|the four try guys|try anything celebs|try stuff|the try guys art|the try guys date|mandalorian helmet|allure","212485","9611","96","266","https://i.ytimg.com/vi/bqiSv8uEsKc/default.jpg","False","False","Keith, Ned, Zach, and Eugene of The Try Guys linked up to dazzle us once more with a second installment of Try 9. The infamous Try Guys try nine things they've never done before, from making a Mandalorian helmet with puppy pee pads to carving their faces on a butternut squash. Who will walk away a Try warrior and who will carry their squash carving away in shame?The Try Guys documentary Behind The Try will premiere on 12/18. Get tickets for the virtual premiere: https://tryguys.veeps.com/stream/events/5999949829fcStill haven’t subscribed to Allure on YouTube? ►► http://bit.ly/AllureYouTubeSubABOUT ALLUREThe best daily makeup tips, skin-care advice, hair tutorials, product reviews, and videos from beauty experts. The Try Guys Try 9 Things They've Never Done Before - Part 2 | Allure"
"nIk8YnCGckw","$549 AirPods Max Impressions: Has Apple Lost Their Minds?","2020-12-08T22:08:04Z","UCDlQwv99CovKafGvxyaiNDA","Jonathan Morrison","28","20.14.12","AirPods|AirPods max|AirPods Pro|AirPods Pro max|AirPods max review|AirPods max unboxing|AirPods max hands on|apple|AirPods Pro vs AirPods max|AirPods max headphones|AirPods vs Sony|Apple vs Sony|tld|Jonathan Morrison","332419","12058","586","2444","https://i.ytimg.com/vi/nIk8YnCGckw/default.jpg","False","False","AirPods Max Impressions! $549. Has Apple lost their minds? Or will these be great? Subscribe for my AirPods Max hands on review! Apple M1 music review impressions! https://youtu.be/VB78wqZHclEwe made a song out of the MagSafe sound :o https://youtu.be/mugdii5TJpIShot on iPhone 12 Pro - HDR Dolby Vision Footage + channel! https://youtu.be/zAS8AOoiWug14 inch MacBook Pro? https://youtu.be/1VV8e3BOOzcGiving the iPhone 11 to strangers  - https://www.youtube.com/watch?v=AbuDm0C4vt0&t=7sFollow me (if ya want) - http://www.twitter.com/tldtodayhttp://www.instagram.com/tldtoday"
"nECoRwLniwQ","IM MOVING TO LA ..😳😊| vlogmas 2020","2020-12-08T22:37:05Z","UCynjCtSSEmAoZJ8ijA6EK_Q","LIL JERZ","22","20.14.12","[none]","237623","12819","147","679","https://i.ytimg.com/vi/nECoRwLniwQ/default.jpg","False","False","I love you guys Soo much! Stay connected on all social media: Instagram: @Lil.JerzSnapchat: @Jerzigurl23 TikTok: @LilJerz Twitter: @AlvaradoJerziASK JERZ Email: ASKLilJerz@gmail.comSHOP @liljerzcloset Business Inq: Jerzi@IMPERIALMGMT.comPO Box 503 Litchfield Park AZ 85340 VLOGMAS INTRO : https://youtu.be/WoOS_hV0K8cJOIN THE COMMUNITY!! https://www.liljerz.com/If you are struggling with something and need immediate help- don’t be afraid to reach out and call!! Suicide Prevention line 1-800-273-8255 #jerzigirlz🦋"
"D0VAQ2BhObA","Basaksehir WALK OFF the field in protest against racism during Champions League tie against Paris","2020-12-08T20:36:42Z","UC0jPwNs4B7yJySNewHan5hQ","Optus Sport","17","20.14.12","how to watch|where can I watch|optus sport|australia|highlights|premier|league|goal|review|premier league highlights|goals|champions league highlights|europa league highlights|soccer|football|premier league|epl|ucl|uel|uefa|psg|Istanbul Basaksehir|psg racism|webo|demba ba racism|suspended|walk off|paris|coaching staff","669292","13095","558","4695","https://i.ytimg.com/vi/D0VAQ2BhObA/default.jpg","False","False","There was unbelievable scenes in Paris, with Istanbul Basaksehir walking off the pitch in protest against an apparent racist comment made by a UEFA official..The world's best football.All in one place.Get free access to Optus Sport on eligible Optus plans or purchase for $14.99/mth. Data charges may apply.Join Optus Sporthttps://sport.optus.com.au/signup==========================For the latest updates, follow us on:►TWITTER: http://twitter.com/optussport►FACEBOOK: http://facebook.com/optussport ►INSTAGRAM: http://instagram.com/optussport Optus Sport is the home of the Premier League, UEFA Champions League, UEFA Europa League, FA Women's Super League and Euro 2020.#OptusSport"
"eykh4PSQZcc","Call of Duty®: Black Ops Cold War & Warzone™ - Season One Cinematic","2020-12-07T19:14:11Z","UC9YydG57epLqxA9cTzZXSeQ","Call of Duty","20","20.14.12","call of duty|cod|activision|cw|cold war|mp|s1|season 1|warzone|br|battle royale","1192645","55676","1553","4688","https://i.ytimg.com/vi/eykh4PSQZcc/default.jpg","False","False","Time to settle the score. A trap has been set. A CIA safehouse has been hit. And an old enemy returns to get his revenge.After storming an experimental Nova 6 production site on Rebirth Island, Russell Adler has made a powerful enemy in Vikhor Stitch Kuzmin, the ex-KGB leader of the Nova 6 program. And Stitch is looking to settle the score.Now, Adler and his CIA strike team find themselves trapped, and surrounded by enough Nova 6 nerve gas to throw the world off its axis.Season One arrives to Call of Duty: Black Ops Cold War on December 16."
"9wwi5wfNFQo","Spiderman Helps Santa (Parkour In Real Life)","2020-12-08T14:00:02Z","UChCBHudFoBnsF0O1flPXqiQ","Nick Pro","24","20.14.12","spiderman parkour|spider-man parkour|spiderman santa|santa spiderman|spiderman in real life|spider-man in real life|spider-man|santa claus|spiderman|spider man real life|spiderman real life|spiderman vs|in real life|parkour|real life|nick pro|superheroes in real life","1337962","20467","1348","1059","https://i.ytimg.com/vi/9wwi5wfNFQo/default.jpg","False","False","Spiderman Helps Santa (Parkour In Real Life) | Nick Pro#Spiderman #Parkour #SpidermanInRealLife👨🏻‍🎤Subscribe👨🏻‍🎤 : https://bit.ly/SubNickPro🔔 Never miss a video, turn on Notifications! 🔔🎬 Watch More 🎬: https://www.youtube.com/playlist?list=PL9A7496ADDBBA0F75Most Filming by: Inceptive Studios https://www.youtube.com/channel/UCDd7VYaPMqCPqKNrtVLGBAQ👕 Nick Pro & Parkour MERCH 👕: https://bit.ly/NickProMerch📷 INSTAGRAM 📷: https://bit.ly/NickProInsta✉️ WEBSITE ✉️: https://bit.ly/NickProWEB"
"qIUb3bjh42Y","Pringles Update: Last Week Tonight with John Oliver (Web Exclusive)","2020-12-07T04:00:05Z","UC3XTzVzaHQEd30rQbuvCtTQ","LastWeekTonight","24","20.14.12","[none]","4544302","188044","3973","9240","https://i.ytimg.com/vi/qIUb3bjh42Y/default.jpg","False","False","With the help of viewers at home, John tries to get to the bottom of an important mystery.Connect with Last Week Tonight online... Subscribe to the Last Week Tonight YouTube channel for more almost news as it almost happens: www.youtube.com/lastweektonight Find Last Week Tonight on Facebook like your mom would: www.facebook.com/lastweektonight Follow us on Twitter for news about jokes and jokes about news: www.twitter.com/lastweektonight Visit our official site for all that other stuff at once: www.hbo.com/lastweektonight"
"Rc4hUBa-554","Quarterback runs backwards for an intentional safety, a breakdown","2020-12-07T17:00:09Z","UCl9E4Zxa8CVr2LBLD0_TaNg","Jomboy Media","24","20.14.12","a breakdown|mlb|jomboy videos|jomboy|jake sucks|talkin yanks|jomboy podcast|tv podcast|just talkin podcast|mlb breakdowns|Talkin yanks|jomboy jake radio","1329189","16011","379","1441","https://i.ytimg.com/vi/Rc4hUBa-554/default.jpg","False","False","#louisianna #appstate #cfbSUBSCRIBE TO THE NEWSLETTER: https://confirmsubscription.com/h/t/3D96AF9DDCC13BEBBUY MERCH! https://shop.jomboymedia.com/collections/jomboy-mediaLEAVE BREAKDOWN SUGGESTIONS HERE: http://bit.ly/BreakdownSuggestionsSubscribe to our other YT ChannelsTalkin' Yanks: https://www.youtube.com/channel/UCzcaZfAmCJlCSoBOiNWx20QTalkin' Baseball: https://www.youtube.com/channel/UCeQ5xiPb9TMpTQIjcscvBRgLaughs from the Past: https://www.youtube.com/channel/UCAFEYBtgbNxHAVMGNsyqMiQJomboy & Jake Radio: https://www.youtube.com/channel/UCifMPWjBEu7rYx3CVdkjiWAFB: https://www.facebook.com/JomboyMedia/TW: http://www.twitter.com/jomboymediaIG: http://www.instagram.com/JomboyMediaP.O. Box 524607Bronx, NY 10452"
"4pUfu96WXHw","UFC 256 Embedded: Vlog Series - Episode 3","2020-12-09T19:32:54Z","UCvgfXK4nTYKudb0rFR6noLA","UFC - Ultimate Fighting Championship","17","20.14.12","ufc|ultimate|fighting|championship|champion|champ|embedded|episode|series|mma|ultimate fighting championship|UFC Apex|Apex|Las Vegas|Deiveson|Figueiredo|Brandon|Moreno|Ferguson|tony|oliveira|flyweight","536953","9899","219","1647","https://i.ytimg.com/vi/4pUfu96WXHw/default.jpg","False","False","Presented by Hyperice, Junior Dos Santos arrives on a late-night flight. Champion Deiveson Figueiredo hits the sauna; opponent Brandon Moreno sings through training and PT. Jacare Souza starts his quarantine. Tony Ferguson checks in with his not-coach. Visit https://hyperice.com/Subscribe to get all the latest UFC content: http://bit.ly/2uJRzRRExperience UFC live with UFC FIGHT PASS, the digital subscription service of the UFC. Visit https://ufcfightpass.com/To order UFC Pay-Per-Views on ESPN+, visit https://bit.ly/2vNIBE8 (U.S. only)To order UFC Pay-Per-Views, visit http://welcome.ufcfightpass.com/#PPV (Non U.S.)Connect with UFC online and on Social:Website: http://www.ufc.comTwitter: http://www.twitter.com/ufcFacebook: http://www.facebook.com/ufcInstagram: http://www.instagram.com/ufcSnapchat: UFCPeriscope: http://Periscope.tv/ufcConnect with UFC FIGHT PASS on Social:Twitter: http://www.twitter.com/ufcfightpassFacebook: http://www.facebook.com/ufcfightpassInstagram: http://www.instagram.com/ufcfightpass#UFC256"
"2unhM-tWKQA","Secret Formula","2020-12-06T18:00:00Z","UC91V6D3nkhP89wUb9f_h17g","MeatCanyon","1","20.14.12","meatcanyon|spongebob|meatcanyon spongebob|meatcanyon cartoon|secret formula|meatcanyon secret formula","6440401","342322","13948","51877","https://i.ytimg.com/vi/2unhM-tWKQA/default.jpg","False","False","thanks for watching the toon! if you wanna support the channel consider signing up for a monthly sticker on my patreon!https://www.patreon.com/meatcanyonAnimators MeatcanyonFantishow: https://www.youtube.com/user/FANTASHOW100Primate Punk: https://www.youtube.com/user/PrimatePunkBackgrounds:Davecavedraws: https://www.instagram.com/davecavedraws/?hl=enVFXMolly Wright: https://www.youtube.com/c/wollymightMusic Composer:Samuel Long: https://open.spotify.com/artist/1o4eqJumHhKcJrpybBK20R?si=I8xtb8hBTxmamyd8jt9mZAPAudio Engineer:Justin Greger: https://twitter.com/imadeasongMeatcanyon Twitter: https://twitter.com/meatcanyon?ref_src=twsrc%5Egoogle%7Ctwcamp%5Eserp%7Ctwgr%5EauthorMeatcanyon Instagram: https://www.instagram.com/meatcanyon/?hl=en"
"8-PZoB-wRt8","RB Leipzig vs. Manchester United: Extended Highlights | UCL on CBS Sports","2020-12-08T22:22:31Z","UCET00YnetHT7tOpu12v8jxg","Champions League on CBS Sports","17","20.14.12","RB Leipzig|Manchester United|RB Leipzig vs. Manchester United","726638","7425","238","2236","https://i.ytimg.com/vi/8-PZoB-wRt8/default.jpg","False","False","Extended Highlights Presented By HeinekenRB Leipzig was able to fend off Manchester United on Matchday 6 and secured a monumental 3-2 win. Both sides were still vying for a spot in the knockout stage and RB Leipzig made their presence known jumping out to a three goal lead but Manchester United staged a late comeback that with a Bruno Fernandes goal in the 80’ and a Paul Pogba goal in the 82’ but it was too little too late and Leipzig got the win.  Leipzig wasted no time scoring in this match as Angelino opened things up in the 2’. From there, they doubled their lead in the 13’ with a Haidara goal, they held onto that 2-0 lead going into half. In the 69’ Leipzig tacked on a much needed third goal when Kluivert found the back of the net. Man. United got one back when Bruno Fernandes powered it home from the penalty spot in the 80’ to cut the Leipzig lead to 3-1. Then just two minutes later Paul Pogba, who had come on as a substitute, gave Manchester United life when he headed one home to cut the lead to one. That would be all the English side could muster, unable to find the back of the net in the match’s final minutes and with Leipzig holding on for the win, Manchester United will not advance to the UEFA Champions League knockout stage.  Stream every UEFA Champions League match live on CBS All Access:http://bit.ly/ucloncbssports #UEFA #RBLeipzig #ManchesterUnited #ManU #Leipzig #ManUnited #UCL #ChampionsLeague #Matchday6"
"I-VHMHIELNQ","FRESH'S $1,000,000 OFFICE TOUR! (hosted by lazarbeam)","2020-12-07T14:28:48Z","UChnm6XBN1Izz82EPzpmL1Pw","FreshFresh","22","20.14.12","fresh|lazarbeam|lazar|mrfreshasian|setup|music|freshfresh|Harley Fresh","1106172","81484","1315","9676","https://i.ytimg.com/vi/I-VHMHIELNQ/default.jpg","False","False","Hope you guys enjoyed the office tour! Leave a comment with what you wanna see on this channel, I'm wanting to expand and do a lot more!10 MASSIVE NEXT GEN CONSOLE GIVEAWAY: *ENDED*YesFollow me @Twitch: https://www.twitch.tv/freshTwitter: https://www.twitter.com/mrfreshasianInstagram: https://www.instagram.com/mrfreshasian/Discord: https://discord.gg/yes"
