video_id,title,publishedAt,channelId,channelTitle,categoryId,trending_date,tags,view_count,likes,dislikes,comment_count,thumbnail_link,comments_disabled,ratings_disabled,description
"NFUQm1nYxYM","Gerardo Diaz y su Gerarquia - Las Envidias, Los Chismes y Las Traiciones (Video Oficial)","2020-12-04T21:00:09Z","UCZ3pVT4hv4hgWwHpJHyTNRQ","AfinArte Music","10","20.10.12","Afinarte Music|Latin|Regional Mexicano|Afinarte|El Fantasma|Música Norteña|Banda|Sierreño|el fantasma|el fantasma ranchero hasta las cachas|ranchero hasta las cachas|el fantasma ranchero|ranchero hasta las cachas letra|ranchero hasta las cachas el fantasma|fantasma ranchero|fantasma|el fantasma 2020|ranchero el fantasma|regional mexican|ranchero|el fantasma ranchero hasta las cachas letra|cabrón y vago|mariachi|el fantasma mariachi|el fantasma letra|musica","628287","18597","496","672","https://i.ytimg.com/vi/NFUQm1nYxYM/default.jpg","False","False","Suscríbete aquí: http://bit.ly/2LWw4CtContrataciones: Miguel (714) 277-5589Gerardo Diaz y su Gerarquia - Las Envidias, Los Chismes y Las Traiciones (Video Oficial)Localizada en Anaheim California, AfinArte Music es una disquera que desarrolla talento musical, representación, promocional y editorial.Síguenos en:Instagram: https://www.instagram.com/afinartemusic/ Like en FB: https://www.facebook.com/Afinartemusic"
"N_kp7qqUk5Y","Clash Royale: NEW LEGENDARY CARD REVEAL 😮 TV Royale Update","2020-12-04T07:53:40Z","UC_F8DoJf9MZogEOU51TpTbQ","Clash Royale","20","20.10.12","Clash Royale|Clash Royale Game|Supercell|Supercell Game|Clash Royale Supercell|Mobile Game","6328442","193386","5784","8810","https://i.ytimg.com/vi/N_kp7qqUk5Y/default.jpg","False","False","It's our first Legendary card since the Fisherman entered the Arena in July 2019! Find out who she is and catch up on what's coming in the next Clash Royale season... LOGMAS.Follow Drew & Brice: https://twitter.com/drewbian & https://www.instagram.com/bricelavillesaintmartin_3d/https://www.youtube.com/esportsroyale☝️☝️☝️ WATCH THE CLASH ROYALE WORLD FINALS V.O.D HERE ☝️☝️☝️Subscribe for more! ►► http://supr.cl/SubRoyaleEnter the Arena! From the creators of Clash of Clans comes a real-time multiplayer game starring the Royales, your favorite Clash characters and much, much more.Collect and upgrade dozens of cards featuring the Clash of Clans troops, spells and defenses you know and love, as well as the Royales: Princes, Knights, Baby Dragons and more. Knock the enemy King and Princesses from their towers to defeat your opponents and win Trophies, Crowns and glory in the Arena. Form a Clan to share cards and build your very own battle community.Lead the Clash Royale Family to victory!FEATURES• Duel players from around the world in real-time in both 1v1 and 2v2 Battles• Earn chests to unlock rewards, collect powerful new cards and upgrade existing ones• Destroy opponent's towers and win Crowns to earn epic Crown chests• Build and upgrade your card collection with the Clash Royale Family along with dozens of your favorite Clash troops, spells and defenses• Construct your ultimate Battle Deck to defeat your opponents• Progress through multiple Arenas all the way to the top• Form a Clan to share cards and build your very own battle community• Challenge your Clanmates and friends to a private duel, or play side-by-side in a 2v2 Battle• Work together with your Clan to unlock Clan Chests• Play new events every week• Learn different battle tactics by watching the best duels on TV RoyalePLEASE NOTE! Clash Royale is free to download and play, however, some game items can also be purchased for real money. If you don't want to use this feature, please disable in-app purchases in your device's settings. Also, under our Terms of Service and Privacy Policy, you must be at least 13 years of age to play or download Clash Royale. A network connection is also required.Support:Are you having problems? Visit http://supercell.helpshift.com/a/clash-royale/ or contact us in-game by going to Settings, Help and support.Privacy Policy:http://supercell.com/en/privacy-policy/Terms of Service:http://supercell.com/en/terms-of-service/Parent's Guide:http://supercell.com/en/parents/#ClashRoyale #NewCard #Update"
"_7mm_gpC_A0","Highlights | Pogba, Greenwood & Rashford seal comeback win | West Ham 1-3 Manchester United","2020-12-05T22:00:10Z","UC6yW44UGJJBvYTlfC7CRg2Q","Manchester United","17","20.10.12","manchester united|mufc|man utd|manutd|mu|ggmu|old trafford|goals|highlights|west ham united|marcus rashford|bruno fernandes|paul pogba|dean henderson|mason greenwood|alex telles","3573586","63719","1620","3000","https://i.ytimg.com/vi/_7mm_gpC_A0/default.jpg","False","False","See all the highlights from the London Stadium as United came from behind to win a 9th successive away Premier League win thanks to goals from Paul Pogba, Mason Greenwood and Marcus Rashford.Subscribe to Manchester United on YouTube at http://bit.ly/ManU_YTVisit Manchester United at http://www.manutd.comLike Manchester United on Facebook at http://www.facebook.com/manchesterunitedFollow Manchester United on Twitter at http://www.twitter.com/ManUtdFollow Manchester on Instagram at http://www.instagram.com/manchesterunitedSubscribe to MUTV at https://bit.ly/2L9ymRs"
"bAP3Kdbdhak","J.I. - Excuse My Pain (Official Music Video)","2020-12-04T05:00:09Z","UCT4WhY3XAlGz5fb4vUaDXNA","J.I.","10","20.10.12","ji|j.i|j.i.|ji the prince|j.i the prince|j.i. the prince|ji the prince of ny|j.i the prince of ny|j.i the prince of n.y|excuse my pain|j.i excuse my pain|ji excuse my pain|j.i the prince excuse my pain|ji the prince excuse my pain|excuse my pain mv|excuse my pain music video|ji new music|ji 2020|ji music video","1036683","76605","705","4485","https://i.ytimg.com/vi/bAP3Kdbdhak/default.jpg","False","False","“Excuse My Pain” out now: https://smarturl.it/ExcuseMyPainFollow J.I:https://www.instagram.com/iamj.i/https://twitter.com/i_am_j_iLyrics:Lemme talk my shit cause nobody talk it like I do Imma boss so when I speak nobody talking when I do I’m a big stepper way I walk keep fucking up my shoes No religion where I’m from but they got faith in the way I move Cause I’m a evil nigga I deserve to die in pain And my heart so cold I got frostbite inside my veins I can’t see no evil I put tints inside my frames I’m ina world so cold please excuse me for This pain  When we was kids I’m the one your mother told you not to play with She was scared for your life never thought one day I’d take it I know its cold world but I’m a colder Nigga Had too much conversations with the devil on my shoulder’s nigga This little body of mine never had a soul in it Had trouble finding my heart I move too cold with it Can’t give you none of my time I know you thought I was blind I even saw through the blinds how you had control of me I ain’t ever need no bitch to keep me company I just said it so you think I had a heart You knew my true intentions from the start Left a bunch of bitches reminiscing cause we fell apart Can’t show no love feel no pain move the same wayAnd if I’m stepping in your hood, I let my chains hang I can’t be concerned about niggas if they ain’t gang gang Put you on a shirt make your family feel the same pain It’s time to put this shit to rest I never meant to break your heart And Treat you like the rest I know I’m a fucking mess I love it when you get undressed and you tell me All those pretty little lies I’m impressed with you Cause I’m a evil nigga I deserve to die in pain And my heart so cold I got frostbite inside my veins I can’t see no evil I put tints inside my frames I’m ina world so cold please excuse me for This pain x2Please excuse me for the pain Bout to make you feel my pain Lemme talk my shit Please excuse me for the rain But I really think it’s time I let these niggas feel my pain She play my heart like it’s her favorite song Gather all my past bitches just so y’all can sing along Why you move so wrong to me Why u move so wrongfully You should sing this song for meGot The power to make you crawl to me Please excuse me for the rain but I really think it’s timeI let these niggas feel my pain I know I said my love won’t change Then I got my first check and I spent it on my chains Used to get bad luck when you cry but I would always brush it off so I never took the blame Know I always said I would change for you I wasn’t try stay the same for you And I can’t take the blame for you no more#JI #ExcuseMyPain #JIthePrinceofNYJ.I. - Excuse My Pain (Official Music Video)"
"gbxyZAduGvY","Daveed Diggs - Puppy for Hanukkah","2020-12-04T05:00:22Z","UCgwv23FVv3lqh567yagXfNg","DisneyMusicVEVO","10","20.10.12","Daveed|Diggs|Puppy|for|Hanukkah|Walt|Disney|Records|Holiday","620646","12385","455","1008","https://i.ytimg.com/vi/gbxyZAduGvY/default.jpg","False","False","I want a puppy for Hanukkah! And I'm gonna get just what I wanted!🎶Check out Daveed Digg's official music video Puppy for Hanukkah! Check out more Disney Channel Holiday’s Unwrapped content here: https://www.youtube.com/playlist?list=PLiv1IUQDVSNItUYVbUZh5VCcjuUIi27jf    Subscribe to DisneyMusicVEVO 🔔 for all the latest Disney music videos: https://disneymusic.co/disneymusicYT Follow Disney Music: Instagram: https://instagram.com/disneymusicTwitter: https://twitter.com/disneymusicFacebook: https://facebook.com/disneymusic Subscribe to Disney Channel for all the latest videos:https://youtube.com/disneychannel Follow Disney Channel: Instagram: https://instagram.com/disneychannelTwitter: https://twitter.com/disneychannel Facebook: https://facebook.com/disneychannel Disney+ is the only place to stream your favorites from Disney, Pixar, Marvel, Star Wars, National Geographic and more. Access it all at https://disneymusic.co/JoinDisneyPlus?iqid=dmvevo  #PuppyforHanukkah #HolidaysUnwrapped #DisneyChannelMusic video by Daveed Diggs performing Puppy for Hanukkah. © 2020 Walt Disney Records"
"qOUTjn2lVO8","The Mandalorian Season 2 Episode 6 Breakdown OH MY GOD","2020-12-04T19:02:34Z","UC8CbFnDTYkiVweaz8y9wd_Q","Star Wars Theory","24","20.10.12","the mandalorian|star wars|baby yoda|mandalorian season 2|ahsoka tano|the mandalorian season 2|the child|disney plus|boba fett|mandalorian ahsoka|the mandalorian season 2 episode 6|rosario dawson|moff gideon|dave filoni|grand admiral thrawn|star wars explained|star wars theory|the mandalorian reaction|jon favreau|bo katan|boba fett the mandalorian|jango fett|vader vs ahsoka|ahsoka mandalorian|dark troopers|luke skywalker the mandalorian|jedi","1335699","54755","844","9311","https://i.ytimg.com/vi/qOUTjn2lVO8/default.jpg","False","False","This episode had it all! The Mandalorian Season 2 Episode 6 finally shows the one and only, Boba Fett in the spotlight. We see Boba return and eventually help Din Djarin and Grogu against Moff Gideon's Storm Troopers and Dark Troopers (phase 2 I think), who end up taking Grogu.Fennec Shand reminds me a lot of Zam Wessel from Attack of the Clones, who was pursued by Anakin Skywalker and Obi-Wan Kenobi, until Jango showed up.We also learn a lot about Jango Fett, Boba Fett's Father. We learn that Jango Fett was a Mandalorian! This is awesome! Since it was skewed in canon, it's nice to know we finally have an answer. They seem to be following his story from Open Seasons comic book series which shows the story of Jango as a boy. Long story short, Jango was the son of a farmer on Concord Dawn. A man named Jaster Mereel who was leader of the True Mandalorians, was on the run from a traitor named Tor Vizsla from Death Watch. Jango’s dad hid Jaster Mereel in his farm, and told Jango that he was feeding some homeless men. When Tor Vizsla came looking near Jango’s Dad’s farm, he found Jango’s Dad and beat him up infant of Jango, until Jango’s mom created a distraction and Jango ran for his life, leaving his parents who were immediately murdered, Fett ran into Jaster Mereel who eventually took the boy under his wing and recruited him in the Mandalorian Civil War against Death Watch, as one of the True Mandalorians. Jaster died eventually and Jango avenged him, becoming the leader of the True Mandalorians. Now the people who found Din, were death watch, so the two clans have always been waging wars against one another and have varying beliefs. Explaining this to Din, Din accepts that the armour belongs to Boba. So this armour, is just repainted from his dad’s, from Jango’s. The deal is done, says Din, where Boba assures him that it is not, as he promised the safety of the child in return for his armour. Now Boba joins the crew until the child is safe. Flying in the Slave 1, they arrive on Nevarro 7, where Cara Dune is now a New Republic Marshal, where he asks her to locate Mayfeld, who you might remember from season 1. Mando is going to spring him out of jail to locate Moff Gideon’s cruiser.We jump to Moff Gideon’s light cruiser, he walks to the cell containing the child.As Moff Gideon enters, we see Grogu using the force on stormtroopers. Even going as far as using force choke, to which many might think is a dark side move, but, I should mention, Luke Skywalker used it as well in Return of the Jedi, and he was far from the dark side.As Grogu knocks them out, Gideon steps up to him and ignites his dark saber, asking Grogu if he remembers one of these, meaning if he remembers using a lightsaber or having seen many lightsabers during his time as a Jedi at the Jedi Temple before Order 66. Grogu is tired, I think because he had to cut himself off from the force for so long that he isn’t used to using it as much as when he was at the Jedi temple learning from the many masters. Using the force can also tire one out, like it does to Luke in the empire strikes back when failing to lift the x-wing out of Yoda’s swamp. They blast Grogu with a stun blast, and cuff him. Gideon tells his officer to contact Dr. Pershing, the cloning doctor responsible for the experiments on the child, to tell him that they have their donor. The plan now is for Gideon to kill Grogu to harvest all of his blood which has force powers, or in Star Wars lingo, a high Midichlorian count. End of the episode.It was amazing. Simply amazing. My favourite episode of the entire show so far, which is saying a lot. Boba is back and badder than ever, as Terry Silver would say. I think the next episode will revolve around rescuing Mayfeld from Jail, and then tracking the light cruiser or going to Dr. Pershing who will have the child momentarily. I think the season finale will end in a Big Bang all out battle like end game. With everyone we’ve seen from this season fighting together against Moff Gideon and his dark troopers, as he himself gets in a phase 3 dark trooper mega suit to destroy Din. Hopefully Ahsoka Tano returns with Bo Katan, and we get to see another Jedi, Luke or Ezra is my guess.Become a Patron to support future content - https://www.patreon.com/StarWarsTheoryJoin this channel to get access to perks:https://www.youtube.com/channel/UC8CbFnDTYkiVweaz8y9wd_Q/join"
"XNFBE0t0hIM","Dixie D'Amelio - One Whole Day Feat. Wiz Khalifa (Official Video)","2020-12-04T18:00:09Z","UCLOEGprmycLLbyzBj2jozLg","Dixie D'Amelio","10","20.10.12","dixie damelio|dixie d'amelio|dixie|damelio|be happy|music video|tik tok|official music video|dixie damelio be happy|dixie d'amelio be happy|be happy music video|dixie damelio music video|dixie d'amelio music video|charli damelio|charli d'amelio|tiktok|charli|d'amelio|one whole day|wiz khalifa|wiz|khalifa","9515217","726418","77639","91056","https://i.ytimg.com/vi/XNFBE0t0hIM/default.jpg","False","False","One Whole Day Featuring @Wiz Khalifa Stream/Buy One Whole Day Below:https://lnk.to/OneWholeDayCreditsDirector | Jake The ShooterExecutive Producer | Garret Brockschmitt & Tony PillowVideo Commissioner | Dominic WestProduction Company | One Machine Media Subscribe for more official content from Dixie: https://www.youtube.com/dixiedamelio?...Connect with DixieTikTok: https://www.tiktok.com/@dixiedamelioInstagram: https://www.instagram.com/dixiedamelioTwitter: https://twitter.com/dixiedamelioWebsite: https://www.dixiedamelio.comLyricsWe’d be laying in my bedAnd you’d randomly get up and leaveYou would make a lot of timeFor anyone other than meThe more that I gave the more you held backNow I am emotionally starvedYou’re stuck on your ex you’re stuck in the pastTruth is that you really broke my heartFor one day, one day I was really, really, really, really sadFor one day, one whole dayI missed you really, really, really badAnd a single tear trickled down my faceWhile I threw your shit in the fireplace I was really, really, really, really sadFor one day, one whole dayI woke up and it was strangeAll that I felt was relievedNo more feeling second best I'm cringing at those memoriesLike the time that you left meAlone at the partyWhen I didn’t even know anybodyTruth is that you really broke my heartReally broke my heartFor one day, one day I was really, really, really, really sadFor one day, one whole day I missed you really, really, really badAnd a single tear trickled down my faceWhile I threw your shit in the fireplace I was really, really, really, really sadFor one day, one whole dayWiz Khalifa Wake up, make up I wake up, bake upQuit your cryin’ Why you messin’ up your makeup?Late night, I stay upTryin’ get my money way upSoon as I do, something wrongYou approach me the day ofYou tellin’ me it’s over and you’re doneAnd you can’t take no moreYou walkin’ out the door And I’m lying like what you waitin’ for?Just trying to get the truth I ain’t trying to be confrontationalBefore you make a decisionI’mma just let you stay For one day, one dayI was really, really, really, really sadFor one day, one whole day I missed you really, really, really badAnd a single tear trickled down my faceWhile I threw your shit in the fireplace I was really, really, really, really sadFor one day, one whole day #dixiedamelio #wixkhalifa #onewholeday"
"MTgKfVXpMBY","OUR GENDER REVEAL! | The Herbert's","2020-12-03T17:00:17Z","UCtPqR1gumPRaMLhSTlLn5nw","The Herbert's","22","20.10.12","abby|abbi|hurbert|herbets|herbert family|joshua hurbert|joshua|herbet|abi","4034147","127333","3612","8798","https://i.ytimg.com/vi/MTgKfVXpMBY/default.jpg","False","False","The wait is finally over... The Herbert's Official Baby Gender Reveal! We are so excited to share this moment with you. Subscribe to our channel for more videos!SIGN UP FOR RELATE CO.https://relateco.shop/passwordSubscribe to Abbie’s Channel: https://www.youtube.com/channel/UCQ0FHihUP3_hkeQ0_lwOBeA/videosSubscribe to Josh’s Channel: https://www.youtube.com/user/joshherbertmusicFollow us and be part of the Herbert Fam!—————————————————————————————————————Abbie’s Instagram: https://www.instagram.com/abbieherbert_/?hl=enJosh’s Instagram: https://www.instagram.com/joshherbert/?hl=enAbbie’s Twitter: https://twitter.com/AbbieHerbert_Josh’s Twitter: https://twitter.com/joshherbert?lang=enAbbie’s TikTok: https://www.tiktok.com/@abbieherbert_?lang=enJosh’s TikTok: https://www.tiktok.com/@josh_herbert?lang=enSpotify: https://open.spotify.com/artist/61ePJuIL6XaEV7hoycpVGZ?si=0i3py6yqR8-QfZ6UHd4vuwOUR CANDLE BUSINESS: https://herbertcandle.coABOUT US: Hi guys! We are Josh & Abbie Herbert! You might know us from our viral TikTok videos. We are known as that TikTok couple that is always doing the latest trends. We are so excited to have you on this journey with us. BUISNESS INQUIRIES: Abbie@talentxent.comJosh.Herbert@talentxent.comOUR MOST POPULAR VIDEOS Finding out I'm PREGNANT! https://youtu.be/BNhKSjfRzQUAsking My Husband **JUICY** Questions Girls Are Afraid Too Afraid To Ask: https://youtu.be/IJ-GYDZs8eYAsking My Wife *JUICY* Questions Guys Are Too Afraid To Ask https://youtu.be/bX5MqPGZO6s#TheHerberts #GenderReveal #BabyHerbert"
"qWUsV2Ios8A","India take 1-0 lead after dramatic T20 opener | Dettol T20I Series 2020","2020-12-04T12:25:13Z","UCkBY0aHJP9BwjZLDYxAQrKg","cricket.com.au","17","20.10.12","Australia|India|first T20I|Canberra|Manuka Oval","28064179","478398","22814","18023","https://i.ytimg.com/vi/qWUsV2Ios8A/default.jpg","False","False","India produced a gutsy comeback to claim victory by 11 runs over Australia as Yuzvendra Chahal starred with the ball after coming into the game at the halfway point as a concussion substitute for Ravindra Jadeja who posted an unbeaten 44.Stream all the ODI action via Kayo Sports: https://watch.cricket.com.au/ Fixtures, news, videos for the #AUSvIND T20Is: https://cricketa.us/AUSvIND20-T20IFollow us on Facebook: https://www.facebook.com/cricketcomauFollow us on Instagram: https://www.instagram.com/cricketcomauFollow us on Twitter: https://www.twitter.com/cricketcomau"
"9sqo3ksVp1E","West Ham v. Manchester United | PREMIER LEAGUE HIGHLIGHTS | 12/5/2020 | NBC Sports","2020-12-05T20:42:01Z","UCqZQlzSHbVJrwrn5XvzrzcA","NBC Sports","17","20.10.12","NBC Sports|NBC|NBCSN|Premier League|Soccer|Premier League 2020-21|PL 20-21|Premier League 2020-21 Matchweek 11|Matchweek 11|Premier League highlights|PL highlights|West Ham|West Ham v. Manchester United|West Ham highlights|Manchester United|Premier League extended highlights|PL extended highlights|Premier League highlights today|Manchester United highlights","469929","5516","129","789","https://i.ytimg.com/vi/9sqo3ksVp1E/default.jpg","False","False","Manchester United came from behind once again to win away from home, as Paul Pogba, Mason Greenwood and Marcus Rashford found the net to beat West Ham. #NBCSports #PremierLeague #WestHam #ManchesterUnited» Subscribe to NBC Sports: https://www.youtube.com/nbcsports?sub_confirmation=1» Watch Live Sports on NBCSports.com: http://www.nbcsports.com/live» Get more Premier League news on NBC Sports: https://nbcsports.com/soccer/premier-leagueWant more Premier League? Check out Peacock Premium: peacocktv.com/premierleagueNBC Sports Group serves sports fans 24/7 with premier live events, insightful studio shows, and compelling original programming. NBC Sports is an established leader in the sports media landscape with an unparalleled collection of sports properties that include the Olympics, NFL, Premier League, NHL, NASCAR, PGA TOUR, the Kentucky Derby, Tour de France, French Open, IndyCar and many more.Subscribe to our channel for the latest sporting news and highlights!The Premier League across NBC Sports Group launched in 2013 with their biggest and broadest programming commitment to-date in the United States. With live multi-platform coverage of all 380 games, analysis from best-in-class talent and extensive surrounding coverage all week long, NBC Sports Group has become the ultimate destination for new and existing Premier League fans.The Premier League maintains strong and consistent reach across NBC, NBCSN, CNBC, and NBC Sports Group’s live streaming products, led by the biggest stars and most prestigious teams in the world.Visit NBC Sports: https://www.nbcsports.comFind NBC Sports on Facebook: https://www.facebook.com/NBCSportsFollow NBC Sports on Twitter: https://twitter.com/nbcsportsFollow NBC Sports on Instagram: https://www.instagram.com/nbcsports/https://www.nbcsports.com/nfl/sunday-night-footballhttps://nbcsports.com/motors/nascarhttps://nbcsports.com/soccer/premier-leagueWest Ham v. Manchester United | PREMIER LEAGUE HIGHLIGHTS | 12/5/2020 | NBC Sportshttps://www.youtube.com/nbcsports"
"4fW_stRQcxw","Parkour VS Normal People In Real Life (Part 2)","2020-12-04T14:00:02Z","UChCBHudFoBnsF0O1flPXqiQ","Nick Pro","24","20.10.12","parkour|parkour vs|vs normal people|nick pro|parkour pov|parkour vs normal people|freerunning|stunts|rooftop parkour|world best parkour|normal vs parkour|parkour in real life|extreme parkour|best parkour|in real life|pov parkour|free running|parkour chase","2161373","49520","1719","1884","https://i.ytimg.com/vi/4fW_stRQcxw/default.jpg","False","False","Parkour VS Normal People In Real Life (Part 2) | Nick ProThis is what happens when a parkour athlete who flips does things that normal people do! 👨🏻‍🎤Subscribe👨🏻‍🎤 : https://bit.ly/SubNickPro🔔 Never miss a video, turn on Notifications! 🔔🎬 Watch More 🎬: https://www.youtube.com/playlist?list=PL9A7496ADDBBA0F75👕 Nick Pro & Parkour MERCH 👕: https://bit.ly/NickProMerch📷 INSTAGRAM 📷: https://bit.ly/NickProInsta✉️ WEBSITE ✉️: https://bit.ly/NickProWEB"
