video_id,title,publishedAt,channelId,channelTitle,categoryId,trending_date,tags,view_count,likes,dislikes,comment_count,thumbnail_link,comments_disabled,ratings_disabled,description
"9P7P1lxwZms","King Von - Wayne's Story (Official Video)","2020-12-08T17:00:09Z","UC47kJWRBD-NREBvmBg5kWeA","King Von","10","20.10.12","king von|king von 2018|king von official|king von music|otf|only the family|rap|hip hop|chicago hip hop|new hip hop songs","4468624","344216","3714","41593","https://i.ytimg.com/vi/9P7P1lxwZms/default.jpg","False","False","From the album Welcome to O'Block. Out now!Stream: https://music.empi.re/oblock.oydFollow King Von:https://www.instagram.com/kingvonfrmdaohttps://twitter.com/KingVonFrmdaWicSubscribe to King Von's official channel for exclusive music videos and behind the scenes looks: http://bit.ly/Subscribe-to-King-VonShop King Von's Get Back Gang Apparel Here:  https://thehyv.shop/collections/king-von#KingVon #WelcomeToOBlock #OTFOfficial music video by King Von - Wayne's Story © 2020 Only The Family Entertainment / EMPIRE"
"zsZM5nX8uPY","If Everything Was Like Among Us 4","2020-12-08T23:00:14Z","UCn3AViOfcFN4zIICMC5hvPg","Shiloh & Bros","22","20.10.12","among us|among us in real life|among us imposter|in real life|irl|among us reality|if everything was like among us|imposter iq|imposter among us|part 2|part 3|part 4|imposter|among us but in real life|real life|among us irl|among us parody|among us skit|funny among us|funny|funny among us moments|real life among us|imposter iq 999|imposter vs crewmate|imposter in real life|siblings|comedy|shiloh|shiloh and bros|real|shiloh nelson","4847966","120223","5232","14778","https://i.ytimg.com/vi/zsZM5nX8uPY/default.jpg","False","False","Among us in real life guys. Guess who the imposter is and let us know if you guessed correctly. This is a part 4 to our If Everything Was Like Among Us vid. Which person do you relate to the most? Get the Onepiece outfits we wear in the video here!! https://www.onepiece.com/us/?ref=bb-xwxyw2 Use code AMONGUS for 25% off. This is an affiliate link. Our merch store! https://shilohandbros.com/If you like Piper Rockelle, The Norris Nuts, Dixie D'Amelio, or the Txunamy, you'll love our channel. We do funny pranks, challenges, and skits!Shiloh's Instagram: https://www.instagram.com/shilohanelson/   Elijah's Instagram: https://www.instagram.com/iamelijahnelson/Our Tik Tok channel is ShilohAndBros   Subscribe here! http://bit.ly/ShilohToJudahChannelHit the bell to be notified when we post new videos! #amongus #imposteramongus #inreallife"
"LcDQqGJG8pA","Cobra Kai: Season 3 | Official Trailer | Netflix","2020-12-09T15:00:00Z","UCWOA1ZGywLbqmigxE4Qlvuw","Netflix","24","20.10.12","Karate Kid|Cobra Kai|Miyagi-Do|Ralph Macchio|William Zabka|Mary Mouser|Peyton List|Jacob Bertrand|Courtney Henggeler|Gianni DeCenzo|Xolo Mariduena|Tanner Buchanan|Martin Kove|Vanessa Rubio|Dan Ahdoot|Annalisa Cochrane|Daniel LaRusso|Johnny Lawrence|Mr. Miyagi|Netflix|Netflix Original|NX|Youtube Original|karate|dojo|fight|epic fight|Throwback|Metal|Rock|What To Watch|Wax On|Tournament|Drama|Chozen|New Years","1005114","56501","368","7252","https://i.ytimg.com/vi/LcDQqGJG8pA/default.jpg","False","False","New year. New season. Still badass. Season 3 of Cobra Kai premieres this January only on Netflix. And remember, Cobra Kai Never Dies.Watch Cobra Kai, only on Netflix: https://www.netflix.com/CobraKaiSUBSCRIBE: http://bit.ly/29qBUt7About Netflix:Netflix is the world's leading streaming entertainment service with over 195 million paid memberships in over 190 countries enjoying TV series, documentaries and feature films across a wide variety of genres and languages. Members can watch as much as they want, anytime, anywhere, on any internet-connected screen. Members can play, pause and resume watching, all without commercials or commitments.Cobra Kai: Season 3 | Official Trailer | Netflixhttps://youtube.com/NetflixWith a new sensei at the helm of the Cobra Kai dojo, a three-way feud takes center stage. Old grudges — like Cobra Kai — never die."
"303vmqUNC_U","Barcelona vs. Juventus: Extended Highlights | UCL on CBS Sports","2020-12-08T22:11:13Z","UCET00YnetHT7tOpu12v8jxg","Champions League on CBS Sports","17","20.10.12","Barcelona|Juventus|Barcelona vs. Juventus","1262567","13990","591","4289","https://i.ytimg.com/vi/303vmqUNC_U/default.jpg","False","False","Extended Highlights Presented By HeinekenJuventus and Ronaldo jumped out to an early 2-0 lead over Messi and Barcelona and they were never able to recover, dropping this one 3-0 on matchday 6 but both are on to the next stage. In the 13’ Ronaldo opened the scoring when he found the back of the net from the penalty spot. Then just 7 minutes later, Weston McKennie, the US Men’s National Team player, doubled the Juventus lead when acrobatically parked one in the net. Ronaldo was not finished with his day of scoring as he powered another home from the penalty spot yet again in the 52’. All match Barcelona was unable to finish their chances and Juventus took advantage, winning 3-0 in decisive fashion. Both sides will advance to the Round of 16. Stream every UEFA Champions League match live on CBS All Access:http://bit.ly/ucloncbssports #UEFA #Barcelona #Juventus #Messi #Ronaldo #UCL #ChampionsLeague #Matchday6"
"NAAwQ7pisjM","The Dixie D'Amelio Show With James Charles","2020-12-09T17:30:10Z","UCLOEGprmycLLbyzBj2jozLg","Dixie D'Amelio","22","20.10.12","dixie damelio|dixie d'amelio|dixie|damelio|be happy|music video|tik tok|dixie damelio be happy|dixie d'amelio be happy|charli damelio|charli d'amelio|tiktok|charli|d'amelio|exclusive|marc d'amelio|heidi d'amelio|talkshow|show|dog|dogs|me|fun|the dixie d'amelio show|noah beck|noah|dixie and noah|noah and dixie|hollywood fix|marc|heidi|hype house|sway house|james charles|james|charles|makeup|snails|snail|dinner with the damelios","1255083","109672","1688","5810","https://i.ytimg.com/vi/NAAwQ7pisjM/default.jpg","False","False","Hey guys! When is it a not great conversation when @James Charles! I'm so thankful for our friendship and being able to sit and talk with you! Thanks for coming on the show!!! I hope you all enjoy!!!Website: https://www.dixiedamelio.comSubscribe for more official content from Dixie: https://www.youtube.com/dixiedamelio?sub_confirmation=1Connect with me!TikTok: https://www.tiktok.com/@dixiedamelioInstagram: https://www.instagram.com/dixiedamelioTwitter: https://twitter.com/dixiedamelioWebsite: https://www.dixiedamelio.comConnect with James!YouTube: https://www.youtube.com/jamescharlesTikTok: https://www.tiktok.com/@jamescharlesInstagram: https://www.instagram.com/jamescharlesWe love our Tov chairs!https://tovfurniture.comCheck out my merch: https://dixiedamelio.shop/#dixiedamelio #jamescharles"
"9e9D7ABgHpU","Unbreakable Ice Cream Safe- How to make cool stuff (I made a class!)","2020-12-08T19:44:55Z","UCY1kMZp36IQSyNx_9h4mpCg","Mark Rober","28","20.10.12","[none]","4241284","265165","5758","19865","https://i.ytimg.com/vi/9e9D7ABgHpU/default.jpg","False","False","Enroll at https://Monthly.com/MarkRober and I'll see you in class!So stoked to finally announce my creative engineering class has just launched today! Enrollment is now open until Dec 27 at Monthly.com/MarkRober (link also in bio).This class is a hands-on, 30-day learning experience that will teach you how to use engineering and science to bring your creative ideas to life.During this class, I'm going to share with you my entire creative engineering process from start to finish. You're going to follow along with me as I fully design and engineer 3 brand new builds from scratch... from how I come up the idea, all the way through bringing the final builds to life.The best part is, over the month, you'll follow along with me and my process, side by side, and you will leave the class with 3 original, creative builds of your own.This is the class I wish I had when I was starting out. It's designed to take your skills to make cool stuff to the next level, whether you're a beginner or a more experienced maker/engineer.The class officially starts on January 4, 2021, and it will only run a few times per year, so claim your spot if you're interested!See you in class!-Mark"
"tyDRtSUYTRs","GTA Online: The Cayo Perico Heist","2020-12-09T15:07:11Z","UC6VcWc1rAoWdBCM0JxrRQ3A","Rockstar Games","20","20.10.12","[none]","1826999","160332","3786","16222","https://i.ytimg.com/vi/tyDRtSUYTRs/default.jpg","False","False","Anything goes on Cayo Perico, a private paradise that's home to the infamous El Rubio, the world’s preeminent narcotrafficker and supplier to the Madrazo family.  Cayo Perico is not only the nerve center of El Rubio’s drug empire, but the island also plays host to his other great love: marathon dance parties on golden beaches, where everyone from jetsetters and heiresses to legendary music producers gather to rave until the sun comes up.But away from the beach’s earthly delights lies an untold fortune in art, gold and drug money, scattered across the island. It’s the score of a lifetime for those who can find a way in.The Cayo Perico Heist is the biggest GTA Online adventure ever and will be available on December 15th.Stay tuned for more details, and check out the lineup for The Music Locker, Los Santos’ hottest new underground club that’s opening soon: http://rsg.ms/5d102a5Featured Music:Gettin' Money by Burna BoyProduced by KeinemusikBurna Boy appears courtesy of Atlantic Recording Corp.(p) 2020 Atlantic Recording Corp and Rockstar Games Inc."
"3pjluP5vNug","Jack Harlow - Way Out feat. Big Sean [Official Video]","2020-12-09T17:15:11Z","UC6vZl7Qj7JglLDmN_7Or-ZQ","Jack Harlow","10","20.10.12","jack harlow|jack rapper|harlow rapper|private garden|jack Harlow confetti|new jack Harlow|Louisville rapper|Kentucky rapper|white rapper|jack harlow what’s poppin|jack harlow whats popping|jack harlow whats poppin|whats poppin song|sweet action|tyler herro|jack harlow tyler herro|whats poppin|thats what they all say|jack harlow album|new album|way out|big sean|jack harlow way out|big sean way out|twtas|i can tell whos on the way out","852372","98701","639","7218","https://i.ytimg.com/vi/3pjluP5vNug/default.jpg","False","False","Jack Harlow - Way Out feat. Big Sean [Official Video]Listen now: https://JackHarlow.lnk.to/WayOut'Thats What They All Say' out Dec 11!Pre-save now: https://JackHarlow.lnk.to/ThatsWhatTheyAllSayProd Co: Riveting EntertainmentExec Prod: Andrew ListermannDirector: Ace ProProducer: Kevin BostonProd Mgr: Erica NagaiDP: Justin JonesMarketing: Alexandra “Ali B” BianchiCommissioner: Kareem Johnson / OverScene LLCFOLLOW JACK HARLOWWebsite: https://www.jackharlow.us/Instagram: https://JackHarlow.lnk.to/InstagramTwitter: https://JackHarlow.lnk.to/TwitterFacebook: https://JackHarlow.lnk.to/FacebookLISTEN TO JACK HARLOWYoutube: https://JackHarlow.lnk.to/YouTubeSoundCloud: https://JackHarlow.lnk.to/SoundCloudSpotify: https://JackHarlow.lnk.to/SpotifyApple: https://JackHarlow.lnk.to/AppleLYRICSSh*t is a jamSh*t is a jamI can tell who’s on the way out25 shows check the pay outI ain’t going home imma stay outMuf*ckas hate you when they lookin for a way outI just sit back and let it play outand She gon let me hit it any day now oohWhat you gon say now oohAmahhhhhMy ex girl got a baby oohBut she still let me stay now oohI got a Dallas and an H Town booGot a baddie out in Cape Town, tooWhole gang eating steak house foodGet the check, I ain’t checkin what it came out toI tell promoters I don’t talk about the moneyYou know who to hand the envelope toBig John got the cash and he been the go-toHeard the beat told Nickie put it in the Pro ToolsGot a fountain on the chain and it’s indigo blueMight f*ck around and get a gold toothI’m a restaurant-goer, never been to Whole FoodsShe gon listen to the song, say this sh*t a whole moodI’m in the mountains out West on a tour busTexting this chick I used to mess withGot her in the bath doing video shootsTried to send one to me but it didn’t go throughDamnAnd She gon let me hit it any day now oohWhat you gonna say now oohAmahhhhhMy ex girl got a baby oohBut she still let me stay now oohI can tell who’s on the way out25 shows check the pay outI ain’t going home imma stay outMuf*ckas hate you when they lookin for a way outI just sit back and let it play outAnd She gon let me hit it any day now oohWhat you gon say now oohAmahhhhMy ex girl got a baby oohBut she still let me stay now oohWhoa, whoa, yeahI get paid to do me that’s a fact checkI run it up then retrace my last stepsI’m in her eardrums talking about assets“Do you want a?” “Yes!” Hold up I ain’t even ask yetShe got her hair doneShe finna need it redoneBoy, that p*ssy so good (so good)Stuck it in damn near almost made me pre cumI let her give me some advice like I need someBooked up, tell a dumb b*tch read someI’m anointed, I’m the bossI done came out of pocket so muchYou thought that I was disjointedThey pointed me towards ya dissUm I’m disappointedMy ex treat me like I ain’t thereWhat happened to the feelings and love that we still share?Just like the girls who got my name tatted and covered upI know deep down, under the surface it’s still thereShe gon let me hit it any day now oohWhat you gon say now oohMy ex girl got a baby now oohBut she still let me stay now oohI can tell who’s on the way out25 shows check the pay outI ain’t going home imma stay outMuf*ckas hate you when they lookin for a way outI just sit back and let it play out(and) She gon let me hit it any day now oohWhat you gon say now oohAmaaahhhhEx girl got a bae now oohBut she still let me stay now oohThe official YouTube channel of Generation Now and Atlantic Records artist Jack Harlow. Subscribe for the latest music videos, performances, and more.SUBSCRIBE TO JACK’S YOUTUBE: https://JackHarlow.lnk.to/YouTube#JackHarlow #ThatsWhatTheyAllSay #WayOut"
"3DN4-LZFZtc","Riverdale | Season 5 Trailer | The CW","2020-12-09T18:00:11Z","UCJyEY_Iwtg8-FLP3Gg5pL0Q","Riverdale","24","20.10.12","riverdale|cw|lili reinhart|bughead|riverdale cast|cast sprouse|cole sprouse|varchie|archie|ronnie|beronica|cole|interview|camila mendes|kj apa lili reinhart|jughead|kj apa|veronica and archie|madelaine petsch|fashion|riverdale fan theories|cw show|cw tv|teen drama|mystery|bingeable tv|netflix|katy keene|NY Times Quotes Extended|Season Trailer","541803","67930","621","5663","https://i.ytimg.com/vi/3DN4-LZFZtc/default.jpg","False","False","Season 5 premieres Wednesday, January 20! Stream next day free only on The CW.SUBSCRIBE: https://go.cwtv.com/RVRYTSubscribeConnect with RIVERDALE:Stream FREE EPISODES: go.cwtv.com/genRVRytFollow RIVERDALE on INSTAGRAM: instagram.com/thecwriverdaleFollow RIVERDALE on TWITTER: twitter.com/CW_RiverdaleLike RIVERDALE on FACEBOOK: facebook.com/CWRiverdale#Riverdale About RIVERDALE:The Official YouTube Channel for The CW’s Riverdale – Based on the characters from the Archie Comics, Riverdale is a bold and subversive take on the wholesome town of Riverdale and some of its teen residents, including Archie, Betty, Veronica and Jughead as they discover the darkness and dangers that bubble underneath their town’s wholesome facade. About The CW:Official YouTube Channel for The CW Network featuring the hit series Riverdale, as well as All American, Batwoman, Black Lightning, The Flash, DC’s Stargirl, Supergirl, DC’s Legends of Tomorrow, Supernatural, Nancy Drew, Charmed, Dynasty, In the Dark, Legacies, Penn & Teller: Fool Us, Masters of Illusion, and Roswell, New Mexico.Connect with The CW Online:Visit The CW WEBSITE: http://on.cwtv.com/homeLike The CW on FACEBOOK: http://www.facebook.com/thecwFollow The CW on TWITTER: http://twitter.com/thecwFollow The CW on INSTAGRAM: http://instagram.com/thecwRiverdale | Season 5 Trailer | The CWhttp://www.youtube.com/user/Riverdale"
"ETnepJ1zgKQ","It Finally Happened | OT 20","2020-12-07T23:00:40Z","UCRijo3ddMTht_IHyNSNXpNQ","Dude Perfect","17","20.10.12","dude perfect|dude perfect stereotypes|dude perfect water bottle flip|bottle flip|water bottle flip|dude perfect bottle flip|dude perfect basketball|dp|dude perfect world record|edition|nerf|trick shots|trick shot|family|ping pong|bowling|clean|family friendly|bubble wrap|soccer|football|spinner|spinners|fidget spinners|dude|overtime|over|time|20|small|games|big|prizes|cool|not cool|wheel|unfortunate|plus|dp+|behind|the|scenes|cat|own a cat|chair|chair drop","6882447","342755","7068","30437","https://i.ytimg.com/vi/ETnepJ1zgKQ/default.jpg","False","False","The Wheel Unfortunate spin you’ve all been waiting for. Today's OT kicks off with a brand new segment, followed by all your faves! Thanks to Dr Pepper for sponsoring this video! Click HERE to learn more about the Tuition Giveaway! https://bit.ly/DrPepperDP Be sure to subscribe so you don't miss our 4 back-to-back OT's in December!► Thanks for subscribing! - http://bit.ly/SubDudePerfect► Subscribe to our Behind The Scenes channel! - https://bit.ly/DPplusSubscribeThanks for watching #Overtime20Intro: 0:00Small Games Big Prizes: 1:02Cool Not Cool: 7:44Dude Perfect Plus Sneak Peak: 15:24Wheel Unfortunate: 17:52Shout out to @WorkshopHustle (Instagram) for creating the unbelievable DP chair. We are terribly sorry for what happened in cool not cool... but equally as excited to see if you accept our challenge to build another chair!Special thanks to Little Elm Animal Shelter!NEXT LEVEL STUFF -------------------------------------------🎒 NEW Merch - http://bit.ly/DPStore🎮 Play our FREE iPhone game! - http://smarturl.it/DudePerfect2📱 Text us - (469) 205-7005🔔 Hit the bell next to Subscribe so you don't miss a video!👨🏻‍💻 Watch our newest vids! - http://bit.ly/NewDPVids📕 Read our Book - Go Big - http://amzn.to/OYdZ2sFollow our Instagrams so we can be best friends -------------------------------------------🏆 http://Instagram.com/DudePerfect🧔🏻 http://Instagram.com/TylerNToney👱🏻‍♂️ http://Instagram.com/Cody_Jones_🙋🏻‍♂️ http://Instagram.com/CobyCotton👨‍🦰 http://Instagram.com/GarrettHilbert⛹🏻‍♂️ http://Instagram.com/CoryCotton-------------------------------------------Bonus points if you're still reading this! Comment: Yay for Tiger Lilly!!Click here to learn more about Dude Perfect:http://bit.ly/AboutDudePerfectAs always...Go Big and God Bless!- Your friends at Dude PerfectBusiness or Media, please contact us at: Dude@DudePerfect.com------------5 Best Friends and a Panda.If you like Sports + Comedy, come join the Dude Perfect team!Best known for trick shots, stereotypes, battles, bottle flips, ping pong shots and all-around competitive fun, Dude Perfect prides ourselves in making the absolute best family-friendly entertainment possible! Welcome to the crew! Pound it 👊🏻 Noggin 🙇🏻‍♂️ - Dude Perfect"
"j-pKKM6CXr0","Why did I build Monoliths all around the World?","2020-12-08T23:07:07Z","UCJLZe_NoiG0hT7QCX_9vmqw","I did a thing","24","20.10.12","[none]","1841571","158666","4766","13360","https://i.ytimg.com/vi/j-pKKM6CXr0/default.jpg","False","False","Go watch their Netflix show!  https://www.netflix.com/auntydonnasbigolhouseoffunMonolith Location: https://www.google.com/maps/place/Doongalla+Picnic+Ground/@-37.8459467,145.3447355,469m/data=!3m1!1e3!4m5!3m4!1s0x0:0xda3df305fa212bb8!8m2!3d-37.8454896!4d145.3454013Patreon: https://www.patreon.com/user?u=13180179Twitter: https://twitter.com/ididathing1Discord: https://discord.gg/mppfmHW"
"Wm4eM19FGy0","Rich The Kid & YoungBoy Never Broke Again - Can't Let The World In (Official Video)","2020-12-09T17:00:29Z","UCvTEOPrdg8f_mufsqH3VGQw","Rich The Kid","10","20.10.12","[none]","306358","33978","279","1981","https://i.ytimg.com/vi/Wm4eM19FGy0/default.jpg","False","False","Listen to the album “Nobody Safe”. Out Now!Stream: https://music.empi.re/nobodysafe#RichTheKid #YoungboyNeverBrokeAgain #NobodySafeOfficial Audio by Rich The Kid & Youngboy Never Broke Again from the album Nobody Safe  © 2020 Rich Forever Music / EMPIRE"
"UnA7tepsc7s","Cyberpunk 2077 — Official Launch Trailer — V","2020-12-08T17:01:00Z","UC4zyoIAzmdsgpDZQfO1-lSA","Cyberpunk 2077","20","20.10.12","Cyberpunk|Cyberpunk 2077|CP|CP77|CP2077|2077|gameplay|official|trailer|video game|game|RPG|Night City|FPP|cd projekt|cd projekt red|CDPR|cd project|cd project red|Xbox|Xbox One|PlayStation|PlayStation 4|PS4|PS5|PlayStation 5|PC|Stadia","8661490","354278","4330","31918","https://i.ytimg.com/vi/UnA7tepsc7s/default.jpg","False","False","Would you rather live in peace as Mr. Nobody... or go down for all times in a blaze of glory?December 10th.#Cyberpunk2077 Cyberpunk 2077, an open-world, action-adventure story from CD PROJEKT RED, is coming to Xbox One, PlayStation 4, PC, and Google Stadia on December 10th, 2020. The game will also be playable on Xbox Series X and PlayStation 5 consoles when available.Pre-order now: https://www.cyberpunk.net/pre-orderAbout the game:Cyberpunk 2077 is an open-world, action-adventure story set in Night City, a megalopolis obsessed with power, glamour and body modification. You play as V, a mercenary outlaw going after a one-of-a-kind implant that is the key to immortality. You can customize your character’s cyberware, skillset and playstyle, and explore a vast city where the choices you make shape the story and the world around you.Learn more:https://www.cyberpunk.net https://www.twitter.com/CyberpunkGamehttps://www.facebook.com/CyberpunkGame https://www.instagram.com/CyberpunkGamehttps://www.discord.gg/CyberpunkGamehttps://www.CyberpunkGame.tumblr.comMusic:P.T. Adamczyk feat. Olga Jankowska – Never Fade Away (SAMURAI Cover)"
"32I0Qso4sDg","[HOONIGAN] Gymkhana 2020: Travis Pastrana Takeover; Ultimate Hometown Shred in an 862hp Subaru STI","2020-12-08T14:00:00Z","UCXlfi8sf6cKGQ8sOd0-yRuw","Hoonigan","2","20.10.12","Hoonigan|Gymkhana|Gymkhana 11|Gymkhana eleven|Gymkhana 2020|Gymkhana Annapolis|Gymkhana Maryland|Travis Pastrana|Travis Pastrana Gymkhana|Ken Block Gymkhana|Annapolis Jump|Annapolis car jump|Travis Pastrana Motocross|Subaru|Subaru Gymkhana|Subaru WRX STI|Subaru Rally|Subaru Motorsports|Pastranaland|Pit Viper|Kirby Chambliss|Stunt plane|Ego Alley","3987983","212376","1878","14218","https://i.ytimg.com/vi/32I0Qso4sDg/default.jpg","False","False","More than a decade-long rivalry between friends and rally drivers Travis Pastrana and Ken Block has culminated in a passing of the torch. Travis Pastrana is trying his hand at his own Gymkhana film, shot and edited by the same crew that makes all the Gymkhana films: Hoonigan Media Machine.  Who’s the real winner here? You! Gymkhana 2020 is brought to you by: Subaru USAWeb: https://www.subaru.com/IG: https://www.instagram.com/subaru_usa/FB: https://www.facebook.com/subaruofamerica/ Subaru MotorsportsWeb: https://www.subaru.com/motorsportsIG: https://www.instagram.com/subarumotorsportsusa/FB: https://www.facebook.com/subarumotorsportsusa/ Yokohama TireWeb: https://www.yokohamatire.comIG: https://www.instagram.com/yokohamatire/FB: https://www.facebook.com/yokohamatire OmazeWeb: https://www.omaze.com/*** Enter for your chance to win the custom built Subaru STI in this video: https://bit.ly/You-Custom-Subaru *** Pit ViperWeb: https://www.pitvipersunglasses.comIG: https://www.instagram.com/pit_viper/?hl=enFB: https://www.facebook.com/pitviperlifestyle/ Black Rifle Coffee CompanyWeb: https://www.blackriflecoffee.comIG: https://www.instagram.com/blackriflecoffee/?hl=enFB: https://www.facebook.com/blackriflecoffeeco/  Steel-it CoatingsWeb: https://www.steel-it.comIG: https://www.instagram.com/steelitcoatings/?hl=enFB: https://www.facebook.com/STEELITCOATINGS/  Method Race WheelsWeb: https://www.methodracewheels.comIG: https://www.instagram.com/methodracewheels/?hl=enFB: https://www.facebook.com/MethodRaceWheels/ Big props to Connor Stitt on his double backflip in this video... at only 9 years old!? Give him a follow: https://www.instagram.com/connor.stitt/For press inquiries, please contact Ron Zarasron@hoonigan.com We’ve got channels for all your car content needs. Subscribe, nerds. The Hoonigans: https://www.youtube.com/user/TheHoonigans?sub_confirmation=1 Project Cars: https://www.youtube.com/c/HooniganProjectCars??sub_confirmation=1 Daily Transmission: http://www.youtube.com/c/HooniganDailyTransmission?sub_confirmation=1 Ken Block: https://www.youtube.com/KenBlockHHIC?sub_confirmation=1 AutoFocus: https://www.youtube.com/channel/UCuGuOqcXsgzL3YrguODoGXw?sub_confirmation=1 Bonus: https://www.youtube.com/channel/UCFhUumuHyYL-mAXSeZVbqMg?sub_confirmation=1 Stay fresh with the latest apparel: https://www.hoonigan.com/thenewnew Facebook: https://www.facebook.com/TheHoonigans/ Instagram: https://www.instagram.com/thehoonigans/ Follow Our Crew:@brianscotto@hertlife@vin_tra@dangerdan3@mister_zachary@jchase7452@nadsynads@larry_chen_foto@suppymk4@amezcua_fs1@roncar And don’t forget to turn on notifications so you don’t miss out on our latest uploads!https://www.hoonigan.com/"
