video_id,title,publishedAt,channelId,channelTitle,categoryId,trending_date,tags,view_count,likes,dislikes,comment_count,thumbnail_link,comments_disabled,ratings_disabled,description
"Bbyftsl7Owo","Best Friends Buy Each Other Christmas Gifts!","2020-12-22T20:01:49Z","UCucot-Zp428OwkyRm2I7v2Q","James Charles","24","20.23.12","james|james charles|makeup artist|mua|covergirl|coverboy|cute|easy makeup|how-to|reviews|tutorials|funny videos|beauty tips|hacks|beauty|sister|sisters apparel|morphe|james charles x morphe|lips|prom makeup|tik tok makeup|tik tok hacks|tik tok beauty hacks|christmas|christmas gifts|secret santa|best friends|charli d'amelio|dixie d'amelio|chase hudson|lilhuddy|larri|larrayxo|noah beck|squad|best friends halloween|best friends christmas|holiday special","3362675","320547","3287","22833","https://i.ytimg.com/vi/Bbyftsl7Owo/default.jpg","False","False","HI SISTERS! Happy Holidays! Today's video is another massive collabs with my best friends, Charli & Dixie D'Amelio, Noah Beck, Larray, and Chase Hudson! We played Secret Santa and got each other super emotional gifts to celebrate an amazing year all together. We hope you enjoy and don't forget to thumbs up and subscribe!!JAMES'S VIDEO » https://youtu.be/Bbyftsl7OwoCHARLI'S VIDEO » https://youtu.be/20WNckAJbXUDIXIE'S VIDEO » https://youtu.be/I9RC_DANDAMNOAH'S VIDEO » https://youtu.be/KLjUPvrSG_QCHASE'S VIDEO » https://youtu.be/PIiY2z1A27ALARRAY'S VIDEO » https://youtu.be/R3JQPlYb6vg🎥 PREVIOUS VIDEO » 👕 SISTER'S APPAREL » http://sisters-apparel.com🛎 Subscribe to my channel to join the sisterhood & hit the notification bell so you never miss an upload! » http://bit.ly/JamesCharles for new videos!💞 LET'S BE BFFSTEXT ME! » 310-905-8746INSTAGRAM » http://instagram.com/jamescharlesFACEBOOK » http://facebook.com/jcharlesbeautyTWITTER » http://twitter.com/jamescharlesSNAPCHAT » jamescharlessTIKTOK » jamescharles💌 Business Inquiries » business@spinandco.com💸 COUPON CODES 💸USE CODE JAMES FOR MONEY OFF YOUR ORDER!MORPHE » http://morphebrushes.comLILLY LASHES » https://lillylashes.com/LAURAS BOUTIQUE » http://lauras-boutique.com🔥 MY AMAZING TEAMDIRECTOR OF CONTENT: Louis Gargiulahttp://instagram.com/louisgargiulaEDITOR: Ryan Allenhttp://www.youtube.com/user/helloxryan GRAPHICS: Michael Rusakovhttp://instagram.com/michael.nyOUTRO SONG: Earcandyhttps://earcandy.lnk.to/christmas/"
"KLjUPvrSG_Q","Gingerbread House Competition Ft. My Best Friends","2020-12-22T20:01:59Z","UClPsjnF7D_Ar1ZSrEsnTxJA","Noah Beck","24","20.23.12","dixie d’amelio|charli d’amelio|james charles|larraye|lilhuddy|chase hudson|noah beck|dixie|charli|noah|chase|larri|james|christmas collab|xmas|gingerbread|gingerbread contest|collab|doah","1102277","108632","1002","4847","https://i.ytimg.com/vi/KLjUPvrSG_Q/default.jpg","False","False","What's up guys and Happy Holidays!! In today's video my best friends and I will be pairing up to compete to see who can make the best Gingerbread House. May the best pair win!!JAMES'S VIDEO » https://youtu.be/Bbyftsl7OwoLARRAY'S VIDEO » CHARLI'S VIDEO » https://youtu.be/20WNckAJbXUDIXIE'S VIDEO » https://youtu.be/I9RC_DANDAMCHASE'S VIDEO » https://youtu.be/PIiY2z1A27A...to see more of me, follow my social medias below!!GET YOUR MERCH (ur luv'd): https://shopurluvd.com/Instagram: https://www.instagram.com/noahbeck/?hl=enTikTok: http://vm.tiktok.com/ZMJm2bnHd/Twitter: https://twitter.com/noahbeck?s=11Snapchat: noah_beck8"
"sY8gUtyeAKE","Coming 2 America - Official Trailer","2020-12-22T14:59:46Z","UCQJWtTnAHhEG5w4uN0udnUQ","Amazon Prime Video","24","20.23.12","coming to america|coming 2 america|coming 2 america trailer|coming to america 2|coming to america 2 trailer|coming to america trailer|trailer|official trailer|official trailer 2021|trailer 2021|eddie murphy coming to america|eddie murphy coming to america 2|arsenio hall|arsenio hall coming to america|arsenio hall coming to america 2|james earl jones|james earl jones coming to america|james earl jones coming to america 2|amazon|amazon prime video|prime video","2555700","44047","1113","4552","https://i.ytimg.com/vi/sY8gUtyeAKE/default.jpg","False","False","Set in the lush and royal country of Zamunda, newly-crowned King Akeem (Eddie Murphy) and his trusted confidante Semmi(Arsenio Hall) embark on an all-new hilarious adventure that has them traversing the globe from their great African nation to the borough of Queens, New York – where it all began. Available March 5th on Prime Video. Starring: Eddie Murphy, Arsenio Hall, Jermaine Fowler, Leslie Jones, Tracy Morgan, KiKi Layne, Shari Headley, with Wesley Snipes and James Earl Jones. Also starring John Amos, Teyana Taylor, Vanessa Bell Calloway, Paul Bates, Nomzamo Mbatha, Bella Murphy Screenplay by: Kenya Barris and Barry W. Blaustein & David Sheffield Story by: Barry W. Blaustein & David Sheffield and Justin Kanew Directed by: Craig Brewer Based on characters created by: Eddie Murphy Produced by: Kevin Misher and Eddie Murphy Costumes by: Ruth E. Carter.» SUBSCRIBE: http://bit.ly/PrimeVideoSubscribe About Prime Video:Want to watch it now? We've got it. This week's newest movies, last night's TV shows, classic favorites, and more are available to stream instantly, plus all your videos are stored in Your Video Library. Over 150,000 movies and TV episodes, including thousands for Amazon Prime members at no additional cost. Get More Prime Video: Stream Now: http://bit.ly/WatchMorePrimeVideoFacebook: http://bit.ly/PrimeVideoFBTwitter: http://bit.ly/PrimeVideoTWInstagram: http://bit.ly/AmazonPrimeVideoIG Prime Videohttps://www.youtube.com/PrimeVideo"
"Ty-CHgmCeKw","Lil Durk - Backdoor (Official Music Video)","2020-12-21T05:00:10Z","UCaxOQZrF5llUMp-JjesUz1A","Lil Durk","10","20.23.12","lil durk|lil durk music|lil durk music video|just cause yall waited 2|lil durk 2020|just cause y'all waited 2|durkio|smurkio|lil durk official|drill|drill music|chicago hip hop|only the family|OTF|backdoor|back door|king von|von","3967492","197974","4738","18404","https://i.ytimg.com/vi/Ty-CHgmCeKw/default.jpg","False","False","Stream: https://smarturl.it/BackdoorDurkShot by @JerryPHDFollow Lil Durk:https://instagram.com/durkioworldhttps://twitter.com/lildurkhttps://fb.com/lildurkhttps://soundcloud.com/lildurkhttp://officiallildurk.comSubscribe to Lil Durk's official channel for exclusive music videos and behind the scenes looks: http://bit.ly/Subscribe-to-Durk#lildurk #otf #backdoor"
"w-G39yJCHeA","among us NEW DOCTOR ROLE (mods)","2020-12-21T18:00:45Z","UCsEgeyBfOnGGBpjIvkDJbWg","Socksfor1","20","20.23.12","Socksfor1|among us|among us mods|socksfor1 mods|among us NEW DOCTOR ROLE (mods)|among us roles|among us medic|among us revive players|among us impostor|among us impostor iq players|among us update|among us termiantor|among us but the impostor can drag bodies|among us new update","4358630","130547","3604","8784","https://i.ytimg.com/vi/w-G39yJCHeA/default.jpg","False","False","today in among us we added a doctor role (revive players) Previous Video →https://www.youtube.com/watch?v=ne0WPNUNe8M#amongus#ModFriends (sub to them) Fatmemegod- https://bit.ly/33oDf0GBlaza-https://bit.ly/3cWCMGjJuice- https://bit.ly/3oga4ENNadwe- https://bit.ly/3mmpJ4O⛏️JOIN SERVER → socks.gg use code Socksfor1 in the item shop ad😀TIKTOK→ https://bit.ly/2UynFdt👽REDDIT → https://bit.ly/3ejZBmf🔴TWITCH → https://bit.ly/3iSmkcq📷INSTAGRAM → https://bit.ly/38KFjRA 🐦TWITTER → https://bit.ly/2Oi0YHC👕NEW MERCH → https://bit.ly/2AThH0O🎥2ND CHANNEL → https://bit.ly/38Kb6SQ 😀DISCORD → https://bit.ly/2ZXonUcMUSIC → https://bit.ly/3edT2Sc (Kevin MacLeod)→ https://bit.ly/3kdvbVY (Epidemic) OUTRO → https://bit.ly/2DoKefpMODPACK → EDITOR → praduhEMAIL→ nicholas@socksfor1.comFamily Friendly PG Clean 13+"
"XrRcfaWutLQ","LIVE! See the Great Conjunction (Christmas Star) of 2020","2020-12-22T02:45:05Z","UC4zmFY211sXfEamwmsJcrYA","Lowell Observatory","28","20.23.12","Lowell Observatory|Giovale Open Deck Observatory|astronomy|stargazing|telescopes|Stargazing|Live|Leonids|Leonids Meteor Shower|ChristmasStar","2130396","31176","583","432","https://i.ytimg.com/vi/XrRcfaWutLQ/default.jpg","False","False","*Update 12/21: Skies are perfectly clear here in Flagstaff, Arizona! Below is tonight's Great Conjunction Program Schedule (all times MST; schedule subject to change).0:00:00 | Dr. Jeff Hall, Lowell Observatory Director: Welcome00:04:31 | Dr. Michael West, astronomer: Winter and Summer Solstice Around the World 00:24:24 | Jos Schindler, educator: Introduction to the 2020 Great Conjunction00:46:08 | Dr. Jennifer Hanley, planetary scientist: The Icy Moons of Jupiter and Saturn01:07:45 | Dr. Larry Wasserman, planetary scientist: Thoughts on This (and Other) Great Conjunctions01:23:42 | Jos Schindler, educator: Recap of the 2020 Great Conjunction01:32:10 | Dr. Joe Llama, astronomer: Conjunctions in Other Planetary Systems01:49:09 | Kevin Schindler, historian: Historic Conjunctions and the Christmas Star 02:09:37 | Dr. Nick Moskovitz, planetary scientist: Ursids Meteor Shower02:28:21 | Dr. Jeff Hall, Lowell Observatory Director: Closing RemarksOnce every 20 years, the two largest planets in our solar system—Jupiter and Saturn—appear to meet in Earth’s skies. This “Great Conjunction” happens next on December 21, 2020, but this time, Jupiter and Saturn will be closer than they’ve been in nearly 400 years.  December 21 also happens to be the night of the winter solstice, and the peak of the Ursid meteor shower. For most Great Conjunctions, Jupiter and Saturn are separated by about 1 degree, which is the width of two full moons in the sky. This year, they will be separated by just one-tenth of a degree, which is one-fifth the size of the full moon. A Great Conjunction happens every 20 years, but the last time Jupiter and Saturn were this close was the year 1623.Join Lowell Observatory at 5pm MST on Monday, December 21, 2020, to celebrate the Great Conjunction with an evening of telescope viewing and commentary from Lowell's own astronomers and educators.#ChristmasStar"
"WQ8Xgp8ALFo","Robot Barber V2. Just mess my stuff up.","2020-12-22T16:07:20Z","UCj1VqrHhDte54oLgPG4xpuQ","Stuff Made Here","28","20.23.12","stuff made here|haircut robot|invention|quarantine haircut|robotics|engineering|incredible inventions","552774","46003","299","3378","https://i.ytimg.com/vi/WQ8Xgp8ALFo/default.jpg","False","False","The first 1000 people to use this link will get a free trial of Skillshare Premium Membership: https://skl.sh/stuffmadehere12201Please consider supporting these projects through my patreon: http://patreon.com/stuffmadehere Although very fun, these videos are very time consuming and expensive.I use a glowforge pro for rapid prototyping and it's great. You can $500 off a Glowforge pro here: http://glowforge.com/stuffmadehere -----------It was time to take another pass on the hair cutting robot. The new robot is bigger, better, way more reliable and travel friendly. I tried to cut MatPats hair (live) then my brothers hair and then my own. For some reason I'm compelled to improve the pattern carving functionality even though I have zero desire to actually use it....One final thing - if you know of any actual problems that could use a better solution please leave a comment. One of my goals is to make a portion of my projects attempts at solving legitimately useful problems and I would love to have a good list of them. Thanks!"
"1hx_LdKeexk","Reindeer Christmas Prank (Behind The Scenes)","2020-12-21T23:01:13Z","UCmo9ZEJ3ipgaZdkiRRYtLAg","Dude Perfect Plus","22","20.23.12","dude|perfect|plus|bonus|bts|behind|the|scenes|extra|compilation|dp|editors|funny|bloopers|deleted|family|team|trick|shot|shots|battle|stereotype|overtime|sparky|tyler|cory|coby|cody|garrett|panda|chad|tim|derek|hashtag|prank|Christmas|snow|santa|reindeer|elf","845561","35097","360","1182","https://i.ytimg.com/vi/1hx_LdKeexk/default.jpg","False","False","December 2020 was FULL of Overtime! With a brand new episode every Monday!! Everything you love about Dude Perfect.. plus even more!  Be sure to SUBSCRIBE for more behind the scenes, bloopers, and bonus content! ► CLICK HERE: http://bit.ly/DPplusSubscribe► Click HERE to watch the main video: https://youtu.be/LP02BulYw3g► Click HERE to watch more Behind the Scenes on Dude Perfect Plus: https://www.youtube.com/watch?v=XBh4bnd51c4&list=PLC_fTveW0jTZ-jc2LqY4dvhpyYSuPgNB7&ab_channel=DudePerfectPlusNEXT LEVEL STUFF -------------------------------------------🎒 NEW Merch - bit.ly/DPStore🎮 Play our FREE iPhone game! - http://smarturl.it/DudePerfect2📱 Text us - (469) 205-7005🔔 Hit the bell next to Subscribe so you don't miss a video!👨🏻‍💻 Watch our newest vids! - http://bit.ly/NewDPVids📕 Read our Book - Go Big - http://amzn.to/OYdZ2sFollow our Instagrams so we can be best friends -------------------------------------------🏆 http://Instagram.com/DudePerfect🧔🏻 http://Instagram.com/TylerNToney👱🏻‍♂️ http://Instagram.com/Cody_Jones_🙋🏻‍♂️ http://Instagram.com/CobyCotton👨‍🦰 http://Instagram.com/GarrettHilbert⛹🏻‍♂️ http://Instagram.com/CoryCotton-------------------------------------------Bonus points if you're still reading this! Comment: Codes got hosed!Click here to learn more about Dude Perfect:http://bit.ly/AboutDudePerfectAs always...Go Big and God Bless!- Your friends at Dude PerfectBusiness or Media, please contact us at: Dude@DudePerfect.com------------5 Best Friends and a Panda.If you like Sports + Comedy, come join the Dude Perfect team!Best known for trick shots, stereotypes, battles, bottle flips, ping pong shots and all-around competitive fun, Dude Perfect prides ourselves in making the absolute best family-friendly entertainment possible! Welcome to the crew! Pound it 👊🏻 Noggin 🙇🏻‍♂️ - Dude Perfect"
"6abApk-3lOM","Filipino Food *GALORE* Mukbang - Moms Foodtruck is here","2020-12-21T21:01:42Z","UC3EFKdXAU99j3ppGgvTz7XQ","Bretman Rock","22","20.23.12","bretman|bretman rock|funny|video|dabaddest","1680607","155777","957","7805","https://i.ytimg.com/vi/6abApk-3lOM/default.jpg","False","False","Please give it a thumbs up and share this video! ------------------------------------------------------------------------------- AFFILIATION/DISCOUNT CODES -Morphe - 10% off entire purchasehttps://www.morphebrushes.comCode: BretmanRockOfra CosmeticsCode: BretmanRockOfracosmetics.com Nubounsom Lashes - 20% entire purchasehttps://www.nubounsom.comCode: Bretman Lilly Lashes - 10% off entire Purchasehttps://www.lillylashes.comCode: BretmanWhite With Style - $28 for any whitening kitshttps://www.whitewithstyle.comLAGirlUsa.comCode: BretmanRock10 for 10% off_____________________- KEEP IN TOUCH - Website | BretmanRock.comInstagram | @Bretmanrock - http://instagram.com/bretmanrock/Twitter | @BretmanRock - https://twitter.com/bretmanrockSnapchat | @BretmanRockTumblr | bretmanrock.tumblr.comFacebook | The Bretman RockTikTok | @bretmanrockEmail/Business | management@dabaddest.com"
"fmAtBZSTBYA","House Tour Part 1 | Dhar and Laura","2020-12-22T02:10:50Z","UCyA2du_flsYZHLaoU_5Qjkg","Dhar and Laura","24","20.23.12","dhar mann|dhar and laura|dhar mann and laura g|laura g|dhar manns house|dhar and lauras house|house tour|dhar and laura house tour|vlog|couples vlog|ella rose|ella rose mann|dhar mann house tour","445186","31698","742","23361","https://i.ytimg.com/vi/fmAtBZSTBYA/default.jpg","False","False","We hope you loved our House Tour Part 1! Part Two is coming real soon. To WIN an iPhone 12, all you have to do is SUBSCRIBE + COMMENT your Instagram or Twitter handle so we can message you if you won!ALSO, BIG THANK YOU to Chad Mellon Studio who shot and edited this video, check them out on Instagram here: https://www.instagram.com/chadmellon/?hl=en💥 Don't forget to SUBSCRIBE to our channel by clicking here ➞ ➞ http://bit.ly/DharAndLauraYouTube **Make sure you click the bell icon so you can get notifications when our next video goes up so you don’t miss anything!CONNECT ON SOCIAL MEDIA: Follow official Dhar Mann and Laura G (LauraG_143) accounts below:Laura's Profiles:Instagram ➜ https://www.instagram.com/laurag_143 AND https://www.instagram.com/sweetlifeoflaura/TikTok ➜ https://www.tiktok.com/@laurag_143Pinterest ➜ https://www.pinterest.com/LauraG_143O...Dhar's Profiles:Facebook ➜ https://www.facebook.com/dharmannoffi...YouTube ➜ http://bit.ly/DharMannYouTubeInstagram ➜ https://www.instagram.com/dhar.mann/TEXT Dhar (213-212-4550) ➜ http://bit.ly/DharMannCommunityTikTok ➜ https://www.tiktok.com/@dhar.mannShop Merch ➜ https://shop.dharmann.com/Stay up to date with Ella Rose here: https://bit.ly/2YFfvDl"
"c7HEM58-SC4","Try Not to Laugh Challenge #60 - Gauntlet w/ Our Crew!","2020-12-22T18:00:13Z","UCYJPby9DRCteedh5tfxVbrw","Smosh Pit","22","20.23.12","smosh|smosh pit|smosh games|funny|comedy|Try Not to Laugh Challenge #60 - Gauntlet w/ Our Crew!|christmas|try not to laugh|try not to laugh challenge|tntl|crew|employees|team|improv|smosh crew","353856","35853","246","1677","https://i.ytimg.com/vi/c7HEM58-SC4/default.jpg","False","False","Today we’re back in the Gauntlet hot seats and our CREW is up for the Try Not To Laugh challenge!This video was shot with a very limited crew. All cast & crew followed all CDC and California COVID-19 precautions and filming guidelines.Watch last year’s Gauntlet with our crew: https://youtu.be/V2P96OFekCEPunch that bell icon so you'll know when we add a new episode!SHOP THE SMOSH CLOTHING LINE: https://smosh.storeCASTTommy Bowe: https://www.instagram.com/tomeybonesRachel Evans: https://www.instagram.com/rachelsamevansSpencer Agnew: https://www.instagram.com/spennser/Yasmeen Mughal: https://www.instagram.com/themughalempire/Matt Duran: https://www.instagram.com/durrrrran/Garrett Palm: https://www.instagram.com/gpalm79/Kevin Rygg: https://www.instagram.com/kevin_ryggLayne Pavoggi: https://twitter.com/laynepavoggiMatt Raub: https://www.instagram.com/mattraub/Sarah Whittle: https://www.instagram.com/rudeunicorns/Lisa Van Lenner https://www.instagram.com/herestheproblem/Ian Hecox: https://www.instagram.com/ianhecox/Courtney Miller: https://www.instagram.com/co_mill/Shayne Topp: https://www.instagram.com/shaynetopp/Damien Haas: https://www.instagram.com/damienhaas/Keith Leak: https://www.instagram.com/keithleakjr/Jacklyn Uweh: https://www.instagram.com/jacklyn_uweh/Kimmy Jimenez: https://www.instagram.com/kimmydoesstuff/CREWVice President, Unscripted: Matt RaubExecutive Producer/Director: Sarah WhittleEditor: Rock ColemanProducer/Cam Op: Kevin RyggProduction Manager: Garrett PalmProduction Coordinator: Nancy AzconaArt Director: Cassie VanceArt Coordinator: Yasmeen MughalArt Assistant: Alex AguilarDP: Brennan IketaniCam Op / G&E: Dustin BloodgoodSound Mixer: Greg JonesAssistant Editor/DIT: Matt DuranPA: Jacqi JonesPA: Andrew HarmonGFX: Brittany Metz Content Manager: Kiana ParkerStage Manager: David HillExecutive Assistant: Sammie MillerWatch BTS Stans: The World's Most Powerful Army: https://youtu.be/icULJn8sk1UWatch Try Not To Loud Challenge!: https://youtu.be/EiGipxBqhuYWatch The Dumbest Way to Die is… (Board AF): https://youtu.be/RuHugUy2g8AWatch Uno Battle in Smosh Vegas!: https://youtu.be/9jwCO8HacbkSubscribe To Smosh Pit: https://smo.sh/Sub2SmoshPitFollow Us:Instagram: https://instagram.com/smoshTikTok: https://smo.sh/TikTokTwitch: https://twitch.tv/smoshgamesFacebook: https://facebook.com/smoshTwitter: https://twitter.com/smoshCheck Out Our Other Smosh Channels:Smosh: https://smo.sh/Sub2SmoshSmosh Games: https://smo.sh/Sub2SmoshGamesSmoshCast: https://smo.sh/Sub2SmoshCast"
"4SjOv_szzVM","What It Takes to Break a RAM with ESD (ft. Linus Tech Tips)","2020-12-22T18:00:01Z","UCJ0-OtVpF0wOKEqT2Z1HEtA","ElectroBOOM","28","20.23.12","educational|electrical|ElectroBOOM|science|electronics|engineering|entertainment|equipment|measurement|experiment|mehdi|mehdi sadaghdar|arc|mishap|physics|Sadaghdar|test|tools|circuit|funny|learn|shock|spark|discharge|high voltage|electrostatic discharge|esd|RAM|computer parts|esd protection|handling|grounding","414672","56198","476","2992","https://i.ytimg.com/vi/4SjOv_szzVM/default.jpg","False","False","Go to https://expressvpn.com/electroboom and find out how you can get 3 months of ExpressVPN free!Watch my Colab with Linus: https://youtu.be/nXkgbmr3dRAWe handle computer parts without ESD protection most of the times. But what does it take to break one with ESD through human body? Let’s check it out!Support ElectroBOOM: http://patreon.com/electroboomCheckout my merch: http://teespring.com/stores/electroboomCheckout my Amazon picks (my affiliate link): https://www.amazon.com/shop/ElectroboomPost your submissions to: http://reddit.com/r/electroboom My Facebook: http://www.facebook.com/ElectroBOOMMy Twitter: http://twitter.com/electroboomguyMy other articles: https://www.electroboom.com/Thanks to http://CircuitSpecialists.com and http://keysight.com for proving my essential lab tools and giveaways.Below are my Super Patrons with support to the extreme!Nicholas Moller at https://www.usbmemorydirect.comSam LutfiEIM Technology: https://www.eimtechnology.com/Maestri Investment Group Ltd.: https://investmaestri.com/Enter your school for tools: https://goo.gl/forms/VAgRre8rLVvA1cEi2My sponsors and top patrons: http://www.electroboom.com/?page_id=727By: Mehdi Sadaghdar--------------------------------------------------------------------------"
"dg2Ag3e8W-Q","I Opened A Restaurant That Pays You To Eat At It","2020-12-19T22:00:03Z","UCX6OQ3DkcsbYNE6H8uQQuVA","MrBeast","24","20.23.12","[none]","25795222","1887854","16965","630876","https://i.ytimg.com/vi/dg2Ag3e8W-Q/default.jpg","False","False","Download our MrBeast Burger App and order food NOW!IOS - https://apps.apple.com/us/app/mrbeast-burger/id1543431762android - https://play.google.com/store/apps/details?id=com.chepri.mrbeastburgerNew Merch - https://shopmrbeast.com/SUBSCRIBE OR I TAKE YOUR DOG╔═╦╗╔╦╗╔═╦═╦╦╦╦╗╔═╗║╚╣║║║╚╣╚╣╔╣╔╣║╚╣═╣ ╠╗║╚╝║║╠╗║╚╣║║║║║═╣╚═╩══╩═╩═╩═╩╝╚╩═╩═╝----------------------------------------------------------------follow all of these or i will kick you• Facebook - https://www.facebook.com/MrBeast6000/• Twitter - https://twitter.com/MrBeastYT•  Instagram - https://www.instagram.com/mrbeast--------------------------------------------------------------------"
"RezB3Pn85yE","morray - dreamland (official music video)","2020-12-21T23:30:13Z","UCyVppwD0G-t1KQM9zWn_oOA","Morray","10","20.23.12","Morray|R&B|Hip Hop|Rap|pick six records|morray dreamland|dreamland morray|dreamland|dream land|moray quicksand|quicksand morray|morray switched up|morray low key|moray|murray|christmas|birthday|genius|fayetteville|North Carolina|rod wave|morae|rmr|roddy ricch|dababy|lyrical rap|melodic rap|pain|quicksand|black music|nba youngboy|future life is good|morray quicksand|rap music|hip hop music|music|morrayda1","362993","31961","281","3736","https://i.ytimg.com/vi/RezB3Pn85yE/default.jpg","False","False","Download: https://picksix.ffm.to/dreamland IG: @morrayda1Subscribe to Morray https://tinyurl.com/yy8fzunhFollow Morray (@morrayda1)http://facebook.com/morrayda1http://soundcloud.com/morrayda1http://instagram.com/morrayda1http://twitter.com/morrayda1video by Christian Breslauer @christhedirectormorray dreamland"
"4VeMZFmWkEs","VLOG #1: Q & A SNEAK PEAK","2020-12-20T17:27:46Z","UCHvpvPosasDgAbqGumlQqAw","ANNA SHUMATE","22","20.23.12","[none]","320523","21939","1230","1036","https://i.ytimg.com/vi/4VeMZFmWkEs/default.jpg","False","False","WATCH THE FULL VIDEO HERE https://anna-shumate.vhx.tv/Visit Anna Shumate's Official Websiteanna-shumate.comFollow Anna Shumate's Social Media Accountshttps://www.instagram.com/annashumatee/https://www.tiktok.com/@annabananaxdddd?lang=enSnapchat: shumate.annahttps://twitter.com/anna_shumateProduced and Filmed bythatguccigoosehttps://www.instagram.com/thatguccigoose/"
