video_id,title,publishedAt,channelId,channelTitle,categoryId,trending_date,tags,view_count,likes,dislikes,comment_count,thumbnail_link,comments_disabled,ratings_disabled,description
"hmnhDiGKPjc","Cyberpunk 2077 in a Nutshell","2020-12-18T16:59:36Z","UCV6g95OBbVtFmN9uiJzkFqQ","CircleToonsHD","1","20.23.12","Cyberpunk 2077 in a Nutshell|cyberpunk 2077|cyberpunk meme|cyberpunk 2077 bugs|glitch|funny|story|jackie|johnny silverhand|syberpunk|2077|glitches|meme|animation|cartoon|satire|parody|circletoonshd|rpg|circle|toons|hd|in a nutshell|cyberpunk in a nutshell|cyberpunk 2077 in a nutshell|performance|keanu reeves|cyberpunk 2077 meme|cyberpunk 2077 memes|PC|ps4|xbox|glitches and bugs|bug|toon|vehicle|car|weapons|loot|mission|quest|missions","1023228","85352","826","3317","https://i.ytimg.com/vi/hmnhDiGKPjc/default.jpg","False","False","Is it a glitch or a feature??? Maybe both???Subscribble for more viddles ► https://www.youtube.com/circletoonshdMerch! ► https://shop.makeship.com/collections/circletoonshdTwitter! ► https://www.twitter.com/CircletoonshdFacebook! ► https://www.facebook.com/JustMeBeingACircleTwitch! ► https://www.twitch.tv/circletoonshdInstagram! ► https://www.instagram.com/thealmightycircleJoin! Gain access to new Circle emojis!►https://www.youtube.com/channel/UCV6g95OBbVtFmN9uiJzkFqQ/join"
"ATNK14X269k","Animators React to Bad & Great CGi 2","2020-12-19T17:00:03Z","UCSpFnDQr88xCZ80N-X7t0nQ","Corridor Crew","24","20.23.12","animators react|vfx artists react|stuntmen react|cartoons|animation|hollywood|movies|shot breakdown|vfx|cgi|toy story|food fight|frozen","1212508","75573","684","4222","https://i.ytimg.com/vi/ATNK14X269k/default.jpg","False","False","Sponsored by Shudder. To try Shudder free for 30 days, go to https://www.shudder.com/ and use promo code: corridorcrewCONSIDER SUBSCRIBING ► http://bit.ly/Subscribe_Corridor_CrewWatch Season 5 From Beginning ► https://bit.ly/Crew_Season_5This Episode ►After getting tested for coronavirus (with negative results,) Niko and Clint sit down with with Veteran Animator and Director Alexander Snow of DreamWorks Animation, to break down some of the best and worst CGi animation in pop culture.Follow Alex and his adventures in the world of animation ►https://www.instagram.com/snowmationFOLLOW ►Instagram: http://bit.ly/_Corridor_InstagramSub-Reddit: http://bit.ly/_Corridor_Sub-RedditSUPPORT ► Join Our Website: https://bit.ly/Crew_MembershipBuy Merch: http://bit.ly/Corridor_StoreOUR GEAR & PARTNERS  ►Most Used Equipment: http://bit.ly/CorridorCrew_GearPerfect Camera: https://bhpho.to/2FJpQmRPuget Systems Computers: http://bit.ly/PC_Puget_WorkstationsActionVFX - https://bit.ly/TheBest_ActionVFXMUSIC ►Epidemic: http://bit.ly/Corridor_Music click this link for a free month!"
"eIM4U4fYwKQ","Turning a $20 Grocery Store Cake into a Winter Wedding Cake!","2020-12-18T14:00:06Z","UC500_29hTGKAj6GBmSoMiBw","The Icing Artist","26","20.23.12","wedding cake|diy wedding cake|grocery store haul|easy|how to|this to that|turning this into that|how to tier a cake|how to ice a cake|how to ice a cake with square edges|wedding|bridal|shower|classic|elegant|gold leaf|trendy|viral|the icing artist|christmas|christmas baking|christmas recipes|winter|winter wonderland|winter wedding cake","687602","26822","687","2209","https://i.ytimg.com/vi/eIM4U4fYwKQ/default.jpg","False","False","Thanks so much to Skillshare for sponsoring this video! I am SOOO excited for you gus to take my class! The first 1000 people to use this link will get a free trial of Skillshare Premium Membership! https://skl.sh/theicingartist12201 #ad #thistothatWhat to watch next! https://www.youtube.com/watch?v=o5lUeeGrLHs&list=PL4k6Y3I1hb-jI33k8OjObO8oFrgSnb27r&index=1&t=43sSUBSCRIBE HERE: https://www.youtube.com/theicingartist?sub_confirmation=1This week I am tackling the impossible (again!), by turning this into that featuring me turing a store bough grocery store cake into a elegant modern trendy winter wedding cake. The grocery store cake was iced in whipped buttercream icing and I am going to use that frosting to ice the bridal cake. This DIY winter wonderland wedding cake was so easy to make. I will show you how to create a two tiered cake iced in blue icing and covered in gold splatter, and fresh christmas flowers and greenery. Let's do this! Tools I use: http://bit.ly/theicingartistMy Recipes: http://www.theicingartist.comFOLLOW ME:TikTok- https://www.tiktok.com/@theicingartistFacebook- https://www.facebook.com/theicingartistInstagram- https://www.instagram.com/icingartistMake sure to come back every week for new yummy videos! Xo"
"vXCiQBwC_LY","CRAZY VIDEO! Blizzard in New York, USA (Dec 17, 2020)","2020-12-17T21:15:05Z","UC_vwW7c9VMnF500kGnJ9gPg","FOBOS STORM","22","20.23.12","snow storm|blizzard|winter storm|new york|new york city|snow footage|snowstorm|snowfall|snow storm in usa|blizzard in usa|snowfall in usa 2020|snowfall in new york|new york news|snow|weather|new york blizzard|storm|nyc|wind|cold|world news|latest news|news|travel|fobos storm|natural disasters|caught on camera|Binghamton|nyc snow|ice|winter|climate change|viral video|crazy|epic|best video|amazing|earth|nature|top 10|compilation|nbc news|facts|dangerous","2301672","18654","742","3790","https://i.ytimg.com/vi/vXCiQBwC_LY/default.jpg","False","False","Epic video! Crazy Blizzard in New York, USA 2020. The core of heaviest snow, on the order of 2-3 feet fell across southern New York state and northern Pennsylvania. A small band in this zone around Binghamton received 40 inches of snow where a narrow snow band remained nearly stationary for hours Wednesday night. Binghamton’s previous 2-day snowfall record was 35.3 inches, set in March 2017. Endicott reported 40.5 inches of snow Thursday morning and nearby locations Vestal and Johnson City also saw up to 37.5 inches of snowfall.EXTREME WEATHER! Blizzard in USA - https://youtu.be/ujWz1G16SlQ🔥 FOBOS STORM — https://www.youtube.com/channel/UC_vwW7c9VMnF500kGnJ9gPg?sub_confirmation=1🌳 FOBOS RELAX — https://www.youtube.com/channel/UCajZT2VQy1H6Ou6xgp_G3Ww?sub_confirmation=1🌋 FOBOS PLANET — https://www.youtube.com/channel/UCaJs3QtwUWJ2u_sdQVBs4XA?sub_confirmation=1Instagram: https://www.instagram.com/geofobosFacebook: https://www.facebook.com/fobosplanetEmail: geofobos@gmail.com#FobosStorm #Winter #Blizzard #Snowfall #SnowStorm #weather #storm #snow #usnews #worldnews #winterstorm #NewYork #naturaldisasters #Binghamton #Marlton"
"sAi39ZNt0OE","jxdn - Better Off Dead (Official Video)","2020-12-18T05:00:10Z","UC9UrqyY1mljZF6rfyDT-ENA","jxdn","10","20.23.12","[none]","1084234","161212","814","7569","https://i.ytimg.com/vi/sAi39ZNt0OE/default.jpg","False","False","'Better Off Dead' out now: https://jxdn.lnk.to/betteroffdeadProduction Company: Tuff Contender Director / Editor / Colorist: Max Moore Executive Producer: DJay Brawner Head of Production: Max Rose Producer: Lakell Haves Director of Photography: Justyn Moro Production Designer: Jessican Garrison & Diana Mantis"
"OElX_Ta7dpg","Haters will say it’s in reverse.","2020-12-17T17:24:52Z","UCb8vrqP8Z7Oz9ZTYvUtjUHQ","Daniel LaBelle","23","20.23.12","[none]","3538637","185175","5805","23541","https://i.ytimg.com/vi/OElX_Ta7dpg/default.jpg","False","False","One of these clips is actually not in reverse. Can you figure out which one?Other socials: https://linktr.ee/DanielLaBelle"
"LeYsRMZFUq0","I Gave People $1,000,000 But ONLY 1 Minute To Spend It!","2020-12-15T21:00:11Z","UCX6OQ3DkcsbYNE6H8uQQuVA","MrBeast","24","20.23.12","[none]","33149824","2437597","24169","137848","https://i.ytimg.com/vi/LeYsRMZFUq0/default.jpg","False","False","Subscribe right now and you might be picked to be in my next video! (its epic)New Merch - https://shopmrbeast.com/SUBSCRIBE OR I TAKE YOUR DOG╔═╦╗╔╦╗╔═╦═╦╦╦╦╗╔═╗║╚╣║║║╚╣╚╣╔╣╔╣║╚╣═╣ ╠╗║╚╝║║╠╗║╚╣║║║║║═╣╚═╩══╩═╩═╩═╩╝╚╩═╩═╝----------------------------------------------------------------follow all of these or i will kick you• Facebook - https://www.facebook.com/MrBeast6000/• Twitter - https://twitter.com/MrBeastYT•  Instagram - https://www.instagram.com/mrbeast--------------------------------------------------------------------"
"BvUZUptq3Mk","Cody and Noel Do: Drunk Baking (pt. 2)","2020-12-17T18:15:16Z","UC4sf8XtH_uXnwNP699luQVQ","Tiny Meat Gang","22","20.23.12","[none]","859004","81878","228","2243","https://i.ytimg.com/vi/BvUZUptq3Mk/default.jpg","False","False","SOFIA MERCH STILL AVAILABLE!http://tmgpod.comListen to Sofia: https://tinymeatgang.lnk.to/SofiaPatreon: https://www.patreon.com/tinymeatgangTour Tickets: http://tinymeattour.comHighlights Channel: https://www.youtube.com/channel/UCdftuX9H8kW14Njxtpnuy3QCODY: http://youtube.com/codyko http://twitter.com/codyko http://instagram.com/codykoNOEL: http://youtube.com/thenoelmiller http://twitter.com/thenoelmiller http://instagram.com/thenoelmillerCody and Noel Do: Drunk Baking (pt. 2)https://youtu.be/BvUZUptq3MkEDITED BY CASSIUS PETTIThttps://www.instagram.com/cassiuspettit"
"kJ96dvMfkrE","Brewstew - School Fundraiser","2020-12-17T21:53:13Z","UCepPGz8AVCbggMl3BvboaBA","brewstewfilms","23","20.23.12","brewstew|school|fundraiser|cartoon|animation|flash animation|stick figure|candy bar|sale|storytime|funny story","902827","55095","480","5610","https://i.ytimg.com/vi/kJ96dvMfkrE/default.jpg","False","False","Ya'll wanna buy a candy bar? 450 more sales, and I'll get the YakBak rewardMerch Store:https://teespring.com/stores/brewstewSpecial Thanks to the people that support me on Patreon!https://www.patreon.com/brewstewBrewstew.comMusic:Hidden Agenda Kevin MacLeod (incompetech.com) Licensed under Creative Commons: By Attribution 3.0http://creativecommons.org/licenses/b...End Music by Mark JaySound Effects:http://www.freesfx.co.uk/School Fundraiser"
"EGOz9f78IjI","[OFFICIAL VIDEO] My Favorite Things - Pentatonix","2020-12-17T20:00:10Z","UCmv1CLT6ZcFdTJMHxaR9XeA","PTXofficial","10","20.23.12","Pentatonix|Penatonix|PTX|PTXofficial|Mitch Grassi|Kirstie Maldonado|Scott Hoying|Avi Kaplan|Matt|Sallee|Kevin|Olusola|K-O.|Cello|Cellobox|Beatbox|A Cappella|Harmony|Acapella|Acappela|Choir|Singing Competition|The Sing-Off|Sing-Off|Reality TV|Sing|Singing|Chorus|Sara Bareilles|Shawn Stockman|Ben Folds|The Voice|Voice|Pitch Perfect|holiday|christmas|My favorite things|favorite things|sound of music|christmas classics|pentatonix christmas|christmas songs","1019946","74106","713","3978","https://i.ytimg.com/vi/EGOz9f78IjI/default.jpg","False","False","NEW CHRISTMAS ALBUM “WE NEED A LITTLE CHRISTMAS”, AVAILABLE NOW. BUY/STREAM https://smarturl.it/PTXWNALXMAS🎧  PUT YOUR HEADPHONES ON TO LISTEN TO IN IMMERSIVE 360 REALITY AUDIO MY FAVORITE THINGS WAS MIXED WITH AN IMMERSIVE #360RA EXPERIENCE IN MIND, USE HEADPHONES FOR THE FULL EFFECT. STREAM MY FAVORITE THINGS IN FULL 360 REALITY AUDIO, NOW AVAILABLE ON TIDAL, AMAZON AND DEEZER. REGISTER AT THE LINK BELOW TO REDEEM YOUR 3-MONTH FREE TRIAL! VISIT: https://cutt.ly/music_com_Pentatonix  *QUANTITIES ARE LIMITED, WHILE SUPPLIES LAST. THE LUCKY ONES THE NEW ORIGINAL ALBUM WITH 11 NEW SONGS INCLUDING HAPPY NOW & BE MY EYES. AVAILABLE 2.12.21. PRE-ORDER NOW https://smarturl.it/PTXTHELUCKYONESJOIN OUR PATREON FAN PAGE!! http://www.patreon.com/pentatonixGET ‘AT HOME’ EP: BUY https://smarturl.it/PTXATHOME?IQid=yt STREAM https://smarturl.it/PTXATHOME?IQid=yt GET THE BEST OF PENTATONIX CHRISTMAS: BUY: https://smarturl.it/bestofPTXmas?IQid=yt STREAM: https://smarturl.it/bestofPTXmas?IQid=ytGET CHRISTMAS IS HERE! BUY http://smarturl.it/pTXmasIsHere?IQid=yt STREAM http://smarturl.it/pTXmasIsHere?IQid=yt GET A PENTATONIX CHRISTMAS (DELUXE) BUY http://smarturl.it/APTXmasDlxD?IQid=yt STREAM http://smarturl.it/APTXmasDlxD/spotify?Iqid=yt GET THAT'S CHRISTMAS TO ME (DELUXE) BUY http://smarturl.it/TCTMDlxiT?IQid=yt STREAM http://smarturl.it/TCTMDlxS?IQid=yt GET PTXMAS BUY http://smarturl.it/PTXmas?IQId=yt STREAM http://smarturl.it/PTXmas1Sp?IQid=yt GET PTX PRESENTS: TOP POP, VOL. 1 BUY http://smarturl.it/PTXTPV1?IQid=yt STREAM http://smarturl.it/PTXTPV1?IQid=yt GET PENTATONIX THE ALBUM BUY http://smarturl.it/PTXalbum?IQid=yt STREAM http://smarturl.it/PTXalbumS?IQid=yt GET PTX VOL. 4 - CLASSICS EP BUY http://smarturl.it/PTXVol4iT?IQid=yt STREAM http://smarturl.it/StreamPTXVol4?IQid=yt GET PTX VOL III BUY http://smarturl.it/PTXVol3?IQId=yt STREAM http://smarturl.it/PTXVol3Spot?IQid=yt GET PTX VOL II BUY http://smarturl.it/PTXVolume2?IQid=yt STREAM http://smarturl.it/PTXV2Spotify?IQid=yt GET PTX VOL I BUY http://smarturl.it/PTXVol1?IQid=yt STREAM http://smarturl.it/PTXV1Spotify?IQid=yt ON MY WAY HOME THE DOCUMENTARY | AVAILABLE NOW! ITUNES: http://smarturl.it/PTXOMWHi?IQid=yt AMAZON: http://smarturl.it/PTXOMWHDVD?IQid=yt MY FAVORITE THINGS LYRICS: Raindrops on roses and whiskers on kittens Bright copper kettles and warm woolen mittens Brown paper packages tied up with strings These are a few of my favorite thingsCream colored ponies and crisp apple strudels Doorbells and sleigh bells and schnitzel with noodles Wild geese that fly with the moon on their wings These are a few of my favorite thingsGirls in white dresses with blue satin sashes Snowflakes that stay on my nose and eyelashes Silver white winters that melt into springs These are a few of my favorite thingsWhen the dog bitesWhen the bee stingsWhen I'm feeling sadI simply remember my favorite things And then I don't feel so badRaindrops on roses and whiskers on kittens Bright copper kettles and warm woolen mittens Brown paper packages tied up with strings These are a few of my favorite thingsCream colored ponies and crisp apple strudels Doorbells and sleigh bells and schnitzel with noodles Wild geese that fly with the moon on their wings These are a few of my favorite thingsWhen the dog bitesWhen the bee stingsWhen I'm feeling sadI simply remember my favorite things And then I don't feel so badWhen the dog bitesWhen the bee stingsWhen I'm feeling sadI simply remember my favorite things And then I don't feel so badhttp://www.ptxofficial.com http://www.twitter.com/ptxofficial @ptxofficial http://www.facebook.com/Pentatonix http://www.instagram.com/ptxofficial @ptxofficial https://www.tiktok.com/@pentatonix @pentatonixhttp://www.snapchat.com/add/PTXsnapCREDITSDirector: Jimmy BatesProduction Company: Green Glow FilmsExecutive Producer: Stephen Wayne MallettHead of Production: Brooklynn Reeves-MallettProducer: Hans Boysen1st Assistant Director: Jeff CobbDirector of Photography: Timothy S. Jensen1st AC: Luis Suarez2nd AC: Joel MartinSteadicam Operator: Merlin ShowwaterDIT: Erick Wilczynski#Pentatonix #WeNeedALittleChristmas #MyFavoriteThings"
"uBEbZBthWY8","Operation Snowdown Begins In Fortnite!","2020-12-18T14:37:45Z","UClG8odDC8TS6Zpqk9CGVQiQ","Fortnite","20","20.23.12","Fortnite|Epic Games|PC|PS4|Xbox One|Battle Royale|Unreal Tournament|Unreal Engine|Fortnite Battle Royale|Fortnite Creative","3334757","157170","3199","12935","https://i.ytimg.com/vi/uBEbZBthWY8/default.jpg","False","False","'Tis the season for free rewards, fan-favorite LTMs and plenty of snow-filled holiday cheer! Read more: https://www.epicgames.com/fortnite/news/operation-snowdown-starts-now-in-fortnite-unlock-free-outfits-take-flight-and-moreOperation Snowdown has arrived! Starting now through January 5, 2021, login each day to earn free rewards and play in returning LTMs.Play Fortnite Battle Royale, the completely free 100-player PvP mode. One giant map, A Battle Bus, Last one standing wins. ESRB Rating: Teen with Violence.Instagram: https://www.instagram.com/fortnite/Twitter: https://twitter.com/FortniteGameFacebook: https://www.facebook.com/FortniteGame/Learn More: https://www.epicgames.com/fortnite/en-US/#FortniteSeason5 #OperationSnowdown"
"Xgqv3tZuj2E","We Broke the Tracked Raptor","2020-12-17T23:51:42Z","UChRlaISXbl2gECFAmDzxgzg","Westen Champlin","2","20.23.12","raptor|ford raptor|wrecked raptor rebuild|wrecked ford raptor|ford|eco boost|boost|3.6l v6 straight pipe|westen|westen champlin|offroading|jumping a ford raptor|raptor jump gone bad|raptors jump view|track|tracked raptor","718354","29471","565","1688","https://i.ytimg.com/vi/Xgqv3tZuj2E/default.jpg","False","False","While testing out the tracked raptor..well we had a bit of a problem.Follow us on Instagram: https://www.instagram.com/westengwFacebook:https://www.facebook.com/westengwTrack system http://www.americantracktruck.com/"
"u0RtFobm4uU","Gorillaz | Episode Nine 'The Lost Chord' | Official Trailer","2020-12-18T12:00:14Z","UCfIXdjDQH9Fau7y99_Orpjw","Gorillaz","1","20.23.12","[none]","597815","46930","220","3383","https://i.ytimg.com/vi/u0RtFobm4uU/default.jpg","False","False","Order Song Machine Season One: Strange Timez by Gorillaz here – https://smarturl.it/gorillaz.storeGorillaz present Song Machine | Season One Episode Nine: The Lost Chord ft. Leee JohnWorld Premiere December 24th - 5.00pm GMTFollow your nearest Song Machine https://gorill.az/songmachineHit subscribe now (snooze you lose)Follow Gorillaz: https://instagram.com/gorillaz https://twitter.com/gorillaz https://facebook.com/gorillaz https://gorillaz.com#Gorillaz #SongMachine"
"au1Z-3KzF8Y","Gingerbread House Battle w/ Pretty Little Liars Cast | Shay Collabs | Shay Mitchell","2020-12-17T19:46:39Z","UCDTtciKkf_AzXtKNUjkUEPg","Shay Mitchell","24","20.23.12","Shay Mitchell|Shay|Mitchell|Shay Mitchell YouTube|YouTube Shay Mitchell|Shannon Mitchell|ShayM|Shay Mitch|Pretty Little Liars|PLL|Emily Fields|ABC Family|Actress|Fashion|ashley benson|benson ashley|ian harding|harding ian|christmas 2020|gingerbread house challenge|festive 2020|tyler blackburn|blackburn tyler|gingerbread house|gingerbread house decorating|battle|challenge|holiday cocktail|christmas cocktails|drinking games|truth or drink","1799949","130642","383","3479","https://i.ytimg.com/vi/au1Z-3KzF8Y/default.jpg","False","False","'Tis the season to be making all the Gingerbread Houses with Ian Harding. Tune in to this week’s holiday content to see how one of my favorite Pretty Little Liars castmates and I battle to make the best gingerbread house while dishing the dirt on who we would f*ck, marry, kill PLL edition. We couldn't decide who won, so we called a few of our friends from Pretty Little Liars. Check out my video where Ian Harding and I try the weirdest pregnancy cravings: https://bit.ly/PregnancyASMRHoliday Cocktail Recipes White Spritzmas - 1 oz Dry Sherry, 1/2 oz Orgeat (almond syrup) 1/2 oz Lemon, Method: Shake with Ice and Strain into a champagne flute. Top with Sparkling WineGarnish: Mint & Berries Dusted with Powdered SugarTwisted Elf Shot - 3/4 oz Tequila, 3/4 oz Grand Marnier, .5 oz Baileys, 3 dashes Mole bittersmethod: Shake / Strain into a small glass and top with grated nutmegRudolph's Drop - 1.5 oz Vodka, 1/2 oz St. Germain, 1/2 *Spiced Cranberry syrup, 3/4 oz LimeMethod: Shake with Ice and Strain into a Cocktail coupe or Martini glassGarnish: Rosemary & CranberryCocoa & Cognac  - 1 oz Cognac, 1 oz *Cocoa Egg Nog, 1 oz AmaroMethod: Shake with Ice and Strain into Holiday Mug Garnish: Whip Cream and Crushed Candy Cane*Cocoa Egg Nog - Blend 1/2 Cup of Strauss Family Farms Egg Nog with 1 tsp of Cocoa Powder for 10 secondsMind Eraser Shot - 1 oz Vodka, 1 oz Coffee Cordialmethod: Shake / Strain into a small glass and top with club sodaSpecial thanks to our mixologist and friend, Robin Chopra.Hi! I’m Shay Mitchell, but you may know me as Emily, Peach, or Stella! Oh, or it’s possible that you may also know me as the CBO + Founder of BÉIS and Co-founder of Onda. Or as Atlas’s mom. Or as a pizza fanatic. Whatever you know me as I’m Shay, and this is my YouTube.  Join me for my favorite recipes, beauty collabs with my friends + a behind the scenes (and screen) look at my life.   Be sure to watch my series Still Not Ready featuring me as a new mom: https://bit.ly/StillNotReadySeries Follow me! YouTube: http://bit.ly/ShayMitchellYT Instagram: http://bit.ly/ShayInstagram Tik Tok: https://bit.ly/ShayTikTok Facebook: http://bit.ly/ShayFacebook Twitter: http://bit.ly/ShayTwitter"
"iTjV6MNIdq8","MAKING JAMES CHARLES TRY A MEXICAN ANTOJITO WITH LAURA!! | Louie's Life","2020-12-17T01:00:07Z","UCZDdF_p-L88NWVpzF0vjvMQ","Louie's Life","24","20.23.12","making|james|charles|james charles|sister|hermana|hi sisters|hi sister|flashback marry|mua|makeup artist|male mua|cover boy|makeup|tutorial|easy|glam|try|trying|mexican|antojito|antojitos|mexcian antojitos|how to|mukbang|food|comida|bomb af|chile|rico|delicioso|facil|laura|laura mellado|lauras boutique|cooking|cook|hispanic dish|dulces|spicy|sandia loca|candies|louie|castro|louie castro|louies life|the baddest perra|spanglish|spanish makeup tutorial|latino","1511955","90673","1654","5176","https://i.ytimg.com/vi/iTjV6MNIdq8/default.jpg","False","False","I wanted to make a cooking video with James but instead of cooking a traditional hispanic dish, Laura and I thought it would be a good idea to make him try a MEXICAN ANTOJITO!! You guys know I lovee dulces, antojitos, chile, todo!!! James had never heard of a Sandia Loca so of course we had to make one and have him try it. We got all the ingredients and dulces that we needed to put it together! There were a few of candies that James hadn't tried so it was perfect! After making them I had them both rate it and tell me their final thoughts!———————————————————————————HERMANAS COLLECTION: sisters-apparel.com LIVE Thu. December 17th at 12PM PST!———————————————————————————Watch my previous videos:-THE CRAZINESS THAT HAPPENED!!https://youtu.be/_iS8kjnPSpM-TRYING TO COOK ENCHILADAS!!:https://youtu.be/m_2aSHgDxAw-FUNNY AF HALLOWEEN COSTUMES!!:https://youtu.be/GPDJMbYF4fs———————————————————————————Social Media:Instagram: @louiecasttroTwitter: @louiecasttroSnapchat: thehamielouie———————————————————————————Business Email: louiecasttro@yahoo.com———————————————————————————LOVE YOU PERRAS!"
"RLIf8YEqJPA","Anything You Paint, I'll Pay For Challenge! | ZHC Crafts","2020-12-17T20:46:22Z","UCPAk4rqVIwg1NCXh61VJxbg","ZHC Crafts","26","20.23.12","[none]","1670801","67750","1266","6817","https://i.ytimg.com/vi/RLIf8YEqJPA/default.jpg","False","False","Anything You Paint, I'll Pay For Challenge! | ZHC CraftsSubscribe To Help Fund ZHC's Expensive Videos  @ZHC  Follow The TeamIG - @zhcomicartIG - @munchie.michelleIG - @itsviveeIG - @leomahaloIG - @zhccrafts"
"FF50-LY2Kro","TWICE CRY FOR ME (Official Audio)","2020-12-18T04:59:59Z","UCzgxx_DM2Dcb9Y1spb9mUJA","TWICE","10","20.23.12","TWICE|트와이스|CRYFORME|크라이포미|TWICECRYFORME|트와이스크라이포미|TWICE크라이포미|CRYFORMETWICE|CRYFORME트와이스|크라이포미트와이스|크라이포미TWICE|TWICE디지털싱글|TWICEDigitalSingle|디지털싱글TWICE|DigitalSingleTWICE|트와이스디지털싱글|디지털싱글트와이스|트와이스신곡|TWICENewSong|신곡트와이스|NewSongTWICE|TWICE신곡|신곡TWICE","3897418","466721","3077","50559","https://i.ytimg.com/vi/FF50-LY2Kro/default.jpg","False","False","TWICE CRY FOR ME (Official Audio)TWICE CRY FOR ME Released Online:https://twice.lnk.to/CRYFORMETWICE Official Shop: https://TWICE.lnk.to/ShopTWICE Official YouTube: http://www.youtube.com/c/TWICETWICE Official Facebook: http://www.facebook.com/JYPETWICETWICE Official Twitter: http://www.twitter.com/JYPETWICETWICE Official Instagram: http://www.instagram.com/TWICETAGRAMTWICE Official Homepage: http://TWICE.jype.comTWICE Official Fan's: http://fans.jype.com/TWICEⓒ 2020 JYP Entertainment. All Rights Reserved#TWICE #트와이스 #CRYFORME"
"VYdAQKoUm7o","Explaining the Pandemic to my Past Self Part 4","2020-12-17T14:00:14Z","UCy0Pr5u-MwGXXzp_GDd4m_g","Julie Nolke","23","20.23.12","[none]","1687151","114401","1514","5944","https://i.ytimg.com/vi/VYdAQKoUm7o/default.jpg","False","False","What would happen if I tried to explain what's happening now to the October 2020 version of myself?Part 1 here: https://youtu.be/Ms7capx4Cb8Part 2 here: https://youtu.be/xdyDpP2s-ogPart 3 here: https://youtu.be/Pbdk_lBCxJkSupport the channel by liking and subscribing! Join my Patreon for behind the scenes videos and early access to videos here: https://www.patreon.com/julienolke"
