video_id,title,publishedAt,channelId,channelTitle,categoryId,trending_date,tags,view_count,likes,dislikes,comment_count,thumbnail_link,comments_disabled,ratings_disabled,description
"-5q5mZbe3V8","BTS (방탄소년단) 'Life Goes On' Official MV","2020-11-20T04:58:11Z","UC3IZKseVpdzPSBaWxBxundA","Big Hit Labels","10","20.21.11","BIGHIT|빅히트|방탄소년단|BTS|BANGTAN|방탄","65453297","6317876","25314","3033129","https://i.ytimg.com/vi/-5q5mZbe3V8/default.jpg","False","False","BTS (방탄소년단) 'Life Goes On' Official MVCredits:Director: Jeon Jung KookAssistant Director: Yong Seok Choi, Jihye Yoon (Lumpens)Photo: Nu KimDirector of Photography: Hyunwoo Nam (GDW)Focus Puller: Sangwoo Yun2nd AC: Eunki Kim3rd AC: Kyuwon SeoGaffer: Choi Doo Soo (DS LIGHT)Lighting Crew: Jung Yu Jin, Kim Jun O, Lee Seong Min, Kim Sung Wook, Lee HyunsuArt Director: Bona Kim, Jinsil Park (MU:E)Assistant Art Team: Yeri Kang, Minjung Kim (MU:E)Art-team Manager: ilho Heo (MU:E)Visual Creative: Nu Kim, Sabinne Cheon, Lee Sun Kyoung, Kim Ga Eun, Cha Yeon HwaArtist Management: Kim Shin Gyu, Kim Su Bin, Kim Dae Young, Park Jun Tae, An Da Sol, Ahn Jong Hun, Yun Tae Woong, Lee Seung Byeong, Lee Jung Min, Lee Hyeon KiBig Hit Entertainment. Rights are reserved selectively in the video. Unauthorized reproduction is a violation of applicable laws. Manufactured by Big Hit Entertainment, Seoul, Korea.Connect with BTS: https://ibighit.com/bts http://twitter.com/BTS_bighithttp://twitter.com/BTS_twt http://www.facebook.com/bangtan.official https://www.youtube.com/user/BANGTANTV http://instagram.com/BTS.bighitofficial https://channels.vlive.tv/FE619 https://www.tiktok.com/@bts_official_bighithttps://weverse.onelink.me/qt3S/94808190https://www.weibo.com/BTSbighithttps://www.weibo.com/BTSmembers http://i.youku.com/btsofficial http://btsblog.ibighit.com#BTS #방탄소년단 #LifeGoesOn #BTS_BE #MV"
"7PBYGu4Az8s","Megan Thee Stallion - Body [Official Video]","2020-11-20T05:00:10Z","UCKrdjiuS66yXOdEZ_cOD_TA","Megan Thee Stallion","10","20.21.11","Megan Thee Stallion|Good News|Megan Thee Stallion Good News|megan thee stallion|good news|megan thee stallion good news|megan thee stallion album|Body|Megan Thee Stallion Body|Body Megan Thee Stallion|Megan Thee Stallion Body Official Video|body good news megan|megan thee stallion body good news|body megan thee stallion good news|megan thee stallion good news body|megan thee stallion body official video good news|body official video megan thee stallion|body","3399100","298809","10099","18071","https://i.ytimg.com/vi/7PBYGu4Az8s/default.jpg","False","False","The official video for Megan Thee Stallion's “Body” from her album ‘Good News’ - Out Now!Stream ‘Good News’ on all platforms: https://megantheestallion.ffm.to/goodnewsExperience “Body” in a totally new way with 360 Reality AudioStream “Body” in full 360 Reality Audio, now available on TIDAL, Amazon and Deezer. Use headphones for the full effect. 🎧Register at the link below to redeem your 3-month free trial!Visit: https://cutt.ly/music_com_Megan_Thee_Stallion*Quantities are limited, while supplies lastA Boy In The Castle productionDirector - Colin TilleyExecutive Producers - Jamee Ranta & Colin TilleyLine Producer - Whitney Jackson1st AD - Ev SalomonDP - Elias TalbotProduction Designer - Wes DoganChoreographer - JaQuel KnightEditor - Chris Simmons with VH PostMTS GlamStylist - Brookelyn StylesStyling Assistant - Carlos AvilesHair - Kellon DeryckMake Up - Priscilla OnoNails - Coca MichelleChoreographer Assistant - Darina LittletonChoreographer Assistant - Rebbi RosieDancer - Dnay BaptisteDancer - Ashley SeldonDancer - Cayla EvansDancer - Dominique LoudeDancer - Taylor TerryDancer - Corbin HunterText Megan Thee Stallion:(832) 210-1202Follow Megan Thee Stallion:https://www.instagram.com/theestallionhttps://twitter.com/theestallionhttps://www.facebook.com/theestallionnhttps://soundcloud.com/megan-thee-stallion--#MeganTheeStallion #Body #GoodNews #OfficialVideo© 2020 1501 Certified Ent LLC under exclusive license to 300 Entertainment"
"uKhy1Y69BT4","DaBaby - Gucci Peacoat (Official Video)","2020-11-20T14:22:38Z","UC2CCXzC56k0b8L49R_iW-Yw","DaBaby","10","20.21.11","DaBaby|Baby Jesus|Charlotte|Hip Hop|Rap","1071861","138197","1011","7545","https://i.ytimg.com/vi/uKhy1Y69BT4/default.jpg","False","False","LONG LIVE GLENN.Directed By: Gemini Vision (@Gemini.one1)Song Produced By: K.I.D (@iamdjkid)MY BROTHERS KEEPER (LONG LIVE G) OUT NOW"
"E0gmyePNri4","Meek Mill - Pain Away feat. Lil Durk [Official Video]","2020-11-20T05:00:06Z","UC9HlWVtENbiMQzVRmnbJxtw","Meek Mill","10","20.21.11","meek mill|meek|mill|hip hop|rap|atlantic|atlantic records|wins & losses|dreams worth more than money|dangerous|championship|pain away|lil durk|meek mill pain away|meek pain away|quarantine pack|meek quarantine|meek quarantine pack|meek lil durk|dream chaser|dream chasers|dreamchasers|durk","1476246","106529","1484","6691","https://i.ytimg.com/vi/E0gmyePNri4/default.jpg","False","False","Meek Mill - Pain Away feat. Lil DurkListen to Meek's 'QUARANTINE PACK' out now:https://meekmill.lnk.to/QUARANTINEPACK Subscribe for more official content from Meek Mill:https://MeekMill.lnk.to/subscribeFollow Meek Millhttp://meekMill.comhttp://twitter.com/MeekMillhttp://facebook.com/MeekMillhttp://instagram.com/MeekMillhttps://soundcloud.com/meek-mill-dcThe official YouTube channel of Atlantic Records artist Meek Mill. Subscribe for the latest music videos, performances, and more."
"tXSnd7zJlpU","Jeezy On Ending Feud With Gucci Mane, Black Men Healing, New Album + More","2020-11-20T14:33:02Z","UChi08h4577eFsNXGd3sxYhw","Breakfast Club Power 105.1 FM","24","20.21.11","the breakfast club|breakfast club|power1051|celebrity news|radio|video|interview|angela yee|charlamagne tha god|dj envy","635391","17411","432","5044","https://i.ytimg.com/vi/tXSnd7zJlpU/default.jpg","False","False","Subscribe NOW to The Breakfast Club: http://ihe.art/xZ4vAcAGet MORE of The Breakfast Club:► LISTEN LIVE: http://power1051fm.com/► CATCH UP on What You Missed: http://ihe.art/Dx2xSGN► FOLLOW us on Instagram: https://www.instagram.com/BreakfastClubAM/► FOLLOW us on Twitter: https://twitter.com/BreakfastClubAM► LIKE us on Facebook: https://www.facebook.com/BreakfastClubAM/Executive Producer: Eddie F.Associate Producer: Daniel Greene - @d7greeneBoard Producer: DJ Dramos - @djdramosProducer: Taylor Hayes - @funsize_tCamera/Video Editor: Nick Cio - @isaywesayAssistant Editor: Breanna Chianne - @iamb_chianneThe Breakfast Club features celebrity interviews, Charlamagne tha God’s Donkey of the Day, Angela Yee’s Rumor Reports, DJ Envy’s mixes and so much more! Every guest visiting the world’s most dangerous morning show is grilled with their signature blend of honesty and humor. The results are the best interviews to be found on radio.#BreakfastClub#Jeezy#GucciMane"
"MPbUaIZAaeA","Shawn Mendes, Justin Bieber - Monster","2020-11-20T05:00:11Z","UC4-TgOSMJHn-LtY4zCzbQhw","ShawnMendesVEVO","10","20.21.11","Shawn|Mendes|Justin|Bieber|Monster|LP4-5|PS/|Island|Pop","11564125","1506660","17396","93675","https://i.ytimg.com/vi/MPbUaIZAaeA/default.jpg","False","False","Listen to “Monster” now: https://Monster.lnk.to/Single New album WONDER from Shawn Mendes available Dec 4thPre-order now: https://wonder.lnk.to/Album Listen to Holy + Lonely from Justin Bieberhttps://justinbieber.lnk.to/OutNow Directed by: Colin TilleyProduced by: Jack WinterCreative Direction: Connor Brashier Follow Shawn:Instagram | https://www.instagram.com/shawnmendes/Twitter | https://twitter.com/ShawnMendesFacebook | https://www.facebook.com/ShawnMendesOfficialTikTok | https://www.tiktok.com/@shawnmendesWebsite | http://www.shawnmendesofficial.com/ Follow Justin:Instagram | http://instagram.com/justinbieberTwitter | http://twitter.com/justinbieberFacebook | http://facebook.com/justinbieberTikTok | https://www.tiktok.com/@justinbieberWebsite | https://www.justinbiebermusic.com/Lyrics:You put me on a pedestal and tell me I’m the bestRaise me up into the sky until I’m short of breathFill me up with confidence, I say what’s in my chestSpill my words and tear me down until there’s nothing leftRearrange the pieces just to fit me with the restBut what if I what if I trip, what if I what if I fallThen am I the monster yeah, just let me knowwhat if I what if I sin, what if I what if I breakThen am I the monster yeah, just let me know yeaahhhI was 15 when the world put me on a pedestalI had big dreams of doing shows and making memories Made some bad moves trying to act cool upset by their jealousyLifting me up, lifting me up, yeah and tearing me down, tearing me down, down, down,Take responsibility for everything I’ve done, holding it against me like you’re the holy oneI had a chip on my shoulder, had to let it goCause unforgiveness keeps them in control, I came in with good intentions then I let it goAnd now I really wanna knowWhat if I what if I trip, what if I what if I fall, I fallThen am I the monster, just let me knowwhat if I what if I sin, what if I what if I break yeahThen am I the monster, just let me knowPlease just let me knowPlease don’t let me fallOh please don’t let me fallWhat if I’m the monster, what if I’m the monster yeahMusic video by Shawn Mendes, Justin Bieber performing Monster. © 2020 Island Records/Def Jam Recordings, a division of UMG Recordings, Inc."
"tOD4fkQiulg","Kylie Jenner: Grinch Cupcakes with Stormi","2020-11-19T17:18:20Z","UCWkYXtnAuu7VTLPwUcRSB6A","Kylie Jenner","22","20.21.11","[none]","6432699","0","0","18291","https://i.ytimg.com/vi/tOD4fkQiulg/default.jpg","False","True","In celebration of my KYLIE X GRINCH collection launching today, Stormi and I made Grinch cupcakes! Shop my limited edition Grinch holiday collection at http://kyliecosmetics.com today at 3pm PST"
"_sxUG8O6M2w","BTS (방탄소년단) 'BE' Comeback Countdown","2020-11-20T04:28:08Z","UCLkAepWjdylmXSltofFvsYQ","BANGTANTV","10","20.21.11","방탄소년단|BTS|BANGTAN|HIPHOP|알엠|RM|슈가|SUGA|제이홉|jhope|지민|JIMIN|정국|JUNGKOOK|JIN|BTS BE|Life Goes On|라이프 고즈 온|라고온|BTS Comeback Countdown|방탄 컴백|방탄 카운트다운|BE 앨범|BTS new album|LGO|컴백카운트다운|Comeback countdown","12287783","2138620","8312","163623","https://i.ytimg.com/vi/_sxUG8O6M2w/default.jpg","False","False","Life Goes On Official MV 공개를 방탄소년단과 함께 준비하세요! 'BE' Comeback Countdown이 끝나면 Life Goes On Official MV가 바로 공개됩니다.Get ready with BTS for the Life Goes On Official MV release on Nov. 20, 2PM(KST), 12AM(EST).Join us for the 'BE' Comeback Countdown right before the premiere of  Life Goes On Official MV.#BTS_BE #LifeGoesOn #BTS #방탄소년단 Connect with BTS: https://ibighit.com/bts http://twitter.com/BTS_bighithttp://twitter.com/BTS_twt http://www.facebook.com/bangtan.official https://www.youtube.com/user/BANGTANTV http://instagram.com/BTS.bighitofficial https://channels.vlive.tv/FE619 https://www.tiktok.com/@bts_official_bighithttps://weverse.onelink.me/qt3S/94808190https://www.weibo.com/BTSbighithttps://www.weibo.com/BTSmembers http://i.youku.com/btsofficial http://btsblog.ibighit.com"
"sVgd0pIZ8fQ","Gucci Mane - Truth (Official Music Video)","2020-11-20T00:02:50Z","UCSugZEYrWbzqIWGD195V-YA","Gucci Mane","10","20.21.11","officialguccimane|gucci mane|gucci|mane|atlantic records|guwop|radric davis|hip hop|rap|i get the bag|solitaire|real rich|el gato|mr. davis|atlanta|the new 1017|gucci mane 1017|1017 label|1017 records|so icy gang|so icy gang vol. 1|so icy gang vol 1|big scarr|foogiano|pooh shiesty|kshiday|enchanting|roboy|the truth|the truth video|gucci truth|jeezy|verzuz","744727","37731","644","5479","https://i.ytimg.com/vi/sVgd0pIZ8fQ/default.jpg","False","False","I AM MY ONLY COMPETITION!https://guccimane.lnk.to/TrapGodClassicsSubscribe for more official content from Gucci Mane:https://Atlantic.lnk.to/GMsubscribeFollow Gucci Manehttp://GucciManeOnline.comhttp://Twitter.com/Gucci1017http://Facebook.com/GucciManehttp://Instagram.com/LaFlare1017https://open.spotify.com/artist/13y7CgLHjMVRMDqxdx0XdoFollow The New 1017Website: https://www.thenew1017records.com/Instagram: https://thenew1017.lnk.to/InstagramFacebook: https://thenew1017.lnk.to/FacebookYoutube: https://thenew1017.lnk.to/YoutubeSoundCloud: https://thenew1017.lnk.to/SoundcloudGIPHY: https://thenew1017.lnk.to/GiphyThe official YouTube channel of Atlantic Records artist Gucci Mane. Subscribe for the latest music videos, performances, and more."
"-6Ildn2Dq2A","Tom MacDonald - SELLOUT","2020-11-20T16:58:23Z","UCElGBUWDCa05jRzc2PfmGqQ","Tom MacDonald","10","20.21.11","Eminem|MGK|Token|NF|Hopsin|Machine Gun Kelly|Merkules|Chris Webby|Joyner Lucas|Tech N9ne|Krizz Kaliko|Yelawolf|Rittz|Strange Music|Slumerican|Jellyroll|Struggle|ICP|Twiztid|Violent J|Shaggy 2 Dope|Upchurch|Adam Calhoun|Ryan Upchurch|Madchild|Logic|Diss Track|Rap Beef|Juggalo|R.A. The Rugged Man|Mac Lethal|Crypt|Quadeca|Horrorcore|Falling In Reverse|Lil Peep|Ghostmane|Pouya|Hip Hop|Rap|Country Rap|Tom MacDonald|Whiteboy|Lil Dicky|Macklemore|Hick Hop|Beef","454176","69829","932","8403","https://i.ytimg.com/vi/-6Ildn2Dq2A/default.jpg","False","False","AUTOGRAPHED ALBUMS: http://www.HangOverGang.com/storeSUBSCRIBE TO THIS CHANNEL &  CONNECT W/ TOM MACDONALD!FACEBOOK: http://www.facebook.com/TomMacDonaldOfficialINSTAGRAM: http://www.instagram.com/hangovergangTWITTER: http://www.twitter.com/IAmTomMacDonaldWEBSITE: http://www.hangovergang.comSPOTIFY: http://spoti.fi/2H35BQRiTUNES: https://apple.co/2BQucZOWRITTEN & PRODUCED BY Tom MacDonaldSHOT by Nova Rockafellerhttp://www.instagram.com/NovaRockafellerMIXED & MASTERED by Evan Morganwww.evanmorganproductions.comwww.facebook.com/EvanMorganProductionswww.instagram.com/EMorganProductions"
"bUIpeD0tA8g","The Cayo Perico Heist: Coming December 15 to GTA Online","2020-11-20T15:00:31Z","UC6VcWc1rAoWdBCM0JxrRQ3A","Rockstar Games","20","20.21.11","gta online|gta online update|gta 5 online|cayo perico heist|ps4|ps5|xbox series x|xbox one x|pc","990364","86397","2370","8321","https://i.ytimg.com/vi/bUIpeD0tA8g/default.jpg","False","False","It’s time to raise the stakes higher than ever before. You’ve broken a convicted spy out of Bolingbroke Penitentiary. You’ve saved the world from an egomaniacal tech billionaire. And you’ve beaten the odds to drain a casino of its cash. This time, you’re taking on an entire island.Prepare to infiltrate the remote island compound of the world’s most notorious drug dealer in Grand Theft Auto Online’s biggest, most daring, and action-packed addition yet: The Cayo Perico Heist.It’s up to you to find a way to breach Cayo Perico, one of the most secure private islands in the entire world, evade or neutralize the heavily armed security forces stationed there, and escape with valuable evidence along with as much art, gold and drug money as you can carry.  Choose your tools. Choose your approach. Choose your crew – or even go it entirely alone. Just make it back to Los Santos in one piece.The Cayo Perico Heist is the biggest GTA Online adventure ever, introducing an all-new exotic Heist location, with a brand-new approach to Heist design that features the ability to play everything solo or with up to three other players. Plus you can acquire new vehicles and tactical weapons, experience new social spaces to dance and party with friends and new world-class DJs, and listen to new radio stations with over 100 new songs. Oh, and a very large, very versatile, and very heavily armed submarine HQ with plenty of other surprises.  Stay tuned for more details as you prepare for The Cayo Perico Heist.Coming to PS4, Xbox One, PC, and via backward compatibility for PS5 / Xbox Series X|S."
"P8jNPawT-aM","Megan Thee Stallion - Shots Fired [Official Audio]","2020-11-20T05:00:04Z","UCKrdjiuS66yXOdEZ_cOD_TA","Megan Thee Stallion","10","20.21.11","Megan Thee Stallion|Good News|Megan Thee Stallion Good News|megan thee stallion|good news|megan thee stallion good news|megan thee stallion album|Shots Fired|Megan Thee Stallion Shots Fired|Shots Fired Megan Thee Stallion|Megan Thee Stallion Shots Fired Official Audio|shots fired good news megan|megan thee stallion shots fired good news|shots fired megan thee stallion good news|megan thee stallion good news shots fired|megan thee stallion shots fired official","532407","42267","1791","3904","https://i.ytimg.com/vi/P8jNPawT-aM/default.jpg","False","False","The official audio for Megan Thee Stallion's “Shots Fired” from her album ‘Good News’ - Out Now!Stream ‘Good News’ on all platforms: https://megantheestallion.ffm.to/goodnewsText Megan Thee Stallion:(832) 210-1202Follow Megan Thee Stallion:https://www.instagram.com/theestallionhttps://twitter.com/theestallionhttps://www.facebook.com/theestallionnhttps://soundcloud.com/megan-thee-stallion--#MeganTheeStallion #ShotsFired #GoodNews #OfficialAudio© 2020 1501 Certified Ent LLC under exclusive license to 300 Entertainment"
"zav8i32PCio","The Undertaker Takes Care of Business While Eating Spicy Wings | Hot Ones","2020-11-19T16:00:30Z","UCPD_bxCRGpmmeQcbe2kpPaA","First We Feast","26","20.21.11","First we feast|fwf|firstwefeast|food|food porn|cook|cooking|chef|kitchen|complex|complex media|Cook (Profession)sean evans|hot ones|hot ones interview|hot ones the undertaker|hot ones wwe|wwe|the undertaker|the undertaker interview|the undertaker interview 2020|the undertaker hot ones|hot sauce|hot sauce show|hot sauce reactions|hot sauce prank|chicken wings|hot chicken|hot chicken wings show|wwe the undertaker|sean evans|sean evans interview","2949032","155574","1253","14365","https://i.ytimg.com/vi/zav8i32PCio/default.jpg","False","False","Mark Calaway is the Undertaker—a 7x World Heavyweight Champion (in WWF and WWE), and one of the greatest professional wrestlers of all time. His five-part docuseries ‘The Last Ride’ is currently airing on the WWE Network. On November 22 he'll be giving his Final Farewell at ‘Survivor Series,’ the same event where he made his wrestling debut more than 30 years ago. How will Big Evil match up in this rumble with the wings of death? Find out how the trench coat-wearing Deadman fares in the scoville inferno known as Hot Ones while answering questions about his early days performing under the name Commando, backstage locker room beef, the zen of motorcycling, Mike Tyson’s impact on professional wrestling, and how he wants his fans to remember him. Will the Lord of Darkness ascend from hell and survive the hottest hot sauces to ever enter the ring, or will he be buried alive in the chicken bone graveyard? From Death Valley… The Undertaker!*NEW* BUY HOT ONES X REEBOK COLLAB: https://www.reebok.com/hot_onesBUY HOT ONES TRUTH OR DAB THE GAME NOW: http://truthordabgame.comBUY HOT ONES HOT SAUCE NOW: http://bit.ly/HotOnesSaucesNEWHOT ONES MERCH AVAILABLE NOW: https://bit.ly/2AIS271SIGN UP FOR THE HOT ONES MONTHLY HOT SAUCE SUB BOX: https://bit.ly/2veY50PSIGN UP FOR THE FIRST WE FEAST NEWSLETTER: http://firstwefeast.com/signupSubscribe to First We Feast on YouTube: http://goo.gl/UxFzhKCheck out more of First We Feast here:http://firstwefeast.com/https://twitter.com/firstwefeasthttps://www.facebook.com/FirstWeFeasthttp://instagram.com/firstwefeastFirst We Feast videos offer an iconoclastic view into the culinary world, taking you behind-the-scenes with some of the country's best chefs and finding the unexpected places where food and pop culture intersect."
"3QhHQozncGo","Morgan Wallen - Still Goin Down (Official Lyric Video)","2020-11-20T14:50:07Z","UCiQtJ9wVv8R-x7GKHzgZu8A","MorganWallenVEVO","10","20.21.11","Morgan|Wallen|Still|Goin|Down|(Lyric|Video)|Republic|Records|Country","203963","9730","87","430","https://i.ytimg.com/vi/3QhHQozncGo/default.jpg","False","False","Pre-order ‘Dangerous: The Double Album’ here: https://MorganWallen.lnk.to/DangerousYD Stay connected for exclusive updates:▸Mailing List: https://bit.ly/2FRP7LK▸Text: 865-351-6290▸Website: https://morganwallen.com/ Follow Morgan:▸Instagram: https://instagram.com/morganwallen/▸Twitter: https://twitter.com/morganwallen/▸TikTok: https://vm.tiktok.com/ZMJHVheG5/▸Facebook: https://facebook.com/morgancwallen Lyrics:Bama red 4-Runner pulled into the partywith a 30A sticker on the back windshield2 tone tank top slippin’ off her shoulderkinda girl when she steps out the world stands stillooooooo - I know where this is goin’I .... already know it (she’s)somebody’s problemsomebody’s goodbyesomebody’s last call number that they can’t findsomebody’s best day - somebody’s worst nightsomebody’s reason for leavin’ on the porch lightthinkin’ bout them tanlinesand I’m thinkin’ damn I’dlove to drown in them heartbreaker blue eyesshe’s somebody’s problem - and somebody’s problem’s‘bout to be mine‘bout to be minekinda girl once you’ve had her you can’t stand to lose herkinda girl where your friends tell you don’t F it upkinda girl that goes from tryin’ to just get her numberto slidin’ through the summer - to talkin’ bout loveoooooo - I think I’m likin’ where it’s goin’I - I - I’d like to try me some ofsomebody’s problemsomebody’s goodbyesomebody’s last call number that they can’t find somebody’s best day - somebody’s worst nightsomebody’s reason for leavin’ on the porch lightthinkin’ bout them tanlinesand I’m thinkin’ damn I’dlove to drown in them heartbreaker blue eyesshe’s somebody’s problem - and somebody’s problem’s‘bout to be mine‘bout to be mineoh - oh - oh hey baby don’t just keep me wishin’aw - aw - aw let me get to fixin’somebody’s problemsomebody’s goodbyesomebody’s last call number that they can’t findsomebody’s best day - somebody’s worst nightsomebody’s reason for leavin’ on the porch lightthinkin’ bout them tanlinesand I’m thinkin’ damn I’dlove to drown in them heartbreaker blue eyesshe’s somebody’s problem - and somebody’s problem’s‘bout to be mine‘bout to be mine‘bout to be mine‘bout to be mine#MorganWallen #DangerousTheDoubleAlbum"
"aZItoGB9zss","Lil Tjay - Move On (Official Video)","2020-11-20T16:00:10Z","UChwzHCrvf74cjQzmubiV8nw","liltjayVEVO","10","20.21.11","Lil TJay|Lil TJay Move On|Losses|New York Rap|Zoo York|Hip-Hop|Lil TJay new song|Lil TJay new video|Ice Cold|Leaked|LilTJayMoveOn|Move On Lil TJay|Mood Swing|Bronx Rapper|Bronx|Trench Kid|Trenches|Lil TJay new music|Pop Smoke|A Boogie Wit Da Hoodie|Roddy Rich|Lil Tjay Movie|Columbia|Hip Hop|Lil Tjay|Move On","769575","111259","515","11690","https://i.ytimg.com/vi/aZItoGB9zss/default.jpg","False","False","Official video for Move On by Lil Tjay. Listen & Download Move On by Lil Tjay out now: https://LilTjay.lnk.to/MoveOnAmazon Music -  https://LilTjay.lnk.to/MoveOn/AmazonMusicApple Music -  https://LilTjay.lnk.to/MoveOn/AppleMusiciTunes -  https://LilTjay.lnk.to/MoveOn/iTunesSpotify -  https://LilTjay.lnk.to/MoveOn/SpotifySoundcloud – https://LilTjay.lnk.to/MoveOn/SoundcloudYouTube Music - https://LilTjay.lnk.to/MoveOn/YouTubeMusicDirected & Edited by David Karp and Courtney LooProducer - McCray SutherlinProduction Companies - Thrice Cooked x Muddy WaterCast - Daniella Perkins & Noah GerryDirector of Photography - Franklin Ricart Production Designer & VFX - Noah DainsCostume - Kelly BroderickPM - Parker VaughnPC - Antoinette DormerColor - Gabe Sanchez1st AD - Cort Carpenter2nd AD - John K Gittens1st AC - Aaron Cheung2nd AC - Mitchell BoyceSteadicam - Toby HarboGaffer - Jorge HernandezBBE - Mike LongKey Grip - Camilo GodoyBBG - Carlos OrtezSwings - Jack Alexander & Colvin AngProp Master - Jack MassuraSet Decorator - Piper TompkinsArt Assistant - Wesley GoodrichCostume Assistant - Hunter FreedmanHMU - Brittany ThomasSPFX Makeup - Wen ZhangPAs - Jeremy Chambers, Damien Pettway, April Edquaban, Nanichi OlivaManagement - Deon Douglas, Clayton Barmore, Rich Kemp, Ty WarrenVideo Commissioner - Jill KaplanVideo Coordinator - Alexa ZeligerMarketing: Victoria White-Mason Follow Lil TjayFacebook - https://www.facebook.com/LilTjayInstagram - https://www.instagram.com/liltjay/Twitter - https://twitter.com/liltjay https://www.liltjaymusic.com/ #LilTjay #MoveOnhttp://vevo.ly/SsAHPj"
"wLCYlAj9rkI","Jeezy - Almighty Black Dollar ft. Rick Ross","2020-11-20T05:00:15Z","UCl1f01Dy5pim6F9hmXV4rPg","JeezyVEVO","10","20.21.11","Jeezy|Almighty|Black|Dollar|Jeezy/Def|Jam|Hip|Hop","367300","23165","386","2046","https://i.ytimg.com/vi/wLCYlAj9rkI/default.jpg","False","False","Music video by Jeezy performing Almighty Black Dollar. © 2020 YJ Music, Inc., under exclusive license to Def Jam Recordings, a division of UMG Recordings, Inc.http://vevo.ly/xVZyDf"
"P_MiPhs3Hz8","Down With the SICK","2020-11-20T19:03:21Z","UCu6v4AdYxVH5fhfq9mi5llA","Let Me Explain Studios","1","20.21.11","[none]","381803","56300","228","6589","https://i.ytimg.com/vi/P_MiPhs3Hz8/default.jpg","False","False","Winter Wear: https://bit.ly/36ovF6kI dun got sick and no one knew what it was. So have a filler toon until the real video comes out! YEAH! LOVE YOU!#LetMeExplainStudios #Sick #BlizzardBeach #RebeccaParham #animation #cartoon #DisneyWorld #Disney #NewYork #animated #winter"
