video_id,title,publishedAt,channelId,channelTitle,categoryId,trending_date,tags,view_count,likes,dislikes,comment_count,thumbnail_link,comments_disabled,ratings_disabled,description
"mDcws6MxHT8","Quarantinewhile... Hey Dolly Parton, Thanks For Funding A Covid Vaccine!","2020-11-18T08:35:01Z","UCMtFAi84ehTSYSE9XoHefig","The Late Show with Stephen Colbert","24","20.21.11","The Late Show|Late Show|Stephen Colbert|Steven Colbert|Colbert|celebrity|celeb|celebrities|late night|talk show|comedian|comedy|CBS|joke|jokes|funny|funny video|funny videos|humor|hollywood|famous","1127413","19220","386","2020","https://i.ytimg.com/vi/mDcws6MxHT8/default.jpg","False","False","Quarantinewhile... Add this to your list of reasons to love Stephen Colbert's friend Dolly Parton: she's partly responsible for funding the Moderna Coronavirus vaccine. #Colbert #Meanwhile #QuarantinewhileSubscribe To The Late Show Channel HERE: http://bit.ly/ColbertYouTubeFor more content from The Late Show with Stephen Colbert, click HERE: http://bit.ly/1AKISnRWatch full episodes of The Late Show HERE: http://bit.ly/1Puei40Like The Late Show on Facebook HERE: http://on.fb.me/1df139YFollow The Late Show on Twitter HERE: http://bit.ly/1dMzZzGFollow The Late Show on Google+ HERE: http://bit.ly/1JlGgzwFollow The Late Show on Instagram HERE: http://bit.ly/29wfREjFollow The Late Show on Tumblr HERE: http://bit.ly/29DVvtRWatch The Late Show with Stephen Colbert weeknights at 11:35 PM ET/10:35 PM CT. Only on CBS.Get the CBS app for iPhone & iPad! Click HERE: http://bit.ly/12rLxgeGet new episodes of shows you love across devices the next day, stream live TV, and watch full seasons of CBS fan favorites anytime, anywhere with CBS All Access. Try it free! http://bit.ly/1OQA29B---The Late Show with Stephen Colbert is the premier late night talk show on CBS, airing at 11:35pm EST, streaming online via CBS All Access, and delivered to the International Space Station on a USB drive taped to a weather balloon. Every night, viewers can expect: Comedy, humor, funny moments, witty interviews, celebrities, famous people, movie stars, bits, humorous celebrities doing bits, funny celebs, big group photos of every star from Hollywood, even the reclusive ones, plus also jokes."
"aT4rITutAwA","Watch NASA's SpaceX Crew-1 Mission Arrive at the International Space Station","2020-11-17T07:16:06Z","UCLA_DiR1FfKNvjuUpBHmylQ","NASA","28","20.21.11","[none]","1253034","26160","557","0","https://i.ytimg.com/vi/aT4rITutAwA/default.jpg","True","False","Tune in live as the Crew Dragon Resilience spacecraft docks to the International Space Station with astronauts Michael Hopkins, Shannon Walker, and Victor Glover of NASA and Soichi Noguchi of JAXA (Japan Aerospace Exploration Agency) aboard. The four astronauts will begin a six-month science mission on the station. Docking is scheduled at 11 p.m. EST (4 a.m. UTC), Monday, Nov. 16 followed by the hatch opening at 1:10 a.m. EST (6:30 a.m. UTC), and a welcome ceremony at 1:40 a.m. EST (6:40 a.m. UTC) Tuesday, Nov. 17.Download Link: https://images.nasa.gov/details-Crew-1%20Docking,%20Hatch%20Opening%20and%20Welcoming%20Ceremony"
"LFgexG6LN8Q","I STOLE THIS FOR YOU | Official Treyten Merch","2020-11-17T22:10:25Z","UCu1lq83POgLJq3x7WwYq7RQ","Treyten Live","20","20.21.11","Treyten|RedlineRP|gta 5|funny moments|grand theft auto|gta 5 mods|treyten merch|gta online","123055","12945","61","1870","https://i.ytimg.com/vi/LFgexG6LN8Q/default.jpg","False","False","MERCH - https://represent.com/store/treytenOfficial Treyten merch is finally available for purchase!"
"tbjdN8sGa5A","Jeep® | Wrangler Rubicon 392 | Reveal","2020-11-17T17:00:11Z","UCMWLdSdAyDcCy_OVzONKm0w","Jeep","2","20.21.11","[none]","186769","4682","91","769","https://i.ytimg.com/vi/tbjdN8sGa5A/default.jpg","False","False","A new degree of freedom. Watch the full reveal to get your first look at the powerful Wrangler Rubicon 392.1:00 – Jim Morrison’s Introduction2:18 –  80 Year History4:50 – 80th Anniversary Models7:30 –  The Reveal10:43 – Specs and Capability13:46 – Interior and Upgrades14:41 – Performance and Engineering15:43 – Sound and Styling16:30 – Closing RemarksFor more than 75 years, the Jeep name has been indelibly associated with freedom, authenticity, adventure and passion. These are vehicles for “dreamers and doers”–forging extraordinary, uncommon bonds between themselves and their owners, because adventure is found in every Jeep vehicle’s DNA. The Jeep badge stands for more than a brand. In truth, it’s a badge of honor.Subscribe to the #Jeep brand YouTube channel: https://www.youtube.com/Jeep Follow The Jeep brand on Social: · Facebook: https://www.facebook.com/jeep · Twitter: https://twitter.com/jeep · Instagram: https://instagram.com/jeep"
"zDRwXZg7i-Q","Vin Got SCAMMED. 402,000 Mile Porsche 911 Hot Rod Build!","2020-11-17T16:00:20Z","UCCQAt0ipBbsOOIFpIDu9z2Q","Hoonigan Project Cars","2","20.21.11","porsche|911 sc|german|volkswagen|hoonigan|scammed","204844","9160","110","936","https://i.ytimg.com/vi/zDRwXZg7i-Q/default.jpg","False","False","It happened: the king of buying, selling, and trading cars got played. If you play the game long enough, it’s bound to happen. What was originally advertised as a 102k 911, turned out to be a 400,000+ mile 911. Oddly enough… we’re even more into it now. This project is made possible from parts and DIY articles from Pelican Parts! Need parts? Bought an old Porsche and have no idea what you're doing? Hit Pelican! @Pelican Parts  www.pelicanparts.comWant this exhaust?  @Supersprint Exhausts Thanks to  @ECS Tuning for the quick shipping!Thanks to Thermo-tec: https://www.thermotec.com/IG:https://www.instagram.com/thermotec/ We’ve got channels for all your car content needs. Subscribe, nerds.The Hoonigans: https://www.youtube.com/user/TheHoonigans?sub_confirmation=1Project Cars: https://www.youtube.com/c/HooniganProjectCars??sub_confirmation=1Daily Transmission: http://www.youtube.com/c/HooniganDailyTransmission?sub_confirmation=1Ken Block: https://www.youtube.com/KenBlockHHIC?sub_confirmation=1AutoFocus: https://www.youtube.com/channel/UCuGuOqcXsgzL3YrguODoGXw?sub_confirmation=1Bonus: https://www.youtube.com/channel/UCFhUumuHyYL-mAXSeZVbqMg?sub_confirmation=1Stay fresh with the latest apparel: https://www.hoonigan.com/thenewnewFacebook: https://www.facebook.com/TheHoonigans/Instagram: https://www.instagram.com/thehoonigans/Follow Our Crew:@brianscotto@hertlife@vin_tra@dangerdan3@mister_zachary@jchase7452@nadsynads@larry_chen_foto@suppymk4@amezcua_fs1@roncarAnd don’t forget to turn on notifications so you don’t miss out on our latest uploads!"
"Tm7LykboX2U","FRENCH TOAST - How to make - SWEET 🕒 1 min Video","2020-11-13T18:00:07Z","UCf0prLxUOEpdg1OQs55bk3g","HowToMin","26","20.21.11","how to make French toast|how|to|how-to|French toast|popular homemade dishes|homemade|French cuisine|Pain Perdu|lost bread|dessert course|dessert course for breakfast|original French toast recipe|toast recipe|tasty dessert|breakfast|video recipe|how to make original French toast|howtomin|sweet French toast Recipe|sweet French toast|baguette|stale bread|french toast recipe|french toast|easy french toast|how to make","401328","5796","347","89","https://i.ytimg.com/vi/Tm7LykboX2U/default.jpg","False","False","Video shows how to make French toast. French toast – one of the most popular homemade dishes in French cuisine. In France, they call French toast – “Pain Perdu” (it means lost bread). This recipe explains how to make French toast (SWEET) as a dessert course for breakfast. Using this original French toast recipe, you will make a tasty dessert in 8-10 min for breakfast. The main ingredients of recipe are bread, egg and milk. All other ingredients of this recipe for staffing and garnishing you can change on your own taste. Enjoy this easy and quick 1 min video recipe how to make original French toast from HowToMin!Sweet French toast Recipe:INGREDIENTS:• 4 thick slices of baguette• 1 large egg • 50ml (1.7 fl. oz.) milk or cream • 2 tbsp. sugar • 1/4 tsp cinnamon • pinch of salt • splash of vanilla extract • butter for cooking• Greek yogurt, jam and Blueberries for garnishIMPORTANT:You can use fresh or stale bread for this recipe of the French toast. HOW TO MAKE FRENCH TOAST:Stir the egg with milk - 50ml (1.7 fl. oz.)Add sugar, salt, cinnamon and a drop of vanilla extract  Stir wellCut 4 thick (about 2 inch) slices of baguette (or any other stale bread)Pour the mix in a plateArrange the bread slices and leave them to soak for 2 minFlip the slices and leave them to soakHeat the pan and melt butterPlace the bread and sear 2 min from each sideSpread a cooking dish with butterCook in oven about 5-6 min 320˚F (160˚C)Garnish with Greek yogurt, blueberries and mint leavesEnjoy your tasty French toast!WEBSITE: https://howtomin.com FOLLOW US ON:INSTAGRAM: https://www.instagram.com/howtomin_com FACEBOOK: https://www.facebook.com/howtomin/ TWITTER: https://twitter.com/howtomin_com  TikTok: https://www.tiktok.com/@howtomin"
"2qN7TkyoH4E","10 Games That COPIED Among Us","2020-11-15T22:40:54Z","UCYBetkejPxK8t_41zueazcA","T5G","20","20.21.11","among us|10 Games That COPIED Among Us|among us ripoff|among us ripoffs|among us copy|among us 2|fake among us|among us new|new among us|among us new update|new among us update|among us updates|update among us|ripoff among us|among us ripped off|among us secrets|among|us|new|update|video","4923584","221952","8388","12668","https://i.ytimg.com/vi/2qN7TkyoH4E/default.jpg","False","False","10 Games That COPIED Among UsVideo Sources (Go Subscribe)Follow Clish here - https://www.instagram.com/clishhhh/https://pastebin.com/FgnM9BVhFollow us on Instagram & Twitter to be informed when we post:https://twitter.com/Top5Gamingxhttps://www.instagram.com/top5gamingx/Check out Other Among Us Videos Here15 AMONG US Tips & Tricks EVERYONE Should Know (1000 IQ)https://www.youtube.com/watch?v=29_8bhzjTqI15 Among Us SECRETS You MISSED!https://www.youtube.com/watch?v=TyahPGDr4-E10 SECRET Among Us Easter Eggshttps://www.youtube.com/watch?v=nzo9MBH91k8AMONG US, but with 99 IMPOSTORShttps://www.youtube.com/watch?v=YTZ-GZPTND8This Among Us Video is based around the 10 Games That COPIED Among Us, For more among us tips & tricks, among us secrets, among us best moments & more subscribe."
"5EZnz89BLtk","Our First Ultrasound | IT'S TWINS!","2020-11-17T20:34:06Z","UC_0mlge_fLewbr5P8YEL2tA","THE WEISS LIFE","24","20.21.11","our first ultrasound | IT'S TWINS!|first ultrasound twins|twins|the weiss life|weiss life|first ultrasound|twins ultrasound surprise|pregnant with twins|pregnant|ultrasound|pregnancy|babies|new baby|seeing our baby for the first time|pregnancy announcement|surprise|vlog|twin pregnancy|emotional|miscarriage|pregnancy reveal|pregnant ultrasound|are we having twins|first ultrasound pregnancy|twin ultrasound|twin|surprise twins|Twins surprise","154500","8691","114","0","https://i.ytimg.com/vi/5EZnz89BLtk/default.jpg","True","False","Don't forget to subscribe! http://www.youtube.com/theweisslifeIn today's family vlog - Our First Ultrasound | IT'S TWINS!↓Our Other Channels↓Melissa Weiss: https://www.youtube.com/channel/UCaGkVbFGD9JfRfppLbKR9mAJeff Weiss: https://www.youtube.com/channel/UCSLH3SFScL5W1o-ORoyJzPAThe Weiss Girls: https://www.youtube.com/channel/UCah5-HV5ektOuCByZJcN6fgOUR WEBSITE! https://www.weisslife.com*Follow us on Instagram, Facebook and Twitter*Instagram Accounts:Melissa: http://www.instagram.com/theweissfamGabrielle: http://www.instagram.com/missgabriellenicholeJeff: http://www.instagram.com/jeffweisslifeFacebook: http://www.facebook.com/theweisslifeTwitter: http://twitter.com/TheWeissLifeSend Us Mail!The Weiss Life69 Lincoln Blvd. Suite-A # 267Lincoln, CA 95648Production Music courtesy of  www.epidemicsound.com"
"8q8LsYbDCmM","Binging with Babish: Omelette du Fromage from Dexter's Laboratory","2020-11-17T14:00:02Z","UCJHA_jMfCvEnv-3kRjTCQXw","Babish Culinary Universe","24","20.21.11","binging with babish|babbish|babish|basics with babish|pear qwerty horse|omelette du fromage|omelette recipe|cheese omelette recipe|cheese omelette|omelette du fromage dexter|dexter's lab|dexter's laboratory|dexter omelette du fromage|omelette du fromage recipe|how to make omelette du fromage|omelette au fromage|omelette au fromage recipe|how to make cheese omelette","1894001","88504","758","5793","https://i.ytimg.com/vi/8q8LsYbDCmM/default.jpg","False","False","This episode is sponsored by Butcherbox. New members will get 6 free grass-fed, grass-finished steaks! That’s 2 New York strips and 4 top sirloins added to your first box for free. Click here: http://butcherbox.com/babishToday, I'm given an excuse to (probably horrendously incorrectly) attempt some French - both the language and cuisine. An iconically challenging but ironically simple dish becomes the sole phrase in Dexter McPherson's normally-stacked vocabulary, the admittedly-seductive-sounding omelette du fromage. Let's crack some eggs!Recipe: https://www.bingingwithbabish.com/recipes/omelette-du-fromage-dexters-laboratoryMusic: Petal by Broke for Freehttps://soundcloud.com/broke-for-freeMy playlist of preferred cooking tunes, Bangers with Babish!https://spoti.fi/2TYXmiYBinging With Babish Website: http://bit.ly/BingingBabishWebsiteBasics With Babish Website: http://bit.ly/BasicsWithBabishWebsitePatreon: http://bit.ly/BingingPatreonInstagram: http://bit.ly/BabishInstagramFacebook: http://bit.ly/BabishFacebookTwitter: http://bit.ly/BabishTwitter"
"Z_XeyQyheYw","Behind the Scenes of my Kylie X Grinch Shoot","2020-11-18T20:57:44Z","UCWkYXtnAuu7VTLPwUcRSB6A","Kylie Jenner","22","20.21.11","Kylie Jenner|Kylie Cosmetics|Grinch|The Grinch|Holidays|Christmas|Makeup|Photoshoot|Behind the scenes","900623","0","0","2829","https://i.ytimg.com/vi/Z_XeyQyheYw/default.jpg","False","True","Come behind the scenes with me at the shoot of my Kylie x Grinch collection for Kylie Cosmetics. Launching this Thursday, November 19 at 3pm PST only on http://KylieCosmetics.com"
"Scl5NRK7hu8","FaZe Adapt vs FaZe Rug - $10,000 1v1","2020-11-16T22:26:03Z","UCi87kxosIT3wrnEA-mv4jWA","FaZe Adapt","22","20.21.11","Adapt|FaZeClan|FaZe Gaming","730185","46298","683","2654","https://i.ytimg.com/vi/Scl5NRK7hu8/default.jpg","False","False","Playing FaZe Rug for $10,0000 (1v1)....Let me know what video you guys wanna see next in the comments! Leave a like if you enjoyed!👉 SUBSCRIBE ► http://bit.ly/SubAdapt ► Instagram: http://instagr.am/TheFaZeAdapt► Twitter: https://twitter.com/FaZeAdapt► Snapchat: https://www.snapchat.com/add/AdaptAlexEdited by Waff: https://twitter.com/coL_Waffster"
"LqYsc7Wm0Bc","Red VS Blue (Rooster Teeth) | DEATH BATTLE!","2020-11-16T18:00:09Z","UCB9_VH_CNbbH4GfKu8qh63w","DEATH BATTLE!","24","20.21.11","DEATH BATTLE|Rooster Teeth|RT|DBX|DEATH BATTLE Cast|screwattack|red vs blue|redvsblue|rvb|sarge|caboose|church|tex|grif|donut|simmons|lopez|tucker|red vs blue zero|rvb zero|freelancer|project freelancer|leonard church|roosterteeth|burnie burns|matt hullum|gus sorola|geoff ramsey|deathbattle|ben singer|chad james|machinima|animated battle|3D animation|animated fight|animation|versus|who would win|comedy|halo|xbox|series x|halo infinite|combat evolved","840847","43544","2011","9195","https://i.ytimg.com/vi/LqYsc7Wm0Bc/default.jpg","False","False","A 17-year-long rivalry comes to an end! Who would really win Blood Gulch?Go to http://harrys.com/death and redeem your trial offer today!Go to http://keeps.com/death to receive your first month of treatment for FREE!Check out Episode 1 of RvB Zero for free at https://roosterteeth.com/series/red-vs-blue Get the MUSIC: - “Wiz & Boomstick – Death Battle ThemeDownload Link: http://www.bit.ly/DeathBattleTheme- Blood Gulch Bedlam - Battle MusicDownload Link: https://bit.ly/BloodGulchBedlamOFFICIAL DEATH BATTLE SUGGESTION FORM: http://bit.ly/DBRequestFormClick to SUBSCRIBE: http://bit.ly/SubToDeathBattle►Our Twitter: https://twitter.com/DEATHBATTLE►Our Store: http://bit.ly/DeathBattleStore►Watch our stuff early: http://bit.ly/2m9WLsZ►Follow the hosts on Twitter:Ben - https://twitter.com/BenBSingerChad - https://twitter.com/ChadJamesRT"
"fAQfEFUfN1o","The Eric Andre Show Hannibal Quits (Full Episode) | adult swim","2020-11-16T17:00:19Z","UCgPClNr5VSYC3syrDUIlzLw","Adult Swim","24","20.21.11","adult swim|animation|adult animation|the eric andre show|the eric andre show season 5 episode 2|eric andre season 5|eric andre episodes|eric andre full episodes|saweetie|shanola hampton|rapper warrior ninja|shanola hampton eric andre","1205231","63742","789","2788","https://i.ytimg.com/vi/fAQfEFUfN1o/default.jpg","False","False","After only one and a half episodes, Hannibal quits the show and is poorly cloned into a giant mutant version of himself named Blannibal. Eric survives a plane crash and welcomes Saweetie and Shanola Hampton. Jasper Dolphin, Taco, Pi'erre Bourne and MadeinTYO get tortured on Rapper Warrior Ninja.SUBSCRIBE: http://bit.ly/AdultSwimSubscribeAbout Adult Swim:Get your Adult Swim fix whenever and wherever you want at www.adultswim.com, or by downloading the Adult Swim app. Binge marathons or watch selected episodes of many of your favorite shows including Rick and Morty, Robot Chicken, Venture Bros., Aqua Teen Hunger Force and many more. And check out the Live Stream, our block of live, interactive shows every weekday: www.adultswim.com/streamsConnect with Adult Swim Online:Download the APPS: http://www.adultswim.com/apps/Visit Adult Swim WEBSITE: http://www.adultswim.com Like Adult Swim on FACEBOOK: http://bit.ly/ASFacebookFollow Adult Swim on TWITTER: http://bit.ly/ASTweetFollow Adult Swim on INSTAGRAM: http://instagram.com/adultswim"
"0nTZ-jEtTwA","Kiki with Willam (two women getting ready)","2020-11-16T20:00:00Z","UC0biFgrMdkv1hFAFLVePODQ","Trixie Mattel","24","20.21.11","willam|belli|trixie|mattel|cosmetics|makeup|drag|queens|rpdr|getting ready","787339","44854","697","2285","https://i.ytimg.com/vi/0nTZ-jEtTwA/default.jpg","False","False","@willam belli drops by for a kiki with Trixie to talk makeup, drag, backstage tea, and Willam's makeup lineShop Suck Less Face & Body: https://sucklessfaceandbody.com/Follow Willam on Instagram and Twitter: @/willamShop Trixie Cosmetics: https://www.trixiecosmetics.com/"
"Zco4AQNcX0U","Skip & Shannon on James Harden denying historic contract to focus on joining Nets | NBA | UNDISPUTED","2020-11-17T16:25:43Z","UCLXzq85ijg2LwJWFrz4pkmw","Skip and Shannon: UNDISPUTED","17","20.21.11","fox|fox sports|fs1|fox sports 1|undisputed|skip bayless|shannon sharpe|skip and shannon|fs1 undisputed|skip|bayless|shannon|sharpe|sports|news|nba|basketball|trade|houston|rockets|james harden|beard|harden|join|historic|contract|50 million|brooklyn|nets|kyrie|irving|kevin|durant|JamesHarden|James|Houston Rockets|NBA history|Kevin Durant|KevinDurant|Kyrie Irving|KyrieIrving|Kevin Durant and Kyrie Irving|MVP|James Harden and Nets","950124","10336","353","3106","https://i.ytimg.com/vi/Zco4AQNcX0U/default.jpg","False","False","James Harden has reportedly turned down a two-year extension with the Houston Rockets that would’ve made him the first player in NBA history to earn $50 million per year. Harden has apparently made it clear to ownership his goal now is to force a trade to join up with Kevin Durant and Kyrie Irving in Brooklyn. However, Harden is still under contract until at least 2022, so Houston has no incentive to take any bad deal in exchange for the former MVP. Hear what Skip Bayless and Shannon Sharpe have to say about Harden's pursuit of joining KD & Kyrie in Brooklyn.#Undisputed #NBA #JamesHarden #KevinDurant #KyrieIrving #HoustonRockets #Nets SUBSCRIBE to get the latest UNDISPUTED content: http://foxs.pt/SubscribeUNDISPUTEDListen to UNDISPUTED on Spotify: https://foxs.pt/UNDISPUTEDSpotifyThe all-new FOX Sports App, built for the modern sports fan: https://tinyurl.com/y4uouolb►Watch the latest content from UNDISPUTED: https://foxs.pt/TheLatestOnUNDISPUTED▶First Things First's YouTube channel: http://foxs.pt/SubscribeFIRSTTHINGSFIRST▶The Herd with Colin Cowherd’s YouTube channel: http://foxs.pt/SubscribeTHEHERD▶Speak for Yourself’s YouTube channel: http://foxs.pt/SubscribeSPEAKFORYOURSELF►FOX Bet Live’s YouTube Channel: https://foxs.pt/SubscribeFOXBETLIVE►Club Shay Shay’s YouTube Channel: http://foxs.pt/SubscribeCLUBSHAYSHAYSee more from UNDISPUTED: http://foxs.pt/UNDISPUTEDFoxSportsLike UNDISPUTED on Facebook: http://foxs.pt/UNDISPUTEDFacebookFollow UNDISPUTED on Twitter: http://foxs.pt/UNDISPUTEDTwitterFollow UNDISPUTED on Instagram: http://foxs.pt/UNDISPUTEDInstagramFollow Skip Bayless on Twitter: http://foxs.pt/SkipBaylessTwitterFollow Shannon Sharpe on Twitter: http://foxs.pt/ShannonSharpeTwitterFollow Jenny Taft on Twitter: https://foxs.pt/JennyTaftTwitterAbout Skip and Shannon: UNDISPUTED:UNDISPUTED is a daily two-and-a-half hour sports debate show starring Skip Bayless and Shannon Sharpe. Every day, Skip and Shannon will give their unfiltered, incisive, passionate opinions on the biggest sports topics of the day.Skip & Shannon on James Harden denying historic contract to focus on joining Nets | NBA | UNDISPUTEDhttps://youtu.be/Zco4AQNcX0USkip and Shannon: UNDISPUTEDhttps://www.youtube.com/c/UndisputedOnFS1"
"bnChQbxLkkI","Crew-1 Mission | Launch","2020-11-16T01:06:24Z","UCtI0Hodo5o5dUb67FeUjDeA","SpaceX","28","20.21.11","SpaceX|Space|Crew-1|Crew-1 Mission|Launch|Dragon|Crew Dragon|Commercial Crew|Elon Musk|Musk|Astronaut|Astronauts|Victor Glover|Mike Hopkins|Michael Hopkins|Shannon Walker|Soichi Noguchi|NASA|JAXA|ISS|International Space Station","4992612","125830","2399","4273","https://i.ytimg.com/vi/bnChQbxLkkI/default.jpg","False","False","Coast Phase: https://youtu.be/eVB02SSeqgQSpaceX and NASA are targeting Sunday, November 15 for Falcon 9’s launch of Dragon’s first operational crew mission (Crew-1) to the International Space Station (ISS) from historic Launch Complex 39A (LC-39A) at NASA’s Kennedy Space Center in Florida. The instantaneous launch window opens at 7:27 p.m. EST on November 15, 00:27 UTC on November 16. Following stage separation, SpaceX will attempt to land Falcon 9’s first stage on the “Just Read the Instructions” droneship, which will be stationed in the Atlantic Ocean. The launch webcast will go live about 4 hours before liftoff. Tune in here to watch live."
"j8eZ_PjgDBM","The Freedom Factory Has a MAJOR Track Problem... (LeMullets Damage Report)","2020-11-17T23:29:39Z","UCh8f8vssLddD2PbnU3Ag_Bw","Cleetus McFarland","1","20.21.11","leroy|1320video|drag racing|boosted|cleetus McFarland|cleetus|McFarland|Leroy|bald eagles|bald eagle machine|1320|modified|boost|turbo|twin turbo|precision turbo|Texas speed|Texas speed and performance|Fasterproms|tuning|tuned|burnout|stick shift|six speed|corvette|Leroy Vette|c5 corvette|Chevrolet|unicorn|c5|supercharging Leroy|turbocharging Leroy|freedom factory|ruby|auction corvette|lemullets","904968","37874","528","3032","https://i.ytimg.com/vi/j8eZ_PjgDBM/default.jpg","False","False","Visit http://simplisafe.com/cleetus to get a special holiday offer! SimpliSafe is award -winning home security that keeps your home safe around the clock. It's really reliable, easy to use, and there are no contracts.    Hot off the press CLEETUS SHIRTS!!! Grab yours here -  https://www.cleetusmcfarland.comOur 2020 Sponsors: https://www.holley.comhttps://texas-speed.comhttps://www.motionraceworks.comhttps://www.nittotire.comhttps://www.summitracing.comhttps://heatwavevisual.comCheck out our schedule for 2020 here - https://www.cleetusmcfarland.com/year2020/Cleetus2 Channel - https://goo.gl/Ph2wyoHolley's channel - https://www.youtube.com/channel/UCeQfJXzg0gnfuM4tgmagCCw**Social Media:Instagram - https://goo.gl/LZvy5eFacebook - https://goo.gl/gdwhh1**SEND ME FAN MAIL... (bald eagles welcome) Cleetus McFarland12961 44th St N. Ste BClearwater, FL 33762United States of AmericaThe first time we've ever been pulled over in either of these cars... CLEETER T-SHIRTS!!!!! Grab yours here -  https://www.cleetusmcfarland.com"
"nrGPaVUMBl4","Watch the Shadowlands Launch Cinematic: “Beyond the Veil”","2020-11-16T18:00:09Z","UCbLj9QP9FAaHs_647QckGtg","World of Warcraft","20","20.21.11","World of Warcraft|WoW|Warcraft|Blizzard|Blizzard Entertainment|shadowlands|Bastion|Ardenweald|Madlraxxus|Revendreth|the maw|the jailer|winter queen|krexus|Denathrius|warcraft lore|story","1913814","49057","3381","4644","https://i.ytimg.com/vi/nrGPaVUMBl4/default.jpg","False","False","In the Shadowlands, every soul has its place—from the path of ascension among the spires of Bastion to an eternity of torment in the depths of the Maw. Choose where your destiny lies.Enter the Shadowlands on November 23 at 3:00pm PST. Learn more at http://worldofwarcraft.com► Latest WoW news:: http://worldofwarcraft.com/news ► Subscribe to WoW: http://blizz.ly/WoWYTSub► Visit WoW on Battle.net: https://blizz.ly/3hDM1Na --► Follow Warcraft on Twitter: https://twitter.com/warcraft ► Follow Warcraft on Instagram: https://instagram.com/warcraft ► Like Warcraft on Facebook: https://facebook.com/warcraft"
