video_id,title,publishedAt,channelId,channelTitle,categoryId,trending_date,tags,view_count,likes,dislikes,comment_count,thumbnail_link,comments_disabled,ratings_disabled,description
"axth9vCCx_w","Harden plus KD & Kyrie won't work, Schröder to Lakers will — Broussard | NBA | FIRST THINGS FIRST","2020-11-16T18:32:28Z","UCOTPo2y-NHJjg1EuENrxypA","First Things First","17","20.21.11","fox|fox sports|fox sports 1|fs1|first things first|nick wright|nick|wright|sports|news|nba|basketball|trade|2020|covid|james harden|big 3|big three|kd|kevin durant|kyrie irving|bed-stuy|brooklyn|nets|houston|rockets|los angeles|lakers|dennis schroder|danny green|oklahoma city|thunder|okc|Brooklyn Nets|Dennis Schröder|los Angeles Lakers|National Basketball Association|Oklahoma City Thunder|Houston Rockets","156143","1546","80","463","https://i.ytimg.com/vi/axth9vCCx_w/default.jpg","False","False","Chris Broussard joins the show to break down the latest NBA reports. Broussard feels James Harden joining Kevin Durant & Kyrie Irving on the Brooklyn Nets won't work, but Dennis Schröder to the Los Angeles Lakers in exchange for Danny Green will.#FirstThingsFirst #NBA #JamesHarden #KevinDurant #KyrieIrving #DennisSchröder #DannyGreen #Lakers #Nets SUBSCRIBE to get the latest from First Things First: http://foxs.pt/SubscribeFIRSTTHINGSFIRSTThe all-new FOX Sports App, built for the modern sports fan: https://tinyurl.com/y4uouolb►Watch the latest content from First Things First: https://foxs.pt/LatestOnFIRSTTHINGSFIRST▶The Herd with Colin Cowherd’s YouTube channel: http://foxs.pt/SubscribeTHEHERD►UNDISPUTED’s YouTube channel: http://foxs.pt/SubscribeUNDISPUTED ▶Speak for Yourself’s YouTube channel: http://foxs.pt/SubscribeSPEAKFORYOURSELF►FOX Bet Live’s YouTube Channel: https://foxs.pt/SubscribeFOXBETLIVE►Club Shay Shay’s YouTube Channel: http://foxs.pt/SubscribeCLUBSHAYSHAYSee more from First Things First: http://foxs.pt/FIRSTTHINGSFIRSTFoxSportsLike First Things First on Facebook: http://foxs.pt/FIRSTTHINGSFIRSTFacebookFollow First Things First on Twitter: http://foxs.pt/FIRSTTHINGSFIRSTTwitterFollow First Things First on Instagram: http://foxs.pt/FIRSTTHINGSFIRSTInstagramFollow Nick Wright on Twitter: http://foxs.pt/NickWrightTwitterFollow Kevin Wildes on Twitter: https://foxs.pt/KevinWildesTwitterFollow Jenna Wolfe on Twitter: http://foxs.pt/JennaWolfeTwitterAbout First Things First:Nick Wright, Kevin Wildes, and Jenna Wolfe team up on First Things First, a discussion and opinion-based studio program that covers all the headlines weekdays on FS1.Harden plus KD & Kyrie won't work, Schröder to Lakers will — Broussard | NBA | FIRST THINGS FIRSThttps://youtu.be/axth9vCCx_wFirst Things Firsthttps://www.youtube.com/c/FirstThingsFirst"
"SrDO3nsLdjk","Making-Over my Alternative Sister to the Girly Side","2020-11-15T23:20:50Z","UCuVHOs0H5hvAHGr8O4yIBNQ","Niki and Gabi","26","20.21.11","niki and gabi|making over my sister|sister makeover|making over my sister to be girly|emo to girly makeover|challenge|sister|before and after|niki demar|fancy vlogs by gab|girly makeover|swap|fancy","1128482","61111","1128","3472","https://i.ytimg.com/vi/SrDO3nsLdjk/default.jpg","False","False","this is a 2-part makeover series where we give eachother EXTREME maksovers into each other's styles. in this makeover video, I transform my *EMO* sister to the girly side ;) #makeover Stream 𝖇𝖎𝖙𝖊 𝖔𝖋 𝖒𝖊 out now! https://stem.ffm.to/biteofme'Bite of Me' (Official Music Video): https://www.youtube.com/watch?v=TJwZU...TO BINGE:Our Opposite Twin Challenge playlist➜ https://www.youtube.com/playlist?list...Our Fashion // Shopping playlist➜ https://www.youtube.com/playlist?list...**NEW VIDEOS EVERY SUNDAY and SOMETIMES WEDNESDAY**If you see this, comment NIKI WAS JEALOUS only those who watch up to that point will know what this means ;)vlog channels:niki demarhttps://www.youtube.com/user/nikidemarfancy vlogs by gab https://www.youtube.com/channel/UCLGe...SOCIAL MEDIA Instagram➜ @NIKI / @GABITwitter➜ @nikidemar / @gabcakeTumblr➜ nikidemar / breakfastatchanel-starringgabiSnapchat➜ nikidemarrr / fancysnapsbygabWe’re Niki and Gabi! We hope you enjoyed our Answering Assumptions About Us video! We’re twin sisters who are different with opposite fashion and styles, but we come together to make videos like challenges, sister vs sister, photoshoot challenges, 24 hour challenges, DIY, swaps, shopping challenges, 24 hour challenges, diy, style, beauty, lifestyle, fashion, comedy, types of girls, music, and more!"
"IHBxAsSEjBo","Vikings vs. Bears Week 10 Highlights | NFL 2020","2020-11-17T04:22:11Z","UCDVYQ4Zhbm3S2dlz7P1GBDg","NFL","17","20.21.11","NFL|Football|offense|defense|American Football|highlight|highlights|game|sport|play|plays|season|2020|touchdown|td|game highlights|week 10|best plays|top plays|vikings|minnesota|min|bears|chicago|chi|vikings bears game highlights|vikings highlights|bears highlights|vikings td|bears td","1217646","11438","465","2255","https://i.ytimg.com/vi/IHBxAsSEjBo/default.jpg","False","False","The Minnesota Vikings take on the Chicago Bears during Week 10 of the 2020 NFL season.Subscribe to NFL: http://j.mp/1L0bVBuCheck out our other channels:Para más contenido de la NFL en Español, suscríbete a https://www.youtube.com/nflenespanolNFL Fantasy Football https://www.youtube.com/nflfantasyfootballNFL Vault http://www.youtube.com/nflvaultNFL Network http://www.youtube.com/nflnetworkNFL Films http://www.youtube.com/nflfilmsNFL Rush http://www.youtube.com/nflrushNFL Play Football https://www.youtube.com/playfootballNFL Podcasts https://www.youtube.com/nflpodcasts#NFL #Vikings #Bears"
"452iQ8ttIcc","Watch Live: President-Elect Joe Biden Addresses The Nation I ABC News","2020-11-08T02:08:14Z","UCBi2mrWuNuyYy4gbM6fU18Q","ABC News","25","20.21.11","2020 election|2020 presidential election|trump election|biden election|trump biden|joe biden 2020|donald trump 2020|election results|election news|election coverage|politics|politics news|news|abc news","3846261","57347","7252","12493","https://i.ytimg.com/vi/452iQ8ttIcc/default.jpg","False","False","#Election2020 #Election #JoeBiden #PresidentElect #Vote2020LIVE UPDATES: https://abcn.ws/2HXvyWYJoe Biden set to become 46th President of the United States: https://abcn.ws/3ezMXRTKamala Harris set to make history as first woman VP: https://abcn.ws/3mZT1GgSUBSCRIBE to ABC NEWS: https://bit.ly/2vZb6yPWatch More on http://abcnews.go.com/LIKE ABC News on FACEBOOKhttps://www.facebook.com/abcnewsFOLLOW ABC News on TWITTER:https://twitter.com/abc"
"IGCLNMvm1Cc","Ultimate Fountain Challenge #4","2020-11-16T14:00:03Z","UCDRbNGFusqlXX4a5vwi9ouQ","Vat19","24","20.21.11","vat19|vat 19|vat-19|crazy fountain|will it fountain challenge|ultimate fountain challenge|vat19 will it fountain|vat19 challenge accepted|chocolate fountain|vat19 fountain|vat19 fondue|will it fountain|gross fountain challenge|fountain challenge|vat19 challenges food|vat19 fountain challenge|fountain challenge vat19","1095814","25209","812","2978","https://i.ytimg.com/vi/IGCLNMvm1Cc/default.jpg","False","False","Ever wondered what peanut butter, mustard, and frosting look like in a chocolate fountain?Buy here: https://www.vat19.com?adid=youtubeMore Crazy Challenges: https://www.youtube.com/watch?v=p3JpUcf4M28&list=PLSqiExuEA-RHv58jpflkQz9fepBq9ns0BSubscribe to Vat19: http://www.youtube.com/subscription_center?add_user=vat19comVisit the Vat19 Headquarters: https://www.vat19.com/tour0:00 Intro0:13 Caramel Syrup & Ice Cream Crispy Cone1:30 Mustard Soda & White Castle Burgers2:57 BBQ Larvets & Ribs4:09 Horchata & Churros Cookies5:24 Purple Hot Chocolate & Creature Eye Lollipops6:30 Spicy Peanut Butter & Jelly7:47 Blue Frosting & Cupcake Cookies8:54 Apple Cider Vinegar & mBerry11:24 Outro****************** Follow Vat19:Facebook: https://facebook.com/vat19Instagram: https://instagram.com/vat19/Shop hundreds more curiously awesome products:https://www.vat19.com/?adid=youtubeWatch More Vat19:The White Elephant Gift Show: https://www.youtube.com/watch?v=rppcXroNgKI&list=PLSqiExuEA-RFpqW0Y3vn0pn8wDW_3LXAOLatest Uploads: https://www.youtube.com/user/vat19com/videos?shelf_id=1&view=0&sort=ddPopular Videos: https://www.youtube.com/user/vat19com/videos?shelf_id=7&view=0&sort=pFun Stuff to Eat: https://www.youtube.com/watch?v=7RXmNRr8x7I&list=PLSqiExuEA-REt5gzR0A9ernZNHlZ2glIlAbout Vat19:Vat19 is dedicated to curiously awesome gifts, candy, toys, gummy, putty, puzzles, games, and more! In addition to making funny commercials you'll actually want to watch, we produce amazing challenge videos, document our outrageous contraptions, and invite you to a front row seat for our silly stunts. Sometimes we blow things up, fill up a bathtub or pool with crazy stuff, dare each other to eat super spicy foods, and answer “burning questions” from our viewers."
"4Gz3kQsWm3s","Confronting All The Drama... Blood Money Transformation ft. India Ferrah","2020-11-15T20:00:36Z","UCkvK_5omS-42Ovgah8KRKtg","jeffreestar","26","20.21.11","jeffree star|jeffree star cosmetics|india Ferrah|drag queen makeup|drag transformation|blood money palette|jeffree star approved|rupaul|rupaul dragrace|trixie mattel|adore delano|jeffree star drag queen","926877","43265","4960","4436","https://i.ytimg.com/vi/4Gz3kQsWm3s/default.jpg","False","False","HEY EVERYONE... Welcome BACK to my channel! Today the stunning, outspoken and talented India Ferrah is here! You may know her from RuPaul's Drag Race Season 3 & All Stars Season 5! She's here from Las Vegas to transform me and put her face onto MINE! Watch her do my makeup with the Blood Money Palette while me spill the tea and hit the trees! Thank you India for making me feel fabulous and sharing your art with us!WANT MORE? 🖤 WATCH TRIXIE MATTEL TURN ME INTO JEFFREE MATTEL: https://bit.ly/3gDoICUFOLLOW INDIA FERRAH ON IG: https://www.instagram.com/indiaferrah/FOLLOW INDIA ON TWITTER: @indiaferrah+ FOLLOW ME ON TIK TOK: https://www.tiktok.com/@jeffreestar*SHOP: http://www.jeffreestarcosmetics.com+ FOLLOW MY BRAND ON Instagram: http://instagram.com/jeffreestarcosmetics+FOLLOW ME ON IG: http://instagram.com/jeffreestar+ SNAPCHAT: jeffreestar+ TWITTER: @jeffreestarWATCH MORE VIDEOS...................❤️🔮 WATCH FULL FACE OF BRANDS THAT HATE ME  ► https://bit.ly/2O6GgJi💜 WATCH THE SHANE x JEFFREE COLLECTION REVEAL ▷ https://bit.ly/39oZuDS💉 WATCH ME GET BOTOX BEFORE THE LOCKDOWN ▷ https://bit.ly/2wHzUw9MUSIC: hayve x ROY KNO  ► Give Up On You (Feat. imallryt) - https://www.youtube.com/watch?v=c1G1YvhQz2s (courtesy of NoCopyrightSounds)"
"ZVTxUNurw8k","Game Theory: FNAF Security Breach, I Know the BIG TWIST... I think","2020-11-14T19:05:23Z","UCo_IB5145EVNcf8hw1Kku7w","The Game Theorists","20","20.21.11","fnaf|five nights at freddy's|five nights at freddys|fnaf security breach|five nights at freddys security breach|security breach|fnaf security breach trailer|five nights at freddys security breach trailer|fnaf trailer|new fnaf|new fnaf game|fnaf theory|fnaf ar|fnaf help wanted|fnaf vr|fnaf sister location|sister location|fnaf 2|fnaf 6|fnaf animation|game theorists|game theory|matpat|game theory fnaf|fnaf game theory|fnaf security breach gameplay","3584779","245207","2812","27839","https://i.ytimg.com/vi/ZVTxUNurw8k/default.jpg","False","False","Get our NEW Holiday & Official Theorist x FNAF Merch! ► https://bit.ly/2UkxCv0We have brand new Holiday Theory Wear + a FNAF x Theory Wear collaboration! You probably read the title and thought something like, There goes MatPat, trying to figure out a FNAF game that's not even out yet. Well, you may be RIGHT but you are also WRONG! I'm not trying to solve the big TWIST of FNAF Security Breach. All of my days of gathering evidence and researching the Five Nights at Freddy's universe means that I KNOW my stuff. In fact, I know it SO WELL that I can predict - without playing the game - what we will learn that will change the shape of the FNAF story moving forward. What is it? How do I KNOW? Theorists, you'll have to watch to find out.Glitchtrap render by EliteRobo ► https://www.deviantart.com/eliterobo/art/FNaF-SFM-Glitchtrap-Malhare-Render-1-V-2-811441767    Don't forget to Subscribe to Food Theory! ► https://bit.ly/2CdCooV  Find the game here ► http://www.scottgames.com/Need Royalty Free Music for your Content? Try Epidemic Sound. Get A 30 Day Free Trial! ► http://share.epidemicsound.com/MatPat#FNAF #FiveNightsAtFreddys #FNAFSecurityBreach #FNAFTrailer #SecurityBreach #SecurityBreachTrailer #NewFNAF #FNAFTheory #MatPat #Theory #GameTheory    More THEORIES: FNAF, The FINAL Timeline ►► https://bit.ly/2MlHYFeFNAF, The Monster We MISSED! ►► https://youtu.be/_ygN8HLCaJgFNAF This Theory Changes Everything ► https://bit.ly/2JUQUn6FNAF, You Were Meant To Lose ► https://youtu.be/7bn8hM9k0b0FNAF 6, No More Secrets ► https://bit.ly/2LVCq4u   Credits:Writers: Matthew PatrickEditors: Dan Cybert Seibert, Pedro Freitas, Tyler Mascola, and Alex Sedge SedgwickAssistant Editor: AlyssaBeCrazySound Editor: Yosi Berman"
"mAFv55o47ok","Barack Obama: The 2020 60 Minutes interview","2020-11-16T01:21:38Z","UCsN32BtMd0IoByjJRNF12cw","60 Minutes","25","20.21.11","60 Minutes|CBS News|2020 United States Presidential Election|Donald Trump|Barack Obama|Joe Biden","4444306","92468","11347","25907","https://i.ytimg.com/vi/mAFv55o47ok/default.jpg","False","False","The former president shares the advice he would give President Trump, his thoughts on the killing of George Floyd, and what's behind the divisions in Washington and across the U.S. Scott Pelley reports. https://cbsn.ws/3kyvQRGSubscribe to the 60 Minutes Channel HERE: http://bit.ly/1S7CLRuWatch Full Episodes of 60 Minutes HERE: http://cbsn.ws/1Qkjo1FGet more 60 Minutes from 60 Minutes: Overtime HERE: http://cbsn.ws/1KG3sdrRelive past episodes and interviews with 60 Minutes Rewind HERE: http://cbsn.ws/1PlZiGIFollow 60 Minutes on Instagram HERE: http://bit.ly/23Xv8RyLike 60 Minutes on Facebook HERE: http://on.fb.me/1Xb1DaoFollow 60 Minutes on Twitter HERE: http://bit.ly/1KxUsqXGet the latest news and best in original reporting from CBS News delivered to your inbox. Subscribe to newsletters HERE: http://cbsn.ws/1RqHw7TGet your news on the go! Download CBS News mobile apps HERE: http://cbsn.ws/1Xb1WC8Get new episodes of shows you love across devices the next day, stream local news live, and watch full seasons of CBS fan favorites anytime, anywhere with CBS All Access. Try it free! http://bit.ly/1OQA29B---60 Minutes, the most successful American television broadcast in history, began its 52nd season in September. Offering hard-hitting investigative reports, interviews, feature segments and profiles of people in the news, the broadcast began in 1968 is still a hit in 2020. 60 Minutes makes Nielsen’s weekly Top 10 nearly every week and was the #1 weekly television broadcast three times last season.The program still averages more than 10 million viewers, more than double the audience of its nearest network news magazine competitor. The average audience for a 60 Minutes broadcast is 150% higher than those of the network morning news programs; the audience dwarfs the number of viewers drawn by the most popular cable news programs.  About a million more people listen to the 60 Minutes radio simulcast in several major cities and on its companion podcast. Tens of thousands each week experience 60 Minutes online. The broadcast’s segments can be watched at 60Minutes.com and on the CBS All Access app. Its webcast, 60MinutesOvertime.com, offers content originally produced for the web, including behind-the-scenes video about the production of 60 Minutes stories and timely archival segments.60 Minutes has won every major broadcast award. Its 25 Peabody and 150 Emmy awards are the most won by any single news program. It has also won 20 duPont-Columbia University journalism awards. Other distinguished journalism honors won multiple times include the George Polk, RTDNA Edward R. Murrow, Investigative Reporters and Editors, RFK Journalism, Sigma Delta Chi and Gerald Loeb awards.60 Minutes premiered on CBS September 24, 1968. Bill Owens is the program’s executive producer. The correspondents and contributors of 60 Minutes are Sharyn Alfonsi, Anderson Cooper, John Dickerson, Norah O’Donnell, Scott Pelley, Lesley Stahl, Bill Whitaker and L. Jon Wertheim."
"6P5h87hF8RI","Jennifer Lopez Surprised by Nicole Kidman & More at 2020 PCAs | E! People’s Choice Awards","2020-11-16T04:06:28Z","UCD-1jAmL42qnEszozefaa1g","E! Red Carpet & Award Shows","24","20.21.11","Jennifer Lopez|People’s Choice Awards|2020 People’s Choice Awards|peoples choice awards 2020|peoples choice awards|2020 pcas|pcas|peoples choice|people’s choice|e people’s choice awards|people’s choice award winners|people’s choice awards full show|e! Live from the red carpet|e! news|e! Entertainment|celebrity|award show|e! red carpet and award shows|E Red carpet|Renée Zellweger|Nicole Kidman","395916","5420","202","486","https://i.ytimg.com/vi/6P5h87hF8RI/default.jpg","False","False","Renée Zellweger, Nicole Kidman and more surprise the 2020 People's Choice Awards Icon winner! Plus, J.Lo takes a heartfelt look back at all her accomplishments.Subscribe: http://eonli.ne/RedCarpetSubscribeDownload the E! People’s Choice Awards App: https://e.app.link/7RtTsI43l1“The E! People's Choice Awards is the only major awards show voted on entirely by the public for fan favorites in movies, music, television and digital.#JenniferLopez #2020PeoplesChoiceAwards #RedCarpet #PeoplesChoiceAwards #PeoplesIcon #NicoleKidman #RenéeZellwegerAbout E! Red Carpet and Award Shows: E! is the ultimate destination for Red Carpet coverage. From the Academy Awards to the Emmys to the E! People’s Choice Awards, we give you an insider's view of the arrivals, exclusive interviews and of course, cover every stitch of the fabulous fashion. Only Live From the Red Carpet hosts Ryan Seacrest and Giuliana Rancic, along with E!’s entire awards team of fashion and entertainment experts, have the most comprehensive LIVE coverage of the biggest premieres and events. Connect with E! Red Carpet and Award Shows: Visit the E! News WEBSITE: http://eonli.ne/enewsFollow E! Live from the Red Carpet on TWITTER: http://eonli.ne/RedCarpetTwitterFollow E! News on TWITTER: http://eonli.ne/ENewsTWLike E! News on FACEBOOK: http://eonli.ne/ENewsFBCheck out E! News on INSTAGRAM: http://eonli.ne/ENewsIGJennifer Lopez Surprised by Nicole Kidman & More at 2020 PCAs | E! People’s Choice Awardshttps://youtu.be/6P5h87hF8RIhttps://www.youtube.com/ERedCarpetandAwardShows"
"GLoeAJUcz38","Press This Button To Win $100,000!","2020-11-14T21:00:02Z","UCX6OQ3DkcsbYNE6H8uQQuVA","MrBeast","24","20.21.11","[none]","22901620","1144790","19476","49659","https://i.ytimg.com/vi/GLoeAJUcz38/default.jpg","False","False","Push the red subscribe button and you could also win $100,000! (Seriously, we always fly subscribers down lol)New Merch - https://shopmrbeast.com/SUBSCRIBE OR I TAKE YOUR DOG╔═╦╗╔╦╗╔═╦═╦╦╦╦╗╔═╗║╚╣║║║╚╣╚╣╔╣╔╣║╚╣═╣ ╠╗║╚╝║║╠╗║╚╣║║║║║═╣╚═╩══╩═╩═╩═╩╝╚╩═╩═╝----------------------------------------------------------------follow all of these or i will kick you• Facebook - https://www.facebook.com/MrBeast6000/• Twitter - https://twitter.com/MrBeastYT•  Instagram - https://www.instagram.com/mrbeast--------------------------------------------------------------------"
"eVB02SSeqgQ","Crew-1 Mission | Coast Phase","2020-11-16T09:57:41Z","UCtI0Hodo5o5dUb67FeUjDeA","SpaceX","28","20.21.11","SpaceX|Space|Crew-1|Crew|Dragon|Crew Dragon|Commercial Crew|Elon Musk|Musk|Falcon 9|Astronaut|Victor Glover|Mike Hopkins|Michael Hopkins|Shannon Walker|Soichi Noguchi|NASA|JAXA|ISS|International Space Station|Coast Phase|Crew-1 Mission","1548608","30255","703","508","https://i.ytimg.com/vi/eVB02SSeqgQ/default.jpg","False","False","Crew 1 Mission - Sleep: https://youtu.be/LtqMdKyk0NASpaceX and NASA are targeting Sunday, November 15 for Falcon 9’s launch of Dragon’s first operational crew mission (Crew-1) to the International Space Station (ISS) from historic Launch Complex 39A (LC-39A) at NASA’s Kennedy Space Center in Florida. The instantaneous launch window opens at 7:27 p.m. EST on November 15, 00:27 UTC on November 16. Following stage separation, SpaceX will attempt to land Falcon 9’s first stage on the “Just Read the Instructions” droneship, which will be stationed in the Atlantic Ocean. The launch webcast will go live about 4 hours before liftoff. Tune in here to watch live."
"v4t3o5w4K18","Make The 0.1% Chance Trickshot, WIN The PS5","2020-11-15T19:22:01Z","UCQIUhhcmXsu6cN6n3y9-Pww","Jesser","17","20.21.11","ps5|play station 5|playstation 5|ps5 giveaway|new ps5|new ps5 games|ps5 competition|make the shot|make the shot win ps5|trickshots|basketball|basketball challenge|jesser|2HYPE|bucketsquad|kristopher london|zack ttg|jiedel","1437289","68348","1379","53781","https://i.ytimg.com/vi/v4t3o5w4K18/default.jpg","False","False","We're back with another make the shot, win the prize, but this time the brand NEW PlayStation 5 is up for grabs! Make sure to subscribe and comment your IG handle down below for a chance to win some PSN vouchers or even the NEW PS5!INSANE Make the Shot, I'll Buy You Anything Challenge 🏀► https://youtu.be/CURPDbrGP7IMake A Full Court Shot, I'll Buy You Anything... NBA Basketball► https://www.youtube.com/watch?v=7bG07jUmbOo★ Follow me on social media @Jesser ★●Instagram https://instagram.com/jesser●Twitter https://twitter.com/jesser2ND Channel - @JSR► https://www.youtube.com/user/Jesserthelazerhd★BUCKETSQUAD MERCH★► bucketsquad.com2HYPE Group Channel@2HYPE⭐ Text me! 805 - 398 - 6092●Edited by @Rickle & @Feddy#BucketSquad #2HYPE"
"9ElWZKIK72s","PREGNANCY Q&A! GET READY WITH ME","2020-11-15T22:46:55Z","UC21yq4sq8uxTcfgIxxyE9VQ","Carli Bybel","26","20.21.11","carli|bybel|car libel|pregnant|pregnancy|q&a|boyfriend|how I found out|reactions","524830","22072","448","2355","https://i.ytimg.com/vi/9ElWZKIK72s/default.jpg","False","False","ILYSM!!GUYS I'M PREGNANT!!! 😭 Family Reactions: https://www.youtube.com/watch?v=2nnkmwBioGE----------------------------------------­­­-------------------------------------hi my babes!!! Happy sunday! I Hope everyone had an amazing weekend!! I wanted to sit down and film a GRWM while I answer a bunch of your Pregnancy questions!!! This was so much fun to film. I hope you guys enjoy. Love you more than life XOXO CarliI WENT CRAZY @AERIE AND BOUGHT A BUNCH OF MATCHING SEPARATES: https://bit.ly/3f0RyN0PRODUCTS USED IN ORDER:OLE CREAM https://bit.ly/2ICyEAbFAUX FILTER FOUNDATION 320G https://bit.ly/3dCbftVGRAFTOBIAN MIDNIGHT MERIGOLD https://amzn.to/2yOME5jSHAPE TAPE CONCEALER https://bit.ly/2RmJyL0SHAPE TAPE POWDER https://bit.ly/2F2qMGtSHADE & LIGHT https://bit.ly/2U1wM86GRANITE BROW WIZ https://bit.ly/2Fwx0yEGRANITE POWDER https://bit.ly/3nuoeBQMORPHE SETTING MIST 15% OFF CODE Carli https://www.morphe.com/products/continuous-setting-mistMARIO EYE PREP https://bit.ly/38Iolp6MARIO MATTE PALETTE https://bit.ly/2H9V1MYMARIO LIQUID LINER https://bit.ly/2IEOeePMARIO BRIGHTENING PENCIL https://bit.ly/38KqPTT CARLI BYBEL PALETTE https://bit.ly/32Zw6n7FLOWER MASCARA https://bit.ly/2JufTPfKKW 2.5 LINER https://bit.ly/32YGFH5CARLI BYBEL LIBRA LIPSTICK SHES EXPENSIVE GLOSS https://bit.ly/2IvUaa9SWEET PEA BLUSH https://bit.ly/2KoQR4DPEARL WAND https://amzn.to/2IDjFWU----------------------------------------­­­-------------------------------------😁MY FAV TEETH WHITENING KIT 30% OFF WITH CODE; CARLI https://bit.ly/3aHU9sh💕OUR PODCAST JUST LAUNCHED!LISTEN ON APPLE PODCASTS: http://bit.ly/relatedonappleLISTEN ON SPOTIFY: https://bit.ly/RELATEDSPOTIFYSEND ME LETTERS!BEAUTY BY CARLI BYBEL450 SHREWSBURY PLAZA #303SHREWSBURY, NJ 07702 FOLLOW ME ON INSTAGRAM:http://www.instagram.com/CARLIBELFOLLOW ME ON SNAPCHAT!@CARLIPENGUIN5FOLLOW ME ON TWITTER!http://www.twitter.com/CARLIBYBELDisclaimer: this video is NOT sponsored. I was not paid in any way shape or form to create this video. All opinions are my own and honest as always. Some links may be affiliate links which means I make a small commission if you purchase the item through my link. Thank you for your support!!! XOXO"
"Mb6Blx2HMIc","Your PS5 only does this one time.. You don't want to miss it","2020-11-15T18:00:04Z","UCbRlogwNj65Fhyq-wwiJpoQ","John Glasscock","28","20.21.11","ps5|playstation 5|playstation|tips|tricks","3272905","83834","3188","5512","https://i.ytimg.com/vi/Mb6Blx2HMIc/default.jpg","False","False","Here's the PS5 first startup! This screen only happens when you turn on a new Playstation 5 for the first time.. It's beautiful! Also, for new users: I explain the basics of the PS5 Control Center / Quick Menu functions - for new PS5 owners. Thanks for watching!"
