video_id,title,publishedAt,channelId,channelTitle,categoryId,trending_date,tags,view_count,likes,dislikes,comment_count,thumbnail_link,comments_disabled,ratings_disabled,description
"UuAywk8a_w8","Parma 0-4 Juventus | Ronaldo Double & Morata Late Strike See Juventus Clinch Victory! | Serie A TIM","2020-12-19T22:45:25Z","UCBJeMCIeLQos7wacox4hmLQ","Serie A","17","20.23.12","Ronaldo|Juventus|Cristiano Ronaldo|calcio|parma juventus|parma juventus kulusevski|parma juventus ronaldo|parma 0 juventus 4|juventus 4 0 parma|cristiano ronaldo goal|CR7|cristiano ronaldo highlights juventus|cristiano ronaldo highlights|Serie A|highlights|Dybala|AC Milan|Inter Milan|Napoli|Roma|goals|full highlights|watch|migliori gol|migliori in campo|migliori al mondo|gol del mese|lukaku|Lazio|zlatan|ibrahimovic|Matchid=A||2020-21||UNICO||UNI||13||PARJUV","7362458","125777","3123","5785","https://i.ytimg.com/vi/UuAywk8a_w8/default.jpg","False","False","Goals from Cristiano Ronaldo, Alvaro Morata and Dejan Kulusevski claimed all 3 points for Juventus as they push towards the top of the table! | Serie A TIMThis is the official channel for the Serie A, providing all the latest highlights, interviews, news and features to keep you up to date with all things Italian football.Subscribe to the channel here! https://bit.ly/2OM2Eax Find out more about the Serie A at: http://www.legaseriea.it/en/ Questo è il canale ufficiale della Serie A, dove potrai avere accesso ai momenti salienti, alle interviste, alle notizie e alle funzionalità del momento per rimanere aggiornato sulle ultime novità del campionato.Iscriviti qui al canale! https://bit.ly/2OM2EaxPer maggiori informazioni sulla Serie A: http://www.legaseriea.it/it"
"pb29jzOCONY","The Try Guys Bake Pizza Without A Recipe","2020-12-19T16:00:24Z","UCpi8TJfiA4lKGkaXs__YdBA","The Try Guys","23","20.23.12","try guys|keith|ned|zach|eugene|habersberger|fulmer|kornfeld|yang|buzzfeedvideo|buzzfeed|ariel|ned & ariel|comedy|education|funny|try|learn|fail|experiment|test|tryceratops|Without a recipe|pizza|pizza from scratch|how to make pizza|how to cook pizza|bake pizza|fire oven|pizza recipe|new york pizza|pizza review|one bite pizza|pepperoni pizza|best pizza|pan pizza|homemade pizza|hand tossed pizza|pizza near me|spinach pizza|pizza peel|mukbang|vegan pizza","2982142","135578","1553","8467","https://i.ytimg.com/vi/pb29jzOCONY/default.jpg","False","False","Behind The Try: A Try Guys Documentary is now streaming EVERYWHERE: https://tryguys.com/movie ! Watch #BehindTheTry today! •Available in the US on iTunes, Amazon, YouTube Movies, Google Play & Vudu. •Available WORLDWIDE on Veeps with exclusive access to the Red Carpet Premiere, Livestream Event (available only through March 18th 2021.) •View all watch options ➜  https://tryguys.com/movie ─... Slice, slice, babY! Who wants a pizza this?! This week we're bakin pizza's from scratch #WithoutARecipe Behind The Try: A Try Guys Documentary is available everywhere NOW! Watch it on iTunes, Amazon, Vudu, YouTube Movies and Veeps: https://linktr.ee/tryguysAre you a business looking to work with The Try Guys? Reach out to us at 2ndtrybusiness@gmail.com for all business inquiries! 🎧THE TRYPOD 🎧: watch our new podcast at https://youtube.com/trypod or listen at https://tryguys.com/podcast📘THE HIDDEN POWER OF F*CKING UP 📘: check out our new book at https://tryguys.com/bookGet your official Try Guys color hoodies and phone cases at https://tryguys.com/collections/color-line 💙❤️💚💜Support us! http://www.patreon.com/tryguys. Join our Patreon to get videos a day early, plus, live streams, chatrooms, BTS footage, exclusive merchandise, and more!SUBSCRIBE TO AND FOLLOW THE TRY GUYS http://www.youtube.com/c/tryguyshttp://www.facebook.com/tryguys  http://www.twitter.com/tryguyshttps://www.instagram.com/tryguysFOLLOW THE GUYShttp://www.Instagram.com/keithhabshttp://www.Instagram.com/nedfulmerhttp://www.Instagram.com/korndiddyhttp://www.instagram.com/eugeneleeyang http://www.twitter.com/keithhabshttp://www.twitter.com/nedfulmer http://www.twitter.com/korndiddyhttp://www.twitter.com/eugeneleeyang THE TRY GUYSThe #TryGuys is the flagship channel of 2ND TRY, LLC. Tune in twice a week for shows from Keith, Ned, Zach and Eugene, the creators and stars of The Try Guys.FEATURINGKwesi JamesIG, Twitter: @kwesi_jamesJimmy Wong - Actor, Chef, and Author of “Feast of Fiction”IG, Twitter: @jfwonghttps://www.feastoffiction.com/Brandon & Carolina Conaway - Chefs and Owners, Quarantine Pizza Co.IG: @carolinasdaydreams, @crandon_bonawayIG for Co: @quarantinepizzacoEDITED BYRob SeidelMUSICLicensed from AudioNetworkSFXLicensed from AudioblocksVIDEOLicensed from VideoblocksOfficial Try Guys Photos By Mandee Johnson Photography | @mandeephotoEXTERNAL CREWDirected by Rachel Ann ColeProduced by Rachel Ann Cole Produced by Nick RufcaAssociate Producer: Alexandria HerringAssistant Production Coordinator: Sam JohnsonAssistant Production Coordinator: Jonathan KirkDirector of Photography: Phil JacksonCamera Operator: Mike Maliwang Camera Operator: Tanisha MorenoCamera Operator: Delaney Teichler1st AC: Iliana Ipes 1st AC: Natalie AbrahamDIT/Assistant: Editor Will WitwerGaffer: Tim DavisKey Grip: Donato BragagnoloSound Mixer: Kevin BazellBoom Op: Peter BeerBoom Op: David ConanProduction Designer: Susannah HoneyShopper: Megan BrasfieldFood Stylist: Niki FordArt PA: Emily ZiskoArt PA: Alex MerkleProduction Assistant: Edgar Castillo Still Photographer: JD RenesEditor: YB ChangEditor: Rob SidelIllustrator: Jack Sjogren2nd Try, LLC STAFFExecutive Producer - Keith HabersbergerExecutive Producer - Ned FulmerExecutive Producer - Zach KornfeldExecutive Producer - Eugene Lee YangProducer - Rachel Ann ColeProducer - Nick RufcaAssociate Producer - Alexandria HerringEditor - Devlin McCluskeyEditor - YB ChangEditor - Elliot DickerhoofAssistant Editor - Will WitwerPodcast Producer - Miles BonsignoreCamera Operator/Assistant Production Coordinator - Jonathan KirkSound Operator Assistant Production Coordinator - Sam JohnsonContent Strategist - Kaylin BurkeSpecial Thanks To! Thanks to all of our Gold Level Patrons! AJ S., Amy Fleming, Ana Camba, Cat Hicks, Elisa Proust, Emma Godfrey, Erica Rao, Jared Aarons, Kelsey Bock, Kourtney Wong, Loretta Wen, Matthew Tadros, Miha, Paulus, Sarah Waxman, Traci Lew, Wendy Tran, Lily"
"0BvDNk6Gml0","Beating Minecraft As a Pig!","2020-12-20T20:04:48Z","UCIPPMRA040LQr5QPyJEbmXA","MrBeast Gaming","20","20.23.12","[none]","5737242","342684","3306","24045","https://i.ytimg.com/vi/0BvDNk6Gml0/default.jpg","False","False","We played Minecraft survival but all of us are pigs! You'd think this would be a lot harder to beat the Ender Dragon, but watch this whole video to see some cool stuff you can do as a pig!SUBSCRIBE OR YOU'LL HAVE BAD LUCKNew Merch - shopmrbeast.comJoin our discord server for your chance to compete in future Minecraft challenges!https://discord.gg/kCQKvZD----------------------------------------------------------------follow all of these or i will kick you• Facebook - https://www.facebook.com/MrBeast6000/• Twitter - https://twitter.com/MrBeastYT•  Instagram - https://www.instagram.com/mrbeast--------------------------------------------------------------------"
"h9D7llavsRE","Sus Bus!!! | Among Us Animation","2020-12-20T14:00:31Z","UCUKi4zY5ETSqrKAjTBgjM-g","sWooZie","1","20.23.12","swoozie|adande|animation|funny|2d","404691","35685","657","1533","https://i.ytimg.com/vi/h9D7llavsRE/default.jpg","False","False","Stalk Me:ig: http://www.instagram.com/swoozie/TikTok: https://www.tiktok.com/@swoozieftwAnimators:Abby:  https://twitter.com/memedokies 0:07 - 0:52Sev: https://twitter.com/sevpiehl 0:52 - 1:39Matt:  https://twitter.com/qwilman 1:40 - endBackgrounds:BanditMusic:Harry Gettings // https://www.youtube.com/channel/UCV7ZZ9ecss9DlyZXdSz3U_AStoryboards:Jenn: https://twitter.com/jennpadillarthttps://www.instagram.com/jennpadillart/Zeurel: https://twitter.com/ZeurelMystery link with my Oscar winning performance for BEST ACTOR: https://youtu.be/PMZDStjSUo4?t=34"
"2y8-O3ZQ_5k","Truth Or Eat Ft Mian Twins","2020-12-19T22:15:20Z","UCSdkYFmjUv1duOKorLjPh-w","Tayler Holder","1","20.23.12","Tayler Holder|Viral|Mian Twins|Hot Ones|Eating Hot wings|Eating world hottest hot sauce|Hot sauce|Food Challenge|Spicy food Challenge|Truth Or eat|Exposing|Sean Kennedy|Triller Compound|Sway House|Sway|Jay Rod","1097647","80480","605","3082","https://i.ytimg.com/vi/2y8-O3ZQ_5k/default.jpg","False","False","Christmas song belowhttps://ffm.to/knpwgokBig Thank You to Triller For making this video Possible!THANK YOU SO MUCH FOR WATCHING!!!SUBSCRIBE FOR WEEKLY VIDEOS!Edited by: @seankennedytvText me +1 310-356-9053 [ FOLLOW MY SOCIAL MEDIA!  ]Triller: Taylerholderhttps://instagram.com/taylerholderhttps://twitter.com/taylerholderTikTok: @itstaylerholderSnapchat: @tayler"
"zTyZgOkWs4o","Antique Hand Cranked Hammer Drill - Restoration","2020-12-20T07:53:46Z","UCMrMVIBtqFW6O0-MWq26gqw","my mechanics","27","20.23.12","my mechanics|Antique Hand Cranked Hammer Drill - Restoration|rawlplug mechanical hammer|rawlplug hammer drill|antique tools|vintage tools|broken tool repair|how to remove rust|using a manual lathe|using a manual milling maschine|welding steel|wood turning|how to|metal work|machinist|awesome restoration|perfect restoration|bluing steel|how to turn steel black|my mechanics restoration|asmr|asmr restoration|mechanical asmr|sandblasting|heat shrink tube","3076716","69405","1672","5116","https://i.ytimg.com/vi/zTyZgOkWs4o/default.jpg","False","False","It was in spring this year when I picked up this beaten up antique hand cranked hammer drill. My friend has found it on the steel waste together with the german „Weltrekord“ ratchet screwdriver. The condition of the drill was super bad. It was very corroded, had a lot of missing screws, the handle was in very bad condition and the crank was bent so much you couldn't even make a full turn. That's all said, it was the perfect item for a new restoration video.At first I thought this should be a quick and easy project, but one problem after the other became visible and it turned out to be a real challenge. There was the big dent in the left side of the case. Usually you can't bend casted parts, but with a bit of heat and careful pressure on the arbor press I was able to remove it a bit. It also worked to get rid of the warping with some heat. For the finish of the housing I wanted to have an antique cast aluminium look. I thought it would look very cool if I could tumbler these parts after sandblasting. I ended up building a huge rotary tumbler from scratch and it worked very well (video link below).Another big issue was the tool holder and the drill bit, as they were both completly rusted. Big thanks to @Hand Tool Rescue  at this point for helping me out with the dimensions on these two parts by disassembling and measuring his own hammer drill. After a bit of search on eBay I found a set of original Rawlplug drill bits. After they arrived I was able to measure the shaft and the taper of the drill to then turn a new tool holder. It all worked out very well and yes, the drill only holds with the taper ;-)Before I even started this project I just had one question in mind „How am I going to replace the messed up handle cover?“. My first idea was to wrap it in nice black leather like steering wheels are made. That would definitely work, but that's something I've never done before so I was quite sceptical. Then the idea of a heat shrink tube came up. That would be a very easy solution, but heat shrink tubes don't have any structuires to it and it wouldn't quite fit the the rest of the tool. Thanks to the research of my Patreons and channel members, they have found very special heat shrink tubes that have a structure in it. I really liked it as it almost looked exactly the same like the original handle.After all it was a very intense and time consuming project. I've done so many hours of research on this one and I had to learn new skills. I'm very happy how it turned out.I hope you like my work and the video.Huge thank you to all of my Patreon supporters and specially to:Tonya M BroermanZack ThompsonAdel AlSaffarafreeflyingsoulYale BakerGregoryAlex McGeorgeAlistair MoorAmar.kBendurionCourtney MaleportDavid BarkerGreg MarstonJoshua BentleyLambda GPU WorkstationsLuke SchmickLuke StoneMatt BoschMellissa MarcusMike SchlodderMonte GibbsMuzaffer AksoyNick HoustonPaul MampillypotokslowTodd MedburyVickie BlighVince ValentiXavier CarbelYuri ZapuchlakAaron QuanteAlex Bretonalex latzkoAllen FrankAmanda Taylor, EsqAndreas MimraAndrew PhillipsAnthony AdamsArni Bjorgvinssonaudi4444playerBlake TBrandon FitzwaterBrian NewtonCarloChad BryantChris SimondetGrok SenftenHaley McFaddenHarper KimHunter R.Jason KoiJason TarlovJeremy ColeJonas RichartzJordan Pagejustin f.Kelly ImgrundKurt GazowMarc CerisierMarius CostanMartin Rønnow KlarlundMellissa McConnellMichael BierMickey EisenhornMike DonaldsonNick CannonPasacal SchmikalPhilippSchultes ThomasScott MarshallSergei ShvartsmanSvenja KucklaThe CarlsonsTrevor KamTucker IfftWarren G Strand JrWilliam Wallace웅록 윤My camera:Panasonic HC-VX11If you have any questions about the process, machines i'm using or other stuff, just ask me in the comments. I read them all and i try to reply as soon as possible.Sorry for my bad english, it's not my language. I try my best to improve my technical english.Subscribe for more of my content. I'm uploading videos about mechanical stuff, as new creations and buildings and also restorations. Thank you for watching :-)Building a Huge Rotary Tumbler from Scratch - Homemade Rotary Tumbler https://youtu.be/c04x6ZF9kKc„I make a new one“ T-Shirts:https://teespring.com/stores/my-mechanicsMy Main Channel:https://www.youtube.com/c/mymechanics My Second Channel:https://www.youtube.com/channel/UC4EQCwfH54ieNPswtXh5K0w My Patreon Page:https://www.patreon.com/mymechanicsFollow me on Instagram:https://www.instagram.com/my_mechanics/My Facebook Page:https://www.facebook.com/My-mechanics-1966277857002099/"
"nUOx9-u1Kwk","DRAGON BALL FIGHTERZ – Super Baby 2 Announcement Trailer","2020-12-20T15:00:48Z","UC_ntXHv-XdKCD7CPynVvnQw","Bandai Namco Entertainment America","20","20.23.12","Bandai Namco|Bandai Namco Entertainment|Video|Games|DBFZ|SuperBaby2|DragonBallFIGHTERZ|Dragon Ball FighterZ|fighting game|goku|vegeta|Super Baby|Super Baby 2","219667","10479","150","1513","https://i.ytimg.com/vi/nUOx9-u1Kwk/default.jpg","False","False","LET'S GO!!! – Super Baby 2 arrives January 15th, 2020 to Dragon Ball FIGHTERZ! What are you most excited for, #SuperBaby2 or our special teaser at the end? Show us your hype in the comments and don't forget to tag us on Twitter with your reaction video!Pick up FighterZ Pass 3 today & get 2 day early access! #DragonBallFIGHTERZ!  spr.ly/DBFZ-BuyFollow Bandai Namco Entertainment: Instagram: https://www.instagram.com/bandainamcous/Facebook: https://www.facebook.com/BandaiNamcoUSTwitter: https://twitter.com/BandaiNamcoUS/Tumblr: http://bandainamcous.tumblr.com/Twitch: http://www.twitch.tv/bandainamcous"
"bOBQ9gDpJC8","Coming clean with you about my addiction","2020-12-20T15:33:49Z","UCOpP5PqrzODWpFU961acUbg","Berm Peak Express","26","20.23.12","do it yourself|tools|mountain biking|outdoors|rc cars|traxxas|axial|kyosho|mini-z|scx-24|scx-10|trx-4|remote controlled cars","468213","33174","809","3423","https://i.ytimg.com/vi/bOBQ9gDpJC8/default.jpg","False","False","Back in the summer I did an RC car video, almost as a joke. Well, a few companies sent me some real nice cars, and they got me hooked. Now, I'm a full blown RC hobbyist. I get to be a beginner at something again. If you're interested in any of these cars, I suggest you try your local hobby shop before buying them online. Nevertheless, here's what was featured in the video.Land Rover Defender (TRX-4) https://traxxas.com/products/landing/trx-4/Ford Broncho (TRX-4) https://traxxas.com/products/landing/bronco/Jeep Gladiator (SCX-10) https://bit.ly/3h1mBJKChevy C-10 (SCX-24) http://www.axialracing.com/products/axi00001t2Suzuki Jimny (Mini-Z 4x4) https://rc.kyosho.com/en/miniz4x4-jimnyJeep Wrangler Rubicon (Mini-Z 4x4)  https://rc.kyosho.com/en/miniz4x4-jeepCan Am (Axial Yeti JR) https://amzn.to/38lUEs7Rat Rod (Unknown) https://amzn.to/37ysP0oBerm Peak Jerseys https://cognativemtb.com/collections/seths-bike-hacks-collection/products/berm-peak-tech-jersey-tealWant us to review your unique mountain bike or outdoor product? https://www.sethsbikehacks.com/product-review/Check out our main channel https://youtube.com/c/sethsbikehacksFollow me on Instagram https://instagram.com/sethsbikehacksBerm Peak Merch https://cognativemtb.com/collections/seths-bike-hacks-collectionMusic in this video is from http://share.epidemicsound.com/trQSgand https://soundstripe.com?fpr=seth20#RcCarsI'm also working on a long-term moonshot project: Building a free public bike park in the Asheville metro area. Join my Patreon and 100% of the proceeds go towards funding this. https://www.patreon.com/sethsbikehacksAdvertising disclosure: All of these videos contain products, logos, or mentions associated with Diamondback Bicycles. Whether or not the video itself was sponsored by Diamondback, they do support this channel, and by extension, every video on it."
"MpdWc0LAQVo","Nba Youngboy- It Ain’t Over (Interlude)","2020-12-18T04:44:28Z","UClW4jraMKz6Qj69lJf-tODA","YoungBoy Never Broke Again","10","20.23.12","[none]","6675179","236405","5218","23424","https://i.ytimg.com/vi/MpdWc0LAQVo/default.jpg","False","False",""
"bsIXUEOXiDA","Clemson Tigers vs. Notre Dame Fighting Irish | ACC Championship Game | College Football Highlights","2020-12-20T01:05:53Z","UCzRWWsFjqHk1an4OnVPsl9g","ESPN College Football","17","20.23.12","clemson notre dame highlights|clemson vs notre dame|clemson tigers|notre dame|notre dame football|clemson highlights|notre dame highlights|acc championship|college football playoff|trevor lawrence|ian book|ncaa|college football|2020 college football|college football highlights|2020 college football highlights|ncaa football|football highlights|cfb 2020|college football 2020|espn|college football on espn|espn college football|ncaaf|espn cfb|football","406007","3146","129","1082","https://i.ytimg.com/vi/bsIXUEOXiDA/default.jpg","False","False","Check out highlights from the ACC championship game as Trevor Lawrence, Travis Etienne and the No. 3 Clemson Tigers look to avenge their lone loss from the 2020 college football season vs. Ian Book and the No. 2 Notre Dame Fighting Irish.#CFBHighlights #CollegeFootball #ACC✔ Sign up for ESPN+: http://www.espn.com/watch/espnplus/✔ Get the ESPN App: http://www.espn.com/espn/apps/espn✔ Subscribe to ESPN on YouTube: http://es.pn/SUBSCRIBEtoYOUTUBE✔ Subscribe to ESPN FC on YouTube: http://bit.ly/SUBSCRIBEtoESPNFC✔ Subscribe to NBA on ESPN on YouTube: http://bit.ly/SUBSCRIBEtoNBAonESPN✔ Watch ESPN on YouTube TV: http://es.pn/YouTubeTVESPN on Social Media:► Follow on Twitter: http://www.twitter.com/espn► Like on Facebook: http://www.facebook.com/espn► Follow on Instagram: http://www.instagram.com/espnVisit ESPN on YouTube to get up-to-the-minute sports news coverage, scores, highlights and commentary for NFL, NHL, MLB, NBA, College Football, NCAA Basketball, soccer and more. More on ESPN.com: http://www.espn.com"
"2Up7Jbtg37A","FINDING OUT WE'RE PREGNANT WITH OUR RAINBOW BABY! | LAUREN & ARIE LUYENDYK","2020-12-19T23:01:13Z","UCkoZyNqTZyBZ8nu8E_OSkWw","Lauren & Arie","24","20.23.12","THE BACHELOR|ARIE AND LAUREN|LAUREN AND ARIE|PREGNANCY ANNOUNCEMENT|PREGNANCY JOURNEY|Pregnancy|Bachelor Baby","492345","9729","209","1681","https://i.ytimg.com/vi/2Up7Jbtg37A/default.jpg","False","False","We can't even begin to say how happy and grateful we are. For those of you who have been here through our second pregnancy journey, you know exactly how much this means to our family. We can't wait to begin this next chapter and make Alessi a big sister!WATCH UNTIL THE END! YOU WON'T WANT TO MISS PART 2 COMING OUT ON 12-21.Subscribe to follow along on our pregnancy journey!Follow us on Instagram too!https://www.instagram.com/laurenluyendykhttps://www.instagram.com/ariejrhttps://www.instagram.com/alessiluyendykAs always, we love and appreciate every one of you!-Lauren and Arie Luyendyk"
"eqLuPPTZquo","CANELO ALVAREZ EXCLUSIVE! SPEAKS ENGLISH SAYS WHO HE WANTS NEXT AFTER WINNING 168 TITLES","2020-12-20T06:06:06Z","UCms2Ifa9owy2CK3ToKGkaQw","Behind The Gloves","17","20.23.12","BOXING|BOXEO|NEWS|EXCLUSIVE|HIGHLIGHTS|SPORTS|boxer|interview|press conference|workout|michelle joy phelps|behind the gloves|combat|UFC|boxing news|hey fight fans|CANELO|CALLUM SMITH|POST FIGHT|IMMEDIATE REACTION|BILLY JOE SAUNDERS|SPEAKS ENGLISH|CALEB PLANT","305920","4721","122","913","https://i.ytimg.com/vi/eqLuPPTZquo/default.jpg","False","False","Follow us on Social Media: ⬇️IG: OfficialBehindTheGloves  |  @MichelleJoyPhelps Twitter: BehindTheGloves   |  @MichellePhelps"
"5zQ2ZhtuFII","I Turned Myself Into Holiday Barbie 2020!","2020-12-19T17:19:32Z","UCONTNY-QxA-UVtpR7vWW6Pg","Micarah Tewers","24","20.23.12","holiday|barbie|micarah|mi|my|mikarah|miceara|christmas|funny|sewing|diy|tulle|light up|light|up|humor|comedy|dress|gown|marilyn|monroe|gentleman|prefer|blondes|blonde|girl|diamonds|gold|shiny|pretty|fashion|decorations|decorating|tree|landon|tewers|tours","874536","89190","378","6524","https://i.ytimg.com/vi/5zQ2ZhtuFII/default.jpg","False","False","Oops I did it again. But don't worry this video has nothing to do with Britney Spears. If you want the eyelashes I sported in this video, click here! https://glamnetic.com/ and be sure to use the code MICARAH for 20% off! :)instagram: micarahtewers"
"WxCM-STCkRM","I have very bad news","2020-12-18T19:25:56Z","UC6IijBsVf2PlWo_uq6P9wQw","Gloom","24","20.23.12","gloom|gloomykassie|kassie|gloomgames|twink|twinkie|chihuahua|dog|bad news|memorial|remembering|good bye","3467564","290442","4217","79626","https://i.ytimg.com/vi/WxCM-STCkRM/default.jpg","False","False","Been a rough week, also been cathartic yet heartbreaking to edit this together because there are so many good memories. Hard to believe this chapter of my life since I was 13 is over. Finality is tough. Rest in peace, Twinkie.SUBSCRIBE HERE: https://www.youtube.com/channel/UC6IijBsVf2PlWo_uq6P9wQw?sub_confirmation=1My INSTAGRAM: http://www.instagram.com/gloomykassieMy TWITTER: http://www.twitter.com/gloomykassieMy DISCORD SERVER (13 and up only): http://discord.gg/GLOOMMERCH: http://gloom.storeWATCH MY HORRIBLE BITLIVES: https://www.youtube.com/watch?v=-RcgvL6bKZQ&list=PLwbhb6Gu7AnXcLWpGMezpMHtPc6MZIfwYMy TIK TOK is @gloomdog, here's a link: http://vm.tiktok.com/JTHb8L/---------------------------------------------------------------------------I'm Kassie, also known as Gloom! I'm a variety gamer who does gameplay commentary on indie games and some bigger titles too. I also do silly sketches, challenges, Q&As, and whatever makes you goof balls giggle.---------------------------------------------------------------------------I do my best to upload at a few times a week (unless my life is a mess)."
